year,Council,Session,Agenda item,Agenda detail,cosponsored countries,body title number,body title detail,body text,date,file,filecountry,footnote,scanned
1997,N/A,Fifty-first session,21 (b),"STRENGTHENING OF THE COORDINATION OF HUMANITARIAN AND DISASTERRELIEF ASSISTANCE OF THE UNITED NATIONS, INCLUDING SPECIALECONOMIC ASSISTANCE: SPECIAL ECONOMIC ASSISTANCE TO INDIVIDUAL COUNTRIES OR REGIONS","Afghanistan, Armenia, Austria, Azerbaijan, Belarus, Brazil, Canada, Chile, China, Egypt, France, Georgia, Germany, Greece, India, Italy, Kazakstan, Kyrgyzstan, Netherlands, Pakistan, Russian Federation, Tajikistan, Turkey, Turkmenistan, Ukraine, United States of America and Uzbekistan",N/A,"Emergency international assistance for peace, normalcy and _ rehabilitation in Tajikistan","The General Assembly, Recalling Security Council resolutions 1089 (1996) of 13 December 1996 and 1099 (1997) of 14 March 1997, and the statement by the President of the Security Council of 7 February 1997,* in which the Council expressed its deep concern over the worsening of the humanitarian situation in Tajikistan, Recalling also the statement by the President of the Security Council of 12 March 1997* concerning the security and safety of United Nations and other international personnel associated with United Nations operations, as well as personnel of international humanitarian organizations, ? S/PRST/1997/13. Taking note of the reports of the Secretary-General of 5 December 1996 and of 5 March 1997 on the situation in Tajikistan,’ Supporting the efforts of the United Nations, in particular those of the Special Representative of the Secretary-General, aimed at achieving a comprehensive political settlement in the inter-Tajik talks, and those of the personnel of the United Nations Mission of Observers in Tajikistan, Welcoming the recent agreements reached between the Government of Tajikistan and the United Tajik Opposition,’ in particular those signed in Mashhad, Islamic Republic of Iran, and Moscow, aimed at achieving national reconciliation, and urging the parties to continue their efforts to solve the conflict peacefully, Deeply concerned at the impact of the conflict on the humanitarian situation and on the social and economic infrastructure of Tajikistan, and aware that the sharp decline in the provision of social, health and education services, lack of heating fuel for hospitals, schools and homes and the sharp drop in the real income of most families have made it increasingly difficult for large sections of the population in Tajikistan to meet their basic needs, Deploring the deterioration in the security situation, which necessitated the suspension of United Nations humanitarian activities in Tajikistan and has prevented the Organization from implementing fully the measures it had undertaken to ensure the coherent delivery of humanitarian assistance, in particular through the strengthening of coordination structures in Tajikistan, Stressing the importance of ensuring the voluntary return, in safety and dignity, of all refugees and internally displaced persons to their places of permanent residence and of reintegrating them into the social and economic life of the country, Deeply concerned about the danger posed by landmines in Tajikistan, Bearing in mind the close interrelationship between ensuring peace and achieving national reconciliation in Tajikistan and the ability of the country to meet the humanitarian needs of its people and to take effective steps towards the rapid revitalization of the economy, Affirming the urgent need to assist Tajikistan in its efforts to restore basic services and the infrastructure of the country, Expressing its appreciation to the States, United Nations and other intergovernmental organizations and all relevant humanitarian organizations, agencies and non-governmental organizations, including the International Committee of the Red Cross, that have responded and continue to respond positively to the humanitarian needs of Tajikistan, *-§/1996/1070, annexes; S/1997/56, annexes; and S/1997/169, annexes. Tajikistan, and calls upon the parties to comply fully with all obligations they have assumed towards this goal, in particular to respect the ceasefire agreement; 2. Welcomes with appreciation the efforts undertaken by the Secretary- General in drawing the attention of the international community to the acute problems of Tajikistan and in mobilizing assistance for rehabilitation and reconstruction of the country; 3. Encourages Member States and others concerned to respond further both promptly and generously to the consolidated inter-agency donor alert on urgent humanitarian needs for the period from 1 December 1996 to 31 May 1997 launched by the Secretary-General; 4. Encourages States to contribute to the voluntary fund established by the Secretary-General in accordance with Security Council resolution 968 (1994) of 16 December 1994 in support of the implementation of the Agreement on a Temporary Ceasefire and the Cessation of Other Hostile Acts on the Tajik-Afghan Border and within the Country for the Duration of the Talks, signed at Tehran on 17 September 1994;° 5. Condemns terrorist acts and other acts of violence in Tajikistan, and calls upon the parties to ensure the safety, security and freedom of movement of United Nations and other international humanitarian personnel; 6. Encourages the parties to cooperate in order to reduce the threat from the indiscriminate use of landmines to the civil population of Tajikistan and to the provision of humanitarian assistance, and welcomes in this regard the proposal to create a mine action centre in Tajikistan; 7. Requests the Secretary-General to continue to monitor the humanitarian situation in Tajikistan and to report to the General Assembly at its fifty- second session on the progress made in the implementation of the present resolution; 8. Decides to consider at its fifty-second session the question of the situation of Tajikistan under the item entitled ""Strengthening of the coordination of humanitarian and disaster relief assistance of the United Nations, including special economic assistance"". ° §/1994/1102, annex  1. ",23 April 1997,1997_233270,Afghanistan,"* Reissued for technical reasons. + S/PRST/1997/6. *-§/1996/1070, annexes; S/1997/56, annexes; and S/1997/169, annexes.",yes
1997,N/A,special session,5,ILLEGAL ISRAELI ACTIONS IN OCCUPIED EAST JERUSALEM AND THE REST OF THE OCCUPIED PALESTINIAN TERRITORY,"Afghanistan, Algeria, Bahrain, Bangladesh, Bosnia and Herzegovina, Brunei Darussalam, Comoros, Cuba, Democratic People's Republic of Korea, Djibouti, Egypt, India, Indonesia, Jordan, Kuwait, Madagascar, Malaysia, Mauritania, Mauritius, Morocco, Oman, Qatar, Saudi Arabia, Sierra Leone, Sudan, Tunisia, United Arab Emirates, United Republic of Tanzania, Viet Nam, Yemen and Zimbabwe",N/A,N/A,"The General Assembly, Aware of the commencement, after the adoption of General Assembly resolution 51/223 of 13 March 1997, of construction by Israel, the occupying Power, of a new settlement in Jabal Abu Ghneim to the south of East Jerusalem on 18 March 1997, and of other illegal Israeli actions in Jerusalem and the rest of the Occupied Palestinian Territory, Noting with regret that the Security Council, at its 3747th meeting, on 7 March 1997, and at its 3756th meeting, on 21 March 1997, twice failed to adopt a resolution on the actions referred to above, as a result of the negative vote of a permanent member of the Council, Reaffirming the permanent responsibility of the United Nations with regard to the question of Palestine until it is solved in all its aspects, Reaffirming also the principle of the inadmissibility of the acquisition of territory by force, Having considered the serious deterioration of the situation in the Occupied Palestinian Territory, including Jerusalem, and in the Middle East in general, including the serious difficulties facing the Middle East peace process, as a result of recent Israeli actions and measures, Affirming its support for the Middle East peace process, started at Madrid in 1991, on the basis of Security Council resolutions 242 (1967) of 22 November 1967, 338 (1973) of 22 October 1973 and 425 (1978) of 19 March 1978, for the principle of land for peace and for the full and timely implementation of the agreements reached between the Government of Israel and the Palestine Liberation Organization, the representative of the Palestinian people, and of all commitments reached between the parties, Recalling its relevant resolutions, including resolutions 181 (II) of 29 November 1947 and 51/223, and the relevant resolutions of the Security Council, in particular those on Jerusalem and Israeli settlements in the occupied territories, including resolutions 252 (1968) of 21 May 1968, 446 (1979) of 22 March 1979, 452 (1979) of 20 July 1979, 465 (1980) of 1 March 1980, 476 (1980) of 30 June 1980, 478 (1980) of 20 August 1980, 672 (1990) of 12 October 1990 and 1073 (1996) of 28 September 1996, Reaffirming that the international community, through the United Nations, has a legitimate interest in the question of the City of Jerusalem and the protection of the unique spiritual and religious dimension of the City, as foreseen in relevant United Nations resolutions on this matter, Reaffirming also the applicability of the Geneva Convention relative to the Protection of Civilian Persons in Time of War, of 12 August 1949, and the Regulations annexed to the Hague Convention IV of 1907 to the Occupied Palestinian Territory, including Jerusalem, and all other Arab territories occupied by Israel since 1967, Recalling the obligation of the high contracting parties to the Geneva Convention relative to the Protection of Civilian Persons in Time of War to respect and ensure respect for the Convention in all circumstances, in accordance with article 1 of the Convention, Conscious of the serious dangers arising from persistent violation and grave breaches of the Convention and the responsibilities arising therefrom, Convinced that ensuring respect for treaties and other sources of international law is essential for the maintenance of international peace and security, and determined, in accordance with the preamble to the Charter of the United Nations, to establish conditions under which justice and respect for the obligations arising from treaties and other sources of international law can be maintained, Also convinced, in this context, that the repeated violation by Israel, the occupying Power, of international law and its failure to comply with relevant Security Council and General Assembly resolutions and the agreements reached between the parties undermine the Middle East peace process and constitute a threat to international peace and security, Increasingly concerned about the actions of armed Israeli settlers in the Occupied Palestinian Territory, including Jerusalem, Aware that, in the circumstances, it should consider the situation with a view to making appropriate recommendations to the States Members of the United Nations, in accordance with General Assembly resolution 377 A (V) of 3 November 1950, 1.  Condemns the construction by Israel, the occupying Power, of a new settlement in Jabal Abu Ghneim to the south of occupied East Jerusalem and all other illegal Israeli actions in all the occupied territories; 2. Reaffirms that all legislative and administrative measures and actions taken by Israel, the occupying Power, that have altered or purported to alter the character, legal status and demographic composition of Jerusalem are null and void and have no validity whatsoever; 3. Reaffirms also that Israeli settlements in all the territories occupied by Israel since 1967 are illegal and an obstacle to peace; 4. Demands immediate and full cessation of the construction in Jabal Abu Ghneim and of all other Israeli settlement activities, as well as of all illegal measures and actions in Jerusalem; 5. Demands also that Israel accept the de jure applicability of the Geneva Convention relative to the Protection of Civilian Persons in Time of War, of 12 August 1949, to all the territories occupied since 1967, and that it comply with relevant Security Council resolutions, in accordance with the Charter of the United Nations; 6. Stresses the need to preserve the territorial integrity of all of the Occupied Palestinian Territory and to guarantee the freedom of movement of persons and goods in the Territory, including the removal of restrictions into and from East Jerusalem, and the freedom of movement to and from the outside world; 7. Calls for the cessation of all forms of assistance and support for illegal Israeli activities in the Occupied Palestinian Territory, including Jerusalem, in particular settlement activities; 8. Recommends to the States that are high contracting parties to the Geneva Convention relative to the Protection of Civilian Persons in Time of War to take measures, on a national or regional level, in fulfilment of their obligations under article 1 of the Convention, to ensure respect by Israel, the occupying Power, of the Convention; 9. Requests the Secretary-General to monitor the situation and to submit a report on the implementation of the present resolution, within two months of its adoption, in particular on the cessation of the construction of the new settlement in Jabal Abu Ghneim and of all other illegal Israeli actions in occupied East Jerusalem and the rest of the Occupied Palestinian Territory; 10. Expresses the need for scrupulous implementation of the agreements reached between the parties, and urges the sponsors of the peace process, the interested parties and the entire international community to exert all the necessary efforts to revive the peace process and to ensure its success; that a comprehensive, just and lasting solution to the of Jerusalem, which should be reached in permanent status the parties, should include internationally guaranteed the freedom of religion and of conscience of its as permanent, free and unhindered access to the Holy Places by the faithful of all religions and nationalities; 12. Rejects terrorism in all its forms and manifestations, in accordance with all relevant United Nations resolutions and declarations; 13. Decides to adjourn the tenth emergency special session of the General Assembly temporarily and to authorize the President of the General Assembly to resume its meetings upon request from Member States. ",24 April 1997,1997_233379,Afghanistan,"1 1.  Recommends question of the City negotiations between provisions to ensure inhabitants, as well",yes
