year,Council,Session,Agenda item,Agenda detail,cosponsored countries,body title number,body title detail,body text,date,file,filecountry,footnote,scanned
1997,THIRD COMMITTEE,Fifty-second session,107,"REPORT OF THE UNITED NATIONS HIGH COMMISSIONER FOR REFUGEES, QUESTIONS RELATING TO REFUGEES, RETURNEES AND DISPLACED PERSONS AND HUMANITARIAN QUESTIONS","Afghanistan, Bangladesh, Burundi, Congo, Costa Rica, Democratic Republic of the Congo, Ethiopia, Islamic Republic of Iran, Liberia, Malawi, Morocco, Nigeria, Pakistan, Philippines, Qatar, Sudan, Syrian Arab Republic, Turke",N/A,Assistance to unaccompanied refugee minors,"The General Assembly, Recalling its resolutions 49/172 of 23 December 1994, 50/150 of 21 December 1995 and 51/73 of 12 December 1996, Aware of the fact that the majority of refugees are children and women, Bearing in mind that unaccompanied refugee minors are among the most vulnerable and at risk of neglect, violence, forced military recruitment, sexual assault and other abuses and therefore require special assistance and care, Mindful of the fact that the ultimate solution to the plight of unaccompanied minors is their return to and reunification with their families, Noting the revised Guidelines on Refugee Children issued by the Office of the United Nations High Commissioner for Refugees in May 1994 and the development of an emergency kit to facilitate coordination and to enhance the quality of responses to the needs of unaccompanied minors by the Office of the High Commissioner, the United Nations Children's Fund and the non-governmental organizations, Noting with appreciation the efforts of the Office of the High Commissioner in the identification and tracing of unaccompanied refugee minors, and welcoming its effort in reunifying family members of refugees, Welcoming the efforts exerted by the United Nations High Commissioner for Refugees for the reunification of family members of refugees, Noting the efforts of the High Commissioner to ensure the protection of and assistance to refugees, including children and unaccompanied minors, and that further efforts need to be exerted to this effect, Recalling the provisions of the Convention on the Rights of the Child’ and the 1951 Convention* and the 1967 Protocol® relating to the Status of Refugees, 1.  Takes note of the report of the Secretary-General;°* 2. Expresses its deep concern at the continued plight of unaccompanied refugee minors, and emphasizes once again the urgent need for their early identification and for timely, detailed and accurate information on their number and whereabouts; 3. Expresses the hope once again that adequate resources will be provided for programmes of identification and tracing of unaccompanied refugee minors; 4. Calls upon the Office of the United Nations High Commissioner for Refugees, in cooperation with other relevant United Nations bodies, to incorporate policies that aim at preventing refugee family separation into its programmes, conscious of the importance of family unity; 5. Calls upon all Governments, the Secretary-General, the Office of the High Commissioner, all United Nations organizations, other international organizations and non-governmental organizations concerned to exert the maximum effort to assist and protect refugee minors and to expedite the return to and reunification with their families of unaccompanied refugee minors; 6. Urges the Office of the High Commissioner, all United Nations organizations, other international organizations and non-governmental organizations concerned to take appropriate steps to mobilize resources commensurate to the needs and interests of the unaccompanied refugee minors and for their reunification with their families; 7. Condemns all acts of exploitation of unaccompanied refugee minors, including their use as soldiers or human shields in armed conflict and their + Resolution 44/25, annex. United Nations, Treaty Series, vol. 189, No. 2,545. > Ibid., vol. 606, No. 8,79 1. forced recruitment into military forces, and any other acts that endanger their safety and personal security; 8. Calls upon the Secretary-General, the United Nations High Commissioner for Refugees, the Department of Humanitarian Affairs of the Secretariat, the United Nations Children's Fund and other United Nations organizations and international organizations to mobilize adequate assistance to unaccompanied refugee minors in the areas of relief, education, health and psychological rehabilitation; 9. Requests the Secretary-General to report to the General Assembly at its fifty-third session on the implementation of the present resolution, and to give special attention to the girl-child refugee in his report. ",5 November 1997,1997_245936,Afghanistan,* B/52/273.,yes
1997,N/A,Fifty-second session,156,TOWARDS A CULTURE OF PEACE,"Afghanistan, Algeria, Antigua and Barbuda, Argentina, Bangladesh, Barbados, Benin, Bhutan, Bolivia, Bosnia and Herzegovina, Brazil, Chad, Colombia Costa Rica Céte d'Ivoire, Djibouti, Dominican Republic, Ecuador El_ Salvador, Fiji, Georgia, Guatemala, Guinea- Bissau, Guyana, Honduras, Kyrgyzstan, Liberia, Mali, Mauritania, Mongolia, Morocco, Namibia, Nicaragua, Nigeria, Panama, Peru, Philippines, Senegal, Sri Lanka, Sudan, Suriname, Tajikistan, Togo, Tunisia, Turke , Turkmenistan, Uruguay, Venezuela and Zambia:",N/A,N/A,"The General Assembly, Recalling the preamble to Culture of peace the Charter of the United Nations and the purposes and principles of the creation of the United Nations system itself, United Nations, and recalling also that the based upon universally shared values and goals, war and violence to a culture of peace and non-violence, has been a major act towards transformation from a culture of Aware that the task of the United Nations to save future generations from the scourge of war requires transformation towards a culture of peace, consists of values, attitudes and behaviours that ref interaction and sharing based on the principles of freedom, democracy, all human endeavour to prevent through dialogue and rights and the means society, rights, tolerance and solidarity, conflicts by tackling their root to participate fully in the deve Recalling its resolutions 50/173 of 22 December 12 December 1996 on a culture of peace and 51/104 of which ect and inspire social justice and that reject violence and causes to solve problems negotiation and that guarantee the full exercise of all opment process of their 995 and 51/101 of 2 December 1996 on the United Nations Decade for Human Rights Education and public information activities in the field of human rights, Noting that the report of the Director-General of the United Nations Educational, Scientific and Cultural Organization on educational activities under the project entitled ""Towards a culture of peace"", with elements for a provisional declaration and programme of action on a culture of peace, indicates that the transition from the culture of war to a culture of peace has been taken up as a priority by the United Nations Educational, Scientific and Cultural Organization and is also being promoted at many levels by the United Nations system as it enters the twenty-first century, 1.  Takes note of the report of the Director-General of the United Nations Educational, Scientific and Cultural Organization,’ as transmitted by the Secretary-General and submitted in accordance with General Assembly resolution 51/101, which is set within the framework of United Nations actions for peace- building, including the United Nations Decade for Human Rights Education, 1995-2004, and the United Nations Year for Tolerance, as well as the programmes of action of recent United Nations world conferences; 2. Calls for the promotion of a culture of peace based on the principles established in the Charter of the United Nations and on respect for human rights, democracy and tolerance, the promotion of development, education for peace, the free flow of information and the wider participation of women as an integral approach to preventing violence and conflicts, and efforts aimed at the creation of conditions for peace and its consolidation; 3. Notes that the report includes: (a) Elements for a United Nations declaration on a culture of peace, including the historical basis, the meaning and significance of a culture of peace and the major fields and main actors for its promotion; (b) Elements for a programme of action, including the relevant aims as well as the strategies and actions needed to implement each of those aims; (c) A presentation of the progress of projects within the framework of the transdisciplinary project entitled ""Towards a culture of peace""; 4. Requests the Secretary-General, in coordination with the Director- General of the United Nations Educational, Scientific and Cultural Organization and taking into account the debate in the General Assembly, the specific suggestions of Member States and the comments, if any, of member States in the General Conference of the United Nations Educational, Scientific and Cultural Organization at its twenty-ninth session, to submit a consolidated report containing a declaration and programme of action on a culture of peace to the General Assembly at its fifty-third session; 5. Decides to include in the provisional agenda of its fifty-third session an item entitled ""Culture of peace"". + A/52/292, annex. ",11 November 1997,1997_246267,Afghanistan,,yes
1997,THIRD COMMITTEE,Fifty-second session,111,RIGHT OF PEOPLES TO SELF-DETERMINATION,"Afghanistan, Algeria, Andorra, Austria, Bahrain, Bangladesh, Belgium, Brazil, Chile, Colombia, Costa Rica, Cuba, Cyprus, Denmark, Djibouti, Egypt, Finland, France, Germany, Greece, Guinea, Guyana, Indonesia, Ireland, Italy, Japan, Jordan, Kuwait, Lao People’s Democratic Republic, Lesotho, Liechtenstein, Luxembourg, Malaysia, Mali, Malta, Mauritania, Monaco, Morocco, Mozambique, Namibia, Netherlands, Niger, Nigeria, Oman, Pakistan, Portugal, Qatar, San Marino, Saudi Arabia, Senegal, Sierra Leone, South Africa, Spain, Sudan, Sweden, Tunisia, United Arab Emirates, United Kingdom of Great Britain and Northern Ireland, United Republic of Tanzania, Viet Nam and Yemen",N/A,The right of the Palestinian people to self-determination,"The General Assembly, Aware that the development of friendly relations among nations, based on respect for the principle of equal rights and self-determination of peoples, is among the purposes and principles of the United Nations, as defined in its Charter. 1 Recalling the International Covenants on Human Rights,* the Universal Declaration of Human Rights,* the Declaration on the Granting of Independence to + Resolution 2200 A (XXI), annex. ? Resolution 217 A (III). Colonial Countries and Peoples® and the Vienna Declaration and Programme of Action, adopted at the World Conference on Human Rights on 25 June 1993,’ Recalling also the Declaration on the Occasion of the Fiftieth Anniversary of the United Nations,° Expressing deep concern over the deterioration of the Middle East peace process, including the lack of implementation of the agreements signed between the Palestine Liberation Organization and the Government of Israel, Affirming the right of all States in the region to live in peace within secure and internationally recognized borders, 1.  Reaffirms the right of the Palestinian people to self-determination; 2. Expresses the hope that the Palestinian people will soon be exercising their right to self-determination in the current peace process; 3. Urges all States, and the specialized agencies and organizations of the United Nations system to continue to support and assist the Palestinian people in their quest for self-determination. > Resolution 1514 (XV). “ A/CONF.157/24 (Part I), chap. III. ° Resolution 50/6. ",12 November 1997,1997_246324,Afghanistan,,yes
1997,N/A,Fifty-second session,34,COOPERATION BETWEEN THE UNITED NATIONS AND THE ECONOMIC COOPERATION ORGANIZATION,"Afghanistan, Azerbaijan, Iran (Islamic Republic of), Kazakhstan, Kyrgyzstan, Pakistan, Tajikistan, Turkey and Turkmenistan",N/A,N/A,"The General Assembly, Recalling its resolution 48/2 of 13 October 1993, by which it granted observer status to the Economic Cooperation Organization, Recalling also that the Charter of the United Nations provides for the existence of regional arrangements or agencies for dealing with such matters as maintenance of international peace and security as are appropriate for regional action, provided that their activities are consistent with the purposes and principles of the United Nations, Recalling further its resolution 51/21 of 27 November 1996, in which it urged the specialized agencies and other organizations and programmes of the United Nations system to initiate, maintain and increase consultations and programmes with the Economic Cooperation Organization and its associated institutions in the attainment of their objectives, Bearing in mind that the Treaty of Izmir, signed at Izmir, Turkey, on 12 March 1997, later revised at Ashgabat on 11 May 1977 and signed at Izmir on 14 September 1996, created a permanent body for intraregional cooperation, consultation and coordination in order to enhance economic, social and cultural development, and also the measures being taken by the Economic Cooperation Organization aimed at the reorganization and restructuring of the organization, Convinced that the maintenance and further strengthening of the cooperation between the United Nations system and the Economic Cooperation Organization promote the implementation of the goals and principles of these organizations, 1.  Takes note of the decision of the Heads of State and Government of the States members of the Economic Cooperation Organization welcoming the adoption of General Assembly resolution 51/21 on cooperation between the two organizations and endorsing the cooperative arrangements entered into by the Economic Cooperation Organization with various entities of the United Nations system for joint efforts towards the implementation of the economic projects and programmes of the Economic Cooperation Organization; 2. Notes with appreciation the report of the Secretary-General’ on the implementation of General Assembly resolution 51/21, and invites the Secretary- General of the United Nations to continue his efforts, in consultation with the Secretary-General of the Economic Cooperation Organization, to promote and expand cooperation and coordination between the two secretariats in order to increase the capacity of the two organizations to attain their common objectives; 3. Notes with satisfaction the emphasis placed in the Ashgabat Declaration, issued by the Extraordinary Summit Meeting of the Heads of State and Government of the States members of the Economic Cooperation Organization, held at Ashgabat on 13 and 14 May 1997, on the meaningful development of economic cooperation in priority areas of transport and communications and energy with a view to facilitating the access of the landlocked States members of the Economic Cooperation Organization to world markets; 4. Welcomes the continuation of efforts towards further consolidation of interregional consultations and exchange of views on issues of common concern through such useful forums as the annual meeting of the executive heads of Asia's subregional organizations and the Economic and Social Commission for Asia and the Pacific, which held its third meeting at Tehran in May 1997; 5. Urges the specialized agencies and other organizations and programmes of the United Nations system to continue and increase consultation and cooperation with the Economic Cooperation Organization and its associated institutions in the attainment of their objectives; 6. Calls upon the relevant international financial institutions to give favourable consideration to regional developmental plans, including projects and programmes of the Economic Cooperation Organization, in order to extend their assistance in the implementation of these programmes and, in particular, to the establishment of a comprehensive transport and communications infrastructure in the region of the Economic Cooperation Organization that would provide the landlocked countries with greater mobility to promote interregional trade and to establish mutually beneficial economic and commercial interaction with other regions; 7. Invites the Economic and Social Commission for Asia and the Pacific, as the regional arm of the United Nations, to assume a more active role in promoting cooperation with the Economic Cooperation Organization, and reiterates in this regard its request made in paragraph 5 of General Assembly resolution 51/21 in the context of the report to be submitted by the Executive Secretary of the Commission to the Commission at its fifty-fourth session, in 1998; 8. Takes note with satisfaction that it is proposed to introduce the Advance Cargo Information System and the Automated System for Customs Data of the United Nations Conference on Trade and Development, which are compatible with other systems, in the States members of the Economic Cooperation Organization, with the technical assistance of the United Nations Conference on Trade and Development and the United Nations Development Programme; 9. Requests the Secretary-General to submit to the General Assembly at its fifty-third session a report on the implementation of the present resolution; 10. Decides to include in the provisional agenda of its fifty-third session the item entitled ""Cooperation between the United Nations and the Economic Cooperation Organization"". ",17 November 1997,1997_246872,Afghanistan,* B/52/313.,yes
1997,THIRD COMMITTEE,Fifty-second session,112 (b),"HUMAN RIGHTS QUESTIONS: HUMAN RIGHTS QUESTIONS,INCLUDING ALTERNATIVE APPROACHES FOR IMPROVINGTHE EFFECTIVE ENJOYMENT OF HUMAN RIGHTS AND FUNDAMENTAL FREEDOMS","Afghanistan, China, Cuba, Democratic People's Republic of Korea, Iran (Islamic Republic of), Iraq, Libyan Arab Jamahiriya, Myanmar, Sudan and Syrian Arab Republic",N/A,Human rights and unilateral coercive measures,"The General Assembly, Recalling its resolution 51/103 of 12 December 1996, Reaffirming the pertinent principles and provisions contained in the Charter of Economic Rights and Duties of States proclaimed by the General Assembly in its resolution 3281 (XXIX) of 12 December 1994, in particular article 32 thereof, in which it is declared that no State may use or encourage the use of economic, political or any other type of measures to coerce another State in order to obtain from it the subordination of the exercise of its sovereign rights, Taking note of the report submitted by the Secretary-General* pursuant to Commission on Human Rights resolution 1995/45 of 3 March 1995,? Recognizing the universal, indivisible, interdependent and interrelated character of all human rights, and, in this regard, reaffirming the right to development as an integral part of all human rights, Recalling that the World Conference on Human Rights called upon States to refrain from any unilateral coercive measure not in accordance with international law and the Charter of the United Nations that creates obstacles to trade relations among States and impedes the full realization of all human rights,? Bearing in mind all the references to this question in the Copenhagen Declaration on Social Development, adopted by the World Summit for Social Development on 12 March 1995,‘ the Beijing Declaration and Platform of Action,° adopted by the Fourth World Conference on Women on 15 September 1995, and the Istanbul Declaration on Human Settlements and the Habitat Agenda, adopted by the United Nations Conference on Human Settlements (Habitat II) on 14 June 1996,° Deeply concerned that, despite the recommendations adopted on this issue by the General Assembly and recent major United Nations conferences, and contrary to general international law and the Charter of the United Nations, unilateral coercive measures continue to be promulgated and implemented with all their extraterritorial effects, inter alia, on the economic and social development of targeted countries and peoples and individuals under the jurisdiction of other States, Noting the continuing efforts of the Working Group on the Right to Development and reaffirming in particular its criteria according to which unilateral coercive measures are one of the obstacles to the implementation of the Declaration on the Right to Development, ' 1.  Urges all States to refrain from adopting or implementing any unilateral measure not in accordance with international law and the Charter of the United Nations, in particular those of a coercive nature with all their extraterritorial effects, which create obstacles to trade relations among States, thus impeding the full realization of the rights set forth in the > A/CONF.157/24 (Part I), chap. III, sect. I, para. 3 1. ° Report of the Fourth World Conference on Women, Beijing, 4-15 September 1995 (United Nations publication, Sales No. E.96.1V.13), chap. I, resolution 1, annexes I and II. ° Report of the United Nations Conference on Human Settlement (Habitat II), Istanbul, 3-14 June 1996 (United Nations publication, Sales No. E.97.1V.6), chap. I, resolution 1, annexes I and ITI. ” Resolution 41/128, annex. Universal Declaration of Human Rights® and other international human rights instruments, in particular the right of individuals and peoples to development; 2. Rejects unilateral coercive measures with all their extraterritorial effects as tools for political or economic pressure against any country, in particular against developing countries, because of their negative effects on the realization of all the human rights of vast sectors of their populations, in particular children, women and the elderly; 3. Calls upon Member States that have initiated such measures to commit themselves to their obligations and responsibilities arising from the international human rights instruments to which they are party by revoking such measures at the earliest time possible; 4, Reaffirms, in this context, the right of all people to self- determination, by virtue of which they freely determine their political status and freely pursue their economic, social and cultural development; 5. Urges the Commission on Human Rights to take fully into account the negative impact of unilateral coercive measures, including enactment of national laws and their extraterritorial application, in its task concerning the implementation of the right to development; 6. Requests the United Nations High Commissioner for Human Rights, in discharging her functions relating to the promotion, realization and protection of the right to development, to give urgent consideration to the present resolution in her annual report to the General Assembly; 7. Requests the Secretary-General to bring the present resolution to the attention of all Member States and seek their views and information on the implications and negative effects of unilateral coercive measures on their populations, and to submit accordingly a report thereon to the General Assembly at its fifty-third session; 8. Decides to examine this question, on a priority basis, at its fifty- third session under the sub-item entitled ""Human rights questions, including alternative approaches for improving the effective enjoyment of human rights and fundamental freedoms"". ® Resolution 217 A (III). ",18 November 1997,1997_246948,Afghanistan,"* E/CN.4/1996/45 and Add. 1.  * See Official Records of the Economic and Social Council, 1995, Supplement No. 3 and corrigenda (E/1995/23 and Corr.1 and 2), chap. II, sect. A. * Report of the World Summit for Social Development, Copenhagen, 6-12 March 1995 (United Nations publication, Sales No. E.96.IV.8), chap. I, resolution 1, annex I.",yes
