year,Council,Session,Agenda item,Agenda detail,cosponsored countries,body title number,body title detail,body text,date,file,filecountry,footnote,scanned
1998,Third Committee,Fifty-third session,106,Promotion and protection of the rights of children,"Afghanistan, Angola, Antigua and Barbuda, Bangladesh, Barbados, Belarus, Bolivia, Bosnia and Herzegovina, Botswana, Burkina Faso, Canada, Cape Verde, Chile, Congo, Cuba, Cyprus, Dominican Republic, Ecuador, Eritrea, Ethiopia, Ghana, Guinea, Haiti, Honduras, Hungary, Jamaica, Kenya, Lesotho, Liberia, Malawi, Malaysia, Mali, Mauritius, Monaco, Mongolia, Mozambique, Namibia, Nigeria, Rwanda, San Marino, South Africa, Turkey, Uganda, United Republic of Tanzania, Venezuela, Zambia, Zimbabwe",N/A,The girl child,"The General Assembly , Recalling its resolution 52/106 of 12 December 1997 and all previous relevant resolutions, Also recalling the Beijing Declaration and Platform for Action of the Fourth World Conference on Women,' the Copenhagen Declaration on Social Development and the Programme of Action of the World Summit for Social Development,” the Programme of Action of the International Conference on Population and Development,’ the Vienna Declaration and Programme of Action of the World Conference on Human Rights, held at Vienna from 14 to 25 June 1993,‘ the Plan of Action for Implementing the World Declaration on the Survival, Protection and Development of Children in the 1990s of the World Summit for ' Report of the Fourth World Conference on Women, Beijing, 4-15 September 1995 (United Nations publication, Sales No. E.96.IV.13), chap. I, resolution 1, annexes I and II. ? Report of the World Summit for Social Development, Copenhagen, 6-12 March 1995 (United Nations publication, Sales No. E.96.IV.8), chap. I, resolution 1, annexes | and II. A/C.3/53/L.15 Children, held in New York on 29 and 30 September 1990,° the World Declaration on Education for All and the Framework for Action to Meet Basic Learning Needs adopted at the World Conference on Education for All,° the Declaration and Agenda for Action of the World Congress against Commercial Sexual Exploitation of Children, held at Stockholm from 27 to 31 August 1996,’ and the conclusions of the Commission on the Status of Women on critical areas of concern identified in the Beijing Platform for Action, adopted by the Commission at its forty-second session,’ in particular those relating to the girl child, Deeply concerned about discrimination against the girl child and the violation of the rights of the girl child, which often result in less access for girls to education, nutrition, physical and mental health care and in girls enjoying fewer of the rights, opportunities and benefits of childhood and adolescence than boys and often being subjected to various forms of cultural, social, sexual and economic exploitation and to violence and harmful practices such as incest, early marriage, female infanticide, prenatal sex selection and female genital mutilation, Deeply concerned also that girls, in particular adolescent girls, continue to be silent and invisible victims of violence, abuse and exploitation and that some legal systems do not address adequately the vulnerability of girls in the administration of justice, including the need for better protection of child victims and witnesses, Stressing that discrimination and neglect of the girl child can initiate a lifelong downward spiral of deprivation and exclusion from the social mainstream, Deeply concerned that in situations of poverty, war and armed conflict, girl children are among the victims most affected and that thus their potential for full development is limited, Concerned that the girl child has furthermore become a victim of sexually transmitted diseases and the human immunodeficiency virus, which affects the quality of her life and leaves her open to further discrimination, Reaffirming the equal rights of women and men as enshrined, inter alia, in the preamble to the Charter of the United Nations, the Convention on the Elimination of All Forms of Discrimination against Women’ and the Convention on the Rights of the Child, '° 1. Stresses the need for full and urgent implementation of the rights of the girl child as guaranteed to her under all human rights instruments, including the Convention on the Rights of the Child and the Convention on the Elimination of All Forms of Discrimination against Women, as well as the need for universal ratification; 2. Urges all States to take all necessary measures and to institute legal reforms to ensure the full and equal enjoyment by the girl child of all human rights and fundamental freedoms, to take effective action against violations of those rights and freedoms and to base programmes and policies for the girl child on the rights of the child; ® Final Report of the World Conference on Education for All: Meeting Basic Learning Needs, Jomtien, Thailand, 5—9 March 1990, Inter-Agency Commission (UNDP, UNESCO, UNICEF, World Bank) for the World Conference on Education for All, New York, 1990, appendices I and II. > Resolution 34/180, annex. !° Resolution 44/25, annex. A/C.3/53/L.15 3. Urges States to base programmes and policies for the girl child on the rights of the child, the responsibilities, rights and duties of the parents and the evolving capacity of the girl child, in accordance with the Beijing Platform for Action and the Convention on the Rights of the Child; 4. Also urges States to prepare programmes for the girl child as part of their national action plans in order to implement fully the Beijing Platform for Action; 5. Urges all States to enact and enforce legislation protecting girls from all forms of violence, including female infanticide and prenatal sex selection, female genital mutilation, rape, domestic violence, incest, sexual abuse, sexual exploitation, child prostitution and child pornography, and to develop age-appropriate safe and confidential programmes and medical, social and psychological support services to assist girls who are subjected to violence; 6. Calls upon all States and international and non-governmental organizations, individually and collectively: (a) To set goals and to develop and implement gender-sensitive strategies to address the rights and needs of children, in accordance with the Convention on the Rights of the Child and the Convention on the Elimination of All Forms of Discrimination against Women, to take into account the rights and particular needs of the girl child, especially in education, health and nutrition, and to eliminate negative cultural attitudes and practices against the girl child; (b) To take measures to ensure the non-discrimination and equal enjoyment of all human rights and fundamental freedoms of the girl child with disabilities; (c) To generate social support for the enforcement of laws on the minimum legal age for marriage, in particular by providing educational opportunities for girls; (d) To give attention to the rights and needs of adolescent girls, which call for special action for their protection from sexual and economic exploitation and abuse, harmful traditional and cultural practices, teenage pregnancy and vulnerability to sexually transmitted diseases and human immunodeficiency virus/acquired immunodeficiency syndrome and for the development of life skills and self-esteem, reaffirming that the advancement and empowerment of women throughout the life cycle must begin with the girl child at all ages; (e) To review teaching materials, including textbooks, to promote the self-esteem of women and girls through positive self-images and to revise these materials, highlighting women’s effective role in society, including in decision-making, development, culture, history, sports and other social, political and economic endeavours; (f) To take measures to increase awareness of the potential of the girl child and to promote gender-sensitive socialization of boys and girls from early childhood, with the aim of achieving gender equality, development and peace within the family and the community; (g) To ensure the equal participation of girls and young women on the basis of non- discrimination and as partners with boys and young men in social, economic and political life and the development of strategies and the implementation of action aimed at achieving gender equality, development and peace; (h) To strengthen and reorient health education and health services, in particular primary health-care programmes, including in sexual and reproductive health, and to design quality health programmes that meet the physical and mental needs of girls and attend to the needs of young expectant and nursing mothers; (i) To make information and counselling widely available to adolescent girls and boys, especially on human relationships, reproductive and sexual heath, sexually transmitted A/C.3/53/L.15 diseases and adolescent pregnancy, in a manner that is confidential and easily accessible, and to emphasize the equal responsibility of girls and boys; (j) To provide adequate infrastructure and support services to respond to the needs of the survivors of violence against women and girls and to assist them towards full recovery and reintegration into society; (k) To provide gender-sensitive training for personnel in the administration of justice, law enforcement agencies, security, social and health-care services, schools and migration authorities and to develop guidelines to ensure appropriate police and prosecutorial responses in cases of violence against women and girls; 7. Urges States to enact and strictly enforce laws to ensure that marriage is entered into only with the free and full consent of the intending spouses, to enact and strictly enforce laws concerning the minimum legal age of consent and the minimum age for marriage and to raise the minimum age for marriage where necessary; 8. Also urges States to eliminate all barriers so as to enable girls, without exception, to develop their full potential and skills through equal access to education and training; 9. Urges States, educational institutions and the United Nations system to provide gender-sensitive training for school administrators, parents and all members of the school community; 0. Encourages States to consider ways and means to ensure the continuing education and training of married women, pregnant women and young mothers and to protect them from discrimination; 1. Urges States to take special measures for the protection of children, in particular to protect girls from rape and other forms of sexual abuse and gender-based violence in situations of armed conflict, paying special attention to refugee and displaced girls and taking into account the special needs of the girl child in the delivery of humanitarian assistance; 2. Urges States parties to fulfil the obligations they have undertaken under the Convention on the Rights of the Child and the Convention on the Elimination of All Forms of Discrimination against Women to protect women and girls from all forms of violence, including domestic violence, sexual exploitation and trafficking and child prostitution; 3. Urges States to formulate comprehensive, multidisciplinary and coordinated national plans, programmes or strategies, which should be widely disseminated, to eliminate all forms of violence against women and girls and provide targets and timetables for implementation and effective domestic enforcement procedures through monitoring mechanisms, involving all parties concerned, including consultations with women’s organizations; 14. Also urges States to implement measures to protect women and girls from all forms of violence, in line with the recommendations of the Special Rapporteur of the Commission on Human Rights on violence against women, its causes and consequences; 15. Requests all States to implement, on an urgent basis, measures to protect children from all forms of sexual exploitation, including measures in line with those outlined in the Declaration and Agenda for Action of the World Congress against Commercial Sexual Exploitation of Children;’ 16. Calls upon Governments, civil society, including the media, and non-governmental organizations to promote human rights education and the full respect for and enjoyment of the human rights of the girl child, inter alia, through the translation, production and A/C.3/53/L.15 dissemination of age-appropriate information materials on these rights to all sectors of society, and in particular to children; 17. Calls upon Governments to encourage efforts by civil society and non- governmental organizations, including women’s organizations, to establish community-based groups or local committees that could assist with the safety and welfare of children; 18. Requests the Secretary-General, as Chairman of the Administrative Committee on Coordination, to ensure that all organizations and bodies of the United Nations system individually and collectively, in particular the United Nations Children’s Fund, the United Nations Educational, Scientific and Cultural Organization, the World Food Programme, the United Nations Population Fund, the United Nations Development Fund for Women, the World Health Organization and the United Nations High Commissioner for Refugees, take into account the rights and the particular needs of the girl child, especially in education, health and nutrition, and eliminate negative cultural attitudes and practices against the girl child in the implementation of the outcomes of all recent global conferences, in particular the Platform for Action of the Fourth World Conference on Women, and of the system-wide medium-term plan for the advancement of women for the period 1996-2001;""! 19. Calls upon the Commission on Human Rights, when considering the human rights of women, in particular those relating to economic resources, to pay particular attention to all the human rights of the girl child; 20. Requests all human rights treaty bodies, special procedures and other human rights mechanisms of the Commission on Human Rights and the Subcommission on Prevention of Discrimination and Protection of Minorities to regularly and systematically adopt a gender perspective in the implementation of their mandates and to include in their reports information on the qualitative analysis of violations of human rights of women and girls, and encourages the strengthening of cooperation and coordination in that regard; 22. Also calls upon States and international and non-governmental organizations to implement fully, as appropriate, the conclusions on the girl child adopted by the Commission on the Status of Women at its forty-second session. ‘| B/1993/43, annex.",10/26/1998,1998_262635,Barbados,"* 4/45/625, annex.",yes
1998,First Committee,Fifty-third session,71 (q),General and complete disarmament,"Bahamas, Barbados, Belarus, Bolivia, Congo, Fiji, Malawi and Mali:",N/A,Regional disarmament,"The General Assembly , Recognizing that the establishment of internationally recognized nuclear-weapon-free zones, with due regard to the specific characteristics of each region and on the basis of arrangements freely arrived at by the States of the region concerned, can play an important role in promoting regional and global peace and security, Welcoming the Treaties of Tlatelolco, Rarotonga, Bangkok, Pelindaba as well as Almaty Declaration on the creation of nuclear-weapon-free zones and similar initiatives in the respective regions, in accordance with established principles, Noting the sovereign resolve of the States of Central and Eastern Europe to contribute to, and benefit from, the new European security architecture based, inter alia, upon the principles of good-neighbourly relations as well as cooperation with and accession to the Euro-Atlantic structures, Welcoming that, as a result of the historic events of the past few years leading to enhancement of the atmosphere of trust, mutual respect and partnership among European States, the nuclear weapons were withdrawn from the territories of Belarus, Kazakhstan and Ukraine and currently there are no nuclear weapons stationed in the territories of Central and Eastern European States, Taking note also of the statement of Ministerial North-Atlantic Council Meeting, on 10 December 1996 and confirmed by the Heads of States or Governments of NATO countries in Founding Act on Mutual Relations, Cooperation and Security between Russian Federation and the North Atlantic Treaty Organization on 27 May 1997, that NATO countries have no intention, no plan, and no reason to deploy nuclear weapons on the territory of new members, A/C.1/53/L.23/Rev.1 Welcoming efforts to enhance stability and security in Central and Eastern Europe through building a new regional security architecture based on cooperation, shared values and without creating new dividing lines, 1. Urges all the concerned States to exert efforts to continue making it possible to have no intention, no plan and no reason to deploy nuclear weapons on the territory of the non-nuclear States of the region of Central and Eastern Europe; 2. Calls upon all States of Central and Eastern Europe and other States concerned to continue to abide by their nuclear non-proliferation obligations under existing multilateral and bilateral agreements; 3. Decides to consider implementation of the present resolution at its fifty-fifth session under the item entitled ““General and complete disarmament”.",11/03/1998,1998_262947,Barbados,* Reissued for technical reasons.,yes
1998,Economic And Social Council,Fifty-third session,12,Report of the Economic and Social Council98-33619 (E),"Afghanistan, Albania, Algeria, Andorra, Angola, Antigua and Barbuda, Argentina, Armenia, Australia, Austria, Azerbaijan, Bahrain, Bangladesh, Barbados, Belarus, Benin, Bhutan, Bolivia, Bosnia and Herzegovina, Brazil, Bulgaria, Burkina Faso, Burundi, Cameroon, Canada, Cape Verde, Central African Republic, Chile, China, Colombia, Congo, Costa Rica, Céte d’Ivoire, Croatia, Cuba, Cyprus, Czech Republic, Djibouti, Ecuador, Egypt, El Salvador, Equatorial Guinea, Eritrea, Ethiopia, Fiji, Finland, France, Gabon, Georgia, Germany, Greece, Guatemala, Guinea, Guyana, Haiti, Honduras, Iceland, India, Indonesia, Iran (Islamic Republic of), Ireland, Italy, Jamaica, Japan, Jordan, Kazakhstan, Kuwait, Kyrgyzstan, Latvia, Lebanon, Lesotho, Liechtenstein, Luxembourg, Malawi, Malaysia, Malta, Mauritius, Mexico, Monaco, Mongolia, Morocco, Myanmar, Namibia, Nepal, Netherlands, Nicaragua, Nigeria, Norway, Oman, Pakistan, Peru, Philippines, Portugal, Republic of Korea, Republic of Moldova, Romania, Russian Federation, Saint Lucia, Samoa, San Marino, Saudi Arabia, Singapore, Slovakia, Slovenia, Solomon Islands, South Africa, Spain, Sri Lanka, Sudan, Suriname, Syrian Arab Republic, Tajikistan, Thailand, the former Yugoslav Republic of Macedonia, Togo, Trinidad and Tobago, Tunisia, Turkey, Turkmenistan, Uganda, Ukraine, United Republic of Tanzania, United States of America, Uruguay, Uzbekistan, Vanuatu, Venezuela, Viet Nam, Yemen and Zambia",N/A,International Year of Mountains,"The General Assembly , Recalling Economic and Social Council resolution 1998/30 of 29 July 1998, 041198 Recalling also the relevant provisions of Agenda 21 on sustainable mountain development, Noting the work already undertaken to achieve sustainable mountain development by the Food and Agriculture Organization of the United Nations, including its role as task manager for chapter 13 of Agenda 21, 1. Proclaims the year 2002 as the International Year of Mountains; 2. Invites the Food and Agriculture Organization of the United Nations to serve as the lead agency for the Year, in collaboration with Governments, the United Nations Environment Programme, the United Nations Development Programme, the United Nations Educational, Scientific and Cultural Organization and other relevant organizations of the United Nations system and non-governmental organizations; 3. Calls upon Governments, national and international organizations, non- governmental organizations and the private sector to make voluntary contributions in accordance with the guidelines of the Economic and Social Council for international years and anniversaries and to lend other forms of support to the International Year of Mountains; 4. Encourages all Governments, the United Nations system and all other actors to take advantage of the International Year of Mountains to increase awareness of the importance of sustainable mountain development; 5. Requests the Secretary-General to submit to the General Assembly at its fifty-fifth session a report on the state of the preparations for the International Year of Mountains.",11/03/1998,1998_263215,Barbados,N/A,yes
