year,Council,Session,Agenda item,Agenda detail,cosponsored countries,body title number,body title detail,body text,date,file,filecountry,footnote,scanned
1998,Economic And Social Council,Substantive session,7 (f),"*COORDINATION, PROGRAMME AND OTHER QUESTIONS: INTERNATIONAL YEAR FOR THE CULTURE OF PEACE, 2000","Afghanistan**, Bangladesh, Barbados**, Belarus, Brazil, Burundi**, Cape Verde, Costa Rica**, Céte d’Ivoire**, Gabon, Guinea**, Jordan, Kyrgyzstan**, Madagascar**, Mali**, Morocco**, Niger**, Panama**, Papua New Guinea**, Poland, Qatar**, Swaziland**, Saint Lucia, Turkmenistan** and Togo",N/A,International Decade for a Culture of Non-violence and Peace for the Children of the World (2001-2010),"The Economic and Social Council , Recommends to the General Assembly , in this year of the commemoration of the fiftieth anniversary of the Universal Declaration of Human Rights* which sustains the spirit, concept and practice of non-violence, the adoption at its fifty-third session of the following resolution: ** In accordance with rule 72 of the rules of procedure of the Economic and Social Council. + General Assembly resolution 217 A (111). ""International Decade for a Culture of Non-violence and Peace for the Children of the World (2001-2010) "" The General Assembly , ""Taking note with appreciation of the ‘Appeal for the children of the world’ of Nobel Peace Prize laureates, issued in May 1997, which draws attention of all the States Members of the United Nations to the enormous harm and suffering caused to, and by, children through different forms of violence at every level of our societies throughout the world, and proposes the principles and practice of non-violence as a way of promoting respect for the life and dignity of each human being without prejudice or discrimination of any kind, and especially for the world’s children, ""Recalling its resolution 52/15 of 20 November 1997 and Economic and Social Council resolution 1997/47 of 22 July 1997 in which the Council recommended that the General Assembly at its fifty-second session proclaim the year 2000 as International Year for the Culture of Peace, as well as Assembly resolution 52/13 of 20 November 1997 on a culture of peace, ""Recognizing that the appeal by the Nobel Peace Prize laureates to construct a culture of non-violence and peace and simultaneously to teach the practice of non-violence to children in different contexts and continents promotes the purposes and principles of the Charter of the United Nations, and underscores a priority concern of the world community which requires a persistent and sustainable effort throughout the world at the international, regional, national and local levels to reduce the all- too-evident suffering of children, ""Emphasizing that the promotion of a culture of non-violence and peace that emanates from childhood will contribute to the strengthening of international peace and cooperation for socio-economic and cultural development, enable a more deeply mindful behaviour among children and help them to be aware, not only of their rights but also of their responsibilities, by learning how to live together in harmony, within their families and schools, ""Underlining that the proposed decade will contribute to advancing the implementation of the other objectives, activities and programmes of the United Nations and non-governmental organizations aimed at promoting human rights, education, non-discrimination, volunteers’ commitments, protection of the environment and protection of children in especially difficult circumstances as enshrined in the Convention on the Rights of the Child,’ ""Convinced that an international decade for a culture of non-violence and peace for the children of the world, at the beginning of the new millennium, would give a strong encouragement to the efforts of the international community to foster harmony, peace and development on behalf of the children of the globe, 2? General Assembly resolution 44/25, annex. ""Noting with satisfaction that the initiative of the Nobel Peace Prize laureates has been supported by many Governments, non-governmental organizations and individuals of all spiritual traditions, in all regions of the world, "" 1. Proclaims that the period 2001-2010 shall constitute the international decade for a culture of non-violence and peace for the children of the world; ""2, Invites the Secretary-General to present a report to the General Assembly at its fifty-fifth session, prepared in consultation with the Nobel Peace Prize laureates and with all relevant United Nations bodies and non-governmental organizations, with respect to finalizing the programme of action of the Decade in connection with the implementation of the Decade at local, national, regional and international levels, and to nominate a specific team to coordinate the agenda and mandate of the Decade; ""3. Also invites all Member States to take the necessary steps to ensure that the practice of non-violence, which will focus on the practical meaning and benefits of the practice of non-violence in daily life, is taught at all levels in their respective societies, including in each educational institution, and calls upon the relevant United Nations bodies such as the United Nations Children’s Fund, the United Nations Educational, Scientific and Cultural Organization and the Office of the United Nations High Commissioner for Refugees, spiritual leaders throughout the world, non-governmental organizations, educational institutions, the media, the performing arts and civil societies to actively support the Decade for the benefit of each child of the world without anyone’s being left behind; ""4, Decides to include in the provisional agenda of its fifty-fifth session an item entitled ’Decade for a Culture of Non-violence and Peace for the Children of the World (2001-2010)’.""",06/29/1998,1998_256355,Barbados,* E/1998/100. ** In accordance with rule 72 of the rules of procedure of the Economic and Social Council.,yes
1998,General Assembly,Fifty-third session,N/A,UNITED NATIONS A,"Barbuda, Bahamas, Barbados, Belize, Colombia, Costa Rica, Cuba, Dominica, the Dominican Republic, El Salvador, Grenada, Guatemala, Guyana, Haiti, Honduras, Jamaica, Mexico, Nicaragua, Panama, Saint Kitts and Nevis, Saint Lucia, Saint Vincent and the Grenadines, Suriname, Trinidad and Tobago and Venezuela to the United Nations addressed to the Secretary-General Upon instructions from our Governments, we have the honour to request you, pursuant to rule 13 of the rules of procedure of the General Assembly, to include in the provisional agenda of the fifty-third regular session of the General Assembly an item entitled ""Observer status for the Association of Caribbean States in the General Assembly"". Pursuant to rule 20 of the rules of procedure of the General Assembly, we attach an explanatory memorandum (see annex I)",N/A,I,"I). (Signed) Mr. John William ASHE (Signed) Mr. Carlston B. BOUCHER Chargé d’affaires of the Permanent Representative Permanent Mission of Antigua and of Barbados to the United Nations Barbuda to the United Nations (Signed) Mr. Maurice MOORE (Signed) Mr. Alfonso GAHONA Permanent Representative Chargé d’affaires a.i. of the of the Bahamas to the United Nations Permanent Mission of Belize to the United Nations (Signed) Mr. Andelfo J. GARCIA Chargé d’affaires a.i. of the Permanent Mission of Colombia to the United Nations (Signed) Mr. Bruno RODRIGUEZ-PARRILLA Permanent Representative of Cuba to the United Nations (Signed) Mr. Luis LITHGOW Chargé d’affaires a.i. of the Permanent Mission of the Dominican Republic to the United Nations (Signed) Mr. Permanent Representative of Guatemala to the United Nations (Signed) Mr. Robert MILLETTE Permanent Representative of Grenada to the United Nations (Signed) Mr. Hugo NOE-PINO Permanent Representative of Honduras to the United Nations (Signed) Mr. Emanuel TELLO Permanent Representative of Mexico to the United Nations (Signed) Mr. Aquilino BOYD Permanent Representative of Panama to the United Nations (Signed) Mr. Herbert G. V. YOUNG Permanent Representative of Saint Vincent and the Grenadines to the United Nations (Signed) Mr. Michel Orlando KERPENS Chargé d’affaires of the Permanent Mission of Suriname to the United Nations (Signed) Mr. Norman M. MONAGAS-LESSEUR Chargé d’affaires a.i. of the Permanent Mission of Venezuela to the United Nations Julio Armando MARTINI HERRERA (Signed) Mr. Permanent Re of Costa Ric (Signed) Mr. Permanent Re of Dominica (Signed) Mr. Permanent Re Fernando BERROCAL SOTO presentative a to the United Nations Simon Paul RICHARDS presentative to the United Nations Ricardo CASTANEDA-CORNEJO presentative of El Salvador to the United Nations (Signed) Mr. Permanent Re of Guyana to (Signed) Mr. Permanent Re of Haiti to (Signed) Miss Permanent Re of Jamaica t (Signed) Mr. Permanent Re of Nicaragua (Signed) Mr. Chargé d’aff Permanent Mi and Nevis to (Signed) Ms. Chargé d’aff Permanent Mi to the Unite (Signed) Mr. Permanent Re and Tobago t Samuel INSANALLY presentative the United Nations Pierre LELONG presentative the United Nations M. Patricia DURRANT presentative o the United Nations Enrique PAGUAGUA FERNANDEZ presentative to the United Nations Kevin ISAAC aires a.i. of the ssion of St. Kitts the United Nations Sonia R. LEONCE aires a.i. of the ssion of Saint Lucia d Nations George William MCKENZIE presentative of Trinidad o the United Nations ANNEX I {Original: English and Spanish] Explanatory memorandum The Association of Caribbean States (ACS) came into being on 4 August 1995, date of the entry into force of the Convention establishing the Association of Caribbean States, which had been adopted at Cartagena de Indias, Colombia, on 24 July 1994. The members of ACS are Antigua and Barbuda, the Bahamas, Barbados, Belize, Colombia, Costa Rica, Cuba, Dominica, the Dominican Republic, El Salvador, Grenada, Guatemala, Guyana, Haiti, Honduras, Jamaica, Mexico, Nicaragua, Panama, Saint Lucia, Saint Kitts and Nevis, Saint Vincent and the Grenadines, Suriname, Trinidad and Tobago and Venezuela. In addition, France (in respect of French Guiana, Guadeloupe and Martinique) and the Netherlands Antilles have joined the Association as associate members. Participation in this capacity is open to Anguilla, Aruba, Bermuda, the British Virgin Islands, the Cayman Islands, Montserrat, Puerto Rico, the Turks and Caicos Islands, and the United States Virgin Islands. Observer status has been granted to Argentina, Brazil, Canada, Chile, Ecuador, Egypt, India, Italy, the Netherlands (in respect of the Netherlands Antilles and Aruba), Morocco, Peru, the Russian Federation and Spain. The following regional organizations have been granted the status of founding observers of the ACS: the Caribbean Community (CARICOM), the Central American Integration System (SICA), the Latin American Economic System (SELA), and the Permanent Secretariat of the General Treaty on Central American Economic Integration (SIECA). The Convention also provides for participation by social actors. In accordance with article 102 of the Charter of the United Nations, the Convention was registered with the United Nations Secretariat on 1 November 1995. The basic purposes of the ACS are to facilitate consultation, cooperation and concerted action in order to identify and promote the implementation of policies and programmes seeking to: (a) Harness, utilize and develop the collective capabilities of the Caribbean region to achieve sustained cultural, social, scientific and technological advancement; (b) Develop the potential of the Caribbean Sea through interaction among Member States and with third parties; (c) Promote an enhanced economic space for trade and investment with opportunities for cooperation and concerted action, in order to increase the benefits which accrue to the peoples of the Caribbean from their resources and assets, including the Caribbean Sea; (d) Establish, consolidate and augment, as appropriate, institutional structures and cooperative arrangements responsive to the various cultural identities, developmental needs and normative systems within the region. For the purpose of achieving these aims, ACS promotes among its members the following activities: (a) Economic integration, including the liberalization of trade, investment, transportation and other related areas; (b) Discussion on matters of common interest for the purpose of facilitating active and coordinated participation of the region in the various multilateral forums; (c) Formation and implementation of policies and programmes for functional cooperation in the above-mentioned fields; (d) Preservation of the environment and the conservation of natural resources of the region and especially the Caribbean Sea; (e) Strengthening of friendly relationships among Governments and peoples of the Caribbean; (f) Consultation, cooperation and concerted action in such other areas as may be agreed upon. In August 1995 the first summit of heads of State and Government of ACS was held at Port of Spain, Trinidad and Tobago. The Declaration of Principles and Plan of Action adopted at this meeting identified three sectors, tourism, trade and transport, as key areas for the creation of a more viable economic space and the advancement of the integration process in the Caribbean. Since then the Ministerial Council, permanent organ of ACS, has, for the purpose of furthering the achievement of the aims of ACS, held three ordinary meetings. They have taken place, in December 1995, December 1996 and November 1997 at, respectively, Guatemala City, Havana and Cartagena, Colombia. The Ministerial Council has established special committees to deal with matters that include: trade and external economic relations; the protection and conservation of the environment and of the Caribbean Sea; natural resources; science, technology, health, education and culture; and tourism and transport. There has also been established a working group on natural resources under the auspices of the Committee for the Protection and Conservation of the Environment and of the Caribbean Sea. In its endeavour to implement the Plan of Action of Tourism, Trade and Transport, the Special Committee on Tourism has formulated Principles and Strategies for the establishment of a Sustainable Tourism Zone in the Caribbean, the first zone of this type in the world; the Special Committee on Trade and External Economic Relations has begun to work on the development of an ACS information system and a payment system to promote opportunities for trade and investment among ACS member States; the technical group on transportation has outlined the basic principles, objectives and activities for the development of Joes an action plan for 1998, aiming at the realization of the ideal of uniting the Caribbean region by air and sea. It has also been decided to create a mechanism for disaster prevention, mitigation and preparedness with a view to its becoming operational in 1998, on the basis of proposals formulated by the ACS secretariat, the Caribbean Disaster Emergency Response Agency (CERA), the Coordination Centre for the Prevention of Natural Disasters in Central America (CEPREDENAC), and the Pan American Health Organization (PAHO); the Special Committee on Science, Technology, Education, Health and Culture is developing a network for cooperation in areas of common interest in science and technology; and the ACS information and communication network continues to develop through the establishment of ever more fluid communication links among member States. In order to advance the work of ACS, the ACS secretariat, headquartered in Port of Spain, has been charged with coordinating the various activities and cooperating with the founding observers of ACS as well as with other regional, hemispheric and international agencies. As a regional organization composed of and representing 25 member States which are also Members of the United Nations, ACS is convinced that possession of observer status in the United Nations",07/06/1998,1998_256697,Barbados,General AssemblyDistr. GENERALA/53/143 6 July 1998ORIGINAL: ENGLISHFifty-third sessionREQUEST FOR THE INCLUSION OF AN ITEM IN THE PROVISIONAL AGENDA OF THE FIFTY-THIRD SESSIONOBSERVER STATUS FOR THE ASSOCIATION OF CARIBBEAN STATES IN THE GENERAL ASSEMBLYLetter dated 23 June 1998 from the representatives of Antigua and,yes
1998,Economic And Social Council,Substantive session,7 (f),"COORDINATION, PROGRAMME AND OTHER QUESTIONS: INTERNATIONAL YEAR FOR THE CULTURE OF PEACE 2000","Afghanistan*, Bangladesh, Barbados*, Belarus, Brazil, Burundi*, Cape Verde, Costa Rica*, Céte d’Ivoire*, Gabon, Guinea*, Jordan, Kyrgyzstan*, Madagascar*, Mali*, Malta*, Morocco*, Mozambique, Niger*, Panama*, Papua New Guinea’, Philippines*, Poland, Qatar*, Saint Lucia, Swaziland*, Turkmenistan*, Togo and Venezuela*",N/A,International Decade for a Culture of Non-violence and Peace for the Children of the World (2001-2010,"The Economic and Social Council Recommends to the General Assembly , in this year of the commemoration of the fiftieth anniversary of the Universal Declaration of Human Rights* which sustains the spirit, concept and practice of peace and non-violence, the adoption at its fifty-third session of the following resolution: + General Assembly resolution 217 A (111). ""International Decade for a Culture of Non-violence and Peace for the Children of the World "" The General Assembly , ""Recalling its resolution 52/15 of 20 November 1997 and Economic and Social Council resolution 1997/47 of 22 July 1997 proclaiming the year 2000 as the International Year for the Culture of Peace, as well as General Assembly resolution 52/13 of 20 November 1997 on a culture of peace, ""Recognizing that enormous harm and suffering are caused to children through different forms of violence at every level of our societies throughout the world and that principles and practice of non-violence and peace can promote respect for life and dignity of each human being without prejudice or discrimination of any kind, especially for the world’s children, ""Recognizing also the role of education in constructing a culture of non-violence and peace, in particular by teaching the practice of non- violence to children, as it promotes the purposes and principles of the Charter of the United Nations, ""Emphasizing that the promotion of a culture of non-violence and peace that emanates from childhood will contribute to the strengthening of international peace and cooperation for socio-economic and cultural development, and will help children to be aware, not only of their rights but also of their responsibilities, by learning how to live together in harmony, within their families and among fellow human beings, ""Underlining that the proposed decade will contribute to advance the implementation of the other objectives, activities and programmes of the United Nations aimed at promoting human rights, education, non-discrimination, volunteers’ commitments, protection of the environment and protection of children in especially difficult circumstances as enshrined in the Convention on the Rights of the Child,? ""Convinced that an international decade for a culture of non-violence and peace for the children of the world, at the beginning of the new millennium, would give a strong encouragement to the efforts of the international community to foster harmony, peace and development throughout the world, "" 1. Proclaims that the period 2001-2010 will constitute the International Decade for a Culture of Non-violence and Peace for the Children of the World; ""2, Invites the Secretary-General to present a report to the General Assembly at its fifty-fifth session, in consultation with all relevant 2? General Assembly resolution 44/25, annex. United Nations bodies and non-governmental organizations, to finalize the programme of action of the Decade in connection with the implementation of the Decade at local, national, regional and international levels, and to coordinate the agenda and mandate of the Decade; ""3, Invites each Member State to take the necessary steps to ensure that the practice of non-violence is taught at all levels in their society including in each educational institution, which will focus on the practical meaning and benefits of the practice of non-violence in daily life; ""4, Calls upon the relevant United Nations bodies such as the United Nations Children’s Fund, the United Nations Educational, Scientific and Cultural Organization and the Office of the United Nations High Commissioner for Refugees, spiritual leaders throughout the world, non-governmental organizations, educational institutions, the media, the performing arts and civil societies to actively support the Decade for the benefit of every child of the world; ""5. Decides to include in the provisional agenda of its fifty-fifth session an item entitled ’International Decade for a Culture of Non-violence and Peace for the Children of the World (2001-2010)’.""",07/10/1998,1998_256827,Barbados,* In accordance with rule 72 of the rules of procedure of the Economic and Social Council.,yes
1998,Economic And Social Council,Substantive session,7 (e),"COORDINATION, PROGRAMME AND OTHER QUESTIONS","Afghanistan*, Albania*, Algeria, Andorra*, Angola*, Argentina, Armenia*, Australia*, Austria*, Azerbaijan*, Bahrain*, Bangladesh, Barbados*, Belarus, Benin*, Bhutan*, Bolivia*, Bosnia and Herzegovina*, Brazil, Bulgaria*, Canada, Central African Republic, Chile, China, Colombia, Congo*, Costa Rica*, Céte d’ Ivoire*, Croatia*, Cuba, Cyprus*, Czech Republic, Djibouti, Ecuador*, Egypt*, El Salvador, Ethiopia*, Fiji*, France, Gabon, Georgia*, Germany, Greece*, Guatemala*, Guinea*, Guyana, Honduras*, Iceland, India, Indonesia*, Iran (Islamic Republic of)*, Ireland*, Italy, Jamaica*, Japan, Jordan, Kazakhstan*, Kenya*, Kyrgyzstan*, Latvia, Lebanon, Lesotho, Liechtenstein*, Luxembourg*, Malawi*, Malaysia*, Malta*, Mauritius, Monaco*, Mongolia*, Morocco*, Myanmar*, Nepal*, Netherlands*, Nicaragua, Oman, Pakistan, Peru*, Philippines*, Republic of Korea, Moldova*, Romania, Russian Federation, Saint Lucia, San Marino*, Slovakia*, Slovenia*, Solomon Islands*, South Africa*, Spain, Sri Lanka, Tajikistan*, Thailand*, the former Yugoslav Republic of Macedonia*, Tunisia, Turkey, Turkmenistan*, Uganda*, Ukraine*, United States of America, Uruguay*, Viet Nam, Yemen* and Switzerland*",N/A,Proclamation of an international year of mountains,"The Economic and Social Council , Recalling its resolution 1997/45 of 22 July 1997 on the proclamation of an international year of mountains, Social Council. Recalling also its resolution 1980/67 of 25 July 1980 on international years and anniversaries, in which it recognized the contribution that the celebration of international years could make to the furtherance of international cooperation and understanding, Taking note of the report of the Secretary-General, in which it is recognized that the proclamation of an international year of mountains would provide an impetus for achieving sustainable mountain development,’ Recommends that the General Assembly at its fifty-third session proclaim the year 2002 as the International Year of Mountains. + £/1998/68, para. 16.",07/21/1998,1998_257562,Barbados,* In accordance with rule 72 of the rules of procedure of the Economic and,yes
