year,Council,Session,Agenda item,Agenda detail,cosponsored countries,body title number,body title detail,body text,date,file,filecountry,footnote,scanned
1998,Third Committee,Fifty-third session,110 (b),"Human rights questions, including alternative approaches for improving the effective enjoyment of human rights and fundamental freedoms","Angola, Antigua and Barbuda, Argentina, Armenia, Australia, Austria, Azerbaijan, Bangladesh, Barbados, Belarus, Belgium, Benin, Bolivia, Bosnia and Herzegovina, Botswana, Brazil, Bulgaria, Burundi, Cameroon, Canada, Cape Verde, Chile, Colombia, Costa Rica, Céte d’Ivoire, Croatia, Cyprus, Czech Republic, Denmark, Dominican Republic, Ecuador, El] Salvador, Equatorial Guinea, Fiji, Finland, France, Georgia, Germany, Greece, Guatemala, Guyana, Haiti, Honduras, Iceland, Ireland, Israel, Italy, Japan, Kazakhstan, Kenya, Lesotho, Liberia, Liechtenstein, Luxembourg, Madagascar, Malawi, Mali, Malta, Marshall Islands, Micronesia (Federated States of), Monaco, Mongolia, Morocco, Namibia, Nepal, Netherlands, New Zealand, Nicaragua, Norway, Panama, Papua New Guinea, Paraguay, Peru, Philippines, Poland, Portugal, Republic of Korea, Republic of Moldova, Romania, Russian Federation, San Marino, Slovakia, Slovenia, South Africa, Spain, Sweden, Thailand, the former Yugoslav Republic of Macedonia, Togo, Trinidad and Tobago, Tunisia, Turkey, Turkmenistan, Ukraine, United Kingdom of Great Britain and Northern Ireland, United States of America, Uruguay, Venezuela, Zambia and Zimbabwe",N/A,Strengthening of the rule of law,"The General Assembly , Recalling that, by adopting the Universal Declaration of Human Rights,' fifty years ago, Member States pledged themselves to achieve, in cooperation with the United Nations, the promotion of universal respect for and observance of human rights and fundamental freedoms, ' Resolution 217 A (III). A/C.3/53/L.35 Firmly convinced that the rule of law is an essential factor in the protection of human rights, as stressed in the Declaration, and should continue to attract the attention of the international community, Convinced that, through their own national legal and judicial systems, States must provide appropriate civil, criminal and administrative remedies for violations of human rights, Recognizing the importance of the role that can be played by the Office of the United Nations High Commissioner for Human Rights in supporting national efforts to strengthen the institutions of the rule of law, Bearing in mind that, in its resolution 48/141 of 20 December 1993, the General Assembly entrusted the United Nations High Commissioner for Human Rights with, inter alia, providing advisory services and technical and financial assistance in the field of human rights, enhancing international cooperation for the promotion and protection of all human rights and coordinating human rights activities throughout the United Nations system, Recalling the recommendation of the World Conference on Human Rights, which was held at Vienna from 14 to 25 June 1993, that a comprehensive programme be established within the United Nations with a view to helping States in the task of building and strengthening adequate national structures that have a direct impact on the overall observance of human rights and the maintenance of the rule of law,” Bearing in mind that the Office of the High Commissioner remains the focal point for coordinating system-wide attention to human rights, democracy and the rule of law, Recalling its resolution 52/125 of 12 December 1997 and Commission on Human Rights resolution 1997/48 of 11 April 1997,° 1. Welcomes the report of the Secretary-General;* 2. Takes note with appreciation of the increasing number of Member States seeking assistance in strengthening and consolidating the rule of law; 3. Praises the efforts made by the Office of the United Nations High Commissioner for Human Rights to accomplish its ever-increasing tasks with the limited financial and personnel resources at its disposal; 4. Expresses its deep concern at the scarcity of means at the disposal of the Office of the High Commissioner for the fulfilment of its tasks; 5. Notes that the United Nations Programme of Advisory Services and Technical Assistance in the Field of Human Rights does not have sufficient funds to provide any substantial financial assistance to national projects that have a direct impact on the realization of human rights and the maintenance of the rule of law in countries that are committed to those ends but that face economic hardship; 6. Welcomes the deepening of the ongoing cooperation between the United Nations High Commissioner for Human Rights and other relevant bodies and programmes of the United Nations system, with a view to enhancing system-wide coordination of assistance in human rights, democracy and the rule of law, as exemplified by the recent conclusion of a Memorandum of Understanding with the United Nations Development Programme designed See A/CONF.157/24 (Part I), chap. III, sect. II, para. 69. See Official Records of the Economic and Social Council, 1997, Supplement No. 3 (E/1997/23), chap. II, sect. A. A/C.3/53/L.35 to increase coordination, mutual support, efficiency and the effectiveness of rule of law assistance programming; 7. Encourages the High Commissioner to continue the dialogue with other organs and agencies of the United Nations system, taking into account the need to explore new synergies with a view to obtaining increased financial assistance for human rights and the rule of law; 8. Also encourages the High Commissioner to continue to explore the possibility of further contact with and support of financial institutions, acting within their mandates, with a view to obtaining technical and financial means to strengthen the capacity of the Office of the High Commissioner to provide assistance to national projects aiming at the realization of human rights and the maintenance of the rule of law; 9. Requests the High Commissioner to continue to accord high priority to the technical cooperation activities undertaken by her Office with regard to the rule of law; 10. Expresses its appreciation to the efforts made by the High Commissioner to undertake an analysis of the technical cooperation provided by the United Nations in the field of human rights with the aim of formulating recommendations for inter-agency coordination, funding and allocation of responsibilities in order to improve efficiency and complementarity of action concerning, inter alia, assistance to States in strengthening the rule of law;",N/A,1998_263639,Barbados,"* A/53/309. 1 1. Requests the Secretary-General to submit a report to the General Assembly at its fifty-fifth session on the results of the contacts established in accordance with the present resolution, as well as on any other developments pertaining to the implementation of the above-mentioned recommendation of the World Conference on Human Rights.",yes
1998,Third Committee,Fifty-third session,110 (c),Human rights: human rights situations and reports of special rapporteurs and representatives,"Andorra, Antigua and Barbuda, Argentina, Austria, Bahamas, Barbados, Bolivia, Canada, Chile, Colombia, Costa Rica, Cuba, Ecuador, El Salvador, Finland, France, Germany, Greece, Guatemala, Guyana, Haiti, Ireland, Italy, Japan, Luxembourg, Mexico, Monaco, Netherlands, Norway, Panama, Paraguay, Peru, Portugal, Spain, Sweden, United Kingdom of Great Britain and Northern Ireland, United States of America, Uruguay and Venezuela",N/A,Human rights in Haiti,"The General Assembly , Guided by the principles embodied in the Charter of the United Nations, the Universal Declaration of Human Rights’ and the International Covenants on Human Rights, * Recalling its resolution 52/138 of 12 December 1997, and taking note of Commission on Human Rights resolution 1998/58 of 17 April 1998,° Recognizing the interdependence and mutual reinforcement between democracy, development and respect for human rights and fundamental freedoms and the commitment of the international community to supporting, strengthening and promoting this principle, Taking note of the report of the independent expert of the Commission on Human Rights on the situation of human rights in Haiti, Mr. Adama Dieng* who was appointed to assist the Government of Haiti to consider the development of the human rights situation in Haiti and to verify its compliance with its obligations in that field, and the recommendations contained therein, ' Resolution 217 A (III). ? Resolution 2200 A (XXI), annex. A/C.3/53/L.43 Taking into account the report of the Secretary-General on the implementation of the programme of technical cooperation aimed at strengthening the institutional capacity of Haiti in the field of human rights,* Recognizing the important contributions of the International Civilian Mission to Haiti, the United Nations Civilian Police Mission in Haiti and the National Commission for Truth and Justice, to the task of restoring and strengthening democracy in Haiti and of establishing a climate of freedom and tolerance conducive to respect for human rights in that country, Noting with satisfaction that, in its resolution 52/174 of 18 December 1997, the General Assembly renewed the mandate of the United Nations component of the International Civilian Mission of the Organization of American States and the United Nations in Haiti, Welcoming the technical assistance for the institutional development of the Haitian National Police given by the United Nations Development Programme and other members of the international community, Noting that, despite the efforts of the Government to improve the human rights situation in Haiti, in respect of which some progress has been reported, serious problems related mainly to the system for the administration of justice still persist, Noting with concern that the prolonged absence of a Prime Minister has had adverse consequences for the human rights situation, as stated in the report of the independent expert, Reiterating the hope that the Haitian people will, at the earliest possible date, be able to express their wishes fully through free, honest and transparent elections, Welcoming the decision of the Special Rapporteur of the Commission on Human Rights on violence against women to travel to Haiti on mission in November 1998, 1. Expresses its thanks to the Secretary-General, to his Special Representative for Haiti and to the independent expert of the Commission on Human Rights on the situation of human rights in Haiti for their continuing efforts in favour of the consolidation of democratic institutions in Haiti and the respect for human rights in that country; 2. Welcomes the decision of the Government of Haiti to distribute throughout the country, with the support of the International Civilian Mission in Haiti, the report of the National Commission for Truth and Justice of February 1996 and to initiate legal action in serious cases; 3. Encourages the Government of Haiti to continue its work on the reform of the judicial system, underlining the priority which that system has in the framework of the bilateral and multilateral assistance provided by the international community, including the United Nations Development Programme and, in this connection, calls upon all sectors of Haitian society concerned to adopt coordinated measures with a view to the enhancement of the system for the administration of justice, which is essential in order to ensure the respect for human rights; 4. Calls upon the Haitian authorities to mobilize the political will for the pursuit of reform and for the strengthening of the judicial system and the improvement of the country’s prisons; 5. Expresses its deep concern at the prolonged political statement which presents considerable risks for democracy, economic and social development and respect for human rights, and in this regard urges the authorities and political leaders to continue their efforts A/C.3/53/L.43 to resolve the crisis so that the appointment of a Prime Minister may be ratified by the Parliament without further delay; 6. — Notes with satisfaction the putting into operation by the Government of Haiti of the Office of Citizen Protection and invites the United Nations High Commissioner for Human Rights to contribute to its strengthening, through a programme of technical cooperation so that it may develop into a national institution for the promotion of human rights, widely open to participation by civil society; 7. Invites the international community, including the Bretton Woods institutions, to continue their involvement in the reconstruction and development of Haiti, having regard for the fragility of the political, social and economic situation of the country; 8. | Encourages the Government of Haiti to ratify the International Covenant on Economic, Social and Cultural Rights,’ the Convention against Torture and Other Cruel, Inhuman or Degrading Treatment or Punishment® and the Optional Protocols to the International Covenant on Civil and Political Rights;” 9. Decides to continue its consideration of the situation of human rights and fundamental freedoms in Haiti at its fifty-fourth session. © Resolution 39/46, annex. 7 See resolutions 2200 A (XXI), annex, and 44/128, annex.",11/12/1998,1998_263701,Barbados,N/A,yes
1998,Third Committee,Fifty-third session,110 (b),"Human rights questions: human rights questions, including alternative approaches for improving the effective enjoyment of human rights and fundamental freedoms","Antigua and Barbuda, Argentina, Azerbaijan, Bangladesh, Barbados, Bolivia, Brazil, Chile, Colombia, Costa Rica, Céte d’Ivoire, Cuba, Dominican Republic, Ecuador, El Salvador, Fiji, France, Greece, Guatemala, Guyana, Haiti, India, Israel, Madagascar, Mexico, Monaco, Mongolia, Morocco, Niger, Panama, Paraguay, Peru, Philippines, San Marino, Spain, Suriname, The former Yugoslav Republic of Macedonia, Trinidad and Tobago, Turkey, Uruguay and Venezuela",N/A,Human rights and extreme poverty,"The General Assembly , Reaffirming the Universal Declaration of Human Rights,' the International Covenant on Civil and Political Rights,” the International Covenant on Economic, Social and Cultural Rights,’ and other human rights instruments adopted by the United Nations, Considering the relevant provisions of the Vienna Declaration and Programme of Action, adopted by the World Conference on Human Rights on 25 June 1993,* and of the Copenhagen Declaration on Social Development and Programme of Action of the World Summit for Social Development, adopted by the World Summit on 12 March 1995,° ' Resolution 217 A (III). ? See resolution 2200 A (XXI), annex. 3 Ibid. A/C.3/53/L.40 Recalling its resolutions 47/196 of 22 December 1992, by which it declared 17 October International Day for the Eradication of Poverty, 48/183 of 21 December 1993, by which it proclaimed 1996 International Year for the Eradication of Poverty, 50/107 of 20 December 1995, by which it proclaimed the first United Nations Decade for the Eradication of Poverty (1997-2006), 51/97 of 12 December 1996 on human rights and extreme poverty and 52/193 of 18 December 1997, in which it emphasized the follow-up of the Decade, Recalling also its resolution 52/134 of 12 December 1997, in which it recognized that the enhancement of international cooperation in the field of human rights was essential for the understanding, promotion and protection of all human rights, Bearing in mind Commission on Human Rights resolutions 1992/11 of 21 February 1992,° 1993/13 of 26 February 1993,71994/12 of 25 February 1994, 1995/16 of 24 February 1995,° 1996/10 of 11 April 1996}° resolution 1997/11 of 3 April 199% and resolution 1998/25 of 17 April 1998,'? as well as resolution 1996/23 of 29 August 1996 of the Subcommission on Prevention of Discrimination and Protection of Minorities,'* Recalling its resolution 47/134 of 18 December 1992, in which it reaffirmed that extreme poverty and exclusion from society constituted a violation of human dignity and stressed the need for a complete and in-depth study of extreme poverty, based on the experience and the thoughts of the poorest, Recognizing that eradication of extreme poverty is a major challenge within the process of globalization and requires coordinated and continued policies, Recognizing also that, as the existence of widespread extreme poverty inhibits the full and effective enjoyment of human rights, and might, in some situations, constitute a threat to the right to life, its immediate alleviation and eventual elimination must remain a high priority for the international community, Welcoming the appointment, for a period of two years, of an independent expert on the question of human rights and extreme poverty, whose mandate includes, in particular, a contribution to the evaluation in the year 2000 of the World Summit for Social Development, and whose work should continue taking into account the efforts of the poorest themselves and the conditions in which they can convey their experiences, 1. Reaffirms that extreme poverty and exclusion from society constitute a violation of human dignity and that urgent national and international action is therefore required to eliminate them; 2. Also reaffirms that, in accordance with the Vienna Declaration and Programme of Action,"" it is essential for States to foster participation by the poorest people in the decision- making process in the communities in which they live, in the promotion of human rights and in efforts to combat extreme poverty; © See Official Records of the Economic and Social Council, 1992, Supplement No. 2 (E/1992/22), chap. II, sect. A. ° Tbid., 1995, Supplement No. 3 and corrigenda (E/1995/23 and Corr.1 and 2), chap. II, sect. A. ' Ibid., 1996, Supplement No. 3 (E/1996/23), chap. Il, sect. A. ""' Tbid., 1997, Supplement No. 3 (E/1997/23), chap. II, sect. A. Tbid., 1998, Supplement No. 3 (E/1998/23), chap. Il, sect. A. 'S See E/CN.4/1997/2-E/CN.4/Sub.2/1996/41, chap. II, sect. A. A/C.3/53/L.40 3. Recognizes that surmounting extreme poverty constitutes an essential means to the full enjoyment of political, civil, economic, social and cultural rights and reaffirms the interrelationship among these goals; 4. Emphasizes that extreme poverty is a major issue to be addressed by Governments, civil society and the United Nations system, including international financial institutions; 5. Invites the United Nations High Commissioner for Human Rights, within the framework of the implementation of the United Nations Decade for the Eradication of Poverty, to continue to give appropriate attention to the question of human rights and extreme poverty; 6. Notes with appreciation the specific action taken by the United Nations Children’s Fund to mitigate the effects of extreme poverty on children and the efforts of the United Nations Development Programme to give priority to the search for some means of alleviating poverty within the framework of the relevant resolutions, and urges them to continue in this work; 7. Invites States, United Nations bodies, in particular the Office of the United Nations High Commissioner for Human Rights and the United Nations Development Programme, intergovernmental organizations and non-governmental organizations to give appropriate attention to the links between human rights and extreme poverty; 8. Decides to consider this question further at its fifty-fifth session under the sub-item entitled “Human rights questions, including alternative approaches for improving the effective enjoyment of human rights and fundamental freedoms”.",11/12/1998,1998_263708,Barbados,N/A,yes
1998,Third Committee,Fifty-third session,110 (b),"Human rights questions: human rights questions, including alternative approaches for improving the effective enjoyment of human rights and fundamental freedoms","Andorra, Antigua and Barbuda, Armenia, Azerbaijan, Bahrain, Bangladesh, Barbados, Benin, Bosnia and Herzegovina, Bulgaria, Burkina Faso, Cameroon, Cape Verde, Central African Republic, Chad, Chile, Congo, Céte d’Ivoire, Cuba, Cyprus, Democratic Republic of the Congo, Dominican Republic, Ethiopia, Fiji, France, Gabon, Georgia, Greece, Guatemala, Guinea, Guinea-Bissau, Guyana, Hungary, India, Indonesia, Ireland, Italy, Japan, Kazakhstan, Lao People’s Democratic Republic, Lebanon, Lithuania, Madagascar, Mali, Mauritania, Monaco, Morocco, Myanmar, Niger, Pakistan, Paraguay, Peru, Philippines, Poland, Portugal, Republic of Moldova, Romania, Russian Federation, San Marino, Senegal, Spain, the former Yugoslav Republic of Macedonia, Togo, Turkmenistan, Uruguay, Uzbekistan and Venezuela",N/A,The human genome and human rights,"The General Assembly , Guided by the purposes and principles set forth in the Charter of the United Nations, the Universal Declaration of Human Rights,' the International Covenants on Human Rights and the other pertinent international instruments relating to human rights, ' Resolution 217 A (III). ? Resolution 2200 A (XXI), annex. A/C.3/53/L.49 Recalling resolutions 1993/91 of 10 March 1993? and 1997/71 of 16 April 1997 adopted by the Commission on Human Rights on the question of human rights and bioethics, Recalling that, in accordance with the Universal Declaration of Human Rights, recognition of the inherent dignity and of the equal and inalienable rights of all members of the human family is the foundation of freedom, justice and peace in the world, Aware of the rapid development of the life sciences and of ethical concerns raised by certain of their applications with regard to the dignity of the human race and the rights and freedoms of the individual, Seeking to promote scientific and technical progress in the fields of biology and genetics in a manner respectful of fundamental rights and for the benefit of all, Emphasizing, in this regard, the importance of international cooperation in order to ensure that mankind as a whole benefits from the life sciences, while seeking to prevent them from being used for any purpose other than the good of mankind, Recalling the Universal Declaration on the Human Genome and Human Rights* and the accompanying resolution on the Implementation of the Universal Declaration on the Human Genome and Human Rights,° both adopted by the General Conference of the United Nations Educational, Scientific and Cultural Organization at its twenty-ninth session, Recognizing the importance of the process of follow-up to the Universal Declaration on the Human Genome and Human Rights within the framework of the United Nations Educational, Scientific and Cultural Organization, Convinced of the need to develop a life sciences ethic at the national and international levels, Endorses the Universal Declaration on the Human Genome and Human Rights adopted by the United Nations Educational, Scientific and Cultural Organization on 11 November 1997.",11/12/1998,1998_263713,Barbados,N/A,yes
