year,Council,Session,Agenda item,Agenda detail,cosponsored countries,body title number,body title detail,body text,date,file,filecountry,footnote,scanned
1994,General Assembly,Forty-eighth session,181,EMERGENCY ASSISTANCE TO THE REPUBLIC OF MOLDOVA,"Albania, Algeria, Armenia, Azerbaijan, Belarus, Bulgaria, Croatia, Cyprus, Estonia, Georgia, Guatemala, Hungary, Israel, Kazakhstan, Kyrgyzstan, Latvia, Lithuania, Mauritius, Mongolia, Nepal, Nicaragua, Poland, Republic of Moldova, Romania, Russian Federation, Sudan, Tajikistan, the former Yugoslav Republic of Macedonia, Turkey, Turkmenistan, Ukraine and Uzbekistan",N/A,N/A,"The General Assembly , Deeply concerned about the extensive damage and devastation caused by the severe drought, followed by a hurricane and unprecedented floods in the Republic of Moldova, Noting with concern the destruction of thousands of dwellings and the damage to major sectors of the national infrastructure, Recognizing the efforts of the Government of the Republic of Moldova to provide relief and emergency assistance to the people affected by the flood and hurricane, Noting that the earnest efforts of the Government of the Republic of Moldova to promote the economic reform programmes will be hampered by these calamities, 1. Declares its solidarity with the Government and people of the Republic of Moldova in their affliction; 2. Commends the efforts of the international community, including the organs and organizations of the United Nations system, to supplement the efforts of the Government of the Republic of Moldova in relief operations and emergency assistance; urgent basis, further support to the Republic of Moldova to alleviate the economic and financial burden borne by the Moldovan people; 4. Calls upon the Secretary-General, in cooperation with the relevant organs and organizations of the United Nations system and in close cooperation with the government authorities, to assist in the rehabilitation efforts of the Government of the Republic of Moldova.",09/14/1994,1994_161668,Georgia,N/A,yes
1994,General Assembly,Forty-eighth session,180,OBSERVER STATUS FOR THE SOVEREIGN MILITARY ORDER OF MALTA IN THE GENERAL ASSEMBLY,"Albania, Argentina, Armenia, Austria, Belize, Benin, Bolivia, Bosnia _ and Herzegovina, Bulgaria, Burkina Faso, Burundi, Cambodia, Cameroon, Cape Verde, Chile, Colombia, Costa Rica, Céte d’Ivoire, Croatia, Cuba, Czech Republic, Dominican Republic, Ecuador, El Salvador, Estonia, Gabon, Georgia, Grenada, Guatemala, Guinea, Haiti, Honduras, Hungary, Israel, Italy, Latvia, Lebanon, Liechtenstein, Lithuania, Malta, Marshall Islands, Micronesia, (Federated States of), Morocco, Nicaragua, Panama, Paraguay, Peru, Poland, Portugal, Republic of Korea, Republic of Moldova, Romania, San Marino, Senegal, Seychelles, Slovakia, Slovenia, Spain, Thailand, the former Yugoslav Republic of Macedonia, Togo, Uruguay, Venezuela and Zaire",N/A,N/A,"The General Assembly , Considering the long-standing dedication of the Sovereign Military Order of Malta in providing humanitarian assistance, and its special role in international humanitarian relations, Desirous of enhancing cooperation between the United Nations and the Sovereign Military Order of Malta, 1. Decides to invite the Sovereign Military Order of Malta to participate in the sessions and the work of the General Assembly in the capacity of observer; 2. Requests the Secretary-General to take the necessary action to implement the present resolution.",08/22/1994,1994_162131,Georgia,N/A,yes
1994,General Assembly,Forty-ninth session,151,OBSERVER STATUS FOR THE SOUTH PACIFIC FORUM IN THE GENERAL ASSEMBLY,"Andorra, Antigua and Barbuda, Argentina, Armenia, Australia, Austria, Azerbaijan, Bahamas, Bangladesh, Barbados, Belgium, Belize, Benin, Bhutan, Bolivia, Bosnia and Herzegovina, Brazil, Bulgaria, Cambodia, Canada, Cape Verde, Chile, Colombia, Costa Rica, Céte d’Ivoire, Cuba, Cyprus, Czech Republic, Denmark, Ecuador, Egypt, Fiji, Finland, France, Georgia, Germany, Ghana, Greece, Grenada, Guyana, Honduras, Hungary, Iceland, India, Indonesia, Ireland, Israel, Italy, Jamaica, Japan, Kazakhstan, Kenya, Kyrgyzstan, Lao People’s Democratic Republic, Liechtenstein, Luxembourg, Malaysia, Maldives, Malta, Marshall Islands, Mauritius, Mexico, Micronesia (Federated States of), Monaco, Mongolia, Myanmar, Namibia, Nepal, Netherlands, New Zealand, Nicaragua, Nigeria, Norway, Papua New Guinea, Peru, Philippines, Poland, Portugal, Republic of Korea, Romania, Russian Federation, Saint Kitts and Nevis, Saint Lucia, Saint Vincent and the Grenadines, Samoa, San Marino, Seychelles, Sierra Leone, Singapore, Slovakia, Slovenia, Solomon Islands, South Africa, Spain, Sri Lanka, Sudan, Suriname, Sweden, Tajikistan, Thailand, Trinidad _and Tobago, Tunisia, Turkey, Uganda, United Kingdom of Great Britain and Northern Ireland, United States of America, Vanuatu, Venezuela and Viet Nam",N/A,N/A,"The General Assembly , Noting the desire of the South Pacific Forum for cooperation between the United Nations and the South Pacific Forum, 1. Decides to invite the South Pacific Forum to participate in the sessions and the work of the General Assembly in the capacity of observer; 2. Requests the Secretary-General to take the necessary action to implement the present resolution.",10/11/1994,1994_163214,Georgia,N/A,yes
1994,General Assembly,Forty-ninth session,152,OBSERVER STATUS FOR THE INTERNATIONAL FEDERATION OF RED CROSS AND RED CRESCENT SOCIETIES IN THE GENERAL ASSEMBLY,"Afghanistan, Algeria, Antigua _and Barbuda, Armenia, Australia, Austria, Bahamas, Bangladesh, Barbados, Belarus, Belize, Benin, Bhutan, Bolivia, Bulgaria, Burkina Faso, Cambodia, Cameroon, Canada, Cape Verde, Chile, Colombia, Congo, Costa Rica, Céte d’Ivoire, Croatia, Cyprus, Democratic People’s Republic of Korea, Denmark, Djibouti, Dominican Republic, Ecuador, El Salvador, Eritrea, Estonia, Ethiopia, Fiji, Finland, Gambia, Georgia, Ghana, Guatemala, Guinea, Honduras, Hungary, Iceland, Indonesia, Iraq, Jordan, Kazakhstan, Kyrgyzstan, Lao People’s Democratic Republic, Liberia, Libyan Arab Jamahiriya, Liechtenstein, Madagascar, Malawi, Malaysia, Maldives, Mali, Malta, Marshall Islands, Mauritania, Mexico, Micronesia (Federated States of) Mongolia, Morocco, Mozambique, Myanmar, Namibia, Nepal, New Zealand, Norway, Oman, Pakistan, Panama, Papua New Guinea, Peru, Poland, Qatar, Republic of Korea, Saint Lucia, Samoa, San Marino, Saudi Arabia, Senegal, Sierra Leone, Slovakia, Solomon Islands, Sudan, Sweden, Thailand, Togo, Tunisia, Turkey, Ukraine, Vanuatu, Venezuela, Yemen and Zimbabwe",N/A,N/A,"The General Assembly , Recalling the special functions of the member societies of the International Federation of Red Cross and Red Crescent Societies which are recognized by their respective Governments as auxiliaries to the public authorities in the humanitarian field on the basis of the Geneva Conventions of 12 August 1949, Considering the specific role of the International Federation of Red Cross and Red Crescent Societies in international humanitarian relations as further defined by the International Conference of the Red Cross and Red Crescent, Desirous of promoting cooperation between the United Nations and the International Federation of Red Cross and Red Crescent Societies, 1. Decides to invite the International Federation of Red Cross and Red Crescent Societies to participate in the sessions and the work of the General Assembly in the capacity of observer; 2. Requests the Secretary-General to take the necessary action to implement the present resolution.",10/17/1994,1994_163336,Georgia,N/A,yes
1994,General Assembly,Forty-ninth session,22,ASSISTANCE IN MINE CLEARANCE,"Angola, Argentina, Armenia, Australia, Austria, Bangladesh, Belgium, Cambodia, Canada, Croatia, Czech Republic, Denmark, Estonia, Finland, France, Georgia, Germany, Greece, Hungary, Iceland, Ireland, Italy, Japan, Luxembourg, Malta, Monaco, Mongolia, Mozambique, Netherlands, New Zealand, Nicaragua, Norway, Poland, Portugal, Republic of Korea, Romania, Sierra Leone, Singapore, Slovakia, Spain, Sudan, Sweden, United Kingdom of Great Britain and Northern Ireland and United States of America",N/A,N/A,"The General Assembly , Recalling its resolution 48/7 on assistance in mine clearance, adopted without a vote on 19 October 1993, Affirming its deep concern at the tremendous humanitarian problem caused by the presence of mines and other unexploded devices that have serious and lasting social and economic consequences for the populations of mine-infested countries and constitute an obstacle to the return of refugees and other displaced persons, to humanitarian aid operations, to reconstruction and economic development as well as to the restoration of normal social conditions, Stressing its grave alarm at the ever-increasing presence of mines and other unexploded devices as a result of armed conflicts, Deeply concerned that the number of mines being laid each year exponentially outweighs the number of such mines that can be cleared during that time, and convinced of the necessity and urgency of an increase in mine- clearance efforts by the international community, Reiterating its dismay at the high number of victims of mines, especially among civilian populations, and taking note in this context of Commission on Human Rights resolution 1994/94 of 9 March 1994 on the effects of armed conflicts on children’s lives, 1/ Bearing in mind the serious threat that mines and other unexploded devices pose to the safety, the health and the lives of personnel participating in humanitarian, peace-keeping and rehabilitation programmes, Recalling in this regard its resolution 48/79 of 16 December 1983 on the Convention on Prohibitions or Restrictions on the Use of Certain Conventional Weapons Which May Be Deemed to Be Excessively Injurious or to Have Indiscriminate Effects and the convening by the Secretary-General of a conference to review and amend the above-mentioned Convention, taking particular note in this regard of the work of the Group of Governmental Experts at present engaged in preparing the review of that Convention and especially the Protocol on Prohibitions or Restrictions on the Use of Mines, Booby Traps and Other Devices (Protocol II) as a matter of priority, Recalling also its resolution 48/75 K of 16 December 1993, calling for a moratorium on the export of anti-personnel land-mines, Recognizing that, in addition to the primary role of States, the United Nations has an important role in the field of assistance in mine clearance, Noting with satisfaction the inclusion in the mandates of several peace- keeping operations of provisions relating to mine-clearance work carried out under the direction of the Department of Peace-keeping Operations of the Secretariat, in the context of such operations, Commending the activities already undertaken by the United Nations system, donor and recipient Governments, the International Committee of the Red Cross and non-governmental organizations in addressing solutions of problems relating to the presence of mines and other unexploded devices, Commending in particular the activities already undertaken by the Secretary-General, especially the establishment of the Department of Humanitarian Affairs as a focal point within the United Nations for coordinating demining and related issues, 1. Expresses its appreciation to the Secretary-General for his comprehensive report on assistance in mine clearance 2/ and takes note with interest of the proposals contained therein as well as of the contributions by Member States and bodies that have observer status with the General Assembly in the addendum to the report; 3/ 2. Welcomes the establishment by the Secretary-General of a voluntary trust fund to finance, in particular, information and training programmes relating to mine clearance and to facilitate the launching of mine-clearance operations; 3. Appeals to Member States as well as to intergovernmental and non-governmental organizations and foundations to contribute to the voluntary trust fund; 4. Invites all relevant multilateral and national programmes and bodies to include, in coordination with the United Nations, activities related to mine clearance in their humanitarian, social and economic assistance activities; 5. Emphasizes again, in this connection, the importance of coordination by the United Nations of activities related to mine clearance, including those by regional organizations, and in particular activities relating to information and training; 6. Commends the Secretary-General for his efforts to make use of available resources to strengthen the coordination role of the United Nations and encourages him to continue those efforts with a view to improving the effectiveness of assistance in mine clearance by the United Nations; 7. Takes note, in this regard, of the creation, in the context of the current reorganization of the Secretariat Department of Humanitarian Affairs, of a Mine Action Section that, with the support of other Secretariat units, especially the technical expertise provided by the Department of Peace-keeping Operations, is responsible for carrying out the Department’s functions as a focal point; 8. Urges Member States, regional organizations, governmental and non-governmental organizations and foundations to continue to extend full assistance and cooperation to the Secretary-General and, in particular, to provide him with all information and data as well as other pertinent resources which could be useful in strengthening the coordination role of the United Nations in mine-clearance activities; 9. Requests the Secretary-General to submit to the General Assembly before its fiftieth session a report covering the activities of the United Nations on assistance in mine-clearance activities during the past year and especially the operation of the voluntary trust fund; 10. Decides to include in the provisional agenda of its fiftieth session the item entitled ""Assistance in mine clearance"".",10/20/1994,1994_163519,Georgia,"1/ See Official Records of the Economic and Social Council, 1994, Supplement No. 4 (E/1994/24), Chap. II, sect. A. 2/ A/49/357. 3/ See A/49/357/Add. 1.",yes
1994,First Committee,Forty-ninth session,62 (e),GENERAL AND COMPLETE DISARMAMENT: TRANSPARENCY IN ARMAMENTS,"Argentina, Australia, Austria, Bahamas, Belarus, Belgium, Bhutan, Bolivia, Brazil, Bulgaria, Cambodia, Canada, Cape Verde, Chile, Costa Rica, Czech Republic, Denmark, Estonia, Fiji, Finland, France, Georgia, Germany, Greece, Guatemala, Guinea, Guyana, Honduras, Hungary, Iceland, Ireland, Italy, Japan, Kazakhstan, Kyrgyzstan, Latvia, Liechtenstein, Lithuania, Luxembourg, Malaysia, Mali, Malta, Marshall Islands, Namibia, Nepal, Netherlands, New Zealand, Nicaragua, Niger, Norway, Panama, Papua New Guinea, Peru, Poland, Portugal, Republic of Korea, Republic of Moldova, Romania, Russian Federation, Sierra Leone, Singapore, Slovakia, Slovenia, Solomon Islands, Spain, Sweden, the former Yugoslav Republic of Macedonia, Turkey, Ukraine, United Kingdom of Great Britain and Northern Ireland and _ the United States of America",N/A,Transparency in armaments,"The General Assembly , Recalling its resolutions 46/36 L of 9 December 1991, 47/52 L of 15 December 1992 and 48/75 E of 16 December 1993 entitled ""Transparency in armaments"", Continuing to take the view that an enhanced level of transparency in armaments contributes greatly to confidence-building and security among States and that the establishment of the Register of Conventional Arms 1/ constitutes an important step forward in the promotion of transparency in military matters, Welcoming the consolidated report of the Secretary-General on the Register of Conventional Arms, 2/ which includes the returns for 1993 of Member States, Welcoming the response of Member States to the request contained in paragraphs 9 and 10 of resolution 46/36 L to provide data on their imports and exports of arms, as well as available background information regarding their military holdings, procurement through national production and relevant policies, Stressing that the continuing operation of the Register and its further development should be reviewed in order to secure a Register which is capable of attracting the widest possible participation, Taking note of the report of the Conference on Disarmament on its agenda item entitled ""Transparency in armaments"", 1. Reaffirms its determination to ensure the effective operation of the Register of Conventional Arms as provided for in paragraphs 7, 8, 9 and 10 of resolution 46/36 L; 2. Takes note of the report of the Secretary-General on the continuing operation of the Register and its further development 3/ and the recommendations contained therein; 3. Calls upon Member States to provide the requested data and information for the Register, on the basis of resolutions 46/36 L, 47/52 L and the annex and appendices to the report of the Secretary-General on the continuing operation of the Register and its further development, to the Secretary-General by 30 April annually; 4. Decides, with a view to further development of the Register, to keep the scope of and participation in the Register under review, and, to this end: (a) Requests Member States to provide the Secretary-General with their views on the continuing operation of the Register and its further development; (b) Requests the Secretary-General, with the assistance of a group of governmental experts to be convened in 1996 on the basis of equitable geographical representation, to prepare a report on the continuing operation of the Register and its further development, taking into account the work of the Conference on Disarmament and the views expressed by Member States, for submission to the General Assembly with a view to a decision at its fifty-first session; A/C.1/49/L.18 made available for the United Nations Secretariat to operate and maintain the Register; 6. Encourages the Conference on Disarmament to continue its work undertaken in the field of transparency in armaments; 7. Reiterates its call upon all Member States to cooperate at the regional and subregional levels, taking fully into account the specific conditions prevailing in the region or subregion, with a view to enhancing and coordinating international efforts aimed at increased openness and transparency in armaments; 8. Requests the Secretary-General to report to the General Assembly at its fiftieth session on progress made in implementing the present resolution; 9. Decides to include in the provisional agenda of its fiftieth session the item entitled ""Transparency in armaments"".",11/02/1994,1994_163637,Georgia,1/ Resolution 46/36 L. 2/ ~~ A/49/352 of 1 September 1994. 3/ ~=A/49/316 of 22 September 1994.,yes
