year,Council,Session,Agenda item,Agenda detail,cosponsored countries,body title number,body title detail,body text,date,file,filecountry,footnote,scanned
1995,Third Committee,Fiftieth session,112 (b),"HUMAN RIGHTS QUESTIONS: HUMAN RIGHTS QUESTIONS, INCLUDING ALTERNATIVE APPROACHES FOR IMPROVING THE EFFECTIVE ENJOYMENT OF HUMAN RIGHTS AND FUNDAMENTAL FREEDOMS","Angola, Argentina, Armenia, Australia, Austria, Belarus, Belgium, Bosnia _ and Herzegovina, Bulgaria, Canada, Cape Verde, Costa Rica, Czech Republic, Denmark, El Salvador, Finland, France, Georgia, Honduras, Hungary, Iceland, Ireland, Israel, Italy, Liechtenstein, Monaco, Panama, Paraguay, Portugal, Romania, Russian Federation, Slovakia, Slovenia, South Africa and Sweden",N/A,Human rights in the administration of justice,"The General Assembly , Recalling its resolution 48/137 of 20 December 1993, and taking note of Commission on Human Rights resolution 1995/41 of 3 March 1995 on human rights in the administration of justice, in particular of children and juveniles in detention, Bearing in mind the principles embodied in articles 3, 5, 9, 10 and 11 of the Universal Declaration of Human Rights 1/ and the relevant provisions of the International Covenant on Civil and Political Rights and the Optional Protocols thereto, 2/ in particular article 6 of the Covenant, which explicitly states that no one shall be arbitrarily deprived of his life and prohibits the imposition of the death penalty for crimes committed by persons below eighteen years of age, Bearing in mind also the relevant principles embodied in the Convention against Torture and Other Cruel, Inhuman or Degrading Treatment or Punishment, 3/ the International Convention on the Elimination of All Forms of Racial Discrimination 4/ and the Convention on the Rights of the Child, 5/ Mindful of the Convention on the Elimination of All Forms of Discrimination against Women, 6/ in particular of the obligation of States to treat men and women equally in all stages of procedures in courts and tribunals, Calling attention to the numerous international standards in the field of the administration of justice, Recognizing that the rule of law and the proper administration of justice are important elements for sustainable economic and social development and play a central role in the promotion and protection of human rights, Welcoming the important work of the Commission on Human Rights and of the Subcommission on Prevention of Discrimination and Protection of Minorities in the field of human rights in the administration of justice, in particular regarding the independence of the judiciary, the independence of judges and lawyers, the right to a fair trial, habeas corpus, human rights and states of emergency, the question of arbitrary detention, the human rights of juveniles in detention, the privatization of prisons and the question of the impunity of perpetrators of violations of human rights, Welcoming also Commission on Human Rights resolution 1995/36 of 3 March 1995, on the independence and impartiality of the judiciary, jurors and assessors and the independence of lawyers, Welcoming further the important work of the Commission on Crime Prevention and Criminal Justice in the field of human rights in the administration of justice, as reflected, inter alia, in Economic and Social Council resolutions 1995/13 of 24 July 1995, on United Nations standards and norms in crime prevention and criminal justice, and 1995/15 on technical cooperation and interregional advisory services in crime prevention and criminal justice, Emphasizing the importance of coordinating the activities in this field carried out under the responsibility of the Commission on Human Rights with those under the responsibility of the Commission on Crime Prevention and Criminal Justice, Noting that many human rights violations in the administration of justice are specifically or primarily directed against women and that the identification and reporting of those violations demand special vigilance, Aware of the specific situation of children and juveniles in detention and their special needs while deprived of their liberty, in particular their vulnerability to various forms of abuse, injustice and humiliation, 1. Reaffirms the importance of the full and effective implementation of all United Nations standards on human rights in the administration of justice; 2. Acknowledges that the administration of justice, including law enforcement and prosecutorial agencies and, especially, an independent judiciary and legal profession in full conformity with applicable standards contained in international human rights instruments, are essential to the full and non-discriminatory realization of human rights and indispensable to democratization processes and sustainable development; 3. Reiterates, once again, its call on all Member States to spare no effort in providing for effective legislative and other mechanisms and procedures, as well as adequate resources, to ensure full implementation of those standards; 4. Appeals to Governments to include in their national development plans the administration of justice as an integral part of the development process and to allocate adequate resources for the provision of legal-aid services with a view to the promotion and protection of human rights; 5. Invites Governments to provide training in human rights in the administration of justice, including juvenile justice, to all judges, lawyers, prosecutors, social workers and other professionals concerned, including police and immigration officers; 6. Encourages States to make use of technical assistance offered by the United Nations programmes of advisory services and technical assistance, in order to strengthen national capacities and infrastructures in the field of administration of justice; 7. Urges the Secretary-General to consider favourably requests by States for assistance in the field of the administration of justice and to strengthen system-wide coordination in this field, in particular between the United Nations programme of advisory services and technical assistance in the field of human rights and the technical cooperation and advisory services of the United Nations crime prevention and criminal justice programme; 8. Invites the international community to respond favourably to requests for financial and technical assistance for the enhancement and strengthening of the administration of justice, with a view to ensuring the promotion and protection of human rights in the administration of justice; 9. Calls upon Special Rapporteurs, Special Representatives and Working Groups of the Commission on Human Rights to continue to give special attention Jase to questions relating to the effective protection of human rights in the administration of justice and to provide, wherever appropriate, specific recommendations in this regard, including proposals for concrete measures of advisory services and technical assistance; 10. Acknowledges the important role of the regional commissions, specialized agencies and United Nations institutes in the area of human rights and crime prevention and criminal justice, and of other organizations of the United Nations system, as well as intergovernmental and non-governmental organizations, including national professional associations concerned with promoting United Nations standards in this field; 12. Requests the Secretary-General to report to the General Assembly at its fifty-second session on the implementation of the present resolution, including information on the various forms of assistance provided by the United Nations system, at the request of Governments, in the field of administration of justice; 13. Decides to consider the question of human rights in the administration of justice at its fifty-second session under the item entitled ""Human rights questions"".",12/05/1995,1995_201155,Georgia,"1/ Resolution 217 A (III). 2/ See resolution 2200 A (XXI), annex, and resolution 44/128, annex. 3/ Resolution 39/46, annex. 4/ Resolution 2106 A (XX), annex. 5/ Resolution 44/25, annex.",yes
1995,Third Committee,Fiftieth session,112 (d),HUMAN RIGHTS QUESTIONS: COMPREHENSIVE IMPLEMENTATION OF AND FOLLOW-UP TO THE VIENNA DECLARATION AND PROGRAMME OF ACTION,"Albania, Antigua and Barbuda, Armenia, Australia, Austria, Belarus, Belgium, Belize, Bosnia and Herzegovina, Brazil, Bulgaria, Colombia, Costa Rica, Cyprus, Denmark, Ecuador, El Salvador, Estonia, Ethiopia, Finland, France, Georgia, Germany, Greece, Guyana, Honduras, Hungary, Iceland, Ireland, Israel, Italy, Kazakstan, Latvia, Liechtenstein, Luxembourg, Monaco, Morocco, Norway, Peru, Portugal, Republic of Moldova, Romania, Russian Federation, Slovakia, Slovenia, Solomon Islands, Spain, Sweden, Venezuela and Zambia",N/A,Comprehensive implementation of and follow-up to the Vienna Declaration and Programme of Action,"The General Assembly , Recalling its resolution 48/121 of 20 December 1993, in which it endorsed the Vienna Declaration and Programme of Action, 1/ adopted by the World Conference on Human Rights, held at Vienna in June 1993, as well as its resolution 49/208 of 23 December 1994 on the comprehensive implementation of and follow-up to the Vienna Declaration and Programme of Action, Recalling also Commission on Human Rights resolution 1994/95 of 9 March 1994, 2/ in which the Commission decided to review annually the progress towards the full implementation of the recommendations contained in the Vienna Declaration and Programme of Action, Reaffirming the view of the Conference that the promotion and protection of human rights is a matter of priority for the international community, Considering that the promotion of universal respect for and observance of human rights and fundamental freedoms is one of the basic purposes of the Charter of the United Nations and one of the main priorities of the Organization, Recognizing the urgency of eliminating denials and violations of human rights, as expressed in the Vienna Declaration and Programme of Action, Convinced that the Vienna Declaration and Programme of Action has to be translated into effective action by States, the competent United Nations organs and organizations and other organizations concerned, including non-governmental organizations, Noting that the activities envisaged in the Vienna Declaration and Programme of Action add further to the workload and the responsibilities of the United Nations human rights system and that so far only initial steps have been taken towards bridging the gap between resources and the mandated outputs, Recalling the request of the Conference to the Secretary-General and the General Assembly to take immediate steps to increase substantially the resources for the human rights programme from within the existing and future regular budgets of the United Nations, Welcoming the fact that the call of the Conference for a United Nations system-wide approach to human rights issues has been reflected in the recommendations of major international conferences organized by the United Nations in the economic, social and related fields, in particular the Programme of Action of the International Conference on Population and Development held at Cairo from 5 to 13 September 1994, 3/ the Copenhagen Declaration on Social Development 4/ and the Programme of Action 5/ of the World Summit for Social Development, held at Copenhagen from 6 to 12 March 1995 and the Beijing Declaration and the Platform for Action of the Fourth World Conference on Women, 6/ held at Beijing from 4 to 15 September 1995, Noting the ongoing efforts to ensure a coordinated follow-up to major international conferences in the economic, social and related fields, Recognizing that the interdependence of democracy, development and respect for human rights, as stated in the Vienna Declaration and Programme of Action, requires a comprehensive and integrated approach to the promotion and protection of human rights, Recalling its resolution 48/141 of 20 December 1993, in which it decided to create the post of United Nations High Commissioner for Human Rights as the United Nations official with principal responsibility for United Nations human rights activities, including coordination of the human rights promotion and protection activities throughout the United Nations system, Noting that at the first regular session of 1994, of the Administrative Committee on Coordination, in April 1994, the executive heads of all United Nations agencies discussed the implications of the results of the Conference for their respective programmes and committed themselves to supporting the United Nations High Commissioner for Human Rights in the coordination of the United Nations organs, bodies and the specialized agencies whose activities deal with human rights, as set out in General Assembly resolution 48/141, Noting also that the United Nations High Commissioner for Human Rights has established a permanent dialogue with the United Nations programmes and agencies whose activities deal with human rights in order to maintain systematic exchanges of information, experience and expertise, Having considered the report of the United Nations High Commissioner for Human Rights, 7/ 1. Takes note with appreciation of the report of the United Nations High Commissioner for Human Rights; 2. Endorses the reaffirmation in the Vienna Declaration and Programme of Action of the importance of the promotion of universal respect for, and observance and protection of, all human rights and fundamental freedoms in accordance with the Charter of the United Nations; 3. Reaffirms the views of the World Conference on Human Rights on the urgency of eliminating denials and violations of human rights; 4. Recognizes that the international community should devise ways and means to remove current obstacles and meet the challenges to the full realization of all human rights and to prevent the continuation of human rights violations resulting therefrom throughout the world; 5. Calls upon all States to take further action with a view to the full realization of human rights in the light of the recommendations of the Conference; T/ Official Records of the General Assembly , Fiftieth Session, Supplement No. 36 (A/50/36). 6. Urges all States to continue to give widespread publicity to the Vienna Declaration and Programme of Action in order to promote increased awareness of human rights and fundamental freedoms; 7. Reiterates the request of the Conference that immediate steps be taken to increase substantially the resources for the human rights programme from within existing and future regular budgets of the United Nations; 8. Welcomes with appreciation the work of the United Nations High Commissioner for Human Rights accomplished so far, and expresses its commitment to continue to cooperate with and support the High Commissioner in the discharge of his mandate, as set out in General Assembly resolution 48/141; 9. Requests the United Nations High Commissioner for Human Rights, the General Assembly , the Commission on Human Rights and other organs and bodies of the United Nations system related to human rights to take further action with a view to the full implementation of all the recommendations of the Conference; 0. Also requests the United Nations High Commissioner for Human Rights to continue to coordinate the human rights promotion and protection activities throughout the United Nations system, as set out in General Assembly resolution 48/141, including through a permanent dialogue with the United Nations agencies and programmes whose activities deal with human rights; 1. Invites the Administrative Committee on Coordination to continue to discuss the implications of the Vienna Declaration and Programme of Action for the United Nations system; 2. Recognizes the importance of dialogue and cooperation between Governments and non-governmental organizations in the field of human rights; 3. Requests the United Nations High Commissioner for Human Rights to continue to report on the measures taken and the progress achieved in the comprehensive implementation of the Vienna Declaration and Programme of Action; 4. Decides to consider this question at its fifty-first session under the sub-item ""Comprehensive implementation of and follow-up to the Vienna Declaration and Programme of Action"".",12/05/1995,1995_201156,Georgia,"1/ A/CONF.157/24 (Part I), chap. III. 2/ Official Records of the Economic and Social Council, 1994, Supplement No. 4 and corrigendum (E/1994/24 and Corr.1), chap. II, sect. A. 3/ A/CONF.171/13, chap. I, resolution 1, annex. 4/ A/CONF.166/9, chap. I, resolution 1, annex I. 5/ Ibid., annex II.",yes
1995,Third Committee,Fiftieth session,112 (c),HUMAN RIGHTS QUESTIONS: HUMAN RIGHTS SITUATIONS AND REPORTS OF SPECIAL RAPPORTEURS AND REPRESENTATIVES,"Afghanistan, Argentina, Australia, Austria, Azerbaijan, Bosnia and Herzegovina, Botswana, Canada, Chile, Cyprus, Czech Republic, Denmark, El Salvador, Ethiopia, Finland, Gambia, Georgia, Germany, Greece, Guatemala, Honduras, Hungary, Iceland, Ital Mozambique, Norway, Peru, Poland, Portugal, Slovakia, Slovenia, Sweden and Zambia",N/A,Protection of and assistance to internally displaced persons,"The General Assembly , Deeply disturbed by the growing number of internally displaced persons throughout the world who receive inadequate protection and assistance, and conscious of the serious problems this is creating for the international community, Recalling the relevant norms of international human rights instruments as well as of international humanitarian law, Bearing in mind the Vienna Declaration and Programme of Action, 1/ adopted by the World Conference on Human Rights on 25 June 1993, which calls for a comprehensive approach by the international community with regard to refugees and displaced persons, Reiterating its call for a more concerted response by the international community to the needs of internally displaced persons, while emphasizing that activities on their behalf must not undermine the institution of asylum, Conscious of the continuing need for the United Nations system to gather information comprehensively on the issue of the protection of human rights of and assistance to internally displaced persons, Welcoming the decision of the Commission on Human Rights in its resolution 1995/57 of 3 March 1995, 2/ in which it extended the mandate of the representative of the Secretary-General on internally displaced persons for another three years to continue his review of the need for protection of and assistance to internally displaced persons, including his compilation and analysis of legal norms, the root causes of internal displacement, prevention and long-term solutions, Encouraged by the progress made thus far by the representative of the Secretary-General in developing a legal framework, studying the causes and manifestations of internal displacement, and analysing institutional arrangements, undertaking dialogue with Governments, issuing a series of reports on particular country situations together with proposals for remedial measures, and raising the level of awareness, both at the national and international levels, to the problem of internal displacement, Welcoming the cooperation already established between the representative of the Secretary-General and the United Nations humanitarian assistance and development organizations engaged in protecting and assisting internally displaced persons, as well as the International Committee of the Red Cross, the International Federation of Red Cross and Red Crescent Societies and other relevant organizations, Welcoming in particular the decision by the Executive Committee of the Programme of the United Nations High Commissioner for Refugees to promote further consultations with the representative of the Secretary-General on the issue of internally displaced persons, as well as the decision by the Inter-Agency Standing Committee and its working group to invite the representative to participate in relevant meetings as well as in its Task Force on internally displaced persons, Recalling the report of the representative of the Secretary-General submitted to the Commission on Human Rights at its fifty-first session, 3/ and the conclusions and recommendations contained therein with regard to improving protection of, assistance to and development for internally displaced persons, 1. Takes note with appreciation of the report of the representative of the Secretary-General; 4/ 2. Commends the representative for the catalytic role he is playing to raise the level of consciousness about the plight of internally displaced persons; 3. Noting the efforts of the representative to develop a legal framework and to promote strategies for better protection, assistance and development of internally displaced persons; 4. Encourages the representative to continue his analysis of the causes of internal displacement, the needs of those displaced, measures of prevention and ways to increase protection, assistance and solutions for the internally displaced persons; 5. Also encourages the representative to continue to pay specific attention in his review to the protection and assistance needs of women and children, bearing in mind the relevant strategic objective in the Beijing Declaration 5/ and the Platform for Action, 6/ adopted by the Fourth World Conference on Women, held at Beijing from 4 to 15 September 1995; 6. Calls upon the representative to continue to study the problem of internally displaced persons and to invite specialists and consultants to contribute expert assistance during missions as well as research facilities; 7. Invites the representative to finalize his compilation and analysis of existing legal norms for inclusion in his report to the Commission on Human Rights, at its fifty-second session; 8. Calls upon the Commission on Human Rights to consider the question of establishing a framework in this regard, such as a declaration for internally displaced persons, on the basis of the representative’s report and his recommendations therein; 9. Calls upon all Governments to continue to facilitate the activities of the representative, encourages them to give serious consideration to inviting the representative to visit their countries so as to enable him to study and analyse more fully the issues involved, and thanks those Governments that have already done so; 10. Invites Governments to give due consideration, in dialogue with the representative, to the recommendations and suggestions made to them by the representative, in accordance with his mandate, and to inform him of measures taken thereon; the implementation of his programme of activities, and invites the representative to report thereon; 12. Calls upon the representative and regional intergovernmental organizations, such as the Organization of African Unity, the Organization of American States and the Organization for Security and Cooperation in Europe, to intensify their cooperation with a view to encouraging their undertaking initiatives to facilitate assistance to and protection of internally displaced persons; 13. Requests the Secretary-General to give all necessary assistance to the representative to carry out his mandate effectively; 14. Decides to continue its consideration of the question at its fifty- second session.",12/05/1995,1995_201187,Georgia,"1/ A/CONF.157/24 (Part I), chap. III. 2/ Official Records of the Economic and Social Council, 1995, Supplement No. 3 and corrigenda, (E/1995/23 and Corr.1 and 2), chap. II, sect. A. 3/ E/CN.4/1995/50 and Add.1 and Add.1/Corr.1, Add.2 and Add.2/Corr.1, Add.3 and Add.4. 4/ A/50/558, annex. 5/ A/CONF.177/20, chap. I, resolution 1, annex I. 6/ Ibid., annex II.",yes
