year,Council,Session,Agenda item,Agenda detail,cosponsored countries,body title number,body title detail,body text,date,file,filecountry,footnote,scanned
1995,First Committee,Fiftieth session,70,"GENERAL AND COMPLETE DISARMAMENT France, Kazakstan, Russian Federation, United Kingdom of",Great Britain and Northern Ireland and United States of America,N/A,Bilateral nuclear arms negotiations and nuclear disarmament,"The General Assembly , Recalling its previous relevant resolutions, Recognizing the fundamental changes that have taken place with respect to international security, which have permitted agreements on deep reductions in the nuclear armaments of the States possessing the largest inventories of such weapons, Mindful that it is the responsibility and obligation of all States to contribute to the process of the relaxation of international tension and to the strengthening of international peace and security, Stressing the importance of strengthening international peace and security through general and complete disarmament, under strict and effective international control, Stressing that it is the responsibility of all States to adopt and implement measures towards the attainment of general and complete disarmament under strict and effective international control, Appreciating a number of positive developments in the field of nuclear disarmament, in particular the Treaty between the United States of America and the Union of Soviet Socialist Republics on the Elimination of Their Intermediate-Range and Shorter-Range Missiles, 1/ and the treaties on the reduction and limitation of strategic offensive arms, Appreciating the indefinite extension of the Treaty on the Non-Proliferation of Nuclear Weapons 2/ and acknowledging the importance of the determined pursuit by the nuclear-weapon States of systematic and progressive efforts to reduce nuclear weapons globally, with the ultimate goal of eliminating those weapons, and by all States of general and complete disarmament under strict and effective international control, Welcoming the steps that have already been taken by the Russian Federation and the United States of America to begin the process of reducing the number of nuclear weapons and removing such weapons from a deployed status, and bilateral agreements on the issue of de-targeting strategic nuclear missiles, Noting the new climate of relations between the United States of America and the States of the former Soviet Union, which permits them to intensify their cooperative efforts to ensure the safety, security and environmentally sound destruction of nuclear weapons, Noting also that the Russian Federation and the United States of America concurred that, once the Treaty between them on the Further Reduction and Limitation of Strategic Offensive Arms is ratified, they would proceed to deactivate all nuclear delivery systems to be reduced under the Treaty by removing their nuclear warheads or taking other steps to remove them from alert status, Noting further the commitment between the Russian Federation and the United States of America to intensify their dialogue to compare conceptual approaches and to develop concrete steps to adapt the nuclear forces and practices on both sides to the changed international security situation, including the possibility, after ratification of the Treaty on the Further Reduction and Limitation of Strategic Offensive Arms, of further reductions of and limitations on remaining nuclear forces, Taking note of the joint statement of 10 May 1995 by the Russian Federation and the United States of America on the Treaty on the Limitation of Anti-Ballistic Missile Systems, Urging the early ratification of the Treaty on the Further Reduction and Limitation of Strategic Offensive Arms and further intensification of such efforts to accelerate the implementation of agreements and unilateral decisions relating to nuclear arms reduction, Welcoming the significant reductions made by other nuclear-weapon States, and encouraging all nuclear-weapon States to consider appropriate measures relating to nuclear disarmament, 1. Welcomes the entry into force of the Treaty on the Reduction and Limitation of Strategic Offensive Arms, signed in Moscow on 31 July 1991 by the former Union of Soviet Socialist Republics and the United States of America, including the Protocol to that Treaty signed at Lisbon on 23 May 1992 by the parties thereto, and the exchange of documents of ratification between the United States of America, Belarus, Kazakstan, the Russian Federation and Ukraine on 5 December 1994 in Budapest; 2. Also welcomes the signing of the Treaty between the Russian Federation and the United States of America on the Further Reduction and Limitation of Strategic Offensive Arms in Moscow on 3 January 1993, and urges the parties to take the steps necessary to bring that Treaty into force at the earliest possible date; 3. Expresses its satisfaction at the fact that the entry into force of the 1991 Treaty on the Reduction and Limitation of Strategic Offensive Arms clears the way for prompt ratification by the Russian Federation and the United States of America of the 1993 Treaty; 4. Also expresses its satisfaction at the continuing implementation of the Treaty on the Elimination of Intermediate-Range and Shorter-Range Missiles, 1/ in particular at the completion by the parties of the destruction of all their declared missiles subject to elimination under the Treaty; 5. Encourages the United States of America, the Russian Federation, Belarus, Kazakstan and Ukraine to continue their cooperative efforts aimed at eliminating nuclear weapons and strategic offensive arms on the basis of existing agreements, and welcomes the contributions that other States are making to such cooperation as well; 6. Welcomes the accession to the Treaty on the Non-Proliferation of Nuclear Weapons 2/ of Belarus, Kazakstan and Ukraine as non-nuclear-weapon States, which thereby provided a notable enhancement to the non-proliferation regime; 7. Encourages and supports the Russian Federation and the United States of America in their efforts to reduce their nuclear weapons and to continue to give those efforts the highest priority in order to contribute to the ultimate goal of eliminating those weapons; 8. Invites the Russian Federation and the United States of America to keep other States Members of the United Nations duly informed of progress in their discussions and in the implementation of their strategic offensive arms agreements and unilateral decisions.",11/10/1995,1995_200446,Kazakhstan,"* Reissued for technical reasons. 1/ The United Nations Disarmament Yearbook, vol. 12: 1987 (United Nations publication, Sales No. E.88.1X.2), appendix VII. 2/ United Nations, Treaty Series, vol. 729, No. 10485.",yes
1995,Third Committee,Fiftieth session,109,"REPORT OF THE UNITED NATIONS HIGH COMMISSIONER FOR REFUGEES, QUESTIONS RELATING TO REFUGEES, RETURNEES AND DISPLACED PERSONS AND HUMANITARIAN QUESTIONS","Armenia, Belarus, Denmark, Georgia, Germany, Hungar Iceland, Kazakstan, Kyrgyzstan, Norwa Russian Federation Spain and Ukraine",N/A,"Comprehensive consideration and review of the problems of refugees, returnees, displaced persons and related migratory movements","The General Assembly , Recalling the 1951 Convention 1/ and the 1967 Protocol 2/ relating to the Status of Refugees, Recalling also its resolutions 48/113 of 20 December 1993 and 49/173 of 23 December 1994, Having considered the report of the Secretary-General 3/ and the report of the United Nations High Commissioner for Refugees, 4/ Reaffirming the need for the international community to consider comprehensive approaches for the coordination of action with regard to refugees, returnees, displaced persons and related migratory movements, Considering the magnitude of existing and potential refugee and related migratory movements in the countries of the Commonwealth of Independent States and relevant neighbouring States, 1. Takes note of the report of the Secretary-General 3/ as well as of the report of the United Nations High Commissioner for Refugees, 4/ in particular paragraph 30 of the addendum to the report; 2. Calls upon the United Nations High Commissioner for Refugees, in consultation with States concerned and in coordination with relevant intergovernmental, regional and non-governmental organizations, to continue to consider and develop comprehensive regional approaches to the problems of refugees and displaced persons; 3. Expresses its appreciation to the High Commissioner for her efforts to promote and develop a transparent preparatory process for a regional conference to address the problems of refugees, returnees, displaced persons and other forms of involuntary displacement in the countries of the Commonwealth of Independent States and relevant neighbouring States; 4. Welcomes the establishment of a common secretariat for the preparation of the Conference, comprising the Office of the United Nations High Commissioner for Refugees, the International Organization for Migration and the Organization for Security and Cooperation in Europe and its Office for Democratic Institutions and Human Rights; 5. Requests the High Commissioner, in close cooperation with States and intergovernmental organizations concerned, to convene the Conference in 1996; 6. Expresses its appreciation to the United Nations bodies and agencies and other international organizations and institutions for their valuable contribution to the preparatory process leading to the Conference; 7. Urges all States concerned and appropriate intergovernmental, regional and non-governmental organizations to support that process; 8. Appeals to all States and regional and intergovernmental organizations to provide the necessary support and resources needed by the Secretariat for the preparation and holding of the Conference; 9. Requests the Secretary-General to report to the General Assembly at its fifty-first session on the implementation of the present resolution.",11/13/1995,1995_200460,Kazakhstan,"1/ United Nations, Treaty Series, vol. 189, No. 2545. 2/ Ibid., vol. 606, No. 879 1. 3/ A/50/414.",yes
1995,First Committee,Fiftieth session,70,GENERAL AND COMPLETE DISARMAMENT,"Afghanistan, Angola, Albania, Argentina, Armenia, Australia, Austria, Azerbaijan, Bahamas, Belarus, Belgium, Bhutan, Bolivia, Bosnia and Herzegovina, Botswana, Bulgaria, Burundi, Cambodia, Cameroon, Canada, Cape Verde, Chad, Colombia, Congo, Costa Rica, Céte d’Ivoire, Croatia, Cyprus, Czech Republic, Denmark, Ecuador, El Salvador, Ethiopia, Fiji, France, Georgia, Germany, Ghana, Guatemala, Guyana, Haiti, Honduras, Hungary, Iceland, Ireland, Italy, Japan, Jordan, Kazakstan, Kenya, Kuwait, Lesotho, Liberia, Lithuania, Luxembourg, Madagascar, Malaysia, Malta, Marshall Islands, Mauritania, Micronesia (Federated States of), Mongolia, Mozambique, Namibia, Nepal, Netherlands, New Zealand, Nicaragua, Niger, Norway, Panama, Paraguay, Peru, Philippines, Poland, Portugal, Republic of Moldova, Romania, Rwanda, Sierra Leone, Slovakia, Slovenia, Solomon Islands, South Africa, Spain, Sweden, Tajikistan, the former Yugoslav Republic of Macedonia, Togo, Turkmenistan, Ukraine, United Kingdom of Great Britain and Northern Ireland, United States of America, Uruguay, Vanuatu, Venezuela, Yemen and Zambia",N/A,Moratorium on the export of anti-personnel land-mines,"The General Assembly , Recalling with satisfaction its resolutions 49/75 D of 15 December 1994 and 48/75 of 16 December 1993, in which it, inter alia, called upon States to agree to a moratorium on the export of anti-personnel land-mines that pose grave dangers to civilian populations, and urged States to implement moratoria on the export of anti-personnel land-mines, Also recalling with satisfaction its resolution 49/75 D of 15 December 1994, in which it, inter alia, established as a goal of the international community the eventual elimination of anti-personnel land-mines, Noting that according to the 1994 report of the Secretary-General entitled ""Assistance in mine clearance"", 1/ it is estimated that there are more than 110 million land-mines in the ground in more than 60 countries throughout the world, Noting also that according to the same report, the global land-mine crisis continues to worsen as an estimated 2 million to 5 million new land-mines are laid each year, while only an estimated 100,000 were cleared in 1994, Expressing deep concern that anti-personnel land-mines kill or maim hundreds of people every week, mostly innocent and defenceless civilians, obstruct economic development and reconstruction and have other severe consequences for years after emplacement, which include inhibiting the repatriation of refugees and the return of internally displaced persons, Gravely concerned with the suffering and casualties caused to non-combatants as a result of the proliferation, as well as the indiscriminate and irresponsible use, of anti-personnel land-mines, Recalling with satisfaction its resolutions 48/7 of 19 October 1993 and 49/215 A of 23 December 1994, calling for assistance in mine clearance, Welcoming the programmes of assistance which exist for demining and humanitarian support for the victims of anti-personnel land-mines, Welcoming also the International Meeting on Mine Clearance held at Geneva from 5 to 7 July 1995, and noting the statement of the Secretary-General at the meeting that the international community must take specific and tangible steps to address the ""intolerable situation caused by the proliferation of anti-personnel land-mines throughout the world"", Recalling with satisfaction the report of the Secretary-General concerning progress on the initiative in resolution 49/75 D, 2/ Convinced that moratoria by States on the export of anti-personnel land- mines that pose grave dangers to civilian populations are important measures in helping to reduce substantially the human and economic costs resulting from the proliferation, as well as the indiscriminate and irresponsible use, of such devices, Noting with satisfaction that more than twenty-five States already have declared moratoria on the export, transfer or sale of anti-personnel land-mines, with many of these moratoria being declared as a result of the aforementioned resolutions, Believing that ongoing efforts to strengthen the Convention on Prohibitions or Restrictions on the Use of Certain Conventional Weapons Which May Be Deemed to Be Excessively Injurious or to Have Indiscriminate Effects, 3/ particularly Protocol II, 4/ are an essential part of the overall effort to address problems caused by the proliferation, as well as the indiscriminate and irresponsible use, of anti-personnel land-mines, Noting the efforts that were made at the Review Conference of the aforementioned Convention held at Vienna in September and October 1995 to strengthen prohibitions and restrictions in Protocol II governing land-mine use and transfer, and urging parties to build consensus towards agreement on such prohibition and restrictions when the conference reconvenes in January and April 1996, Believing that, in addition to Protocol II, other Measures to control the production, stockpiling and transfer of anti-personnel land-mines are also necessary to address problems caused by anti-personnel land-mines, especially the indiscriminate or illegal use of anti-personnel land-mines that continue to inflict harm on civilian populations long after emplacement, Recognizing that States can move most effectively towards the goal of the eventual elimination of anti-personnel land-mines as viable alternatives are developed that significantly reduce the risk to the civilian population, and emphasizing the need for States to work on developing such alternatives on an urgent basis, 1. Welcomes the moratoria already declared by certain States on the export of anti-personnel land-mines; 2. Urges States that have not yet done so to declare such moratoria at the earliest possible date; 3. Requests the Secretary-General to prepare a report on steps taken by Member States to implement such moratoria, and to submit it to the General Assembly at its fifty-first session under the item entitled ""General and complete disarmament""; 4. Emphasizes the importance of the Convention on Prohibitions or Restrictions on the Use of Certain Conventional Weapons Which May Be Deemed to Be Excessively Injurious or to Have Indiscriminate Effects and Protocol II as the authoritative international instrument governing the responsible use of anti-personnel land-mines and related devices and urges parties to build consensus towards an agreement when the Review Conference reconvenes; 5. Encourages the widest possible accession to the Convention and to Protocol II, and further, urges all States immediately to comply fully with the applicable rules of Protocol II; A/C.1/50/L.45 to the problems caused by anti-personnel land-mines, with a view to the eventual elimination of anti-personnel land-mines.",11/06/1995,1995_200507,Kazakhstan,"1/ A/49/357 and Add.1 and 2. 2/ A/50/70 1. 3/ See The United Nations Disarmament Yearbook, vol. 5: 1980 (United Nations publication, Sales No. E.8 1. 1X.4), appendix VII. 4/ Ibid., Protocol on Prohibitions or Restrictions on the Use of Mines, Booby Traps and Other Devices.",yes
1995,First Committee,Fiftieth session,65,COMPREHENSIVE TEST-BAN TREATY,"Afghanistan, Argentina, Armenia, Australia, Austria, Bangladesh, Belarus, Belgium, Bolivia, Brazil, Brunei Darussalam, Bulgaria, Canada, Cape Verde, Chile, Colombia, Costa Rica, Cuba, Cyprus, Czech Republic, Denmark, Ecuador, Estonia, Ethiopia, Fiji, Finland, France, Germany, Greece, Guatemala, Haiti, Honduras, Hungary, Iceland, Indonesia, Ireland, Italy, Japan, Kazakstan, Kenya, Latvia, Lithuania, Luxembourg, Madagascar, Malaysia, Marshall Islands, Mauritius, Mexico, Micronesia (Federated States of), Monaco, Mongolia, Myanmar, Netherlands, New Zealand, Nicaragua, Nigeria, Norway, Panama, Papua New Guinea, Peru, Philippines, Poland, Portugal, Republic of Korea, Republic of Moldova, Romania, Russian Federation, Samoa, Senegal, Singapore Slovakia, South Africa, Spain, Sri Lanka, Sweden, Thailand, the former Yugoslav Republic of Macedonia, Turkey, Ukraine, United Republic of Tanzania, United Kingdom of Great Britain and Northern Ireland, United States of America, Venezuela and Viet Nam",N/A,Comprehensive nuclear-test-ban treat,"The General Assembly , Recalling its resolutions 48/70 of 16 December 1993 and 49/70 of 15 December 1994, in which the entire international community supported the multilateral negotiations on a comprehensive nuclear-test-ban treaty, Reaffirming that a comprehensive nuclear-test ban is one of the highest priority objectives of the international community in the field of disarmament and non-proliferation, (E) 151195 Joes Convinced that the most effective way to achieve an end to nuclear testing is through the conclusion of a universal and internationally and effectively verifiable comprehensive nuclear-test-ban treaty that will attract the adherence of all States and will contribute to the prevention of the proliferation of nuclear weapons in all its aspects, to the process of nuclear disarmament and therefore to the enhancement of international peace and security, Noting the aspirations expressed by the parties to the 1963 Treaty Banning Nuclear Weapon Tests in the Atmosphere, in Outer Space and under Water 1/ to seek to achieve the discontinuance of all test explosions of nuclear weapons for all time, which are recalled in the preamble to the 1968 Treaty on the Non-Proliferation of Nuclear Weapons, 2/ Welcoming the further elaboration of the rolling text in the Ad Hoc Committee on a Nuclear Test Ban of the Conference on Disarmament, as reflected in the report of the Conference and its appendix, 3/ and the decision of the Conference to continue its work in inter-sessional meetings, 1. Welcomes the continuing efforts in the multilateral negotiation ona comprehensive nuclear-test-ban treaty in the Ad Hoc Committee on a Nuclear Test Ban of the Conference on Disarmament, the significant contributions to the rolling text made by States participating in those negotiations and progress in key areas; 2. Calls upon all States participating in the Conference on Disarmament, in particular the nuclear-weapon States, to conclude, as a task of the highest priority, a universal and multilaterally and effectively verifiable comprehensive nuclear-test-ban treaty which contributes to nuclear disarmament and the prevention of the proliferation of nuclear weapons in all its aspects, so as to enable its signature by the outset of the fifty-first session of the General Assembly ; 3. Also calls upon participants in the Conference on Disarmament to advance work on the basis of the rolling text during the inter-sessional negotiating period so as to proceed to the final phase of the negotiation at the beginning of 1996; 4. Further calls upon the Conference on Disarmament to re-establish the Ad Hoc Committee at the commencement of its 1996 session, and to renew its mandate in order to complete the final text of the treaty as soon as possible in 1996; 5. Urges all States to support the multilateral negotiations in the Conference on Disarmament for a comprehensive nuclear-test-ban treaty and their prompt conclusion; 6. Declares its readiness to resume consideration of this item, as necessary, before its fifty-first session in order to endorse the text of a comprehensive nuclear-test-ban treaty; 7. Requests the Secretary-General to ensure the provision to the Conference on Disarmament of adequate administrative, substantive and conference support services for these negotiations; 8. Decides to include in the provisional agenda of its fifty-first session an item entitled ""Implementation of the comprehensive nuclear-test-ban treaty"".",11/15/1995,1995_200542,Kazakhstan,"1/ United Nations, Treaty Series, vol. 480, No. 6964. 2/ Ibid., vol. 729, No. 10485.",yes
