year,Council,Session,Agenda item,Agenda detail,cosponsored countries,body title number,body title detail,body text,date,file,filecountry,footnote,scanned
1997,General Assembly,Fifty-second session,29,COOPERATION BETWEEN THE UNITED NATIONS AND THE INTER-PARLIAMENTARY UNION,"Albania, Algeria, Andorra, Argentina, Armenia, Australia, Austria, Azerbaijan, Belarus, Belgium, Bolivia, Bosnia and Herzegovina, Brazil, Bulgaria, Canada, Cape Verde, Central African Republic, Chile, Colombia, Costa Rica, Céte d'Ivoire, Croatia, Cuba, Cyprus, Czech Republic, Denmark, Dominican Republic, Ecuador, Egypt, El Salvador, Estonia, Finland, Georgia, Germany, Greece, Guatemala, Honduras, Hungary, Iceland, India, Ireland, Italy, Japan, Kazakhstan Kyrgyzstan, Lebanon, Lithuania, Luxembourg, Malawi, Malta, Mauritius, Mexico, Monaco, Morocco, Netherlands, New Zealand, Nicaragua, Norway, Panama, Paraguay, Peru, Philippines, Poland, Portugal, Republic of Korea, Republic of Moldova, Romania, Russian Federation, Samoa, Seychelles, Slovakia, Slovenia, South Africa, Spain, Sri Lanka, Sudan, Sweden, Tajikistan, Thailand, the former Yugoslav Republic of Macedonia, Tunisia, Turke Uganda, United Kingdom of Great Britain and Northern Ireland, Uruguay, Venezuela, Yemen and Zambia",N/A,N/A,"The General Assembly , Recalling its resolution 51/7 of 25 October 1996, in which it welcomed the conclusion of the cooperation agreement between the United Nations and the Inter-Parliamentary Union as an important step for increased and strengthened cooperation between the two organizations, Having considered the report of the Secretary-General’ and debated the initial aspects of the cooperation resulting from the agreement, 1. Notes with appreciation the increased cooperation between the United Nations and the Inter-Parliamentary Union; 2. Recommends that this cooperation be further strengthened, at a time when the United Nations is preparing to meet the challenges of the twenty-first century; 3. Requests the Secretary-General to submit a further report to the General Assembly at its fifty-third session on various aspects of cooperation between the United Nations and the Inter-Parliamentary Union in implementation of the cooperation agreement; 4. Decides to include in the provisional agenda of its fifty-third session the item entitled ""Cooperation between the United Nations and the Inter-Parliamentary Union"".",10/24/1997,1997_245343,Kazakhstan,* B/52/456.,yes
1997,First Committee,Fifty-second session,75,CONVENTION ON PROHIBITIONS OR RESTRICTIONS ON THE USE OF CERTAIN CONVENTIONAL WEAPONS WHICH MAY BE DEEMED TO BE EXCESSIVELY INJURIOUS OR TO HAVE INDISCRIMINATE EFFECTS,"Australia, Austria, Belgium, Brazil, Bulgaria, Canada, Croatia, Czech Republic, Denmark, Ecuador, Finland, France, German Greece, Hungary, Iceland, Ireland, Italy, Japan, Latvia, Liechtenstein, Luxembourg, Netherlands, New Zealand, Nicaragua, Norway, Panama, Peru, Philippines, Poland, Portugal, Republic of Moldova, Romania, Russian Federation, Sierra Leone, Slovakia Slovenia, Solomon Islands, South Africa, Spain, Sweden, the former Yugoslav Republic of Macedonia, Togo, United Kingdom of Great Britain and Northern Ireland, United States of America and Uruguay",N/A,N/A,"The General Assembly , Recalling its resolution 51/49 of 10 December 1996 and previous resolutions referring to the Convention on Prohibitions or Restrictions on the Use of Certain Conventional Weapons Which May Be Deemed to Be Excessively Injurious or to Have Indiscriminate Effects,?! Recalling with satisfaction the adoption, on 10 October 1980, of the Convention, together with the Protocol on Non-Detectable Fragments (Protocol I),! the Protocol on Prohibitions or Restrictions on the Use of Mines, Booby Traps and Other Devices (Protocol II)! and the Protocol on Prohibitions or Restrictions on the Use of Incendiary Weapons (Protocol III),! which entered into force on 2 December 1983, + See The United Nations Disarmament Yearbook, vol. 5: 1980 (United Nations publication, Sales No. E.8 1. 1X.4), appendix VII. Also recalling with satisfaction the adoption by the Review Conference of the States Parties to the Convention on Prohibitions or Restrictions on the Use of Certain Conventional Weapons Which May Be Deemed to Be Excessively Injurious or to Have Indiscriminate Effects, on 13 October 1995 of the Protocol on Blinding Laser Weapons (Protocol IV),* and on 3 May 1996 of the amended Protocol on Prohibitions or Restrictions on the Use of Mines, Booby Traps and Other Devices (Protocol II),?° Recalling the role played by the International Committee of the Red Cross in the elaboration of the Convention and its Protocols, Noting that, in conformity with article 8 of the Convention, conferences may be convened to examine amendments to the Convention or to any of the Protocols thereto, to examine additional protocols concerning other categories of conventional weapons not covered by existing Protocols or to review the scope and application of the Convention and the Protocols annexed thereto and to examine any proposed amendments or additional protocols, and welcoming the decision adopted by the Review Conference in its Final Declaration on 3 May 1996* to convene a Review Conference not later than 2001, 1. Welcomes the additional ratifications and acceptances of or accessions to the Convention on Prohibitions or Restrictions on the Use of Certain Conventional Weapons Which May Be Deemed to Be Excessively Injurious or to Have Indiscriminate Effects, as well as the ratifications and acceptances of or accessions to the amended Protocol on Prohibitions or Restrictions on the Use of Mines, Booby Traps and Other Devices (Protocol II).° 2. Urgently calls upon all States that have not yet done so to take all measures to become parties, as soon as possible, to the Convention and its Protocols, and in particular to amended Protocol II, with a view to achieving the widest possible adherence to this instrument at an early date, and calls upon successor States to take appropriate measures so that ultimately adherence to these instruments will be universal, 3. Calls, in particular, upon the States parties to the Convention to express their consent to be bound by the amended Protocol II with a view to its entry into force as soon as possible, and, pending its entry into force to respect and ensure respect for its substantive provisions to the fullest extent possible; 4. Commends the Protocol on Blinding Laser Weapons (Protocol IV)* to all States, with a view to achieving the widest possible adherence to this instrument at an early date and calls, in particular, upon the States parties to ? CCW/CONF.I/16 (Part I), annex A. > Ibid., annex B. v ° B/52/227 and Corr.1 and 2. express their consent to be bound by the Protocol with a view to its entry into force as soon as possible; 5. Calls upon the Secretary-General, in his capacity as depositary of the Convention and the Protocols annexed thereto, to continue to inform it periodically of ratifications and acceptances of and accessions to the Convention and the Protocols, and decides to include in the provisional agenda of its fifty-third session the item entitled ""Convention on Prohibitions or Restrictions on the Use of Certain Conventional Weapons Which May Be Deemed to Be Excessively Injurious or to Have Indiscriminate Effects"".",10/29/1997,1997_245567,Kazakhstan,N/A,yes
1997,First Committee,Fifty-second session,71,GENERAL AND COMPLETE DISARMAMENT,"Australia, Belgium, Bulgaria, El Salvador, Estonia, Finland, France, Germany, Hungary, Iceland, Italy, Japan, Latvia, Lithuania, Luxembourg, Mongolia, Poland, Republic of Moldova, Romania, Russian Federation, Slovakia, Spain, Turkmenistan Ukraine, United Kingdom of Great Britain and Northern Ireland and United States of America",N/A,Anti-personnel landmines,"The General Assembly , Recalling its previous resolutions 48/75 K of 16 December 1993, 49/75 D of 15 December 1994, 50/70 O of 12 December 1995 and 51/45 S of 10 December 1996, Taking into account the efforts to address the landmine issue, and underlining that the efforts made within different forums should be mutually reinforcing, Taking note of the decisions taken by States to adopt bans, moratoriums or other restrictions on transfers of anti-personnel landmines and other measures taken unilaterally, Having considered the report of the Conference on Disarmament,’ 1. Urges all States to intensify their efforts to contribute to the objective of the elimination of anti-personnel landmines; + Official Records of the General Assembly , Fifty-second Session, Supplement No. 27 (A/52/27). 2. Welcomes the various bans, moratoriums and other restrictions already declared by States on anti-personnel landmines, and calls upon States that have not yet done so to declare and implement such bans, moratoriums and other restrictions as soon as possible; 3. Invites the Conference on Disarmament to intensify its efforts on the issue of anti-personnel landmines; 4. Decides to include in the provisional agenda of its fifty-third session an item entitled ""Contributions toward banning anti-personnel landmines"".",10/30/1997,1997_245655,Kazakhstan,N/A,yes
1997,First Committee,Fifty-second session,71,GENERAL AND COMPLETE DISARMAMENT,"Argentina, Australia, Austria, Belgium, Canada, Czech Republic, Denmark, Finland, Germany, Hungary, Iceland, Ireland, Ital Japan, Kazakhstan, Lithuania, Luxembourg, Marshall Islands, Netherlands, New Zealand, Poland, Portugal, Republic of Korea Republic of Moldova, Romania, Russian Federation, Slovakia, Spain, Sweden, the former Yugoslav Republic of Macedonia, Ukraine, United Kingdom of Great Britain and Northern Ireland and United States of America",N/A,Bilateral nuclear arms negotiations and nuclear disarmament,"The General Assembly , Recalling its previous relevant resolutions, Recognizing the fundamental changes that have taken place with respect to international security, which have permitted agreements on deep reductions in the nuclear armaments of the States possessing the largest inventories of such weapons, Mindful that it is the responsibility and the obligation of all States to contribute to the process of the relaxation of international tension and to the strengthening of international peace and security and, in this connection, to adopt and implement measures toward the attainment of general and complete disarmament under strict and effective international control, Appreciating a number of positive developments in the field of nuclear disarmament, in particular the signing of the Treaty between the United States of America and the Union of Soviet Socialist Republics on the Elimination of Their Intermediate-Range and Shorter-Range Missiles,! and the treaties on the reduction and limitation of strategic offensive arms, Appreciating also the indefinite extension of the Treaty on the Non-Proliferation of Nuclear Weapons,* and acknowledging the importance of the determined pursuit by the nuclear-weapon States of systematic and progressive efforts to reduce nuclear weapons globally, with the ultimate goal of eliminating those weapons, and by all States of general and complete disarmament under strict and effective international control, Welcoming the steps that have already been taken by the Russian Federation and the United States of America to begin the process of reducing the number of nuclear weapons and removing such weapons from a deployed status, and bilateral agreements on de-targeting strategic nuclear missiles, Noting the new climate of relations between the States of the former Union of Soviet Socialist Republics and the United States of America, which permits them to intensify their cooperative efforts to ensure the safety, security and environmentally sound destruction of nuclear weapons, Recalling the Moscow Summit Declaration on Nuclear Safety and Security, adopted at the Summit on Nuclear Safety and Security, held in Moscow on 19 and 20 April 1996,° Urging early action to complete the ratification of the Treaty on the Further Reduction and Limitation of Strategic Offensive Arms’ and further intensification of efforts to accelerate the implementation of agreements and unilateral decisions relating to nuclear arms reduction, Appreciating the joint statement of 10 May 1995 by the Russian Federation and the United States of America on the Treaty on the Limitation of Anti-Ballistic Missile Systems, as well as their joint statements on future reductions in nuclear forces and outlining the elements of an agreement for higher-velocity theatre missile defence systems, both of 21 March 1997, Welcoming the significant reductions made by other nuclear-weapon States, and encouraging all nuclear-weapon States to consider appropriate measures relating to nuclear disarmament, + The United Nations Disarmament Yearbook, vol. 12: 1987 (United Nations publication, Sales No. E.88.1X.2), appendix VII. ? United Nations, Treaty Series, vol. 729, No. 10485. > A/51/131, annex I. 1. Welcomes the entry into force of the Treaty on the Reduction and Limitation of Strategic Offensive Arms,° signed in Moscow on 31 July 1991 by the former Union of Soviet Socialist Republics and the United States of America, including the Protocol to that Treaty signed at Lisbon on 23 May 1992 by the parties thereto, and the exchange of documents of ratification between the United States of America, Belarus, Kazakhstan, the Russian Federation and Ukraine on 5 December 1994 at Budapest; 2. Also welcomes the signing of the Treaty between the Russian Federation and the United States of America on the Further Reduction and Limitation of Strategic Offensive Arms in Moscow on 3 January 1993,* and urges the parties to take the steps necessary to bring that Treaty into force at the earliest possible date; 3. Further welcomes the joint statement issued at Helsinki on 21 March 1997, in which the President of the Russian Federation, Mr. Boris N. Yeltsin, and the President of the United States of America, Mr. William J. Clinton, reached an understanding that after the entry into force of the Treaty on the Further Reduction and Limitation of Strategic Offensive Arms, their two countries would immediately commence negotiations on a third agreement, which would include the establishment, by 31 December 2007, of lower aggregate levels of 2,000 to 2,500 strategic nuclear warheads, take measures relating to the transparency of inventories of strategic nuclear warheads and destruction of strategic nuclear warheads, and carry out other actions to promote the irreversibility of these deep reductions; 4. Notes with satisfaction the Protocol to the Treaty on Further Reduction and Limitation of Strategic Offensive Arms, the Joint Agreed Statement and the Letters on Early Deactivation signed by the Russian Federation and the United States of America in New York on 26 September 1997, which are intended to promote the further process of still deeper reductions and limitations of strategic offensive arms; 5. Welcomes the signing on 26 September 1997 by the United States of America, Belarus, Kazakhstan, the Russian Federation, and Ukraine of a number of significant agreements that contribute to ensuring the viability of the Treaty on the Limitation of Anti-Ballistic Missile Systems; 6. Expresses its satisfaction at the entry into force and ongoing implementation of the Treaty on the Reduction and Limitation of Strategic Offensive Arms, as well as the advice and consent of the Senate of the United States of America to the Treaty on Further Reduction and Limitation of Strategic Offensive Arms, and expresses its hope that it will soon be possible for the Russian Federation to take corresponding steps to ratify the latter Treaty; 7. Also expresses its satisfaction at the continuing implementation of the Treaty between the former Union of Soviet Socialist Republics and the United States of America on the Elimination of their Intermediate-Range and Shorter- ° Ibid., vol. 16: 1991 (United Nations publication, Sales No. E.92.1X.1), appendix II. Range Missiles,® in particular at the completion by the parties of the destruction of all their declared missiles subject to elimination under the Treaty; 8. Welcomes the removal of all nuclear weapons from the territory of Kazakhstan as at 1 June 1995, from the territory of Ukraine as at 1 June 1996 and from the territory of Belarus as at 30 November 1996; 9. Encourages the United States of America, Belarus, Kazakhstan, the Russian Federation and Ukraine to continue their cooperative efforts aimed at eliminating nuclear weapons and strategic offensive arms on the basis of existing agreements, and also welcomes the contributions that other States are making to such cooperation; 0. Welcomes the participation in the Treaty on the Non-Proliferation of Nuclear Weapons of Belarus, Kazakhstan and Ukraine as non-nuclear States, which thereby provided notable enhancement of the non-proliferation regime; 1. Urges the Russian Federation and the United States of America to commence negotiations on a third agreement immediately after the Treaty on Further Reduction and Limitation of Strategic Offensive Arms enters into force, thereby fulfilling the understandings they reached in the joint statement issued at Helsinki on 21 March 1997; 2. Encourages and supports the Russian Federation and the United States of America in their efforts to reduce their nuclear weapons and to continue to give those efforts the highest priority in order to contribute to the ultimate goal of eliminating those weapons; 13. Invites the Russian Federation and the United States of America to keep other States Members of the United Nations duly informed of progress in their discussions and in the implementation of their strategic offensive arms agreements and unilateral decisions. ® Ibid., vol. 12: 1987 (United Nations publication, Sales No. E.88.1X.2), appendix II.",10/30/1997,1997_245683,Kazakhstan,"* The United Nations Disarmament Yearbook, vol. 18: 1993 (United Nations publication, Sales No. E.94.1X.1), appendix II.",yes
1997,First Committee,Fifty-second session,71,GENERAL AND COMPLETE DISARMAMENT,"Kazakhstan, Kyrgyzstan, Tajikistan, Turkmenistan and Uzbekistan",N/A,Establishment of a nuclear-weapon-free zone in Central Asia,"The General Assembly , Recalling paragraphs 60, 61, 62 and 64 of the Final Document of the Tenth Special Session of the General Assembly ,’ the provisions of the Treaty on the Non-Proliferation of Nuclear Weapons* and paragraphs 5 and 6 of the decision entitled ""Principles and objectives for nuclear non-proliferation and disarmament"" in the Final Document of the 1995 Review and Extension Conference of the Parties to the Treaty on the Non-Proliferation of Nuclear Weapons,” concerning the establishment of nuclear-weapon-free zones, Recognizing the importance of agreements on the establishment of nuclear- weapon-free zones in various regions of the world, Recalling the Almaty Declaration of the Heads of State of the Central Asian States of 28 February 1997‘ and the statement by the Ministers for Foreign + Resolution S-10/2. Affairs of the Republic of Kazakhstan, the Kyrgyz Republic, the Republic of Tajikistan, Turkmenistan and the Republic of Uzbekistan on the establishment of a nuclear-weapon-free zone in Central Asia,°® signed at Tashkent on 15 September 1997, Reaffirming the generally recognized role of the United Nations in the establishment of nuclear-weapon-free zones, Convinced that the establishment of nuclear-weapon-free zones in various regions of the world is a means of achieving general and complete disarmament, Believing that the establishment of nuclear-weapon-free zones in various regions, including Central Asia, will help to strengthen peace and stability at both the regional and the global levels and is in the interests of the security of the States in the Central Asian region, Reaffirming the inalienable right of all States to develop research into nuclear energy and the production and use of nuclear energy for peaceful purposes without discrimination, Welcoming the offer of the Kyrgyz Republic to hold a consultative meeting of experts on the establishment of a nuclear-weapon-free zone in Central Asia in Bishkek in 1998, 1. Calls upon all countries to support the initiative for the establishment of a nuclear-weapon-free zone in Central Asia; 2. Requests the Secretary-General to establish a group of United Nations experts to provide the requisite assistance to the Central Asian countries in the preparation of the form and elements of an agreement on the establishment of a nuclear-weapon-free zone in Central Asia; 3. Decides to consider the question of the establishment of a nuclear- weapon-free zone in Central Asia at its fifty-third session under the agenda item ""General and complete disarmament"". ° A/52/390, annex.",11/03/1997,1997_245734,Kazakhstan,"* Reissued for technical reasons. * ~A/52/112, annex.",yes
