year,Council,Session,Agenda item,Agenda detail,cosponsored countries,body title number,body title detail,body text,date,file,filecountry,footnote,scanned
1994,General Assembly,Forty-eighth session,181,EMERGENCY ASSISTANCE TO THE REPUBLIC OF MOLDOVA,"Albania, Algeria, Armenia, Azerbaijan, Belarus, Bulgaria, Croatia, Cyprus, Estonia, Georgia, Guatemala, Hungary, Israel, Kazakhstan, Kyrgyzstan, Latvia, Lithuania, Mauritius, Mongolia, Nepal, Nicaragua, Poland, Republic of Moldova, Romania, Russian Federation, Sudan, Tajikistan, the former Yugoslav Republic of Macedonia, Turkey, Turkmenistan, Ukraine and Uzbekistan",N/A,N/A,"The General Assembly , Deeply concerned about the extensive damage and devastation caused by the severe drought, followed by a hurricane and unprecedented floods in the Republic of Moldova, Noting with concern the destruction of thousands of dwellings and the damage to major sectors of the national infrastructure, Recognizing the efforts of the Government of the Republic of Moldova to provide relief and emergency assistance to the people affected by the flood and hurricane, Noting that the earnest efforts of the Government of the Republic of Moldova to promote the economic reform programmes will be hampered by these calamities, 1. Declares its solidarity with the Government and people of the Republic of Moldova in their affliction; 2. Commends the efforts of the international community, including the organs and organizations of the United Nations system, to supplement the efforts of the Government of the Republic of Moldova in relief operations and emergency assistance; urgent basis, further support to the Republic of Moldova to alleviate the economic and financial burden borne by the Moldovan people; 4. Calls upon the Secretary-General, in cooperation with the relevant organs and organizations of the United Nations system and in close cooperation with the government authorities, to assist in the rehabilitation efforts of the Government of the Republic of Moldova.",09/14/1994,1994_161668,Kazakhstan,N/A,yes
1994,General Assembly,Forty-ninth session,151,OBSERVER STATUS FOR THE SOUTH PACIFIC FORUM IN THE GENERAL ASSEMBLY,"Andorra, Antigua and Barbuda, Argentina, Armenia, Australia, Austria, Azerbaijan, Bahamas, Bangladesh, Barbados, Belgium, Belize, Benin, Bhutan, Bolivia, Bosnia and Herzegovina, Brazil, Bulgaria, Cambodia, Canada, Cape Verde, Chile, Colombia, Costa Rica, Céte d’Ivoire, Cuba, Cyprus, Czech Republic, Denmark, Ecuador, Egypt, Fiji, Finland, France, Georgia, Germany, Ghana, Greece, Grenada, Guyana, Honduras, Hungary, Iceland, India, Indonesia, Ireland, Israel, Italy, Jamaica, Japan, Kazakhstan, Kenya, Kyrgyzstan, Lao People’s Democratic Republic, Liechtenstein, Luxembourg, Malaysia, Maldives, Malta, Marshall Islands, Mauritius, Mexico, Micronesia (Federated States of), Monaco, Mongolia, Myanmar, Namibia, Nepal, Netherlands, New Zealand, Nicaragua, Nigeria, Norway, Papua New Guinea, Peru, Philippines, Poland, Portugal, Republic of Korea, Romania, Russian Federation, Saint Kitts and Nevis, Saint Lucia, Saint Vincent and the Grenadines, Samoa, San Marino, Seychelles, Sierra Leone, Singapore, Slovakia, Slovenia, Solomon Islands, South Africa, Spain, Sri Lanka, Sudan, Suriname, Sweden, Tajikistan, Thailand, Trinidad _and Tobago, Tunisia, Turkey, Uganda, United Kingdom of Great Britain and Northern Ireland, United States of America, Vanuatu, Venezuela and Viet Nam",N/A,N/A,"The General Assembly , Noting the desire of the South Pacific Forum for cooperation between the United Nations and the South Pacific Forum, 1. Decides to invite the South Pacific Forum to participate in the sessions and the work of the General Assembly in the capacity of observer; 2. Requests the Secretary-General to take the necessary action to implement the present resolution.",10/11/1994,1994_163214,Kazakhstan,N/A,yes
1994,General Assembly,Forty-ninth session,152,OBSERVER STATUS FOR THE INTERNATIONAL FEDERATION OF RED CROSS AND RED CRESCENT SOCIETIES IN THE GENERAL ASSEMBLY,"Afghanistan, Algeria, Antigua _and Barbuda, Armenia, Australia, Austria, Bahamas, Bangladesh, Barbados, Belarus, Belize, Benin, Bhutan, Bolivia, Bulgaria, Burkina Faso, Cambodia, Cameroon, Canada, Cape Verde, Chile, Colombia, Congo, Costa Rica, Céte d’Ivoire, Croatia, Cyprus, Democratic People’s Republic of Korea, Denmark, Djibouti, Dominican Republic, Ecuador, El Salvador, Eritrea, Estonia, Ethiopia, Fiji, Finland, Gambia, Georgia, Ghana, Guatemala, Guinea, Honduras, Hungary, Iceland, Indonesia, Iraq, Jordan, Kazakhstan, Kyrgyzstan, Lao People’s Democratic Republic, Liberia, Libyan Arab Jamahiriya, Liechtenstein, Madagascar, Malawi, Malaysia, Maldives, Mali, Malta, Marshall Islands, Mauritania, Mexico, Micronesia (Federated States of) Mongolia, Morocco, Mozambique, Myanmar, Namibia, Nepal, New Zealand, Norway, Oman, Pakistan, Panama, Papua New Guinea, Peru, Poland, Qatar, Republic of Korea, Saint Lucia, Samoa, San Marino, Saudi Arabia, Senegal, Sierra Leone, Slovakia, Solomon Islands, Sudan, Sweden, Thailand, Togo, Tunisia, Turkey, Ukraine, Vanuatu, Venezuela, Yemen and Zimbabwe",N/A,N/A,"The General Assembly , Recalling the special functions of the member societies of the International Federation of Red Cross and Red Crescent Societies which are recognized by their respective Governments as auxiliaries to the public authorities in the humanitarian field on the basis of the Geneva Conventions of 12 August 1949, Considering the specific role of the International Federation of Red Cross and Red Crescent Societies in international humanitarian relations as further defined by the International Conference of the Red Cross and Red Crescent, Desirous of promoting cooperation between the United Nations and the International Federation of Red Cross and Red Crescent Societies, 1. Decides to invite the International Federation of Red Cross and Red Crescent Societies to participate in the sessions and the work of the General Assembly in the capacity of observer; 2. Requests the Secretary-General to take the necessary action to implement the present resolution.",10/17/1994,1994_163336,Kazakhstan,N/A,yes
1994,First Committee,Forty-ninth session,62,GENERAL AND COMPLETE DISARMAMENT,"Afghanistan, Argentina, Austria, Bahamas, Bhutan, Bolivia, Bulgaria, Burundi, Cambodia, Colombia, Costa Rica, Croatia, Cyprus, Czech Republic, Denmark, El Salvador, Eritrea, Germany, Ghana, Greece, Guatemala, Guyana, Honduras, Hungary, Iceland, Ireland, Italy, Kazakhstan, Liberia, Luxembourg, Madagascar, Maldives, Malta, Marshall Islands, Mauritania, Nepal, Netherlands, New Zealand, Nicaragua, Norway, Panama, Philippines, Poland, Portugal, Republic of Moldova, Romania, Sierra Leone, Slovenia, South Africa, Spain, Sweden, the former Yugoslav Republic of Macedonia, Togo, United Kingdom of Great Britain and Northern Ireland, United States of America, Vanuatu and Yemen",N/A,Moratorium _on the export of anti-personnel land-mines,"The General Assembly , Recalling with satisfaction its resolution 48/75 of 16 December 1993, by which it, inter alia, called upon States to agree to a moratorium on the export of anti-personnel land-mines that pose grave dangers to civilian populations, and urged States to implement such a moratorium, Noting that there are approximately 85 million or more anti-personnel land- mines in the ground throughout the world and that many thousands of such mines continue to be laid in an indiscriminate manner, Expressing deep concern that anti-personnel land-mines kill or maim hundreds of people every week, mostly unarmed civilians, obstruct economic development and reconstruction and have other severe consequences, which include inhibiting the repatriation of refugees and the return of internally displaced persons, Welcoming the programmes of assistance which exist for demining and humanitarian support for the victims of anti-personnel land-mines, Gravely concerned with the suffering and casualties caused to non- combatants as a result of the proliferation, as well as the indiscriminate and irresponsible use, of anti-personnel land-mines, Recognizing that States can move most effectively towards the ultimate goal of the eventual elimination of anti-personnel land-mines as viable and humane alternatives are developed, Recalling with satisfaction the report of the Secretary-General 1/ concerning progress on the initiative in the aforementioned resolution, Convinced that moratoriums by States exporting anti-personnel land-mines that pose grave dangers to civilian populations are important measures in helping reduce substantially the human and economic costs resulting from the use of such devices, Noting with satisfaction that many States already have declared moratoriums on the export, transfer or sale of anti-personnel land-mines and related devices, with many of these moratoriums being declared as a result of the aforementioned resolution, Believing that ongoing efforts to strengthen the Convention on Prohibitions or Restrictions on the Use of Certain Conventional Weapons Which May Be Deemed to Be Excessively Injurious or To Have Indiscriminate Effects 2/ (the Convention on Conventional Weapons), particularly Protocol II, 3/ are an important part of the overall effort to address problems caused by anti- personnel land-mines, Recalling with satisfaction its resolution 48/7 of 19 October 1993 calling for assistance in mine clearance, 1. Welcomes the moratoriums already declared by certain States on the export of anti-personnel land-mines; 2. Urges States that have not yet done so to declare such moratoriums at the earliest possible date; 1/-— A/49/275. A/C.1/49/L.19 Member States to implement such moratoriums, and to submit it to the General Assembly at its fiftieth session under the item entitled ""General and complete disarmament""; 4. Emphasizes the importance of the Convention on Conventional Weapons and its Protocols as the authoritative international instrument governing the responsible use of anti-personnel land-mines and related devices; 5. Urges States which have not done so to adhere to this Convention and its Protocols; 6. Encourages further international efforts to seek solutions to the problems caused by anti-personnel land-mines, with a view towards the eventual elimination of anti-personnel land-mines.",11/01/1994,1994_163619,Kazakhstan,"1/-— A/49/275. 2/ See The United Nations Disarmament Yearbook, vol. 5:1980 (United Nations publication, Sales No. E.8 1. 1X.4), appendix VII. 3/ Ibid., Protocol on Prohibitions or Restrictions on the Use of Mines, Booby Traps and Other Devices.",yes
1994,First Committee,Forty-ninth session,62 (e),GENERAL AND COMPLETE DISARMAMENT: TRANSPARENCY IN ARMAMENTS,"Argentina, Australia, Austria, Bahamas, Belarus, Belgium, Bhutan, Bolivia, Brazil, Bulgaria, Cambodia, Canada, Cape Verde, Chile, Costa Rica, Czech Republic, Denmark, Estonia, Fiji, Finland, France, Georgia, Germany, Greece, Guatemala, Guinea, Guyana, Honduras, Hungary, Iceland, Ireland, Italy, Japan, Kazakhstan, Kyrgyzstan, Latvia, Liechtenstein, Lithuania, Luxembourg, Malaysia, Mali, Malta, Marshall Islands, Namibia, Nepal, Netherlands, New Zealand, Nicaragua, Niger, Norway, Panama, Papua New Guinea, Peru, Poland, Portugal, Republic of Korea, Republic of Moldova, Romania, Russian Federation, Sierra Leone, Singapore, Slovakia, Slovenia, Solomon Islands, Spain, Sweden, the former Yugoslav Republic of Macedonia, Turkey, Ukraine, United Kingdom of Great Britain and Northern Ireland and _ the United States of America",N/A,Transparency in armaments,"The General Assembly , Recalling its resolutions 46/36 L of 9 December 1991, 47/52 L of 15 December 1992 and 48/75 E of 16 December 1993 entitled ""Transparency in armaments"", Continuing to take the view that an enhanced level of transparency in armaments contributes greatly to confidence-building and security among States and that the establishment of the Register of Conventional Arms 1/ constitutes an important step forward in the promotion of transparency in military matters, Welcoming the consolidated report of the Secretary-General on the Register of Conventional Arms, 2/ which includes the returns for 1993 of Member States, Welcoming the response of Member States to the request contained in paragraphs 9 and 10 of resolution 46/36 L to provide data on their imports and exports of arms, as well as available background information regarding their military holdings, procurement through national production and relevant policies, Stressing that the continuing operation of the Register and its further development should be reviewed in order to secure a Register which is capable of attracting the widest possible participation, Taking note of the report of the Conference on Disarmament on its agenda item entitled ""Transparency in armaments"", 1. Reaffirms its determination to ensure the effective operation of the Register of Conventional Arms as provided for in paragraphs 7, 8, 9 and 10 of resolution 46/36 L; 2. Takes note of the report of the Secretary-General on the continuing operation of the Register and its further development 3/ and the recommendations contained therein; 3. Calls upon Member States to provide the requested data and information for the Register, on the basis of resolutions 46/36 L, 47/52 L and the annex and appendices to the report of the Secretary-General on the continuing operation of the Register and its further development, to the Secretary-General by 30 April annually; 4. Decides, with a view to further development of the Register, to keep the scope of and participation in the Register under review, and, to this end: (a) Requests Member States to provide the Secretary-General with their views on the continuing operation of the Register and its further development; (b) Requests the Secretary-General, with the assistance of a group of governmental experts to be convened in 1996 on the basis of equitable geographical representation, to prepare a report on the continuing operation of the Register and its further development, taking into account the work of the Conference on Disarmament and the views expressed by Member States, for submission to the General Assembly with a view to a decision at its fifty-first session; A/C.1/49/L.18 made available for the United Nations Secretariat to operate and maintain the Register; 6. Encourages the Conference on Disarmament to continue its work undertaken in the field of transparency in armaments; 7. Reiterates its call upon all Member States to cooperate at the regional and subregional levels, taking fully into account the specific conditions prevailing in the region or subregion, with a view to enhancing and coordinating international efforts aimed at increased openness and transparency in armaments; 8. Requests the Secretary-General to report to the General Assembly at its fiftieth session on progress made in implementing the present resolution; 9. Decides to include in the provisional agenda of its fiftieth session the item entitled ""Transparency in armaments"".",11/02/1994,1994_163637,Kazakhstan,1/ Resolution 46/36 L. 2/ ~~ A/49/352 of 1 September 1994. 3/ ~=A/49/316 of 22 September 1994.,yes
1994,Economic And Social Council,Forty-ninth session,12,REPORT OF THE ECONOMIC AND SOCIAL COUNCIL,"Algeria, Antigua _and Barbuda, Argentina, Armenia, Austria, Azerbaijan, Belgium, Benin, Bolivia, Bhutan, Brazil, Cambodia, Canada, Cape Verde, Chile, China, Colombia, Congo, Costa Rica, Cuba, Czech Republic, Denmark, Egypt, El Salvador, Eritrea, Ethiopia, Finland, France, Gabon, Gambia, Germany, Greece, Guinea, Guinea-Bissau, Guyana, Honduras, India, Indonesia, Ireland, Italy, Jamaica, Japan, Jordan, Kyrgyzstan, Lao People’s Democratic Republic, Lebanon, Luxembourg, Madagascar, Mali, Mexico, Micronesia (Federated States of), Mongolia, Morocco, Myanmar, Namibia, Nepal, Netherlands, Niger, Norway, Panama, Paraguay, Peru, Philippines, Portugal, Samoa, Senegal, Spain, Sudan, Suriname, Sweden, Tunisia, Turkmenistan, United Kingdom of Great Britain and Northern Ireland, United States of America, Venezuela, Viet Nam and Zambia",N/A,Twenty-fifth anniversary of the operations of the United Nations Population Fund Addendum,"Add the following countries to the list of sponsors of the resolution: Afghanistan, Australia, Bangladesh, Belize, Botswana, Comoros, Céte d'Ivoire, Democratic People’s Republic of Korea, Dominica, Fiji, Haiti, Kazakhstan, Lesotho, Malaysia, Mauritania, Mozambique, Nigeria, Pakistan, Papua New Guinea, Romania, Russian Federation, Rwanda, Sierra Leone, South Africa, Swaziland, Tajikistan, Thailand, Togo, Trinidad and Tobago, Uganda and Vanuatu",10/20/1994,1994_163951,Kazakhstan,N/A,yes
1994,First Committee,Forty-ninth session,57,COMPREHENSIVE TEST-BAN TREATY,"Afghanistan, Algeria, Argentina, Armenia, Australia, Austria, Bangladesh, Belarus, Brazil, Brunei Darussalam, Bulgaria, Canada, Chile, Costa Rica, Croatia, Cuba, Czech Republic, Denmark, Ecuador, Estonia, Fiji, Finland, Germany, Greece, Guatemala, Guinea, Haiti, Honduras, Hungar Iceland, India, Indonesia, Iran (Islamic Republic of), Ireland, Italy, Japan, Kazakhstan, Kenya, Kuwait, Latvia, Lithuania, Luxembourg, Madagascar, Malta, Malaysia, Marshall Islands, Mauritius, Mexico, Micronesia (Federated States of), Mongolia, Myanmar, Nepal, Netherlands, New Zealand, Nicaragua, Nigeria, Norway, Papua New Guinea, Philippines, Poland, Portugal, Republic of Korea, Republic of Moldova, Romania, Samoa, Senegal, Singapore, Slovakia, Solomon Islands, South Africa, Spain, Sri Lanka, Sweden, Thailand, Turkey, Turkmenistan, Ukraine, Venezuela and Viet Nam:",N/A,Comprehensive nuclear test-ban treat,"The General Assembly , Recalling its resolution 48/70 of 16 December 1993, in which the entire international community, for the first time, supported the commencement of multilateral negotiations on a comprehensive nuclear test-ban treaty, Reaffirming that a comprehensive nuclear test ban is one of the highest priority objectives of the international community in the field of disarmament and non-proliferation, Convinced that the most effective way to achieve an end to nuclear testing is through the conclusion of a universal and internationally and effectively verifiable comprehensive nuclear test-ban treaty which will attract the adherence of all States and which will contribute to the prevention of the proliferation of nuclear weapons in all its aspects, to the process of nuclear disarmament and therefore to the enhancement of international peace and security, Reaffirming the conviction that the exercise of utmost restraint in respect of nuclear testing would be consistent with the negotiation of a comprehensive nuclear test-ban treaty, Noting the aspirations expressed by the parties to the 1963 Treaty Banning Nuclear Weapon Tests in the Atmosphere, in Outer Space and under Water 1/ to seek to achieve the discontinuance of all test explosions of nuclear weapons for all time, which are recalled in the preamble to the 1968 Treaty on the Non-Proliferation of Nuclear Weapons, 2/ Welcoming the preparation of a rolling text in the Ad Hoc Committee on a Nuclear Test Ban of the Conference on Disarmament, as reflected in the report of the Conference and its appendix, 3/ and noting the decision of the Conference to continue its work in inter-sessional meetings, 1. Welcomes the multilateral negotiation on a comprehensive nuclear test- ban treaty in the Ad Hoc Committee on a Nuclear Test Ban of the Conference on Disarmament, and the positive and substantial contributions to the elaboration of the rolling text made by States participating in those negotiations; 2. Calls upon participants in the Conference on Disarmament to advance work on the basis of the rolling text during the inter-sessional negotiating period with a view to making substantial progress; 3. Calls _also_ upon the Conference on Disarmament, upon the re-establishment of the Ad Hoc Committee on a Nuclear Test Ban at the commencement of its 1995 session and renewal of its mandate, to proceed to a new phase of negotiation; 4. Urges all States participating in the Conference on Disarmament, in particular the nuclear-weapon States, to negotiate intensively, as a high priority task, and to conclude a universal and multilaterally and effectively verifiable comprehensive nuclear test-ban treaty which contributes to nuclear disarmament and the prevention of the proliferation of nuclear weapons in all its aspects; 5. Calls once more upon all States to support the multilateral negotiations in the Conference on Disarmament for a comprehensive nuclear test- ban treaty and their conclusion without delay; 6. Requests the Secretary-General to ensure the provision to the Conference on Disarmament of adequate administrative, substantive and conference support services for these negotiations; 7. Decides to include in the provisional agenda of its fiftieth session the item entitled ""Comprehensive test-ban treaty"".",11/16/1994,1994_165025,Kazakhstan,"1/ United Nations, Treaty Series, vol. 480, No. 6964. 2/ Ibid, vol. 729, No. 10485.",yes
1994,Third Committee,Forty-ninth session,99,"REPORT OF THE UNITED NATIONS HIGH COMMISSIONER FOR REFUGEES, QUESTIONS RELATING TO REFUGEES, RETURNEES AND DISPLACED PERSONS AND HUMANITARIAN QUESTIONS","Armenia, Azerbaijan, Belarus, Georgia, Kazakhstan, Kyrgyzstan, Russian Federation, Tajikistan and Turkmenistan",N/A,"Comprehensive consideration and review of the problems of refugees, returnees, displaced persons and related migratory movements","The General Assembly , Recalling its resolution 48/113 of 20 December 1993, Having considered the report of the Secretary-General 1/ and the concerns expressed therein about the magnitude of existing and potential refugee and related migratory movements in the Commonwealth of Independent States and relevant neighbouring States, Reaffirming the need for the international community to consider comprehensive approaches for the coordination of action with regard to refugees, returnees, displaced persons and related migratory movements, 1. Calls upon the United Nations High Commissioner for Refugees, in consultation with concerned States and in coordination with relevant intergovernmental and non-governmental organizations, to continue to consider comprehensive regional approaches to the problems of refugees and displaced persons; i/ A/49/533. 2. Also calls upon the High Commissioner to continue her efforts to promote and develop a preparatory process, leading to the convening, not later than 1996, of a regional conference to address the problems of refugees, displaced persons, other forms of involuntary displacement and returnees in the Commonwealth of Independent States and other relevant neighbouring States, and urges States and the intergovernmental and non-governmental organizations concerned to support that process, including follow-up measures; 3. Invites Member States and the specialized agencies, other international organizations, relevant United Nations bodies, regional organizations and non-governmental organizations concerned to continue consultations on the appropriateness of convening a global conference on the problems of refugees, returnees and displaced persons, bearing in mind the results of prior relevant conferences; 4. Requests the Secretary-General to report to the General Assembly at its fiftieth session on the implementation of the present resolution.",11/22/1994,1994_165036,Kazakhstan,N/A,yes
