year,Council,Session,Agenda item,Agenda detail,cosponsored countries,body title number,body title detail,body text,date,file,filecountry,footnote,scanned
1996,First Committee,Fifty-first session,71,GENERAL AND COMPLETE DISARMAMENT,"Argentina, Armenia, Australia, Austria, Belarus, Belgium, Bulgaria, Canada, Czech Republic, Denmark, Finland, France, Georgia, Germany, Greece, Hungary, Iceland, Ireland, Italy, Japan, Kazakstan, Kyrgyzstan, Liechtenstein, Luxembourg, Marshall Islands, Netherlands, New Zealand, Norway, Poland, Portugal, Republic of Korea, Republic of Moldova, Romania, Russian Federation, Slovakia, Slovenia, Spain, Sweden, Tajikistan, the former Yugoslav Republic of Macedonia, Turkey, United Kingdom of Great Britain and Northern Ireland and United States of America",N/A,Bilateral nuclear arms negotiations and nuclear disarmament,"The General Assembly , Recalling its previous relevant resolutions, Recognizing the fundamental changes that have taken place with respect to international security, which have permitted agreements on deep reductions in the nuclear armaments of the States possessing the largest inventories of such weapons, Mindful that it is the responsibility and obligation of all States to contribute to the process of the relaxation of international tension and to the strengthening of international peace and security and, in this connection, to adopt and implement measures towards the attainment of general and complete disarmament under strict and effective international control, Appreciating a number of positive developments in the field of nuclear disarmament, in particular the Treaty between the former Union of Soviet Socialist Republics and the United States of America on the Elimination of Their Intermediate-Range and Shorter-Range Missiles, 1/ and the treaties on the reduction and limitation of strategic offensive arms, Appreciating also the indefinite extension of the Treaty on the Non-Proliferation of Nuclear Weapons 2/ and acknowledging the importance of the determined pursuit by the nuclear-weapon States of systematic and progressive efforts to reduce nuclear weapons globally, with the ultimate goal of eliminating those weapons, and by all States of general and complete disarmament under strict and effective international control, Welcoming the steps that have already been taken by the Russian Federation and the United States of America to begin the process of reducing the number of nuclear weapons and removing such weapons from a deployed status, and bilateral agreements on the issue of de-targeting strategic nuclear missiles, Noting the new climate of relations between the States of the former Soviet Union and the United States of America, which permits them to intensify their cooperative efforts to ensure the safety, security and environmentally sound destruction of nuclear weapons, Noting also that the Russian Federation and the United States of America concurred that, once the Treaty between them on Further Reduction and Limitation of Strategic Offensive Arms 3/ was ratified, they would proceed to deactivate all nuclear delivery systems to be reduced under the Treaty by removing their nuclear warheads or taking other steps to remove them from alert status, Noting further the commitment between the Russian Federation and the United States of America to intensify their dialogue to compare conceptual approaches and to develop concrete steps to adapt the nuclear forces and practices on both sides to the changed international security situation, including the possibility, after ratification of the Treaty on the Further Reduction and Limitation of Strategic Offensive Arms, of further reductions of and limitations on remaining nuclear forces, Taking note of the joint statement of 10 May 1995, between the Russian Federation and the United States of America on the Treaty on the Limitation of Anti-Ballistic Missile Systems, Recalling the Declaration of the Moscow Nuclear Safety and Security Summit of April 1996, Urging early action to complete the ratification of the Treaty on Further Reduction and Limitation of Strategic Offensive Arms and further intensification of efforts to accelerate the implementation of agreements and unilateral decisions relating to nuclear arms reduction, Welcoming the significant reductions made by other nuclear-weapon States, and encouraging all nuclear-weapon States to consider appropriate measures relating to nuclear disarmament, 1. Welcomes the entry into force of the Treaty on the Reduction and Limitation of Strategic Offensive Arms, 4/ signed in Moscow on 31 July 1991 by the former Union of Soviet Socialist Republics and the United States of America, including the Protocol to that Treaty signed at Lisbon on 23 May 1992 by the parties thereto, and the exchange of documents of ratification between the United States of America, Belarus, Kazakstan, the Russian Federation and Ukraine on 5 December 1994 at Budapest; 2. Also welcomes the signing of the Treaty between the Russian Federation and the United States of America on Further Reduction and Limitation of Strategic Offensive Arms in Moscow on 3 January 1993, 3/ and urges the parties to take the steps necessary to bring that Treaty into force at the earliest possible date; 3. Expresses its satisfaction at the entry into force and ongoing implementation of the 1991 Treaty as well as the ratification by the United States of America of the 1993 Treaty, and expresses its hope that it will soon be possible for the Russian Federation to ratify that Treaty also; 4. Expresses further satisfaction at the continuing implementation of the Treaty between the United States of America and the Union of Soviet Socialist Republics on the Elimination of their Intermediate-Range and Shorter-Range Missiles, 1/ in particular at the completion by the parties of the destruction of all their declared missiles subject to elimination under the Treaty; 5. Welcomes the removal of all nuclear weapons from the territory of Kazakstan as of 1 June 1995, and from the territory of Ukraine as of 1 June 1996; 6. Encourages the Russian Federation, the United States of America, Belarus, Kazakstan and Ukraine to continue their cooperative efforts aimed at eliminating nuclear weapons and strategic offensive arms on the basis of existing agreements, and welcomes the contributions that other States are making to such cooperation as well; 7. Welcomes the accession to the Treaty on the Non-Proliferation of Nuclear Weapons of Belarus, Kazakstan and Ukraine as non-nuclear-weapon States, which thereby provided notable enhancement to the non-proliferation regime; 8. Encourages and supports the Russian Federation and the United States of America in their efforts to reduce their nuclear weapons and to continue to give those efforts the highest priority in order to contribute to the ultimate goal of eliminating those weapons; 9. Invites the Russian Federation and the United States of America to keep other States Members of the United Nations duly informed of progress in their discussions and in the implementation of their strategic offensive arms agreements and unilateral decisions.",10/31/1996,1996_223152,Kazakhstan,"1/ The United Nations Disarmament Yearbook, vol. 12: 1987 (United Nations publication, Sales No. E.88.1X.2), appendix VII. 2/ United Nations, Treaty Series, vol. 729, No. 10485. 3/ The United Nations Disarmament Yearbook, vol. 18: 1993 (United Nations publication, Sales No. E.94.1X.1), appendix II. 4/ Ibid., vol. 16: 1991 (United Nations publication, Sales No. E.92.1X.1), appendix II.",yes
1996,Second Committee,Fifty-first session,96 (c),SUSTAINABLE DEVELOPMENT AND INTERNATIONAL ECONOMIC COOPERATION: INTEGRATION OF THE ECONOMIES IN TRANSITION INTO THE WORLD ECONOMY,"Albania, Armenia, Australia, Austria, Azerbaijan, Belarus, Belgium, Bosnia and Herzegovina, Bulgaria, Canada, Croatia, Czech Republic, Denmark, Estonia, Finland, France, Georgia, Germany, Greece, Ireland, Italy, Japan, Kazakstan, Kyrgyzstan, Latvia, Lithuania, Luxembourg, Mongolia, Netherlands, Norway, Poland, Portugal, Republic of Korea, Republic of Moldova, Romania, Russian Federation, Slovakia, Slovenia, Spain, Sweden, Tajikistan, the former Yugoslav Republic of Macedonia, Ukraine, United Kingdom of Great Britain and Northern Ireland, United States of America_and Uzbekistan",N/A,Integration of the economies in transition into the world economy,"The General Assembly , Reaffirming its resolutions 47/187 of 22 December 1992, 48/181 of 21 December 1993 and 49/106 of 19 December 1994, Reaffirming also the need for the full integration of the countries with economies in transition into the world economy, Noting the progress made in these countries in achieving macroeconomic stabilization in the course of structural reforms, which require more active investment policies, Noting also the aspiration of the countries with economies in transition towards the further development of regional and interregional cooperation, Recognizing the need for ensuring favourable conditions for market access of exports from these countries, 1. Takes note of the report of the Secretary-General on the integration of the economies in transition into the world economy; 1/ 2. Welcomes the measures undertaken by the organization of the United Nations system to implement General Assembly resolution 49/106 on the integration of the economies in transition into the world economy and calls upon those organizations to continue to conduct analytical activities and to provide policy advice and technical assistance within existing resources to the economies in transition on the social and political framework for economic and market reforms, in particular in regard to the development of the necessary conditions for attracting foreign investments; 3. Requests the Secretary-General to submit a report on the implementation of the present resolution to the General Assembly at its fifty-third session. i1/ A/51/285.",11/07/1996,1996_223423,Kazakhstan,N/A,yes
1996,Second Committee,Fifty-first session,94 (c),"MACROECONOMIC POLICY QUESTIONS: TRADE AND DEVELOPMENT Afghanistan, Armenia, Azerbaijan, Belarus, Georgia, Iran","(Islamic Republic of), Kazakstan, Kyrgyzstan, Tajikistan, Turkey and Uzbekistan",N/A,Transit environment in the landlocked States in Central Asia_and their transit developing neighbours,"The General Assembly , Recalling its resolutions 48/169 and 48/170 of 21 December 1993 and its resolution 49/102 of 19 December 1994, Recalling also the agreed conclusions and recommendations of the First 1/ and the Second 2/ Meeting of Governmental Experts from Landlocked and Transit Developing Countries and Representatives of Donor Countries and Financial and Development Institutions, held in New York from 17 to 19 May 1993 and from 19 to 22 June 1995 respectively, and in particular the conclusions and recommendations of the above meetings pertaining to the newly independent and developing landlocked States in Central Asia and their transit developing neighbours, Recognizing that the overall socio-economic development efforts of these countries, seeking to enter world markets through the establishment of a multicountry transit system, are impeded by a lack of territorial access to the sea as well as by remoteness and isolation from world markets, Supporting the current efforts being undertaken by the newly independent and developing landlocked States in Central Asia and their transit developing neighbours through relevant multilateral, bilateral and regional arrangements to address the issues regarding the development of a viable transit infrastructure in the region, Considering that the outcome of the Symposium for Landlocked and Transit Developing Countries, held at United Nations Headquarters, New York, from 14 to 16 June 1995, in particular the document entitled ""Proposals for the development of a global framework for transit transport cooperation between landlocked and transit developing countries and the donor community"", 3/ is a practical contribution to the development objectives and efforts of the United Nations, Taking note of the report of the Secretary-General of the United Nations Conference on Trade and Development entitled ""Progress report on measures designed to improve the transit transport environment in Central Asia"", 4/ and considering that the problems of transit transport facing the Central Asian region need to be seen against the backdrop of economic changes and the accompanying challenges, including especially the impact of these changes on the international and intraregional trade of the countries concerned, Recognizing that, to be effective, a transit transport strategy for the newly independent and developing landlocked States in Central Asia and their transit developing neighbours should incorporate actions that address both the problems inhering in the use of existing transit routes and the early development and smooth functioning of new, alternative routes, Emphasizing the importance of strengthening international support measures to address further the problems of the newly independent and developing landlocked States in Central Asia and their transit developing neighbours, 1. Takes note of the results of the Technical Meeting on Central Asia’s Transit Transport Links with World Markets, 5/ held in Ankara, Turkey, from 7 to 9 November 1995, under the auspices of the United Nations Development Programme and the United Nations Conference on Trade and Development; 2. Invites the Secretary-General of the United Nations Conference on Trade and Development and the Governments concerned, in cooperation with the United Nations Development Programme, the Economic and Social Commission for Asia and the Pacific, the Economic Commission for Europe and relevant regional and international organizations and in accordance with approved programme priorities and within existing financial resources, to continue elaborating a programme for improving the efficiency of the current transit environment in the newly independent and developing landlocked States in Central Asia and their transit developing neighbours; 3. Invites donor countries and multilateral financial and development institutions, within their mandates, to provide newly independent and developing landlocked States in Central Asia and their transit developing neighbours with appropriate financial and technical assistance for the improvement of the transit environment for these countries; 4. Calls upon the United Nations system to continue studying, within the scope of the implementation of the present resolution, possible ways of promoting more effective cooperative arrangements between landlocked States in Central Asia and their transit neighbours and to encourage a more active supportive role on the part of the donor community; 5. Requests the Secretary-General of the United Nations Conference on Trade and Development to prepare a report on the implementation of the present resolution, to be submitted to the General Assembly at its fifty-third session.",11/13/1996,1996_223707,Kazakhstan,1/ — TD/B/40 (1) /2-TD/B/LDC/AC.1/4. 2/ TD/B/42 (1) /11-TD/B/LDC/AC.1/7.,yes
1996,General Assembly,Fifty-first session,26,COOPERATION BETWEEN THE UNITED NATIONS AND THE ECONOMIC COOPERATION ORGANIZATION,"Afghanistan, Azerbaijan, Iran (Islamic Republic of), Kazakstan, Kyrgyzstan, Pakistan, Tajikistan, Turkey and Turkmenistan:",N/A,N/A,"The General Assembly , Recalling its resolution 48/2 of 13 October 1993, by which it granted observer status to the Economic Cooperation Organization, Recalling also its resolution 50/1 of 12 October 1995, by which it affirmed the need to strengthen the cooperation that already exists between the entities of the United Nations system and the Economic Cooperation Organization in the areas of economic and social development, Recalling further that the Charter of the United Nations provides for the existence of regional arrangements or agencies for dealing with such matters as maintenance of international peace and security and economic cooperation as are appropriate for regional action, provided that their activities are consistent with the purposes and principles of the United Nations, Bearing in mind that the Treaty of Izmir, signed at Izmir, Turkey, on 12 March 1977, later revised at Ashgabat on 11 May 1996 and signed at Izmir on 14 September 1996, created a permanent body for intraregional cooperation, consultation and coordination in order to enhance economic, social and cultural development, Taking note of the Ashgabat Declaration issued at the Fourth Summit Meeting of the Heads of State and Government of the member States of the Economic Cooperation Organization at Ashgabat on 14 May 1996, Taking note also of the recent measures by the member Governments of the Economic Cooperation Organization to revitalize that organization through the adoption of a new charter of the organization and related documents on its reorganization and restructuring, Convinced that the maintenance and further strengthening of the cooperation between the United Nations system and the Economic Cooperation Organization promote the implementation of the goals and principles of the organization, 1. Takes note of the decision of the Heads of State and Government of the member States of the Economic Cooperation Organization welcoming the adoption of General Assembly resolution 50/1 on cooperation between the two organizations and endorsing the cooperative arrangements entered into by the Economic Cooperation Organization with various entities of the United Nations system for joint efforts towards the implementation of the economic projects and programme of the Economic Cooperation Organization; 2. Notes with satisfaction the report of the Secretary-General of the United Nations’ on the implementation of General Assembly resolution 50/1 and invites the Secretary-General of the United Nations to continue his efforts, in consultation with the Secretary-General of the Economic Cooperation Organization, to promote and expand cooperation and coordination between both secretariats in order to increase the capacity of the two organizations to attain their common objectives; 3. Welcomes the inauguration of the Tejan-Sarakhs-Mashad railway line, which illustrates the significance of the alternative road and railway links which exist or are being developed in order to provide the land-locked countries of the region of the Economic Cooperation Organization further access to the seaport facilities in the Indian Ocean, the Persian Gulf, the Gulf of Oman and the Caspian, Black, Mediterranean and Aegean Seas; 4. Urges the specialized agencies and other organizations and programmes of the United Nations system to initiate, maintain and increase consultation and programmes with the Economic Cooperation Organization and its associated institutions in the attainment of their objectives; 5. Takes note of Economic and Social Commission for Asia and the Pacific resolution 52/11 of 24 April 1996? on the strengthening of subregional economic cooperation among the south-western member countries of the Commission, including the member countries of the Economic Cooperation Organization, in which the Commission is called upon to promote economic and technical cooperation in trade, investment, and transport and communications among member countries of the Economic Cooperation Organization and the request therein to the Executive Secretary of the Commission to report to the Commission at its fifty-fourth session in 1998 on the progress in the implementation of that resolution; 6. Calls upon the Economic and Social Commission for Asia and the Pacific, as the regional arm of the United Nations having all member States of the Economic Cooperation Organization as its members, to assume a specific role in promoting cooperation with the Economic Cooperation Organization; 7. Requests the Secretary-General to submit to the General Assembly at its fifty-second session a report on the implementation of the present resolution; 8. Decides to include in the provisional agenda of its fifty-second session the item entitled ""Cooperation between the United Nations and the Economic Cooperation Organization"".",11/22/1996,1996_228599,Kazakhstan,"* B/51/265. * See Official Records of the Economic and Social Council, 1996, Supplement No. 16 (E/1996/36), chap. IV.",yes
