year,Council,Session,Agenda item,Agenda detail,cosponsored countries,body title number,body title detail,body text,date,file,filecountry,footnote,scanned
1995,Third Committee,Fiftieth session,107,ADVANCEMENT OF WOMEN,"Angola, Argentina, Armenia, Bahamas, Bangladesh, Benin, Bhutan, Botswana, Burkina Faso, Canada, Costa Rica, Céte d'Ivoire, Ethiopia, Fiji, Ghana, Indonesia, Israel, Japan, Kenya, Lesotho, Malawi, Malaysia, Marshall Islands, Mongolia, Mozambique, Myanmar, Namibia, Nepal, Panama, Papua New Guinea, Philippines, Poland, Romania, Singapore, South Africa, Swaziland, Thailand, United Republic of Tanzania, Zambia and Zimbabwe",N/A,The role of the United Nations Development Fund for Women in eliminating violence against women,"The General Assembly , Welcoming the Beijing Declaration and Platform for Action 1/ which called for the prevention and elimination of all forms of violence against women and girls, and the promotion and protection of all human rights of women and girls, stressing that acts or threats of violence, whether occurring within the home or in the community or perpetrated or condoned by the State, instilled fear and insecurity in women's lives and were obstacles to the achievement of equality, development and peace, Recalling that the Platform for Action called for action to eradicate violence against the girl child, recognizing that girls were more vulnerable to all kinds of violence, 1/. A/CONF.177/20, chap. I. Recalling also that the Vienna Declaration and Programme of Action 2/ affirmed that gender-based violence and all forms of sexual harassment and exploitation, including those resulting from cultural prejudice and international trafficking, were incompatible with the dignity and worth of the human person and must be eliminated, Recalling further its resolution 48/104 of 20 December 1993, proclaiming the Declaration on the Elimination of Violence against Women, which recognized that violence against women violated and impaired or nullified the enjoyment by women of human rights and fundamental freedoms, Recognizing the importance of the effective implementation of the Convention on the Elimination of All Forms of Discrimination against Women, Emphasizing the need for full implementation by Governments and community organizations, non-governmental organizations, educational institutions, and the public and private sectors, as appropriate, of the measures set out in the Beijing Declaration and Platform for Action, Urging that Governments allocate adequate resources within their budgets and mobilize community resources for activities related to the elimination of violence against women, including resources for the implementation of plans of action at all appropriate levels, as called for in paragraph 124 (p) of the Platform for Action, Recalling Economic and Social Council resolution 1995/27 of 24 July 1995, in which the Council approved resolution 8 of the Ninth United Nations Congress on the Prevention of Crime and the Treatment of Offenders concerning the elimination of violence against women and urged the Commission on Crime Prevention and Criminal Justice to continue to consider the elimination of violence against women within its priority themes and within the training and technical assistance efforts of the United Nations crime prevention and criminal justice programme, Recognizing the importance of cooperation with the Special Rapporteur of the Commission on Human Rights on violence against women, Reaffirming the importance of developing a holistic and multidisciplinary approach to the task of promoting families, communities and States that are free from violence against women and affirming the need for coordinated and strengthened international support for this approach, Recalling its resolution 48/107 of 20 December 1993, in which it reaffirmed e catalytic role that the United Nations Development Fund for Women has played n facilitating the efforts of Governments and non-governmental organizations at e national and community levels to support innovative activities that directly enefit and empower women, and in increasing opportunities and options for women n developing countries to participate more effectively in the development of eir countries, in line with national priorities, ae ode 1. Reiterates its appreciation for the advocacy initiatives of the United Nations Development Fund for Women, including its contribution to and participation in the follow-up of the Vienna Declaration and Programme of Action, in particular with respect to efforts to combat violence against women, commends the Fund for its support of catalytic and innovative projects that strengthen the national capacity to improve the situation of women and takes note, with appreciation, of the Platform for Action which affirmed that the Fund had the mandate to increase options and opportunities for women's economic and social development in developing countries by providing technical and financial assistance to incorporate the women's dimension into development at all levels and that it should review and strengthen, as appropriate, its work programme in the light of the Platform for Action, focusing on women's political and economic empowerment; 2. Requests the Fund, as one of the operational bodies of the United Nations, to take into account the need to strengthen its activities to eliminate violence against women as part of system-wide efforts of the United Nations towards this goal, in accordance with the measures set out in the Beijing Declaration and Platform for Action and the Declaration on the Elimination of Violence against Women, and focusing on activities, particularly at the national and community levels, and calls on Member States to promote cooperation with the Fund to these ends; 3. Also requests the Fund, in undertaking any relevant activities, to cooperate closely with the relevant organs and bodies of the United Nations, in particular the Division for the Advancement of Women, the Special Rapporteur of the Commission on Human Rights on violence against women, the Centre for Human Rights, the Crime Prevention and Criminal Justice Branch, and the United Nations Children's Fund, in order to ensure that its activities form part of the system- wide efforts of the United Nations to eliminate violence against women; 4. Further requests the Fund to include in its regular reports information regarding its activities to eliminate violence against women and girls and provide such information to the Commission on the Status of Women and the Commission on Human Rights; 5. Requests the Administrator of the United Nations Development Programme, in consultation with the Secretary-General, as well as with the relevant organs and bodies of the United Nations, in particular the Division for the Advancement of Women, the Special Rapporteur of the Commission on Human Rights on violence against women, the Centre for Human Rights and the Crime Prevention and Criminal Justice Branch, to consider the possibility of establishing a trust fund, within the existing mandate, structure and management of the United Nations Development Fund for Women, in support of national, regional and international actions, including those taken by Governments and non-governmental organizations, to eliminate violence against women; 6. Requests the Fund to include in its regular reports information on the implementation of the present resolution and also to provide such information to the Commission on the Status of Women and the Commission on Human Rights.",12/01/1995,1995_200896,Malawi,"1/. A/CONF.177/20, chap. I. 2/ = =A/CONF.157/24 (Part I), chap. III.",yes
1995,Third Committee,Fiftieth session,110,PROMOTION AND PROTECTION OF THE RIGHTS OF CHILDREN,"Afghanistan, Angola, Antigua and Barbuda, Austria, Australia, Bangladesh, Belgium, Benin, Bhutan, Botswana, Burkina Faso, Burundi, Cameroon, Canada, Cape Verde, Chile, Costa Rica, Céte d'Ivoire, Cuba, Denmark, Dominican Republic, Ecuador, Ethiopia, Finland, France, Gabon, Gambia, Germany, Ghana, Guinea, Guinea- Bissau, Guyana, Iceland, India, Ireland, Israel, Jamaica, Japan, Kenya, Lesotho, Liberia, Luxembourg, Madagascar, Malawi, Malaysia, Mali, Marshall Islands, Mauritius, Morocco, Mozambique Namibia, Netherlands, Niger, Nigeria, Norway, Pakistan, Panama, Papua New Guinea, Peru, Philippines, Portugal, Senegal, South Africa, Spain, Suriname, Swaziland, Sweden, Trinidad and Tobago, Uganda, United Kingdom of Great Britain and Northern Ireland United Republic of Tanzania, United States of America, Uruguay, Zambia and Zimbabwe",N/A,The girl child,"The General Assembly , Recalling the Beijing Declaration and the Platform for Action of the Fourth World Conference on Women, 1/ the Copenhagen Declaration on Social Development 2/ and the Programme of Action 3/ of the World Summit for Social Development, the Programme of Action of the International Conference on Population and Development, 4/ the Vienna Declaration and Programme of Action of the World Conference on Human Rights, 5/ Agenda 21, 6/ the Plan of Action for Implementing the World Declaration on the Survival, Protection and Development of Children in the 1990s of the World Summit for Children, 7/ the World Declaration on Education for All and the Framework for Action to Meet Basic Learning Needs adopted at the World Conference on Education for All: Meeting Basic Learning Needs, Recalling also that discrimination against the girl child and the violation of the rights of the girl child was identified as a critical area of concern in the Platform for Action of the Fourth World Conference on Women in the achievement of equality, development and peace for women, and that the advancement and empowerment of women throughout their life-cycle must begin with the girl child, Noting with appreciation that the World Summit for Children sensitized the entire world to the plight of children, Reaffirming the equal rights of women and men as enshrined in the Preamble to the Charter of the United Nations, and recalling the Convention on the Elimination of All Forms of Discrimination against Women 8/ and the Convention on the Rights of the Child, 9/ 1. Urges all States to eliminate all forms of discrimination against the girl child and to eliminate the violation of the human rights of all children, paying particular attention to the obstacles faced by the girl child; 2. Also urges all States, international organizations as well as non-governmental organizations, individually and collectively to set goals and to develop and implement gender-sensitive strategies to address the needs of children, in particular those of girls, in accordance with the Convention on the Rights of the Child and the goals, strategic objectives and actions contained in the Platform for Action of the Fourth World Conference on Women; T/ See A/45/625, annex. 8/ Resolution 34/180, annex. Q/ Resolution 44/25, annex. A/C.3/50/L.31/Rev.1 non-governmental organizations to increase awareness of the potential of the girl child and to promote the participation of girls and young women on an equal basis and as partners with boys and young men in social, economic and political life and in the development of strategies and implementation of actions aimed at achieving gender equality, development and peace; 4. Calls upon Member States and organizations and bodies of the United Nations system, in particular, the United Nations Children's Fund, the United Nations Educational, Scientific and Cultural Organization, the Food and Agriculture Organization of the United Nations and the World Health Organization, to take into account the rights and the particular needs of the girl child, especially in education, health and nutrition, and to eliminate negative cultural attitudes and practices against the girl child; 5. Urges all States to eliminate all forms of violence against children, in particular the girl child; 6. Calls upon States, international organizations as well as non-governmental organizations to help mobilize the necessary financial resources and political support to help achieve goals, strategies and actions relating to the survival, development and protection of the girl child in all programmes for children; 7. Requests the Secretary-General to ensure that the goals and actions relating to the girl child receive full attention in the implementation of the Platform for Action of the Fourth World Conference on Women through the work of all organizations and bodies of the United Nations system; 8. Also requests the Secretary-General, as Chairman of the Administrative Committee on Coordination, to urge all the organizations and bodies of the United Nations system focusing on the advancement of women to make commitments to goals and actions relating to the girl child in the revision and implementation of the system-wide medium-term plan for the advancement of women for the period 1996-2001, 10/ as well as in the medium-term plan for the period 1998-2002. O/ E/1993/43, annex.",12/01/1995,1995_200898,Malawi,"1/ Report of the Fourth World Conference on Women, Beijing 4-15 September 1995 (A/CONF.177/20), chap. I, sect. 1. 2/ Report of the World Summit for Social Development, Copenhagen 6-12 March 1995 (A/CONF.166/9), chap. I, resolution 1, annex I. 3/ Ibid., annex II. 4/ Report of the International Conference on Population and Development, Cairo, 5-13 September 1994 (A/CONF.171/13), chap. I, resolution 1, annex. 5/ Report of the World Conference on Human Rights, Vienna, 14-25 June 1993 (A/CONF.157/24 (Part I)), chap. III. 6/ Report of the United Nations Conference on Environment and Development, Rio de Janeiro, 3-14 June 1992 (A/CONF.151/26/Rev.1 (Vol. I and Vol. I/Corr.1, Vol. II, Vol. III and Vol. III/Corr.1)) (United Nations publication, Sales No. E.93. 1. 8 and corrigenda), vol. I: Resolutions Adopted by the Conference, resolution 1, annex II.",yes
1995,Third Committee,Fiftieth session,110,PROMOTION AND PROTECTION OF THE RIGHTS OF CHILDREN,"Afghanistan, Angola, Antigua and Barbuda, Bangladesh, Benin, Bhutan, Botswana, Burkina Faso, Burundi, Cameroon, Cape Verde, Chile, Céte d'Ivoire, Cuba, Denmark, Dominican Republic, Ecuador, Ethiopia, Finland, Gabon, Gambia, Ghana, Guinea, Guinea-Bissau, India, Ireland, Israel, Jamaica, Japan, Kenya, Lesotho, Liberia, Madagascar, Malawi, Malaysia, Mauritius, Morocco, Mozambique, Namibia, Nigeria, Papua New Guinea, Portugal, Senegal, South Africa, Spain, Suriname, Swaziland, Sweden, Uganda, United Republic of Tanzania, United States of America, Zambia and Zimbabwe",N/A,The girl child,"The General Assembly , Recalling the Beijing Declaration and the Platform for Action of the Fourth World Conference on Women, 1/ the Copenhagen Declaration on Social Development 2/ and the Programme of Action 3/ of the World Summit for Social Development, the Programme of Action of the International Conference on Population and Development, 4/ the Vienna Declaration and Programme of Action of the World Conference on Human Rights, 5/ Agenda 21, 6/ the Plan of Action for Implementing the World Declaration on the Survival, Protection and Development of Children in the 1990s of the World Summit for Children, 7/ the World Declaration on Education for All and the Framework for Action to Meet Basic Learning Needs adopted at the World Conference on Education for All: Meeting Basic Learning Needs, held at Jomtien, Thailand, from 5 to 9 March 1990, Recalling also that discrimination against the girl child and the violation of the rights of the girl child was identified as a critical area of concern in the Platform for Action of the Fourth World Conference on Women in the achievement of equality, development and peace for women, and that the advancement and empowerment of women throughout their life-cycle must begin with the girl child, Noting with appreciation that the World Summit on Children sensitized the entire world to the plight of children, Reaffirming the equal rights of men and women as enshrined in the Preamble to the Charter of the United Nations, and recalling the Convention on the Elimination of All Forms of Discrimination against Women 8/ and the Convention on the Rights of the Child, 9/ 1. Urges all States to eliminate all forms of discrimination against the girl child and to eliminate the violation of the human rights of all children, paying particular attention to the obstacles faced by the girl child; 2. Also urges all States and international and non-governmental organizations, individually and collectively, to set goals and to develop and implement gender-sensitive strategies to address the needs of children, in particular those of girls, in accordance with the Convention on the Rights of the Child and the goals, strategic objectives and actions contained in the Platform for Action of the Fourth World Conference on Women; T/ See A/45/625, annex. 8/ Resolution 34/180, annex. Q/ Resolution 44/25, annex. A/C.3/50/L.31 organizations to increase awareness of the potential of the girl child and to promote the participation of girls and young women on an equal basis and as partners with boys and young men in social, economic and political life and in the development of strategies and implementation of actions aimed at achieving gender equality, development and peace; 4. Calls upon Member States and organizations and bodies of the United Nations system, in particular, the United Nations Children's Fund, the United Nations Educational, Scientific and Cultural Organization, the Food and Agriculture Organization of the United Nations and the World Health Organization, to take into account the rights and the particular needs of the girl child, especially in education, health and nutrition, and to eliminate negative cultural attitudes and practices against the girl child; 5. Urges all States to eliminate all forms of violence against children, in particular the girl child; 6. Calls upon States and international and non-governmental organizations to help mobilize the necessary financial resources and political support to help achieve goals, strategies and actions relating to the survival, development and protection of the girl child in all programmes for children; 7. Requests the Secretary-General to ensure that the goals and actions relating to the girl child receive full attention in the implementation of the Platform for Action of the Fourth World Conference on Women through the work of all organizations and bodies of the United Nations system; 8. Also requests the Secretary-General, as Chairman of the Administrative Committee on Coordination, to urge all the organizations and bodies of the United Nations system focusing on the advancement of women to make commitments to goals and actions relating to the girl child in the revision and implementation of the system-wide medium-term plan for the advancement of women for the period 1996-2001, 10/ as well as in the medium-term plan for the period 1998-2002. O/ E/1993/43, annex.",11/29/1995,1995_201028,Malawi,"1/ Report of the Fourth World Conference on Women, Beijing 4-15 September 1995 (A/CONF.177/20), chap. I, sect. 1. 2/ Report of the World Summit for Social Development, Copenhagen, 6-12 March 1995 (A/CONF.166/9), chap. I, resolution 1, annex I. 3/ Ibid., annex II. 4/ Report of the International Conference on Population and Development, Cairo, 5-13 September 1994 (A/CONF.171/13), chap. I, resolution 1, annex. 5/ Report of the World Conference on Human Rights, Vienna, 14-25 June 1993 (A/CONF.157/24 (Part I)), chap. III. 6/ Report of the United Nations Conference on Environment and Development, Rio de Janeiro, 3-14 June 1992 (A/CONF.151/26/Rev.1 (Vol. I and Vol. I/Corr.1, Vol. II, Vol. III and Vol. III/Corr.1)) (United Nations publication, Sales No. E.93. 1. 8 and corrigenda), vol. I: Resolutions Adopted by the Conference, resolution 1, annex II.",yes
1995,General Assembly,Fiftieth session,164,NORMALIZATION OF THE SITUATION CONCERNING SOUTH AFRICA,"Albania, Algeria, Antigua _ and Barbuda, Australia, Bahamas, Benin, Bolivia, Botswana, Brazil, Burkina Faso, Burundi, Cambodia, Cameroon, Cape Verde, Central African Republic, Chad, Chile, Colombia, Comoros, Congo, Costa Rica, Céte D’ Ivoire, Cuba, Czech Republic, Djibouti, Egypt, El Salvador, Equatorial Guinea, Eritrea, Ethiopia, Fiji, Finland, Gabon, Gambia, Ghana, Grenada, Guatemala, Guinea, Guinea-Bissau, Honduras, Jamaica, Kenya, Lesotho, Liberia, the Libyan Arab Jamahiriya, Madagascar, Malawi, Malaysia, Mali, Marshall Islands, Mauritania, Mauritius, Micronesia (Federated States of), Mongolia, Morocco, Mozambique, Namibia, New Zealand, Nicaragua, Niger, Nigeria, Panama, Papua New Guinea, Peru, Rwanda, Saint Lucia, Saint Vincent and the Grenadines, Samoa, Sao Tome and Principe, Senegal, Seychelles, Sierra Leone, Singapore, Solomon Islands, South Africa, Sudan, Suriname, Swaziland, the former Yugoslav Republic of Macedonia, Togo, Tunisia, Uganda, Ukraine, United Republic of Tanzania, United States of America, Vanuatu, Venezuela, Yemen, Zaire, Zambia and Zimbabwe",N/A,N/A,"The General Assembly , Recalling its resolution 48/258 A, adopted by consensus on 23 June 1994, the date on which South Africa was invited to resume its participation in the work of the General Assembly , Noting that South Africa has since that date commenced payment of its assessed contributions, Also recalling the exceptional circumstances pertaining to the resumption of South Africa’s participation in the work of the General Assembly following the elimination of apartheid and the establishment of a democratic, non-racial South Africa, Recognizing that, owing to these exceptional circumstances, South Africa should not be held liable for contributions relating to the period from 30 September 1974 to 23 June 1994, Recognizing also that the General Assembly took a moral and political decision to exclude South Africa from participation in its work, Recognizing further that the exclusion of South Africa from the work of the General Assembly was unprecedented, 1. Decides that, owing to these unique and exceptional circumstances, South Africa’s unpaid assessments accruing during the period from 30 September 1974 to 23 June 1994 for the regular budget of the United Nations shall be considered no longer due and payable and that the amount of authorized retained surplus in the General Fund pursuant to General Assembly resolution 42/216 A of 21 December 1987 shall be reduced accordingly; 2. Decides also that, owing to these unique and exceptional circumstances, South Africa’s unpaid assessments accruing during the period from 30 September 1974 to 23 June 1994 for United Nations peace-keeping operations shall be considered no longer due and payable; 3. Decides further that under no circumstances shall the decisions referred to in paragraphs 1 and 2 of the present resolution be used as a precedent.",12/04/1995,1995_201036,Malawi,N/A,yes
