year,Council,Session,Agenda item,Agenda detail,cosponsored countries,body title number,body title detail,body text,date,file,filecountry,footnote,scanned
1994,General Assembly,Forty-ninth session,152,OBSERVER STATUS FOR THE INTERNATIONAL FEDERATION OF RED CROSS AND RED CRESCENT SOCIETIES IN THE GENERAL ASSEMBLY,"Afghanistan, Algeria, Antigua _and Barbuda, Armenia, Australia, Austria, Bahamas, Bangladesh, Barbados, Belarus, Belize, Benin, Bhutan, Bolivia, Bulgaria, Burkina Faso, Cambodia, Cameroon, Canada, Cape Verde, Chile, Colombia, Congo, Costa Rica, Céte d’Ivoire, Croatia, Cyprus, Democratic People’s Republic of Korea, Denmark, Djibouti, Dominican Republic, Ecuador, El Salvador, Eritrea, Estonia, Ethiopia, Fiji, Finland, Gambia, Georgia, Ghana, Guatemala, Guinea, Honduras, Hungary, Iceland, Indonesia, Iraq, Jordan, Kazakhstan, Kyrgyzstan, Lao People’s Democratic Republic, Liberia, Libyan Arab Jamahiriya, Liechtenstein, Madagascar, Malawi, Malaysia, Maldives, Mali, Malta, Marshall Islands, Mauritania, Mexico, Micronesia (Federated States of) Mongolia, Morocco, Mozambique, Myanmar, Namibia, Nepal, New Zealand, Norway, Oman, Pakistan, Panama, Papua New Guinea, Peru, Poland, Qatar, Republic of Korea, Saint Lucia, Samoa, San Marino, Saudi Arabia, Senegal, Sierra Leone, Slovakia, Solomon Islands, Sudan, Sweden, Thailand, Togo, Tunisia, Turkey, Ukraine, Vanuatu, Venezuela, Yemen and Zimbabwe",N/A,N/A,"The General Assembly , Recalling the special functions of the member societies of the International Federation of Red Cross and Red Crescent Societies which are recognized by their respective Governments as auxiliaries to the public authorities in the humanitarian field on the basis of the Geneva Conventions of 12 August 1949, Considering the specific role of the International Federation of Red Cross and Red Crescent Societies in international humanitarian relations as further defined by the International Conference of the Red Cross and Red Crescent, Desirous of promoting cooperation between the United Nations and the International Federation of Red Cross and Red Crescent Societies, 1. Decides to invite the International Federation of Red Cross and Red Crescent Societies to participate in the sessions and the work of the General Assembly in the capacity of observer; 2. Requests the Secretary-General to take the necessary action to implement the present resolution.",10/17/1994,1994_163336,Malawi,N/A,yes
1994,Special Political And Decolonization Committee,Forty-ninth session,18,IMPLEMENTATION OF THE DECLARATION ON THE GRANTING OF INDEPENDENCE TO COLONIAL COUNTRIES AND PEOPLESQUESTION OF WESTERN SAHARA,"Algeria, Angola, Antigua and Barbuda, Bahamas, Barbados, Belize, Bolivia, Botswana, Burundi, Chile, Colombia, Congo, Costa Rica, Cuba, Cyprus, Democratic People’s Republic of Korea, Dominica, Ecuador, El Salvador, Ethiopia, Fiji, Ghana, Grenada, Guyana, Haiti, Honduras, Jamaica, Kenya, Lao People’s Democratic Republic, Lesotho, Malawi, Marshall Islands, Mauritania, Mauritius, Mexico, Micronesia (Federated States of), Mozambique, Namibia, Nicaragua, Nigeria, Panama, Papua New Guinea, Paraguay, Rwanda, Saint Kitts and Nevis, Saint Lucia, Saint Vincent and the Grenadines, Seychelles, Sierra Leone, Trinidad and Tobago, Uganda, United Republic of Tanzania, Uruguay, Vanuatu, Venezuela, Viet Nam, Zambia and Zimbabwe",N/A,N/A,"The General Assembly , Having considered in depth the question of Western Sahara, Reaffirming the inalienable right of all peoples to self-determination and independence, in accordance with the principles set forth in the Charter of the United Nations and in General Assembly resolution 1514 (XV) of 14 December 1960, containing the Declaration on the Granting of Independence to Colonial Countries and Peoples, Recalling its resolution 48/49 of 10 December 1993, Recalling also the agreement in principle given on 30 August 1988 by the Kingdom of Morocco and the Frente Popular para la Liberacién de Saguia el-Hamra y de Rio de Oro to the proposals of the Secretary-General of the United Nations and the current Chairman of the Assembly of Heads of State and Government of the Organization of African Unity in the context of their joint mission of good offices, Recalling further Security Council resolutions 621 (1988) of 20 September 1988, 658 (1990) of 27 June 1990, 690 (1991) of 29 April 1991, 725 (1991) of 31 December 1991 and 809 (1993) of 2 March 1993 relating to the question of Western Sahara, Recalling with satisfaction the entry into force of the cease-fire in Western Sahara on 6 September 1991, in accordance with the proposal of the Secretary-General accepted by the two parties, Taking note of the adoption by the Security Council on 29 March 1994 of resolution 907 (1994), Taking note also of the statement by the President of the Security Council on 29 July 1994, 1/ Welcoming the appointment of Mr. Erik Jensen as Deputy Special Representative of the Secretary-General for Western Sahara and the progress made, under his leadership, by the Identification Commission of the United Nations Mission for the Referendum in Western Sahara, Stressing the importance and usefulness of the resumption of direct talks between the two parties, the Kingdom of Morocco and the Frente Popular para la Liberacioén de Saguia el-Hamra y de Rio de Oro, in order to create a propitious atmosphere conducive to a speedy and effective implementation of the settlement plan, Having examined the relevant chapter of the report of the Special Committee on the Situation with regard to the Implementation of the Declaration on the Granting of Independence to Colonial Countries and Peoples, 2/ Having also examined the report of the Secretary-General, 3/ 1. Takes note with appreciation of the report of the Secretary-General; 2. Pays tribute to the Secretary-General for his action with a view to settling the question of Western Sahara by the implementation of the settlement plan; 1/. S/PRST/1994/39. 2/ A/49/23 (Part V), chap. VIII. 3. Reiterates its support for further efforts of the Secretary-General for the organization and supervision by the United Nations, in cooperation with the Organization of African Unity, of a referendum for self-determination of the people of Western Sahara, in conformity with Security Council resolutions 658 (1990) and 690 (1991) by which the Council adopted the settlement plan for Western Sahara; 4. Reaffirms that the goal on which all were agreed consists in the holding of a free, fair and impartial referendum for the people of Western Sahara, organized and conducted by the United Nations in cooperation with the Organization of African Unity and without any military or administrative constraints; 5. Endorses the contents of the statement of 29 July 1994 by the President of the Security Council in which the Council, inter alia, welcomes the progress made to date on the issues outlined in the Secretary-General’s report towards the implementation of the settlement plan; commends, in particular, the work of the Identification Commission and the efforts of the Deputy Special Representative pursuant to resolution 907 (1994) of 29 March 1994; and urges the two parties to continue to cooperate with the Secretary-General and the United Nations Mission for the Referendum in Western Sahara to ensure the earliest possible implementation of the settlement plan; 1/ 6. Encourages the Secretary-General to continue to deploy all efforts to bring the two parties to resume, as soon as possible, direct talks in order to create a propitious atmosphere conducive to a speedy and effective implementation of the settlement plan; 7. Requests Special Committee on the Situation with regard to the Implementation of the Declaration on the Granting of Independence to Colonial Countries and Peoples to continue to consider the situation in Western Sahara, bearing in mind the ongoing referendum process, and to report thereon to the General Assembly at its fiftieth session; 8. Invites the Secretary-General to submit to the General Assembly at its fiftieth session a report on the implementation of the present resolution.",10/25/1994,1994_163789,Malawi,"1/. S/PRST/1994/39. 2/ A/49/23 (Part V), chap. VIII.",yes
1994,Special Political And Decolonization Committee,Forty-ninth session,18,IMPLEMENTATION OF THE DECLARATION ON THE GRANTING OF INDEPENDENCE TO COLONIAL COUNTRIES AND PEOPLESQUESTION OF WESTERN SAHARA,"Algeria, Angola, Antigua and Barbuda, Bahamas, Barbados, Belize, Bolivia, Botswana, Burundi, Chile, Colombia, Congo, Costa Rica, Cuba, Cyprus, Democratic People’s Republic of Korea, Dominica, Ecuador, El Salvador, Ethiopia, Fiji, Ghana, Grenada, Guyana, Haiti, Honduras, Jamaica, Kenya, Lao People’s Democratic Republic, Lesotho, Malawi, Marshall Islands, Mauritania, Mauritius, Mexico, Micronesia (Federated States of), Mozambique, Namibia, Nicaragua, Nigeria, Panama, Papua New Guinea, Paraguay, Rwanda, Saint Kitts and Nevis, Saint Lucia, Saint Vincent and the Grenadines, Seychelles, Sierra Leone, Trinidad and Tobago, Uganda, United Republic of Tanzania, Uruguay, Vanuatu, Venezuela, Viet Nam, Zambia and Zimbabwe",N/A,N/A,"The General Assembly , Having considered in depth the question of Western Sahara, Reaffirming the inalienable right of all peoples to self-determination and independence, in accordance with the principles set forth in the Charter of the United Nations and in General Assembly resolution 1514 (XV) of 14 December 1960, containing the Declaration on the Granting of Independence to Colonial Countries and Peoples, Recalling its resolution 48/49 of 10 December 1993, Recalling also the agreement in principle given on 30 August 1988 by the Kingdom of Morocco and the Frente Popular para la Liberacién de Saguia el-Hamra y de Rio de Oro to the proposals of the Secretary-General of the United Nations and the current Chairman of the Assembly of Heads of State and Government of the Organization of African Unity in the context of their joint mission of good offices, Recalling further Security Council resolutions 621 (1988) of 20 September 1988, 658 (1990) of 27 June 1990, 690 (1991) of 29 April 1991, 725 (1991) of 31 December 1991 and 809 (1993) of 2 March 1993 relating to the question of Western Sahara, Recalling with satisfaction the entry into force of the cease-fire in Western Sahara on 6 September 1991, in accordance with the proposal of the Secretary-General accepted by the two parties, Taking note of the adoption by the Security Council on 29 March 1994 of resolution 907 (1994), Taking note also of the statement by the President of the Security Council on 29 July 1994, 1/ Welcoming the appointment of Mr. Erik Jensen as Deputy Special Representative of the Secretary-General for Western Sahara and the progress made, under his leadership, by the Identification Commission of the United Nations Mission for the Referendum in Western Sahara, Stressing the importance and usefulness of the resumption of direct talks between the two parties mentioned above in order to create a propitious atmosphere conducive to a speedy and effective implementation of the settlement plan, Having examined the relevant chapter of the report of the Special Committee on the Situation with regard to the Implementation of the Declaration on the Granting of Independence to Colonial Countries and Peoples, 2/ Having also examined the report of the Secretary-General, 3/ 1. Takes note with appreciation of the report of the Secretary-General; 2. Pays tribute to the Secretary-General and the United Nations Mission for the Referendum in Western Sahara personnel for their action with a view to settling the question of Western Sahara by the implementation of the settlement plan; 1/. S/PRST/1994/39. 2/ A/49/23 (Part V), chap. VIII. 3. Reiterates its support for further efforts of the Secretary-General for the organization and supervision by the United Nations, in cooperation with the Organization of African Unity, of a referendum for self-determination of the people of Western Sahara, in conformity with Security Council resolutions 658 (1990) and 690 (1991) by which the Council adopted the settlement plan for Western Sahara; 4. Reaffirms that the goal on which all were agreed consists in the holding of a free, fair and impartial referendum for the people of Western Sahara, organized and conducted by the United Nations in cooperation with the Organization of African Unity and without any military or administrative constraints, in conformity with the settlement plan; 5. Endorses the contents of the statement of 29 July 1994 by the President of the Security Council in which the Council, inter alia, welcomes the progress made to date on the issues outlined in the Secretary-General’s report towards the implementation of the settlement plan; commends, in particular, the work of the Identification Commission and the efforts of the Deputy Special Representative pursuant to resolution 907 (1994) of 29 March 1994; and urges the two parties to continue to cooperate with the Secretary-General and the United Nations Mission for the Referendum in Western Sahara to ensure the earliest possible implementation of the settlement plan; 1/ 6. Expresses the hope that direct talks between the two parties will soon resume in order to create a propitious atmosphere conducive to a speedy and effective implementation of the settlement plan; 7. Requests the Special Committee on the Situation with regard to the Implementation of the Declaration on the Granting of Independence to Colonial Countries and Peoples to continue to consider the situation in Western Sahara, bearing in mind the ongoing referendum process, and to report thereon to the General Assembly at its fiftieth session; 8. Invites the Secretary-General to submit to the General Assembly at its fiftieth session a report on the implementation of the present resolution.",10/27/1994,1994_163913,Malawi,"1/. S/PRST/1994/39. 2/ A/49/23 (Part V), chap. VIII.",yes
1994,Second Committee,Forty-ninth session,12,REPORT OF THE ECONOMIC AND SOCIAL COUNCIL,"Albania, Algeria, Andorra, Angola, Antigua and Barbuda, Argentina, Australia, Austria, Bahamas, Bangladesh, Barbados, Belarus, Belgium, Belize, Benin, Bhutan, Bolivia, Brazil, Burkina Faso, Cambodia, Canada, Cape Verde, Chile, Colombia, Comoros, Congo, Costa Rica, Céte d’Ivoire, Cyprus, Czech Republic, Denmark, Dominican Republic, Ecuador, Egypt, El Salvador, Fiji, France, Germany, Greece, Grenada, Guatemala, Guinea-Bissau, Guyana, Honduras, Hungary, Iceland, India, Ireland, Israel, Italy, Jamaica, Lithuania, Luxembourg, Malawi, Maldives, Malaysia, Malta, Marshall Islands, Mauritania, Mauritius, Micronesia (Federated States of), Monaco, Mongolia, Morocco, Mozambique, Netherlands, New Zealand, Nicaragua, Pakistan, Panama, Papua New Guinea, Paraguay, Peru, Philippines, Poland, Portugal, Qatar, Republic of Moldova, Romania, Russian Federation, Saint Kitts and Nevis, Saint Lucia, Samoa, San Marino, Sao Tome and Principe, Senegal, Seychelles, Slovakia, Slovenia, Solomon Islands, South Africa, Spain, Sri Lanka, Suriname, Thailand, Trinidad and Tobago, Turkey, Ukraine, United Kingdom of Great Britain and Northern Ireland, Uruguay, Vanuatu and Venezuela",N/A,Question of declaring 1998 International Year of the Ocean,"The General Assembly , Recalling Economic and Social Council resolution 1994/48 of 29 July 1994, Proclaims 1998 International Year of the Ocean.",11/07/1994,1994_163971,Malawi,N/A,yes
