year,Council,Session,Agenda item,Agenda detail,cosponsored countries,body title number,body title detail,body text,date,file,filecountry,footnote,scanned
1996,First Committee,Fifty-first session,71 (i),GENERAL AND COMPLETE DISARMAMENT,"Algeria, Angola, Bangladesh, Cambodia, Colombia, Costa Rica, Cuba, Ecuador, Egypt, Ethiopia, Fiji, Ghana, India, Indonesia, Iran (Islamic Republic of), Irag, Kenya, Malaysia, Marshall Islands, Mauritius, Mexico, Mongolia, Myanmar, Namibia, Nepal, Nicaragua, Nigeria, Pakistan, Papua New Guinea, Philippines, Samoa, Sri Lanka, Sudan, Thailand, United Republic of Tanzania, Venezuela, Viet Nam, Zaire, Zambia, Zimbabwe",N/A,Nuclear disarmament,"The General Assembly , Recalling its resolution 49/75 E of 15 December 1994 on a step-by-step reduction of the nuclear threat, and its resolution 50/70 P of 12 December 1995 on nuclear disarmament, Reaffirming the commitment of the international community to the goal of the total elimination of nuclear weapons and the creation of a nuclear-weapon- free world, Determined to achieve the objective of prohibiting the development, production, stockpiling and use of nuclear weapons and their destruction, and to conclude such an international convention or conventions at an early date, Bearing in mind paragraph 50 of the Final Document of the Tenth Special Session of the General Assembly , 1/ the first special session devoted to disarmament, calling for the urgent negotiation of agreements for the cessation of the qualitative improvement and development of nuclear weapon systems, and for a comprehensive and phased programme with agreed time frames, wherever feasible, for progressive and balanced reduction of nuclear weapons and their means of delivery, leading to their ultimate and complete elimination at the earliest possible time, Taking note of the adoption of the Comprehensive Nuclear-Test-Ban Treaty by the General Assembly in its resolution 50/245 on 10 September 1996, Recognizing that the Comprehensive Nuclear-Test-Ban Treaty and any proposed treaty on fissile material for nuclear weapons or other nuclear explosive devices must constitute disarmament measures, and not only non-proliferation measures, and that these measures, together with an international legal instrument on adequate security assurances for non-nuclear-weapon States and an international convention prohibiting the use of nuclear weapons must be integral steps leading to the total elimination of nuclear weapons within a time-bound framework, Recognizing also that the end of the cold war has brought about favourable conditions for creating a world free of nuclear weapons, Welcoming the entry into force of the Treaty on the Reduction and Limitation of Strategic Offensive Arms 2/ to which Belarus, Kazakstan, the Russian Federation, Ukraine and the United States of America are States parties, Welcoming also the conclusion of the Treaty on Further Reduction and Limitation of Strategic Offensive Arms 3/ by the Russian Federation and the United States of America, and, the ratification of the Treaty by the United States of America, and looking forward to the full implementation of START I and START II Treaties by the States parties, and to further concrete steps for nuclear disarmament by all nuclear-weapon States, Noting with appreciation the unilateral measures by the nuclear-weapon States for nuclear arms limitation, and encouraging them to undertake further such measures, Recognizing the complementarity of bilateral and multilateral negotiations on nuclear disarmament, and that bilateral negotiations can never replace multilateral negotiations in this respect, Noting the support expressed in the Conference on Disarmament and in the General Assembly for the elaboration of an international convention to assure non-nuclear-weapon States against the use or threat of use of nuclear weapons, and the multilateral efforts in the Conference on Disarmament to reach agreement on such an international convention at an early date, Taking note of the advisory opinion of the International Court of Justice dated 8 July 1966 on the legality of the threat or use of nuclear weapons, and welcoming the unanimous reaffirmation by all Judges of the Court that there exists an obligation for all States to pursue in good faith and bring to a conclusion negotiations leading to nuclear disarmament in all its aspects under strict and effective international control, Taking note also of paragraph 84 and other relevant recommendations in the Final Document of the Eleventh Conference of Heads of State or Government of the Non-Aligned Countries, held at Cartagena de Indias, Colombia, from 18 to 20 October 1995, 4/ calling upon the Conference on Disarmament to establish, on a priority basis, an ad hoc committee to commence negotiations early in 1996 on a phased programme of nuclear disarmament and for the eventual elimination of nuclear weapons within a time-bound framework, and paragraph 26 of the Communiqué of the Meeting of Ministers for Foreign Affairs and Heads of Delegations of the Non-Aligned Countries, held at New York on 25 September 1996, Expressing its regret that the Conference on Disarmament has not been able as yet to establish an ad hoc committee on nuclear disarmament, as called for in its resolution 50/70 P, Taking note of the proposal of twenty-eight delegations to the Conference on Disarmament that are Members of the Group of 21 for a programme of action for the elimination of nuclear weapons, 5/ and expressing its conviction that this proposal will be an important input and will contribute to negotiations on this question in the Conference on Disarmament, 1. Recognizes that, in view of the end of the cold war and recent political developments, time is now opportune for all nuclear-weapon States to undertake effective disarmament measures with a view to the total elimination of these weapons within a time-bound framework; 2. Recognizes also that there is a genuine need to de-emphasize the role of nuclear weapons, and to review and revise nuclear doctrines accordingly; 3. Urges the nuclear-weapon States to stop immediately the qualitative improvement, development, production and stockpiling of nuclear warheads and their delivery systems; 4. Calls upon the nuclear-weapon States to undertake step-by-step reduction of the nuclear threat and a phased programme of progressive and balanced deep reductions of nuclear weapons, and to carry out effective nuclear disarmament measures with a view to the total elimination of these weapons within a time-bound framework; A/C.1/51/L.39 basis, an ad hoc committee on nuclear disarmament to commence negotiations early in 1997 on a phased programme of nuclear disarmament and for the eventual elimination of nuclear weapons within a time-bound framework through a Nuclear Weapons Convention; 6. Urges the Conference on Disarmament to take into account in this regard the proposal of the twenty-eight delegations for a programme of action for the elimination of nuclear weapons; 7. Requests the Secretary-General to submit to the General Assembly at its fifty-second session a report on the implementation of the present resolution; 8. Decides to include in the provisional agenda of its fifty-second session the item entitled ""Nuclear disarmament"".",10/29/1996,1996_223069,Nepal,"1/ — Resolution S-10/2. 2/ The United Nations Disarmament Yearbook, vol. 16: 1991 (United Nations publication, Sales No. E.92.1X.1), appendix II. 3/ Ibid., vol. 18: 1993 (United Nations publication, Sales No. E.94.1X.1), appendix II. 4/ — A/50/752-S/1995/1035, annex III. 5/ See document A/C.1/51/12 of 24 October 1996.",yes
1996,First Committee,Fifty-first session,71 (b),GENERAL AND COMPLETE DISARMAMENT: TRANSPARENCY IN ARMAMENTS,"Afghanistan, Albania, Andorra, Argentina, Armenia, Australia, Austria, Bahamas, Belarus, Belgium, Bhutan, Bolivia, Bulgaria, Cambodia, Cameroon, Canada, Cape Verde, Chile, Costa Rica, Céte d’ Ivoire, Croatia, Cyprus, Czech Republic, Denmark, Ecuador, Estonia, Fiji, Finland, France, Georgia, Germany, Greece, Guatemala, Guinea, Guyana, Honduras, Hungary, Iceland, Ireland, Italy, Japan, Kazakstan, Kyrgyzstan, Latvia, Lesotho, Liechtenstein, Lithuania, Luxembourg, Madagascar, Malaysia, Mali, Malta, Marshall Islands, Monaco, Namibia, Nepal, Netherlands, New Zealand, Nicaragua, Niger, Norway, Panama, Papua New Guinea, Paraguay, Peru, Philippines, Poland, Portugal, Republic of Korea, Republic of Moldova, Romania, Russian Federation, Samoa, San Marino, Sao Tome and Principe, Sierra Leone, Singapore, Slovakia, Slovenia, Solomon Islands, South Africa, Spain, Swaziland, Sweden, the former Yugoslav Republic of Macedonia, Turkey, Ukraine, United Kingdom of Great Britain and Northern Ireland and United States of America",N/A,N/A,"The General Assembly , Recalling its resolutions 46/36 L of 9 December 1991, 47/52 L of 15 December 1992, 48/75 E of 16 December 1993, 49/75 C of 15 December 1994 and 50/70 D of 12 December 1995, Continuing to take the view that an enhanced level of transparency in armaments contributes greatly to confidence-building and security among States and that the establishment of the United Nations Register of Conventional Arms 1/ constitutes an important step forward in the promotion of transparency in military matters, Welcoming the consolidated report of the Secretary-General on the Register, 2/ which includes the returns of Member States for 1995, Welcoming also the response of Member States to the request contained in paragraphs 9 and 10 of resolution 46/36 L to provide data on their imports and exports of arms, as well as available background information regarding their military holdings, procurement through national production and relevant policies, Welcoming further the report of the Disarmament Commission at its 1996 session on the subject of international arms transfers, 3/ which was adopted by consensus, Stressing that the continuing operation of the Register and its further development should be reviewed in order to secure a Register that is capable of attracting the widest possible participation, 1. Reaffirms its determination to ensure the effective operation of the United Nations Register of Conventional Arms 1/ as provided for in paragraphs 7, 8, 9 and 10 of resolution 46/36 L; 2. Calls upon Member States to provide the requested data and information for the Register, on the basis of resolutions 46/36 L and 47/52 L and the annex and appendices to the 1994 report of the Secretary-General on the continuing operation of the Register and its further development, 4/ to the Secretary- General by 30 April annually; 3. Reaffirms its decision, with a view to further development of the Register, to keep the scope of and participation in the Register under review, and, to that end: (a) Recalls its request to Member States to provide the Secretary-General with their views on the continuing operation of the Register and its further development and on transparency measures related to weapons of mass destruction; (b) Recalls its request to the Secretary-General, with the assistance of a group of governmental experts to be convened in 1997, on the basis of equitable geographical representation, to prepare a report on the continuing operation of the Register and its further development, taking into account the report of the Disarmament Commission at its 1996 session on the subject of international arms transfers, 3/ the work of the Conference on Disarmament, the views expressed by Member States and the 1994 report of the Secretary-General on the continuing operation of the Register and its further development, 4/ with a view to a decision at its fifty-second session; A/C.1/51/L.18 made available for the Secretariat to operate and maintain the Register; 5. Invites the Conference on Disarmament to consider continuing its work undertaken in the field of transparency in armaments; 6. Reiterates it call upon all Member States to cooperate at the regional and subregional levels, taking fully into account the specific conditions prevailing in the region or subregion, with a view to enhancing and coordinating international efforts aimed at increased openness and transparency in armaments; 7. Also requests the Secretary-General to report to the General Assembly at its fifty-second session on the progress made in implementing the present resolution; 8. Decides to include in the provisional agenda of its fifty-second session the item entitled ""Transparency in armaments"".",10/29/1996,1996_223102,Nepal,"1/ See resolution 46/36 L. 2/ ~—A/51/300 and Add.1-2. 3/ Official Records of the General Assembly , Fifty-first Session, Supplement No. 42 (A/51/42), annex I. 4/ A/49/316.",yes
1996,First Committee,Fifty-first session,72 (e),REVIEW AND IMPLEMENTATION OF THE CONCLUDING DOCUMENT OF THE TWELFTH SPECIAL SESSION OF THE GENERAL ASSEMBLY: CONVENTION ON THE PROHIBITION OF THE USE OF NUCLEAR WEAPONS,"Bhutan, Bolivia, Botswana, Brunei Darussalam, Colombia, Costa Rica, Cuba, Democratic People’s Republic of Korea, Ecuador, Egypt, Ethiopia, Haiti, India, Indonesia, Iran (Islamic Republic of), Lao People’s Democratic Republic, Libyan Arab Jamahiriya, Mexico, Myanmar, Nepal, Nigeria, Sudan and Viet Nam: revised",N/A,N/A,"The General Assembly , Convinced that the use of nuclear weapons poses the most serious threat to the survival of mankind, Bearing in mind the advisory opinion of the International Court of Justice of 8 July 1996 on the Legality of the Threat _or Use of Nuclear Weapons, 1/ Convinced also that a multilateral, universal and binding agreement prohibiting the use or threat of use of nuclear weapons would contribute to the elimination of the nuclear threat and to the climate for negotiations leading to the ultimate elimination of nuclear weapons, thereby strengthening international peace and security, Conscious that some steps taken by the Russian Federation and the United States of America towards a reduction of their nuclear weapons and the improvement in the international climate can contribute towards the goal of the complete elimination of nuclear weapons, i/ A/51/218. Recalling that, in paragraph 58 of the Final Document of the Tenth Special Session of the General Assembly , 2/ it is stated that all States should actively participate in efforts to bring about conditions in international relations among States in which a code of peaceful conduct of nations in international affairs could be agreed upon and that would preclude the use or threat of use of nuclear weapons, Reaffirming that any use of nuclear weapons would be a violation of the Charter of the United Nations and a crime against humanity, as declared in its resolutions 1653 (XVI) of 24 November 1961, 33/71 B of 14 December 1978, 34/83 G of 11 December 1979, 35/152 D of 12 December 1980 and 36/92 I of 9 December 1981, Determined to achieve an international convention prohibiting the development, production, stockpiling and use of nuclear weapons leading to their ultimate destruction, Stressing that an international convention on the prohibition of the use of nuclear weapons would be an important step in a phased programme towards the complete elimination of nuclear weapons within a time-bound framework, Noting with regret that the Conference on Disarmament, during its 1996 session, was unable to undertake negotiations on this subject as called for in General Assembly resolution 50/71 E of 12 December 1995, 1. Reiterates its request to the Conference on Disarmament to commence negotiations, in order to reach agreement on an international convention prohibiting the use or threat of use of nuclear weapons under any circumstances, taking as a possible basis the Convention on the Prohibition of the Use of Nuclear Weapons annexed to the present resolution; 2. Requests the Conference on Disarmament to report to the General Assembly on the results of those negotiations. ANNEX Draft Convention on the Prohibition of the Use of Nuclear Weapons The States Parties to the present Convention, Alarmed by the threat to the very survival of mankind posed by the existence of nuclear weapons, Convinced that any use of nuclear weapons constitutes a violation of the Charter of the United Nations and a crime against humanity, Desiring to achieve a multilateral, universal and binding agreement prohibiting the use or threat of use of nuclear weapons, Bearing in mind the advisory opinion of the International Court of Justice that there exists an obligation of all States to pursue in good faith and bring to a conclusion negotiations leading to nuclear disarmament in all its aspects under strict and effective international control, Determined, therefore, to achieve an international convention prohibiting the development, production, stockpiling and use of nuclear weapons leading to their ultimate destruction, Convinced _ also that the present Convention would be an important step ina phased programme towards the complete elimination of nuclear weapons within a timebound framework, Determined to continue negotiations for the achievement of this goal, Have agreed as follows: Article 1 The States Parties to the present Convention solemnly undertake not to use or threaten to use nuclear weapons under any circumstances. Article 2 This Convention shall be of unlimited duration. Article 3 1. The present Convention shall be open to all States for signature. Any State that does not sign the Convention before its entry into force in accordance with paragraph 3 of the present article may accede to it at any time. 2. The present Convention shall be subject to ratification by signatory States. Instruments of ratification or accession shall be deposited with the Secretary-General of the United Nations. 3. The present Convention shall enter into force on the deposit of instruments of ratification by twenty-five Governments, including the Governments of the five nuclear-weapon States, in accordance with paragraph 2 of the present article. 4. For States whose instruments of ratification or accession are deposited after the entry into force of the Convention, it shall enter into force on the date of the deposit of their instruments of ratification or accession. 5. The depository shall promptly inform all signatory and acceding States of the date of each signature, the date of deposit of each instrument of ratification or accession and the date of entry into force of this Convention, as well as of the receipt of other notices. 6. The present Convention shall be registered by the depositary in accordance with Article 102 of the Charter of the United Nations. Article 4 The present Convention, of which the Arabic, Chinese, English, French, Russian and Spanish texts are equally authentic, shall be deposited with the Secretary-General of the United Nations, who shall send duly certified copies thereof to the Governments of the signatory and acceding States. IN WITNESS WHEREOF, the undersigned, being duly authorized thereto by their respective Governments, have signed the present Convention, opened for signature at on the day of one thousand nine hundred and .",11/01/1996,1996_223133,Nepal,N/A,yes
1996,First Committee,Fifty-first session,71,GENERAL AND COMPLETE DISARMAMENT,"Afghanistan, Albania, Angola, Argentina, Armenia, Austria, Azerbaijan, Bangladesh, Belgium, Bhutan, Bolivia, Bosnia and Herzegovina, Botswana, Brazil, Brunei Darussalam, Cambodia, Canada, Chad, Chile, Colombia, Costa Rica, Croatia, Cyprus, Czech Republic, Denmark, El Salvador, Ethiopia, Fiji, Gabon, Georgia, Germany, Ghana, Guatemala, Haiti, Honduras, Hungary, Iceland, Ireland, Italy, Jamaica, Japan, Kazakstan, Kyrgyzstan, Liechtenstein, Lithuania, Luxembourg, Maldives, Malta, Marshall Islands, Mauritius, Mexico, Micronesia (Federated States of), Morocco, Mozambique, Namibia, Netherlands, New Zealand, Nicaragua, Niger, Norway, Palau, Peru, Philippines, Poland, Portugal, Republic of Moldova, Romania, Rwanda, Sierra Leone, Slovakia, Slovenia, Solomon Islands, South Africa, Sweden, Tunisia, United Kingdom of Great Britain and Northern Ireland, United States of America, Uruguay, Uzbekistan, Vanuatu, Venezuela, Yemen, Zambia and Zimbabwe",N/A,An_international agreement to ban anti-personnel landmines,"The General Assembly , Recalling with satisfaction its resolutions 48/75 K of 16 December 1993, 49/75 D of 15 December 1994 and 50/70 O of 12 December 1995, in which it, inter alia, urged States to implement moratoria on the export of anti-personnel landmines, Also recalling with satisfaction its resolutions 49/75 D and 50/70 O, in which it, inter alia, established as a goal of the international community the eventual elimination of anti-personnel landmines, Noting that, according to the 1995 report of the Secretary-General entitled ""Assistance in mine clearance"", 1/ it is estimated that there are one hundred and ten million landmines in the ground in more than sixty countries throughout the world, Noting also that, according to the same report, the global landmine crisis continues to worsen as an estimated two million new landmines are laid each year, while only an estimated one hundred and fifty thousand were cleared in 1995, Expressing deep concern that anti-personnel landmines kill or maim hundreds of people every week, mostly innocent and defenceless civilians and especially children, obstruct economic development and reconstruction, inhibit the repatriation of refugees and the return of internally displaced persons, and have other severe consequences for years after emplacement, Gravely concerned about the suffering and casualties caused to non-combatants as a result of the proliferation, as well as the indiscriminate and irresponsible use, of anti-personnel landmines, Recalling with satisfaction its resolutions 48/7 of 19 October 1993, 49/215 A of 23 December 1994 and 50/82 of 14 December 1995 calling for assistance in mine clearance, Welcoming the recent decisions taken at the Review Conference of the States Parties to the Convention on Prohibitions or Restrictions on the Use of Certain Conventional Weapons Which May be Deemed to be Excessively Injurious or to Have Indiscriminate Effects, particularly with respect to the Convention’s amended Protocol II, 2/ and believing that the amended Protocol is an essential part of the global effort to address problems caused by the proliferation, as well as the indiscriminate and irresponsible use, of anti-personnel landmines, Welcoming the adoption of the declaration entitled ""Towards a Global Ban on Anti-Personnel Mines"" by participants at the International Strategy Conference at Ottawa on 5 October 1996, including its call for the earliest possible conclusion of a legally binding international agreement to ban anti-personnel landmines, and further welcoming the follow-on conference at Brussels in June 1997, Welcoming also the recent decisions taken by States to adopt various bans, moratoria or other restrictions on the use, stockpiling, production and transfer of anti-personnel landmines, and other measures taken unilaterally as well as multilaterally, Recognizing the need to conclude an international agreement to ban all anti-personnel landmines as soon as possible, i/ A/50/408. 1. Urges States to pursue vigorously an effective, legally-binding international agreement to ban the use, stockpiling, production and transfer of anti-personnel landmines with a view to completing the negotiation as soon as possible; 2. Urges States that have not yet done so to accede to the Convention on Prohibitions or Restrictions on the Use of Certain Conventional Weapons Which May be Deemed to be Excessively Injurious or to Have Indiscriminate Effects 3/ and Protocol II as amended on 3 May 1996, and urges all States immediately to comply to the fullest extent possible with the applicable rules of Protocol II as amended; 3. Welcomes the various bans, moratoria or other restrictions already declared by States on anti-personnel landmines; 4. Calls upon States that have not yet done so to declare and implement such bans, moratoria or other restrictions - particularly on operational use and transfer - at the earliest date possible; 5. Requests the Secretary-General to prepare a report on steps taken to complete an international agreement banning the use, stockpiling, production and transfer of anti-personnel landmines, and on other steps taken by Member States to implement such bans, moratoria or other restrictions and to submit it to the General Assembly at its fifty-second session under the item entitled ""General and complete disarmament""; 6. Requests Member States to provide the requested information for the report of the Secretary-General on steps taken to complete an international agreement banning the use, stockpiling, production and transfer of anti-personnel landmines, and on other steps taken to implement bans, moratoria or other restrictions on anti-personnel landmines and to submit such information to the Secretary-General by 15 April 1997.",10/31/1996,1996_223135,Nepal,N/A,yes
