year,Council,Session,Agenda item,Agenda detail,cosponsored countries,body title number,body title detail,body text,date,file,filecountry,footnote,scanned
1995,First Committee,Fiftieth session,69,PREVENTION OF AN ARMS RACE IN OUTER SPACE,"Algeria, Bolivia, Brazil, China, Egypt, Ethiopia, India, Indonesia, Iran (Islamic Republic of), Marshall Islands, Mongolia, Myanmar, Nepal, Nigeria, Sri Lanka, Sudan and Ukraine",N/A,Prevention of an arms race in outer space,"The General Assembly , Recognizing the common interest of all mankind in the exploration and use of outer space for peaceful purposes, Reaffirming the will of all States that the exploration and use of outer space, including the Moon and other celestial bodies, shall be for peaceful purposes, shall be carried out for the benefit and in the interest of all countries, irrespective of their degree of economic or scientific development, and shall be the province of all mankind, Reaffirming also provisions of articles III and IV of the Treaty on Principles Governing the Activities of States in the Exploration and Use of Outer Space, including the Moon and Other Celestial Bodies, 1/ Recalling the obligation of all States to observe the provisions of the Charter of the United Nations regarding the use or threat of use of force in their international relations, including in their space activities, Reaffirming further paragraph 80 of the Final Document of the Tenth Special Session of the General Assembly , 2/ in which it is stated that in order to prevent an arms race in outer space further measures should be taken and appropriate international negotiations held in accordance with the spirit of the Treaty, Recalling also its previous resolutions on this issue and taking note of the proposals submitted to the General Assembly at its tenth special session and at its regular sessions, and of the recommendations made to the competent organs of the United Nations and to the Conference on Disarmament, Recognizing the grave danger for international peace and security of an arms race in outer space and of developments contributing to it, Emphasizing the paramount importance of strict compliance with existing arms limitation and disarmament agreements relevant to outer space, including bilateral agreements, and with the existing legal regime concerning the use of outer space, Considering that wide participation in the legal regime applicable to outer space could contribute to enhancing its effectiveness, Noting that bilateral negotiations, begun in 1985 between the Union of Soviet Socialist Republics and the United States of America, were conducted with the declared objective of working out effective agreements aimed, inter alia, at preventing an arms race in outer space, Welcoming the re-establishment of the Ad Hoc Committee on the Prevention of an Arms Race in Outer Space at the 1994 session of the Conference on Disarmament, in the exercise of the negotiating responsibilities of this sole multilateral body on disarmament, to continue to examine and identify, through substantive and general consideration, issues relevant to the prevention of an arms race in outer space, Noting that the Ad Hoc Committee on the Prevention of an Arms Race in Outer Space, taking into account its previous efforts since its establishment in 1985 and seeking to enhance its functioning in qualitative terms, continued the examination and identification of various issues, existing agreements and existing proposals, as well as future initiatives relevant to the prevention of an arms race in outer space, 3/ and that this contributed to a better understanding of a number of problems and to a clearer perception of the various positions, Regretting the inability of the Conference on Disarmament to re-establish the Ad Hoc Committee on the Prevention of an Arms Race in Outer Space in 1995, Emphasizing the mutually complementary nature of bilateral and multilateral efforts in the field of preventing an arms race in outer space, and hoping that concrete results will emerge from those efforts as soon as possible, Convinced that further measures should be examined in the search for effective and verifiable bilateral and multilateral agreements in order to prevent an arms race in outer space, Stressing that the growing use of outer space increases the need for greater transparency and better information on the part of the international community, Recalling in this context its previous resolutions, in particular resolutions 45/55 B of 4 December 1990, 47/51 of 9 December 1992 and 48/74 A of 16 December 1993, in which, inter alia, the importance of confidence-building measures was reaffirmed as means conducive to ensuring the attainment of the objective of the prevention of an arms race in outer space, Conscious of the benefits of confidence- and security-building measures in the military field, Recognizing that there has been agreement in the Ad Hoc Committee that the conclusion of an international agreement or agreements to prevent an arms race in outer space remained the fundamental task of the Committee and that the concrete proposals on confidence-building measures could form an integral part of such agreements, 1. Reaffirms the importance and urgency of preventing an arms race in outer space and the readiness of all States to contribute to that common objective, in conformity with the provisions of the Treaty on Principles Governing the Activities of States in the Exploration and Use of Outer Space, including the Moon and Other Celestial Bodies; 2. Reaffirms its recognition, as stated in the report of the Ad Hoc Committee on the Prevention of an Arms Race in Outer Space, that the legal regime applicable to outer space by itself does not guarantee the prevention of an arms race in outer space, that this legal regime plays a significant role in the prevention of an arms race in that environment, that there is a need to consolidate and reinforce that regime and enhance its effectiveness, and that it is important strictly to comply with existing agreements, both bilateral and multilateral; 3. Emphasizes the necessity of further measures with appropriate and effective provisions for verification to prevent an arms race in outer space; 4. Calls upon all States, in particular those with major space capabilities, to contribute actively to the objective of the peaceful use of outer space and of the prevention of an arms race in outer space and to refrain from actions contrary to that objective and to the relevant existing treaties in the interest of maintaining international peace and security and promoting international cooperation; 5. Reiterates that the Conference on Disarmament, as the single multilateral disarmament negotiating forum, has the primary role in the negotiation of a multilateral agreement or agreements, as appropriate, on the prevention of an arms race in outer space in all its aspects; 6. Requests the Conference on Disarmament to re-establish the Ad Hoc Committee on the Prevention of an Arms Race in Outer Space in 1996 and to consider the question of preventing an arms race in outer space; 7. Also requests the Conference on Disarmament to intensify its consideration of the question of the prevention of an arms race in outer space in all its aspects, building upon areas of convergence and taking into account relevant proposals and initiatives, including those presented in the Ad Hoc Committee at the 1994 session of the Conference and at the forty-ninth and fiftieth sessions of the General Assembly ; 8. Further requests the Conference on Disarmament to re-establish an ad hoc committee with an adequate mandate at the beginning of its 1996 session and to continue building upon areas of convergence, taking into account the work undertaken since 1985, with a view to undertaking negotiations for the conclusion of an agreement or agreements, as appropriate, to prevent an arms race in outer space in all its aspects; 9. Recognizes, in this respect, the growing convergence of views on the elaboration of measures designed to strengthen transparency, confidence and security in the peaceful uses of outer space; 10. Urges the Russian Federation and the United States of America to resume their bilateral negotiations with a view to reaching early agreement for preventing an arms race in outer space and to advise the Conference on Disarmament periodically of the progress of their bilateral sessions so as to facilitate its work;",11/06/1995,1995_190829,Nepal,"1/ Resolution 2222 (XXI), annex. 2/ Resolution S-10/2. 3/ Official Records of the General Assembly , Forty-ninth Session, Supplement No. 27 (A/49/27), sect. III.D (para. 5 of the quoted text).",yes
1995,First Committee,Fiftieth session,68,CONCLUSION OF EFFECTIVE INTERNATIONAL ARRANGEMENTS TO ASSURE NON-NUCLEAR-WEAPON STATES AGAINST THE USE OR THREAT OF USE OF NUCLEAR WEAPONS,"Bangladesh, Brunei Darussalam, Colombia, Democratic People’s Republic of Korea, Iran (Islamic Republic of), Madagascar, Myanmar, Nepal, Pakistan, Sri Lanka, Sudan and Viet Nam",N/A,Conclusion of effective international arrangements to assure non-nuclear-weapon States against the use or threat of use of nuclear weapons,"The General Assembly , Bearing in mind the need to allay the legitimate concern of the States of the world with regard to ensuring lasting security for their peoples, Convinced that nuclear weapons pose the greatest threat to mankind and to the survival of civilization, Welcoming the progress achieved in recent years in both nuclear and conventional disarmament, Noting that, despite recent progress in the field of nuclear disarmament, further efforts are necessary towards the achievement of the goal of general and complete disarmament under effective international control, Also convinced that nuclear disarmament and the complete elimination of nuclear weapons are essential to remove the danger of nuclear war, Determined strictly to abide by the relevant provisions of the Charter of the United Nations on the non-use of force or threat of force, Recognizing that the independence, territorial integrity and sovereignty of non-nuclear-weapon States need to be safeguarded against the use or threat of use of force, including the use or threat of use of nuclear weapons, Considering that, until nuclear disarmament is achieved on a universal basis, it is imperative for the international community to develop effective measures and arrangements to ensure the security of non-nuclear-weapon States against the use or threat of use of nuclear weapons from any quarter, Recognizing also that effective measures and arrangements to assure the non-nuclear-weapon States against the use or threat of use of nuclear weapons can contribute positively to the prevention of the spread of nuclear weapons, Bearing in mind paragraph 59 of the Final Document of the Tenth Special Session of the General Assembly , 1/ the first special session devoted to disarmament, in which it urged the nuclear-weapon States to pursue efforts to conclude, as appropriate, effective arrangements to assure non-nuclear-weapon States against the use or threat of use of nuclear weapons, and desirous of promoting the implementation of the relevant provisions of the Final Document, Recalling the relevant parts of the special report of the Committee on Disarmament, 2/ submitted to the General Assembly at its twelfth special session, 3/ the second special session devoted to disarmament, and of the special report of the Conference on Disarmament submitted to the Assembly at its fifteenth special session, 4/ the third special session devoted to disarmament, as well as of the report of the Conference on its 1992 session, 5/ Recalling also paragraph 12 of the Declaration of the 1980s as the Second Disarmament Decade, contained in the annex to its resolution 35/46 of 3 December 1980, which states, inter alia, that all efforts should be exerted by the Committee on Disarmament urgently to negotiate with a view to reaching agreement on effective international arrangements to assure non-nuclear-weapon States against the use or threat of use of nuclear weapons, Noting the in-depth negotiations undertaken in the Conference on Disarmament and its Ad Hoc Committee on Effective International Arrangements to Assure Non-Nuclear-Weapon States against the Use or Threat of Use of Nuclear Weapons, 6/ with a view to reaching agreement on this item, Taking note of the proposals submitted under that item in the Conference on Disarmament, including the s of an international convention, Taking note also of the decision adopted by the Tenth Conference of Heads of State or Government of Non-Aligned Countries at Jakarta in September 1992, 7/ as well as the relevant recommendations of the Organization of the Islamic Conference reiterated in the Final Communiqué of the Twentieth Islamic Conference of Foreign Ministers, held at Istanbul in August 1991, 8/ calling upon the Conference on Disarmament to reach an urgent agreement on an international convention to assure non-nuclear-weapon States against the use or threat of use of nuclear weapons, Taking note further of the unilateral declarations made by all nuclear- weapon States on their policies of non-use or non-threat of use of nuclear weapons against non-nuclear-weapon States, Noting the support expressed in the Conference on Disarmament and in the General Assembly for the elaboration of an international convention to assure non-nuclear-weapon States against the use or threat of use of nuclear weapons, as well as the difficulties pointed out in evolving a common approach acceptable to all, Noting also the greater willingness to overcome the difficulties encountered in previous years, Noting further Security Council resolution 984 (1995) of 11 April 1995 and the views expressed on it, Recalling its relevant resolutions adopted in previous years, in particular resolutions 45/54 of 4 December 1990, 46/32 of 6 December 1991, 47/50 of 9 December 1992, 48/73 of 16 December 1993 and 49/73 of 15 December 1994, T/ See A/47/675-S/24816, annex, chap. II, para. 47; see Official Records of the Security Council, Forty-seventh Year, Supplement for October, November and December 1992, document S/24816. 1. Reaffirms the urgent need to reach an early agreement on effective international arrangements to assure non-nuclear-weapon States against the use or threat of use of nuclear weapons; 2. Notes with satisfaction that in the Conference on Disarmament there is no objection, in principle, to the idea of an international convention to assure non-nuclear-weapon States against the use or threat of use of nuclear weapons, although the difficulties as regards evolving a common approach acceptable to all have also been pointed out; 3. Appeals to all States, especially the nuclear-weapon States, to work actively towards an early agreement on a common approach and, in particular, on a common formula that could be included in an international instrument of a legally binding character; 4. Recommends that further intensive efforts should be devoted to the search for such a common approach or common formula and that the various alternative approaches, including, in particular, those considered in the Conference on Disarmament, should be further explored in order to overcome the difficulties; 5. Recommends also that the Conference on Disarmament should actively continue intensive negotiations with a view to reaching early agreement and concluding effective international arrangements to assure non-nuclear-weapon States against the use or threat of use of nuclear weapons, taking into account the widespread support for the conclusion of an international convention and giving consideration to any other proposals designed to secure the same objective; 6. Decides to include in the provisional agenda of its fifty-first session the item entitled ""Conclusion of effective international arrangements to assure non-nuclear-weapon States against the use or threat of use of nuclear weapons"".",11/06/1995,1995_190833,Nepal,"1/ Resolution S-10/2. 2/ The Committee on Disarmament was redesignated the Conference on Disarmament as from 7 February 1984. 3/ Official Records of the General Assembly , Twelfth Special Session, Supplement No. 2 (A/S-12/2), sect. III.c. 4/ Ibid., Fifteenth Special Session, Supplement No. 2 (A/S-15/2), sect. III.F. 5/ Ibid., Forty-seventh Session, Supplement No. 27 (A/47/27), sect. III.F. 6/ Ibid., Forty-eighth Session, Supplement No. 27 (A/48/27), para. 39.",yes
1995,First Committee,Fiftieth session,57,COMPLIANCE WITH ARMS LIMITATION AND DISARMAMENT OBLIGATIONS,"Argentina, Australia, Austria, Belgium, Bolivia, Bulgaria, Cameroon, Canada, Chile, Costa Rica, Czech Republic, Denmark, Estonia, Finland, France, Germany, Greece, Guatemala, Honduras, Hungary, Iceland, Ireland, Italy, Japan, Latvia, Lithuania, Luxembourg, Madagascar, Malta, Marshall Islands, Nepal, Netherlands, New Zealand, Nicaragua, Norway, Panama, Paraguay, Peru, Poland, Portugal, Republic of Korea, Republic of Moldova, Romania, Rwanda, Senegal, Singapore, Slovakia, Spain, Sweden, Thailand, the former Yugoslav Republic of Macedonia, Turkey, Ukraine, United Kingdom of Great Britain and Northern Ireland, United States of America, Uruguay, Venezuela and Zambia",N/A,Compliance with arms limitation and disarmament agreements,"The General Assembly , Recalling its resolution 48/63 of 16 December 1993 and other relevant resolutions on the question, Recognizing the abiding concern of all Member States for maintaining respect for rights and obligations arising from treaties and other sources of international law, Convinced that observance of the Charter of the United Nations, relevant treaties and other sources of international law is essential for the strengthening of international security, Mindful, in particular, of the fundamental importance of full implementation and strict observance of agreements and other obligations on arms limitation and disarmament if individual nations and the international community are to derive enhanced security from them, Stressing that any violation of such agreements and other obligations not only adversely affects the security of States parties but can also create security risks for other States relying on the constraints and commitments stipulated in those agreements and other obligations, Stressing also that any weakening of confidence in such agreements and other obligations diminishes their contribution to global or regional stability and to further disarmament and arms limitation efforts and undermines the credibility and effectiveness of the international legal system, Recognizing, in this context, that full compliance by parties with existing agreements and the resolving of compliance concerns effectively can, inter alia, facilitate the conclusion of additional arms limitation and disarmament agreements, Believing that compliance with arms limitation and disarmament agreements by States parties is a matter of interest and concern to all members of the international community, and noting the role that the United Nations has played and should continue to play in that regard, Convinced that resolution of non-compliance questions that have arisen with regard to arms limitations and disarmament obligations would contribute to better relations among States and the strengthening of world peace and security, Welcoming the universal recognition of the critical importance of the question of compliance with and verification of arms limitation and disarmament agreements and other obligations, 1. Urges all States parties to arms limitation and disarmament agreements to implement and comply with the entirety of the spirit and provisions of such agreements; 2. Calls upon all Member States to give serious consideration to the implications that non-compliance with arms limitation and disarmament obligations has for international security and stability, as well as for the prospects for further progress in the field of disarmament; 3. Also calls upon all Member States to support efforts aimed at the resolution of non-compliance questions, with a view to encouraging strict observance by all parties of the provisions of arms limitation and disarmament agreements and maintaining or restoring the integrity of such agreements; 4. Welcomes the role that the United Nations has played in restoring the integrity of certain arms limitation and disarmament agreements and in removal of threats to peace; 5. Requests the Secretary-General to continue to provide assistance that may be necessary in restoring and protecting the integrity of arms limitation and disarmament agreements; 6. Encourages efforts by States parties to develop additional cooperative measures, as appropriate, that can increase confidence in compliance with existing arms limitation and disarmament obligations and reduce the possibility of misinterpretation and misunderstanding; 7. Notes the contribution that verification experiments and research can make and already have made in confirming and improving verification procedures for arms limitation and disarmament agreements under study or negotiation, thereby providing an opportunity, from the time that such agreements enter into force, for enhancing confidence in the effectiveness of verification procedures as a basis for determining compliance; 8. Decides to include in the provisional agenda of its fifty-second session an item entitled ""Compliance with arms limitation and disarmament obligations"".",11/06/1995,1995_191030,Nepal,N/A,yes
