year,Council,Session,Agenda item,Agenda detail,cosponsored countries,body title number,body title detail,body text,date,file,filecountry,footnote,scanned
1995,Third Committee,Fiftieth session,107,ADVANCEMENT OF WOMEN,"Albania, Algeria, Andorra, Antigua and Barbuda, Argentina, Australia, Austria, Bangladesh, Belgium, Benin, Bhutan, Brazil, Burkina Faso, Canada, Costa Rica, Céte d'Ivoire, Cyprus, Denmark, Dominican Republic, Ethiopia, Fiji, Finland, Gambia, Germany, Honduras, Iceland, Ireland, Israel, Italy, Japan, Kenya, Lao People's Democratic Republic, Liechtenstein, Malaysia, Marshall Islands, Mongolia, Morocco, Mozambique, Myanmar, Namibia, Netherlands, New Zealand, Nicaragua, Niger, Norway, Pakistan Panama, Papua New Guinea, Poland, Portugal, Republic of Korea, Republic of Moldova, Romania, Samoa, Singapore, Slovenia, Spain, Suriname, Sweden, Thailand, Togo, Trinidad and Tobago, Turkey, United States of America, Uruguay and Zambia",N/A,Improvement of the status of women in the Secretariat,"The General Assembly , Recalling Articles 1 and 101 of the Charter of the United Nations, Recalling also Article 8 of the Charter, which provides that the United Nations shall place no restrictions on the eligibility of men and women to participate in any capacity and under conditions of equality in its principal and subsidiary organs, Recalling further the relevant paragraphs of the Nairobi Forward-looking Strategies for the Advancement of Women 1/ and the Beijing Declaration and Platform for Action, 2/ Concerned at the serious and continuing underrepresentation of women in the Secretariat, particularly at the higher decision-making levels, Convinced that the improvement of the status of women in the Secretariat could significantly enhance the effectiveness and credibility of the United Nations, including its leadership role in advancing the status of women world wide and in promoting the full participation of women in all aspects of decision-making, Disappointed that the objective set in its resolutions 45/125 of 14 December 1990 and 45/239 C of 21 December 1990 of a 35 per cent overall participation rate of women in posts subject to geographical distribution by 1995 has not been met, Disappointed also that the goal set in its resolution 45/239 C of a 25 per cent participation rate of women in posts at the D-1 level and above by 1995 has not been met and that the level of representative above remains unacceptably low, Recalling its resolution 49/167 of 23 December 1994, in which it urged the Secretary-General to implement fully the strategic plan of action for the improvement of the status of women in the Secretariat (1995-2000), 3/ Noting the efforts made by the Secretary-General and the Office of Human Resources Management of the Secretariat to integrate the objectives set by the General Assembly for the improvement of the status of women in the Secretariat into the overall strategy for the management of the Organization's human resources, and noting also that such a comprehensive approach would be conducive to enhancing the status of women in the Secretariat, Recognizing the importance of providing equal employment opportunities for all staff, Aware that a comprehensive policy aimed at preventing and dealing with sexual harassment should be a integral part of personnel policy, of the United Nations Decade for Women: Equality, Development and Peace, Nairobi, 15-26 July 1985 (United Nations publication, Sales No. E.85.1IV.10), chap. I, sect. A. Welcoming the statement of the Administrative Committee on Coordination on the status of women in the secretariats of the United Nations system, 4/ in which the members of the Committee reaffirmed their strong commitment to ensuring that the advancement of women was a priority within the organizations of the common system and to taking measures to improve the status of women in their respective secretariats, 1. Welcomes the report of the Secretary-General on the improvement of the status of women in the Secretariat; 5/ 2. Notes the efforts to date of the Secretary-General to implement the strategic plan of action for the improvement of the status of women in the Secretariat (1995-2000), and reaffirms that his continued visible commitment is essential to the achievement of the goals and objectives of the strategic plan; 3. Calls upon the Secretary-General to ensure full and urgent implementation of the strategic plan in order to achieve the goal contained in Platform for Action of the Fourth World Conference on Women for overall gender equality, particularly at the Professional level and above, by the year 2000; 4. Also calls upon the Secretary-General to fulfil his target, reaffirmed by the Fourth World Conference on Women, of having women hold 50 per cent of managerial and decision-making positions by the year 2000; 5. Welcomes the Secretary-General's initiatives to date to ensure implementation of the strategic plan, including the incorporation of measures into the performance appraisal system to hold managers responsible and accountable, and inclusion in training programmes of components designed to sensitize managers to gender issues; 6. Urges the Secretary-General to continue his work on improving the work practices and environment within the United Nations system with a view to increasing flexibility so as to remove direct or indirect discrimination, including against staff members with family responsibilities, through, inter alia, consideration of such issues as spouse employment job-sharing, flexible working hours, child-care arrangements and career-break schemes, and to improve access for all staff to training and career development; 7. Notes the examination that has begun of the effectiveness of the Organization's policies and procedures, established in 1992, to deal with sexual harassment in the workplace, and urges the Secretary-General to ensure that the examination leads to a comprehensive and effective policy, including grievance mechanisms, for the prevention and redress of sexual harassment in the Secretariat; 8. Urges the Secretary-General to increase the number of women employed in the Secretariat from developing countries, particularly those that are A/ See A/50/691, annex. unrepresented or underrepresented, and from other countries that have a low representation of women, including countries in transition; 9. Requests the Secretary-General to ensure that equal employment opportunities exist for all staff; 10. Also requests the Secretary-General to enable, from within existing resources, the Focal Point for Women within the Secretariat effectively to monitor and facilitate progress in the implementation of the strategic plan; 12. Requests the Secretary-General, in accordance with the relevant rules on the delivery timetable for documentation, to ensure that a progress report on the status of women in the Secretariat is presented to the Commission on the Status of Women at its fortieth session and to the General Assembly at its fifty-first session.",11/22/1995,1995_200642,Samoa,"1/ Report of the World Conference to Review and Appraise the Achievements 2/ Report of the Fourth World Conference on Women, Beijing, 4- 15 September 1995 (A/CONF.177/20), chap. I, resolution 1. 3/ ~=A/49/587 and Corr.1, sect. IV.",yes
1995,First Committee,Fiftieth session,70,GENERAL AND COMPLETE DISARMAMENT,"Algeria, Angola, Bangladesh, Cambodia, Colombia, Cuba, Democratic People's Republic of Korea, Ecuador, Egypt, Fiji, Ghana, India, Indonesia, Iran (Islamic Republic of), Irag, Kenya, Malaysia, Marshall Islands, Mexico, Mongolia, Myanmar, Nigeria, Pakistan, Papua New Guinea, Philippines, Samoa, Sri Lanka, Sudan, Thailand, United Republic of Tanzania, Viet Nam and Zimbabwe: revised",N/A,Nuclear disarmament,"The General Assembly , Reaffirming the commitment of the international community to the goal of the total elimination of nuclear weapons and the creation of a nuclear-weapon- free world, Determined to achieve the objective of prohibiting the development, production, stockpiling and use of nuclear weapons and their destruction, and to conclude such an international treaty or treaties at an early date, Bearing in mind paragraph 50 of the Final Document of the Tenth Special Session of the General Assembly , 1/ the first special session devoted to disarmament, calling for urgent negotiation of agreements for cessation of the qualitative improvement and development of nuclear-weapon systems, and for a comprehensive and phased programme with agreed time-frames, wherever feasible, for progressive and balanced reduction of nuclear weapons and their means of delivery, leading to their ultimate and complete elimination at the earliest possible time, Recognizing that a comprehensive nuclear-test-ban treaty, the proposed treaty on fissile material for nuclear weapons or other nuclear explosive devices and a convention prohibiting the use of nuclear weapons constitute important steps towards the elimination of the nuclear threat, and will contribute to the achievement of the goal of nuclear disarmament within a time- bound framework, Recognizing also that the end of the cold war has brought about favourable conditions for creating a world free of nuclear weapons, Welcoming the entry into force of the Treaty on the Reduction and Limitation of Strategic Offensive Arms (START I), to which Belarus, Kazakstan, the Russian Federation, Ukraine and the United States of America are States Parties, as well as the conclusion of the START II Treaty by the Russian Federation and the United States of America, and looking forward to full implementation of these treaties and to further concrete steps for nuclear disarmament by all nuclear-weapon States, Noting with appreciation the unilateral measures of nuclear-weapon States for nuclear arms limitation, Recognizing the complementarity of bilateral and multilateral negotiations on nuclear disarmament and that bilateral negotiations can never replace multilateral negotiations in this respect, Recognizing also that a comprehensive nuclear-test-ban treaty and the proposed treaty on fissile material for nuclear weapons or other explosive devices must both constitute disarmament measures and not only non-proliferation measures, and that they must be important steps leading to the total elimination of nuclear weapons within a time-bound framework, Taking note of the support expressed in the Conference on Disarmament and in the General Assembly for the elaboration of an international convention to assure non-nuclear-weapon States against the use or threat of use of nuclear weapons, and the multilateral efforts in the Conference on Disarmament to reach agreement on such an international convention at an early date, Recalling its resolution 49/75 E of 15 December 1994 on a step-by-step reduction of the nuclear threat, Taking note of paragraph 84 and other relevant recommendations in the Final Document of the Eleventh Conference of Heads of State or Government of Non-Aligned Countries, held at Cartagena de Indias from 18 to 20 October 1995, calling on the Conference on Disarmament to establish, on a priority basis, an ad hoc committee to commence negotiations early in 1996 on a phased programme of nuclear disarmament and for the eventual elimination of nuclear weapons within a time-bound framework, 1. Recognizes that, in view of the end of the cold war and recent political developments, time is now opportune for all nuclear-weapon States to undertake effective nuclear disarmament measures with a view to the total elimination of these weapons within a time-bound framework; A/C.1/50/L.46/Rev.1 of nuclear weapons, and to review and revise the nuclear doctrines accordingly; 3. Urges the nuclear-weapon States to stop immediately the qualitative improvement, development, stockpiling and production of nuclear warheads and their delivery systems; 4, Calls upon the nuclear-weapon States to undertake step-by-step reduction of the nuclear threat and a phased programme of progressive and balanced deep reductions of nuclear weapons, and to carry out effective nuclear disarmament measures with a view to the total elimination of these weapons within a time-bound framework; 5. Also calls upon the Conference on Disarmament to establish, on a priority basis, an ad hoc committee on nuclear disarmament to commence negotiations early in 1996 on a phased programme of nuclear disarmament and for the eventual elimination of nuclear weapons within a time-bound framework; 6. Expresses its support for the efforts of the Member States of the Conference on Disarmament to this end; 7. Requests the Secretary-General to submit to the General Assembly at its fifty-first session a report on the implementation of the present resolution; 8. Decides to include in the provisional agenda of its fifty-first session the item entitled ""Nuclear disarmament"".",11/14/1995,1995_200829,Samoa,1/ Resolution S-10/2.,yes
1995,General Assembly,Fiftieth session,96 (c),ENVIRONMENT AND SUSTAINABLE DEVELOPMENT: SUSTAINABLE USE AND CONSERVATION OF THE MARINE LIVING RESOURCES OF THE HIGH SEAS,"Argentina, Australia, Brazil, Canada, Fiji, Iceland, Indonesia, Israel, Malaysia, Marshall Islands, Mauritania, Namibia, New Zealand, Norway, Samoa, Senegal, Singapore, Trinidad and Tobago, Ukraine, United States of America and Urugua",N/A,Agreement for the implementation of the Provisions of the United Nations Convention on the Law of the Sea of 10 December 1982 relating to the Conservation and Management of Straddling Fish Stocks and Highly Migratory Fish Stocks,"The General Assembly , Recalling its resolutions 47/192 of 22 December 1992, 48/194 of 21 December 1993 and 49/121 of 19 December 1994, concerning the United Nations Conference on Straddling Fish Stocks and Highly Migratory Fish Stocks, Taking note of resolutions I and II adopted by the Conference, 1/ Recognizing the importance of the regular consideration and review of developments relating to the conservation and management of straddling fish stocks and highly migratory fish stocks, Taking note of the report of the Secretary-General on the work of the Conference, 2/ 1. Expresses its appreciation to the United Nations Conference on Straddling Fish Stocks and Highly Migratory Fish Stocks for discharging its mandate under resolution 47/192 with the adoption of the Agreement for the Implementation of the Provisions of the United Nations Convention on the Law of the Sea of 10 December 1982 relating to the Conservation and Management of Straddling Fish Stocks and Highly Migratory Fish Stocks; 3/ 2. Welcomes the opening for signature of the Agreement on 4 December 1995; 3. Emphasizes the importance of the early entry into force and effective implementation of the Agreement; 4. Calls upon all States and the other entities referred to in article 1, paragraph 2 (b), of the Agreement that have not done so to sign and ratify or accede to it, and consider applying it provisionally; 5. Requests the Secretary-General to report to the General Assembly on developments relating to the conservation and management of straddling fish stocks and highly migratory fish stocks at the fifty-first session and biennially thereafter, taking into account information provided by States, relevant specialized agencies, in particular the Food and Agriculture Organization of the United Nations, and other appropriate organs, organizations and programmes of the United Nations system, regional and subregional organizations and arrangements for the conservation and management of straddling fish stocks and highly migratory fish stocks, as well as other relevant intergovernmental bodies and non-governmental organizations; 6. Requests the Secretary-General to ensure that reporting on all major fisheries-related activities and instruments is effectively coordinated and duplication of activities and reporting minimized and that relevant scientific and technical studies are disseminated to the international community, and invites the relevant specialized agencies, including the Food and Agriculture Organization of the United Nations, as well as regional and subregional fisheries organizations and arrangements to cooperate with the Secretary-General to that end; 7. Decides to include in the provisional agenda of its fifty-first session, under the item entitled ""Law of the sea"", a sub-item entitled ""Agreement for the Implementation of the Provisions of the United Nations Convention on the Law of the Sea of 10 December 1982 relating to the Conservation and Management of Straddling Fish Stocks and Highly Migratory Fish Stocks"".",11/29/1995,1995_200884,Samoa,"1/ A/CONF.164/38, annex. 2/ A/50/550.",yes
1995,General Assembly,Fiftieth session,39,LAW OF THE SEA,"Argentina, Australia, Austria, Brazil, Cameroon, Canada, Chile, China, Congo, Croatia, Cyprus, Denmark, Egypt, Fiji, Finland, Germany, Iceland, Indonesia, Israel, Italy, Jamaica, Kenya, Malaysia, Marshall Islands, Mauritania, Mexico, Namibia, New Zealand, Norwa Portugal, Samoa, Senegal, Singapore, Sweden Trinidad and Tobago, Tunisia, Ukraine, United Kingdom of Great Britain and Northern Ireland, United States of America and Uruguay",N/A,N/A,"The General Assembly , Emphasizing the universal character of the United Nations Convention on the Law of the Sea, 1/ its fundamental importance for the maintenance and strengthening of international peace and security, as well as for the sustainable use and development of the seas and oceans and their resources, Considering that, in its resolution 2749 (XXV) of 17 December 1970, it proclaimed that the seabed and ocean floor, and the subsoil thereof, beyond the limits of national jurisdiction (hereinafter referred to as ""the Area""), as well as the resources of the Area, are the common heritage of mankind, and considering also that the Convention, together with the Agreement relating to the Implementation of Part XI of the United Nations Convention on the Law of the Sea of 10 December 1982, 2/ provides the regime to be applied to the Area and its resources, Recalling its resolution 49 adopted consequent to the entry 16 November 1994, Aware of the importance of and its uniform and consistent application, promote and facilitate internati affairs at the global, regional Conscious of the strategic national, regional and global ac the United Nations Conference on Agenda 21, 3/ Recognizing the impact on S$ and the increasing need, particu assistance in its implementation Noting the responsibilities international organizations unde entry into force and as required Reaffirming the importance General Assembly of the overall the Convention, as well as of ot and ocean affairs, Noting the decisions taken meetings of States parties to de and other related matters of the in preparation for its establishment and the election of its members, as to prepare for and organize t the Limits of the Continental Sh Noting also that the Assemb concluded its first session and for 1996, from 11 March for up t for up to two weeks, in Kingston Noting further that the Ass for the interim secretariat of t /28 of 6 December 1994, on the law of the sea, into force of the Convention on the effective implementation of the Convention as well as the growing need to onal cooperation on the law of the sea and ocean and subregional levels, importance of the Convention as a framework for tion in the marine sector, as recognized also by Environment and Development in chapter 17 of tates of the entry into force of the Convention larly of developing States, for advice and in order to benefit thereunder, of the Secretary-General and competent r the Convention, in particular pursuant to its by resolution 49/28, of the annual consideration and review by the developments pertaining to the implementation of her developments relating to the law of the sea by States parties to the Convention to convene al with the initial budget and organizational International Tribunal for the Law of the Sea 4/ as well he election of the members of the Commission on elf, ly of the International Seabed Authority has has scheduled two meetings of the Authority o three weeks, if necessary, and from 5 August , Jamaica, 5/ embly of the Authority requested arrangements he Authority, authorizing the Secretary-General A/ SPLOS/4, para. 38. to administer the interim secretariat until the Secretary-General of the Authority is able to assume effectively the responsibility of the Authority's secretariat, 6/ Recalling that the Agreement relating to the Implementation of Part XI of the United Nations Convention on the Law of the Sea of 10 December 1982 provides that the institutions established by the Convention shall be cost-effective, 7/ and recalling also that the meeting of States parties to the Convention decided that this principle would apply to all aspects of the work of the Tribunal, 8/ Emphasizing the importance of making adequate provisions for the efficient functioning of the institutions established by the Convention, 1. Calls upon all States that have not done so to become parties to the United Nations Convention on the Law of the Sea and to ratify, confirm formally or accede to the Agreement relating to the Implementation of Part XI of the United Nations Convention on the Law of the Sea of 10 December 1982 in order to achieve the goal of universal participation; 2. Calls upon States to harmonize their national legislation with the provisions of the Convention and to ensure the consistent application of those provisions; 3. Reaffirms the unified character of the Convention; 4. Recalls its decision to fund the budget for the administrative expenses of the Authority initially from the regular budget of the United Nations, in accordance with the provisions of the Agreement; 9/ 5. Approves the provision by the Secretary-General of such services as may be required for the two meetings of the International Seabed Authority to be held in 1996, from 11 to 22 March and from 5 to 16 August; 6. Approves also the request of the Assembly of the Authority to continue the staff and facilities previously available to the Kingston Office for the Law of the Sea as the interim secretariat of the Authority, and authorizes the Secretary-General to administer the interim secretariat until the Secretary- General of the Authority is able to assume effectively the responsibility of the Authority's secretariat; parties to the Convention from 4 to 8 March, from 6 to 10 May and from 29 July to 2 August 1996; 8. Notes with appreciation the progress made in practical arrangements for the establishment of the International Tribunal for the Law of the Sea, and in preparations for the establishment of the Commission on the Limits of the Continental Shelf; 9. Expresses its appreciation to the Secretary-General for the annual comprehensive report on the law of the sea 10/ and the activities of the Division for Ocean Affairs and the Law of the Sea of the Office of Legal Affairs, in accordance with the provisions of the Convention and the mandate set forth in resolution 49/28; 10. Reaffirms the importance of ensuring the uniform and consistent application of the Convention and a coordinated approach to its effective implementation, and of strengthening technical cooperation and financial assistance for this purpose, stresses once again the continuing importance of the Secretary-General's efforts to these ends, and reiterates its invitation to the competent international organizations and other international bodies to support these objectives; 2. Invites Member States and others in a position to do so to contribute to the further development of the fellowship programme on the law of the sea and training and educational activities on the law of the sea and ocean affairs established by the Assembly in its resolution 35/116 of 10 December 1980, and advisory services in support of effective implementation of the Convention; 3. Requests the Secretary-General to report to the Assembly at its fifty- first session on the implementation of the present resolution, in connection with his annual comprehensive report on the law of the sea; 4. Decides to include in the provisional agenda of its fifty-first session the item entitled ""Law of the sea"".",11/29/1995,1995_200895,Samoa,"1/ Official Records of the Third United Nations Conference on the Law of the Sea, vol. XVII (United Nations publication, Sales No. E.84.V.3), document A/CONF. 62/122. 2/ Resolution 48/263, annex. 3/ Report of the United Nations Conference on Environment and Development, Rio de Janeiro, 3-14 June 1992 (A/CONF.151/26/Rev.1 (Vol. I and Vol. I/Corr.1, Vol. II, Vol. III and Vol. III/Corr.1)) (United Nations publication, Sales No. E.93. 1. 8 and corrigenda), Vol. I: Resolutions Adopted b the Conference, resolution 1, annex II.",yes
