year,Council,Session,Agenda item,Agenda detail,cosponsored countries,body title number,body title detail,body text,date,file,filecountry,footnote,scanned
1997,General Assembly,Fifty-second session,29,COOPERATION BETWEEN THE UNITED NATIONS AND THE INTER-PARLIAMENTARY UNION,"Albania, Algeria, Andorra, Argentina, Armenia, Australia, Austria, Azerbaijan, Belarus, Belgium, Bolivia, Bosnia and Herzegovina, Brazil, Bulgaria, Canada, Cape Verde, Central African Republic, Chile, Colombia, Costa Rica, Céte d'Ivoire, Croatia, Cuba, Cyprus, Czech Republic, Denmark, Dominican Republic, Ecuador, Egypt, El Salvador, Estonia, Finland, Georgia, Germany, Greece, Guatemala, Honduras, Hungary, Iceland, India, Ireland, Italy, Japan, Kazakhstan Kyrgyzstan, Lebanon, Lithuania, Luxembourg, Malawi, Malta, Mauritius, Mexico, Monaco, Morocco, Netherlands, New Zealand, Nicaragua, Norway, Panama, Paraguay, Peru, Philippines, Poland, Portugal, Republic of Korea, Republic of Moldova, Romania, Russian Federation, Samoa, Seychelles, Slovakia, Slovenia, South Africa, Spain, Sri Lanka, Sudan, Sweden, Tajikistan, Thailand, the former Yugoslav Republic of Macedonia, Tunisia, Turke Uganda, United Kingdom of Great Britain and Northern Ireland, Uruguay, Venezuela, Yemen and Zambia",N/A,N/A,"The General Assembly , Recalling its resolution 51/7 of 25 October 1996, in which it welcomed the conclusion of the cooperation agreement between the United Nations and the Inter-Parliamentary Union as an important step for increased and strengthened cooperation between the two organizations, Having considered the report of the Secretary-General’ and debated the initial aspects of the cooperation resulting from the agreement, 1. Notes with appreciation the increased cooperation between the United Nations and the Inter-Parliamentary Union; 2. Recommends that this cooperation be further strengthened, at a time when the United Nations is preparing to meet the challenges of the twenty-first century; 3. Requests the Secretary-General to submit a further report to the General Assembly at its fifty-third session on various aspects of cooperation between the United Nations and the Inter-Parliamentary Union in implementation of the cooperation agreement; 4. Decides to include in the provisional agenda of its fifty-third session the item entitled ""Cooperation between the United Nations and the Inter-Parliamentary Union"".",10/24/1997,1997_245343,Samoa,* B/52/456.,yes
1997,First Committee,Fifty-second session,71 (m),GENERAL AND COMPLETE DISARMAMENT,"Algeria, Angola, Bangladesh, Brunei Darussalam, Burundi, Colombia, Costa Rica, Cuba, Ecuador, Egypt, El Salvador, Ethiopia, Fiji, Ghana, Guinea, India, Indonesia, Iran (Islamic Republic of), Iraq, Kenya, Lao People's Democratic Republic, Lesotho, Malaysia, Mexico, Mongolia, Myanmar, Namibia, Nepal, Nicaragua, Nigeria, Pakistan, Papua New Guinea, Philippines, Samoa, Solomon Islands, Sri Lanka, Sudan, Thailand, United Republic of Tanzania, Uruguay, Viet Nam and Zimbabwe",N/A,Nuclear disarmament,"The General Assembly , Recalling its resolution 49/75 E of 15 December 1994 on a step-by-step reduction of the nuclear threat and its resolutions 50/70 P of 12 December 1995 and 51/45 O of 10 December 1996 on nuclear disarmament, Reaffirming the commitment of the international community to the goal of the total elimination of nuclear weapons and the creation of a nuclear-weapon- free world, Bearing in mind that the 1972 Biological Weapons Convention and the 1993 Chemical Weapons Convention have already established legal regimes on the complete prohibition of biological and chemical weapons, respectively, and determined to achieve a nuclear weapons convention on the prohibition of the testing, development, production, stockpiling, loan, transfer, use and threat of use of nuclear weapons and on their destruction, and to conclude such an international convention at an early date, Recognizing that there now exist favourable conditions for creating a world free of nuclear weapons, Bearing in mind paragraph 50 of the Final Document of the Tenth Special Session of the General Assembly ,’ the first special session devoted to disarmament, calling for the urgent negotiation of agreements for the cessation of the qualitative improvement and development of nuclear-weapon systems, and for a comprehensive and phased programme with agreed time-frames, wherever feasible, for the progressive and balanced reduction of nuclear weapons and their means of delivery, leading to their ultimate and complete elimination at the earliest possible time, Reiterating the highest priority accorded to nuclear disarmament in the Final Document of the Tenth Special Session of the General Assembly and by the international community, Recognizing that the Comprehensive Nuclear-Test-Ban Treaty and any proposed treaty on fissile material for nuclear weapons or other nuclear explosive devices must constitute disarmament measures, and not only non-proliferation measures, and that these measures, together with an international legal instrument on adequate security assurances for non-nuclear-weapon States and an international convention prohibiting the use of nuclear weapons, must be integral steps leading to the total elimination of nuclear weapons within a time-bound framework, Welcoming the entry into force of the Treaty on the Reduction and Limitation of Strategic Offensive Arms,* to which Belarus, Kazakhstan, the Russian Federation, Ukraine and the United States of America are States parties, Welcoming also the conclusion of the Treaty on Further Reduction and Limitation of Strategic Offensive Arms® by the Russian Federation and the United States of America and the ratification of that Treaty by the United States of America, and looking forward to the full implementation of the START I? and START II? Treaties by the States parties, and to further concrete steps for nuclear disarmament by all nuclear-weapon States, Noting with appreciation the unilateral measures by the nuclear-weapon States for nuclear arms limitation, and encouraging them to undertake further such measures, Recognizing the complementarity of bilateral and multilateral negotiations on nuclear disarmament, and that bilateral negotiations can never replace multilateral negotiations in this respect, Noting the support expressed in the Conference on Disarmament and in the General Assembly for the elaboration of an international convention to assure + Resolution S-10/2. > Ibid., vol. 18: 1993 (United Nations publication, Sales No. E.94.1X.1), appendix II. non-nuclear-weapon States against the use or threat of use of nuclear weapons, and the multilateral efforts in the Conference on Disarmament to reach agreement on such an international convention at an early date, Recalling the advisory opinion of the International Court of Justice on the Legality of the Threat or Use of Nuclear Weapons, issued on 8 July 1996,‘ and welcoming the unanimous reaffirmation by all judges of the Court that there exists an obligation for all States to pursue in good faith and bring to a conclusion negotiations leading to nuclear disarmament in all its aspects under strict and effective international control, Mindful of paragraph 84 and other relevant recommendations in the Final Document of the Eleventh Conference of Heads of State or Government of the Non-Aligned Countries, held at Cartagena de Indias, Colombia, from 18 to 20 October 1995,° calling upon the Conference on Disarmament to establish, on a priority basis, an ad hoc committee to commence negotiations early in 1996 ona phased programme of nuclear disarmament and for the eventual elimination of nuclear weapons within a time-bound framework; paragraph 58 of the Final Document of the Twelfth Ministerial Conference of the Movement of Non-Aligned Countries, held at New Delhi on 7 and 8 April 1997;° and paragraphs 40, 41 and 42 of the communiqué of the Meeting of Ministers for Foreign Affairs and Heads of Delegations of the Movement of Non-Aligned Countries to the fifty-second session of the General Assembly ,’ held in New York on 25 September 1997, which called for, as a first step, the conclusion of a universal and legally binding multilateral agreement committing all States to the total elimination of nuclear weapons, Bearing in mind the proposal of twenty-eight delegations to the Conference on Disarmament that are members of the Group of 21 for a programme of action for the elimination of nuclear weapons,® and expressing its conviction that this proposal will be an important input and will contribute to negotiations on this question in the Conference, Commending the initiative by twenty-six delegations to the Conference on Disarmament that are members of the Group of 21,° proposing a comprehensive mandate for an ad hoc committee on nuclear disarmament, which includes ° A/50/752-S/1995/1035, annex III; see Official Records of the Securit Council, Fiftieth Year, Supplement for October, November and December 1995, document S/1995/1035. © A/51/912-S/1997/406, annex. ” BR/52/447-S/1997/775, annex. ® a/C.1/51/12, annex. ° Official Records of the General Assembly , Fifty-second Session, Supplement No. 27 (A/52/27), para. 30. negotiations for, as a first step, a universal and legally binding multilateral agreement committing all States to the objective of the total elimination of nuclear weapons, an agreement on further steps required in a phased programme with time-frames leading to the total elimination of these weapons anda convention on the prohibition of the production of fissile material for nuclear weapons and other nuclear explosive devices taking into account the report of the Special Coordinator on that item’® and the views relating to the scope of the treaty, 1. Recognizes that, in view of recent political developments, the time is now opportune for all nuclear-weapon States to undertake effective disarmament measures with a view to the total elimination of these weapons within a time- bound framework; 2. Recognizes also that there is a genuine need to de-emphasize the role of nuclear weapons, and to review and revise nuclear doctrines accordingly; 3. Urges the nuclear-weapon States to stop immediately the qualitative improvement, development, production and stockpiling of nuclear warheads and their delivery systems; 4, Reiterates its call upon the nuclear-weapon States to undertake the step-by-step reduction of the nuclear threat and a phased programme of progressive and balanced deep reductions of nuclear weapons, and to carry out effective nuclear disarmament measures with a view to the total elimination of these weapons within a time-bound framework; 5. Expresses its concern at the continuing opposition by some States to the establishment of an ad hoc committee on nuclear disarmament in the Conference on Disarmament, as called for in General Assembly resolution 51/45 0; 6. Reiterates its call upon the Conference on Disarmament to establish, on a priority basis, an ad hoc committee on nuclear disarmament to commence negotiations early in 1998 on a phased programme of nuclear disarmament and for the eventual elimination of nuclear weapons within a time-bound framework through a nuclear weapons convention; 7. Urges the Conference on Disarmament to take into account in this regard the proposal of the twenty-eighth delegations for a programme of action for the elimination of nuclear weapons, as well as the mandate for the ad hoc committee on nuclear disarmament, proposed by the twenty-six delegations; 8. Requests the Secretary-General to submit to the General Assembly at its fifty-third session a report on the implementation of the present resolution; 9. Decides to include in the provisional agenda of its fifty-third session the item entitled ""Nuclear disarmament"". ° Cp/1299.",10/31/1997,1997_245660,Samoa,"* The United Nations Disarmament Yearbook, vol. 11: 1991 (United Nations publication, Sales No. E.92.1X.1), appendix II. * A/51/218, annex.",yes
1997,First Committee,Fifty-second session,71 (d),GENERAL AND COMPLETE DISARMAMENT,"Angola, Antigua _ and Barbuda, Argentina, Bahamas, Barbados, Belize, Benin, Bolivia, Bosnia and Herzegovina, Botswana, Brazil, Brunei Darussalam, Cameroon, Central African Republic, Chile, Colombia, Congo, Costa Rica, Céte d'Ivoire, Djibouti, Dominican Republic, Ecuador, Egypt, El Salvador, Ethiopia, Fiji, Gabon, Ghana, Grenada, Guatemala, Guyana, Haiti, Honduras, Indonesia, Jamaica, Kyrgyzstan, Liberia, Malaysia, Marshall Islands, Mexico, Micronesia (Federated States of), Mongolia, Mozambique, Namibia New Zealand, Nigeria, Panama, Papua New Guinea, Paraguay, Peru, Saint Kitts and Nevis, Saint Lucia, Samoa, San Marino, Singapore, Solomon Islands, South Africa, Sudan, Suriname, Thailand, Togo, Trinidad and Tobago, United Republic of Tanzania, Urugua Venezuela and Zimbabwe",N/A,The nuclear-weapon-free southern hemisphere and adjacent areas,"The General Assembly , Recalling its resolution 51/45 B of 10 December 1996, Determined to continue to contribute to the prevention of the proliferation of nuclear weapons in all its aspects and to the process of general and complete disarmament under strict and effective international control, in particular in the field of nuclear weapons and other weapons of mass destruction, with a view to strengthening international peace and security, in accordance with the purposes and principles of the Charter of the United Nations, Recalling also the provisions on nuclear-weapon-free zones of the Final Document of the Tenth Special Session of the General Assembly ,’ the first special session devoted to disarmament, as well as of the decision on principles and objectives for nuclear non-proliferation and disarmament of the 1995 Review and Extension Conference of the Parties to the Treaty on the Non-Proliferation of Nuclear Weapons,’ Stressing the importance of the treaties of Tlatelolco,’ Rarotonga,‘ Bangkok,°® and Pelindaba,® establishing nuclear-weapon-free zones, as well as the Antarctic Treaty,’ to, inter alia, the ultimate objective of achieving a world entirely free of nuclear weapons, and underlining also the value of enhancing cooperation among the nuclear-weapon-free zone treaty members by means of mechanisms such as joint meetings of States parties, signatories and observers to those treaties, Recalling further the applicable principles and rules of international law relating to rights of passage through maritime space, including under the United Nations Convention on the Law of the Sea,* 1. Welcomes the contribution that the Antarctic Treaty’ and the treaties of Tlatelolco,* Rarotonga,’ Bangkok® and Pelindaba® are making towards freeing the entire southern hemisphere and adjacent areas covered by those treaties from nuclear weapons; 2. Calls for the ratification of the treaties of Tlatelolco, Rarotonga, Bangkok and Pelindaba by all regional States, and calls upon all concerned States to continue to work together in order to facilitate adherence to the protocols to nuclear-weapon-free zone treaties by all relevant States that have not yet done so; + Resolution S-10/2. °> Treaty for the Prohibition of Nuclear Weapons in Latin America and the Caribbean. Treaty on the South-East Asia Nuclear-Weapon-Free Zone. African Nuclear-Weapon-Free Zone Treaty. United Nations, Treaty Series, vol. 402, No. 5778. ® Official Records of the Third United Nations Conference on the Law of the Sea, vol. XVII (United Nations publication, Sales No. E.84.V.3), document A/CONF.62/122. 3. Welcomes the steps taken to conclude further nuclear-weapon-free zone treaties on the basis of arrangements freely arrived at among the States of the region concerned and calls upon all States to consider all relevant proposals, including those reflected in its resolutions on the establishment of nuclear- weapon-free zones in the Middle East and South Asia; 4, Stresses the role of nuclear-weapon-free zones in strengthening the nuclear non-proliferation regime and in extending the areas of the world that are nuclear-weapon-free, and, with particular reference to the responsibilities of the nuclear-weapon States, calls upon all States to support the process of nuclear disarmament, with the ultimate goal of eliminating all nuclear weapons; 5. Calls upon the States parties and signatories to the treaties of Tlatelolco, Rarotonga, Bangkok and Pelindaba, in order to pursue the common goals envisaged in those treaties and to promote the nuclear-weapon-free status of the southern hemisphere and adjacent areas, to explore and implement further ways and means of cooperation among themselves and their treaty agencies; 6. Encourages the competent authorities of nuclear-weapon-free zone treaties to provide assistance to the States parties and signatories to such treaties so as to facilitate the accomplishment of these goals; 7. Decides to include in the provisional agenda of its fifty-third session the item entitled ""The nuclear-weapon-free southern hemisphere and adjacent areas"".",10/30/1997,1997_245688,Samoa,"* See 1995 Review and Extension Conference of the Parties to the Treaty on the Non-Proliferation of Nuclear Weapons, Final Document, Part I (NPT/CONF.1995/32 (Part I)). * South Pacific Nuclear Free Zone Treaty.",yes
1997,First Committee,Fifty-second session,71 (c),GENERAL AND COMPLETE DISARMAMENT,"Afghanistan, Albania, Argentina, Armenia, Australia, Austria, Bahamas, Barbados, Belgium, Bhutan, Bolivia, Bosnia and Herzegovina, Brazil, Bulgaria, Cameroon, Canada, Cape Verde, Chile, Congo, Costa Rica, Céte d'Ivoire, Croatia Cyprus, Czech Republic, Democratic Republic of the Congo, Denmark, Ecuador, El Salvador, Estonia, Fiji, Finland, France, Gabon, Georgia, Germany, Greece, Grenada, Guinea, Guyana, Honduras, Hungary, Iceland, Ireland, Israel, Ital Jamaica, Japan, Kazakhstan, Kyrgyzstan, Latvia, Liberia, Liechtenstein, Lithuania, Luxembourg, Malawi, Malaysia, Malta, Marshall Islands, Monaco, Mongolia, Namibia, Nepal, Netherlands, New Zealand, Nicaragua, Niger, Norway, Panama Paraguay, Peru, Philippines, Poland, Portugal, Republic of Moldova, Romania, Russian Federation, Samoa, San Marino, Sierra Leone, Slovakia, Slovenia, Solomon Islands, South Africa, Spain, Swaziland, Sweden, Thailand, the former Yugoslav Republic of Macedonia, Turkey, Ukraine, United Kingdom of Great Britain and Northern Ireland, United States of America and Venezuela",N/A,Transparency in armaments,"The General Assembly , Recalling its resolutions 46/36 L of 9 December 1991, 47/52 L of 15 December 1992, 48/75 E of 16 December 1993, 49/75 C of 15 December 1994, 50/70 D of 12 December 1995 and 51/45 H of 10 December 1996, Continuing to take the view that an enhanced level of transparency in armaments contributes greatly to confidence-building and security among States and that the establishment of the United Nations Register of Conventional Arms?* constitutes an important step forward in the promotion of transparency in military matters, Welcoming the consolidated report of the Secretary-General on the Register,’ which includes the returns of Member States for 1996, Welcoming also the response of Member States to the request contained in paragraphs 9 and 10 of resolution 46/36 L to provide data on their imports and exports of arms, as well as available background information regarding their military holdings, procurement through national production and relevant policies, Welcoming further the report of the Secretary-General on the continuing operation of the Register and its further development, * Stressing that the continuing operation of the Register and its further development should be reviewed in order to secure a Register that is capable of attracting the widest possible participation, 1. Reaffirms its determination to ensure the effective operation of the United Nations Register of Conventional Arms’ as provided for in paragraphs 7, 8, 9 and 10 of resolution 46/36 L; 2. Takes note of the report of the Secretary-General on the continuing operation of the Register and its further development,* and endorses the recommendations contained therein; 3. Calls upon Member States, with a view to achieving universal participation, to provide to the Secretary-General by 31 May annually the requested data and information for the Register, including nil reports if appropriate, on the basis of resolutions 46/36 L and 47/52 L and the recommendations contained in paragraph 64 of the 1997 report of the Secretary- General on the continuing operation of the Register and its further development; * 4. Invites Member States in a position to do so, pending further development of the Register, to provide additional information on procurement from national production and military holdings and to make use of the ""Remarks"" column in the standardized reporting form to provide additional information such as types or models; 5. Decides, with a view to further development of the Register, to keep the scope of and participation in the Register under review, and to that end: + See resolution 46/36 L. ? A/52/312 and Add. 1. > A/52/316. (a) Requests Member States to provide the Secretary-General with their views on the continuing operation of the Register and its further development and on transparency measures related to weapons of mass destruction; (b) Requests the Secretary-General, with the assistance of a group of governmental experts to be convened in 2000, on the basis of equitable geographical representation, to prepare a report on the continuing operation of the Register and its further development, taking into account the work of the Conference on Disarmament, the views expressed by Member States and the reports of the Secretary-General on the continuing operation of the Register and its further development,* with a view to a decision at its fifty-fifth session; 6. Requests the Secretary-General to implement the recommendations within his competence contained in his 1997 report on the continuing operation of the Register and its further development*® and to ensure that sufficient resources are made available for the Secretariat to operate and maintain the Register; 7. Invites the Conference on Disarmament to consider continuing its work undertaken in the field of transparency in armaments; 8. Reiterates its call upon all Member States to cooperate at the regional and subregional levels, taking fully into account the specific conditions prevailing in the region or subregion, with a view to enhancing and coordinating international efforts aimed at increased openness and transparency in armaments; 9. Requests the Secretary-General to report to the General Assembly at its fifty-third session on progress made in implementing the present resolution; 10. Decides to include in the provisional agenda of its fifty-third session the item entitled ""Transparency in armaments"".",10/30/1997,1997_245735,Samoa,* B/49/316 and A/52/316.,yes
