year,Council,Session,Agenda item,Agenda detail,cosponsored countries,body title number,body title detail,body text,date,file,filecountry,footnote,scanned
1996,Third Committee,Fifty-first session,110 (b),"HUMAN RIGHTS QUESTIONS: HUMAN RIGHTS QUESTIONS,INCLUDING ALTERNATIVE APPROACHES FOR IMPROVINGTHE EFFECTIVE ENJOYMENT OF HUMAN RIGHTS AND FUNDAMENTAL FREEDOMS","Afghanistan, Albania, Azerbaijan, Bangladesh, Bolivia, Bosnia and Herzegovina, Bulgaria, Colombia, Ecuador, El Salvador, Fiji, Georgia, Guatemala, Guyana, Honduras, India, Israel, Kyrgyzstan, Madagascar, Morocco, Mozambique, Panama, Peru, Poland, Republic of Korea, Romania, Russian Federation, Samoa, Slovenia, the former Yugoslav Republic of Macedonia, Tunisia, Turkey, Ukraine, Uruguay and Venezuela",N/A,Follow-up to the United Nations Year for Tolerance,"The General Assembly , Recalling its resolutions 47/124 of 18 December 1992, 48/126 of 20 December 1993 and 49/213 of 23 December 1994 by which it proclaimed and supported the United Nations Year for Tolerance, Recalling also that the Charter of the United Nations affirms in its preamble that to practice tolerance is one of the principles to be applied to attain the ends pursued by the United Nations of preventing war and maintaining peace, Stressing that one of the purposes of the United Nations as set forth in the Charter is the achievement of international cooperation in solving international problems of an economic, social, cultural or humanitarian character and in promoting and encouraging respect for human rights and for fundamental freedoms for all without distinction as to race, sex, language or religion, Bearing in mind the Universal Declaration of Human Rights,’ the Vienna Declaration and Programme of Action, adopted by the World Conference on Human Rights on 25 June 1993,* and the International Covenants on Human Rights,° Reconfirming that tolerance is the sound foundation of any civil society and of peace, Taking note of the note by the Secretary-General* transmitting the final report on the United Nations Year for Tolerance, including the Declaration of Principles on Tolerance and Follow-up Plan of Action for the United Nations Year for Tolerance, submitted to him by the United Nations Educational, Scientific and Cultural Organization as requested by the General Assembly in its resolution 49/213, Taking note also of resolution 28 C/5.6 of the General Conference of the United Nations Educational, Scientific and Cultural Organization, 1. Welcomes the role played by the United Nations Educational, Scientific and Cultural Organization in the preparation for and implementation of the United Nations Year for Tolerance; 2. Takes note of the Declaration of Principles on Tolerance and Follow-up Plan of Action for the United Nations Year for Tolerance, adopted by the States Members of the United Nations Educational, Scientific and Cultural Organization on 16 November 1995;4 3. Expresses its appreciation for the contribution of the regional conferences on tolerance and other relevant activities organized during the Year at Rio de Janeiro, Brazil; Seoul; Sienna, Italy; Carthage, Tunisia; New Delhi; Moscow and Yakutsk, Russian Federation; T’bilisi; and Istanbul, Turkey, to the Declaration of Principles and Follow-up Plan of Action for the promotion of tolerance; 4. Invites the United Nations Educational, Scientific and Cultural Organization to take appropriate initiatives, including holding regional meetings, to assure the follow-up and implementation of the outcome of the regional conferences organized during the International Year for Tolerance and to promote further the spirit instigated by those conferences; 5. Invites Member States to consider applying the Declaration of Principles at the national level and to continue to undertake public information campaigns in connection with the Follow-up Plan of Action aimed at the realization of more tolerant societies; + Resolution 217 A (III). ? B/CONF.157/24 (Part I), chap. III. > Resolution 2200 A (XXI). 6. Invites Member States to observe the International Day for Tolerance annually on 16 November with appropriate activities directed towards both educational establishments and the wider public; 7. Encourages the United Nations Educational, Scientific and Cultural Organization to continue its activities aimed at reinforcing the struggle against the rise of intolerance; 8. Recommends that interested intergovernmental and non-governmental organizations and specialized agencies exert efforts in their respective fields to contribute to the long-term follow-up programme for the Year, including celebration of the International Day for Tolerance, and to consider what further contributions they can make to implement and disseminate the standards affirmed in the Declaration of Principles; 9. Requests the United Nations Educational, Scientific and Cultural Organization to continue to coordinate actions in support of tolerance promotion and education in partnership with other United Nations agencies and regional, intergovernmental and non-governmental organizations, to make reports available to the General Assembly on a biennial basis on the implementation of the Declaration of Principles of Tolerance and Follow-up Plan of Action for the United Nations Year for Tolerance; 10. Invites the United Nations Educational, Scientific and Cultural Organization to consider, at an appropriate time, the possibility of organizing an international conference to inform and mobilize public opinion, as well as the United Nations system, in this regard;",11/22/1996,1996_228633,Samoa,* B/51/20 1. 1 1. Decides to consider the question of the follow-up to the United Nations Year for Tolerance at its fifty-third session.,yes
1996,Third Committee,Fifty-first session,110 (c),HUMAN RIGHTS QUESTIONS: HUMAN RIGHTS SITUATIONS AND REPORTS OF SPECIAL RAPPORTEURS AND REPRESENTATIVES,"Andorra, Argentina, Australia, Austria, Barbados, Belgium, Bulgaria, Canada, Czech Republic, Denmark, Ecuador, Finland, France, Germany, Greece, Hungary, Iceland, Ireland, Italy, Japan, Luxembourg, Monaco, Netherlands, Norway, Poland, Portugal, Samoa, San Marino, Slovakia, Slovenia, Solomon Islands, Spain, Sweden, United Kingdom of Great Britain and Northern Ireland and Uruguay",N/A,Situation of human rights in Nigeria,"The General Assembl , Guided by the Charter of the United Nations, the Universal Declaration of Human Rights,’ the International Covenants on Human Rights,* the Vienna Declaration and Programme of Action*® and other human rights instruments, Reaffirming that all Member States have the duty to promote and protect human rights and fundamental freedoms and to fulfil the obligations they have freely undertaken under the various international instruments in this field, + Resolution 217 A (III). ? Resolution 2200 A (XXI), annex. Mindful that Nigeria is a party to the International Covenants on Human Rights and the International Convention on the Elimination of All Forms of Racial Discrimination,‘ Recalling its resolution 50/199 of 22 December 1995 and Commission on Human Rights resolution 1996/79 of 23 April 1996 on the situation of human rights in Nigeria, Deeply concerned about the human rights situation in Nigeria and the suffering caused thereby to the people of Nigeria, Expressing concern that the absence of representative government in Nigeria has led to violations of human rights and fundamental freedoms, and recalling in this regard the popular support for democratic government as evidenced in the 1993 elections, Recalling the announcement made by the Government of Nigeria on 1 October 1995 in which it affirmed the principle of multi-party democracy and the principle of power-sharing, and its intention to lift the ban on political activities and the press, to devolve power to the local levels of government and to subordinate the military to civilian authority, Strongly disappointed that only limited action in this regard has followed, and regretting that political associations have been instructed to disband, while noting the recent registration of five political parties, Welcoming the report of the mission sent to Nigeria by the Secretary- General pursuant to General Assembly resolution 50/199, and noting the interim response of the Government of Nigeria to that mission, Welcoming also the resumption of dialogue between Nigeria and the Commonwealth, Taking note with appreciation of the joint interim report of the Special Rapporteur on the independence of judges and lawyers and the Special Rapporteur on extrajudicial, summary or arbitrary executions,° Noting with deep concern reports of grave violations of human rights, including extrajudicial summary or arbitrary executions and arbitrary detention, failure to respect due process of law and excessive use of force against demonstrators, as described in, inter alia, reports submitted by the Special Rapporteur on the independence of judges and lawyers and the Special Rapporteur on extrajudicial, summary or arbitrary executions, Stressing the importance of the mandate of the Special Rapporteur on the independence of judges and lawyers and the Special Rapporteur on extrajudicial, summary or arbitrary executions to undertake a joint investigative mission to ° A/51/538, annex. Nigeria, as requested by the Commission on Human Rights in its resolution 1996/79, Noting with alarm that persons in detention in Nigeria continue to face a flawed judicial process, and recalling in this regard the arbitrary execution of Ken Saro-Wiwa and his associates, 1. Expresses its deep concern about violations of human rights and fundamental freedoms in Nigeria, and calls upon the Government of Nigeria urgently to ensure their observance, in particular by releasing all political prisoners, trade union leaders, human rights advocates and journalists who are at present detained, guaranteeing freedom of the press and ensuring respect for the rights of all individuals, including persons belonging to minorities; 2. Calls upon the Government of Nigeria to ensure that trials are held strictly in conformity with the international human rights instruments to which Nigeria is a party; 3. Also calls upon the Government of Nigeria to implement fully its interim undertakings to the Secretary-General without further delay and to respond in full to the recommendations of the Secretary-General’s mission to Nigeria; 4. Welcomes the intention of the Secretary-General to pursue his mandate of good offices; 5. Urges the Government of Nigeria to cooperate fully with the relevant mechanisms of the Commission on Human Rights; 6. Regrets that the Government of Nigeria has not enabled the Special Rapporteur on the independence of judges and lawyers and the Special Rapporteur on extrajudicial, summary or arbitrary executions to visit the country before presentation of their report to the General Assembly , and urges the Government of Nigeria to cooperate fully with them during the joint investigative mission to Nigeria mandated by the Commission on Human Rights; 7. Calls upon the Government of Nigeria to abide by its freely undertaken obligations under the International Covenant on Civil and Political Rights* and other human rights instruments, including the African Charter of Human and Peoples’ Rights, adopted by the 18th Conference of Heads of State and Government of the Organization of African Unity at Nairobi on 28 June 1981;° 8. Notes with interest in this regard the recommendations of the Human Rights Committee to the Government of Nigeria;’ ® HR/PUB/90/1, p. 2 1. ’ CCPR/C/79/Add.65. 9. Notes the declared commitment of the Government of Nigeria to civilian rule, and urges it to take immediate and concrete steps to restore democratic government; 10. Decides to consider the situation of human rights in Nigeria at its fifty-second session under the item entitled ""Human rights questions"".",11/22/1996,1996_228635,Samoa,"* Report of the World Conference on Human Rights, Vienna, 14-25 June 1993 (A/CONF.157/24 (Part I)), chap. III. * Resolution 2106 A (XX), annex.",yes
1996,General Assembly,Fifty-first session,24 (a),LAW OF THE SEA,"Argentina, Australia, Austria, Brazil, Cameroon, Canada, China, Costa Rica, Egypt, Fiji, Finland, France, Germany, Indonesia, Ireland, Italy, Jamaica, Kenya, Lebanon, Malaysia, Marshall Islands, Mexico, Micronesia (Federated States of), Myanmar, New Zealand, Nigeria, Norway, Papua New Guinea, Portugal, Republic of Korea, Samoa, Senegal, Singapore, Sudan, Tunisia, Uganda, Ukraine and Uruguay",N/A,N/A,"The General Assembly , Emphasizing the universal character of the United Nations Convention on the Law of the Sea’ and its fundamental importance for the maintenance and strengthening of international peace and security, as well as for the sustainable use and development of the seas and oceans and their resources, Considering that, in its resolution 2749 (XXV) of 17 December 1970, it proclaimed that the seabed and ocean floor, and the subsoil thereof, beyond the limits of national jurisdiction (""the Area""), as well as the resources of the Area, are the common heritage of mankind, and considering also that the Convention, together with the Agreement relating to the implementation of Part XI of the United Nations Convention on the Law of the Sea of 10 December 1982* (""the Agreement""), provides the regime to be applied to the Area and its resources, Noting the entry into force of the Agreement on 28 July 1996, + Official Records of the Third United Nations Conference on the Law of the Sea, vol. XVII (United Nations publication, Sales No. E.84.V.3), document A/CONF.62/122. ? Resolution 48/263, annex. Noting with satisfaction the increase in the number of States parties to the Convention, Recalling its resolution 49/28 of 6 December 1994 on the law of the sea, adopted consequent to the entry into force of the Convention on 16 November 1994, Aware of the importance of the effective implementation of the Convention and its uniform and consistent application, as well as of the growing need to promote and facilitate international cooperation on the law of the sea and ocean affairs at the global, regional and subregional levels, Recognizing the impact on States of the entry into force of the Convention and the increasing need, particularly of developing States, for advice and assistance in its implementation in order to benefit thereunder, Welcoming the establishment of the International Tribunal for the Law of the Sea (""the Tribunal""),*? the Council of the International Seabed Authority, its Legal and Technical Commission and Finance Committee, and the election of their respective members as well as the election of the Secretary-General of the International Seabed Authority (""the Authority"") ,* Noting the decisions taken by States parties to the Convention facilitating the organization of the Tribunal°® and those by the Assembly® and the Council’ of the Authority facilitating the organization of the Authority, Noting also the decisions taken by States parties to the Convention to elect the members of the Commission on the Limits of the Continental Shelf in March 1997,° Recalling article 287 of the Convention regarding the choice of means for the settlement of disputes concerning the interpretation or application of the Convention, Recalling also that the Agreement provides that the institutions established by the Convention shall be cost-effective,® and recalling further °> SPLOS/14, paras. 13-3 1. * See ISBA/A/... ° SPLOS/14, paras. 32-36. ° ISBA/A/14. ’ ISBA/C/10 and 1 1. ® SPLOS/14, para. 4 1. ° Resolution 48/263, annex: Annex to the Agreement, sect. 1, para. 2. that the meeting of States parties to the Convention decided that this principle would apply to all aspects of the work of the Tribunal,?° Emphasizing the importance of making adequate provisions for the efficient functioning of the institutions established by the Convention, Reiterating its appreciation to the Secretary-General for his efforts in support of the Convention and in the effective implementation of the Convention, including providing assistance in the establishment of the institutions created by the Convention, Noting the responsibilities of the Secretary-General and competent international organizations under the Convention, in particular pursuant to its entry into force and as required by resolution 49/28, Noting with appreciation the development, as part of the Organization’s Home Page on the Internet, of the sites of the Division for Ocean Affairs and the Law of the Sea of the Office of Legal Affairs of the Secretariat (Gopher/World Wide Web), which provide users with convenient means for obtaining timely, well-organized and cross-referenced materials and information dealing with various aspects of the oceans, marine affairs and the law of the sea, Conscious that the problems of ocean space are closely interrelated and need to be considered as a whole, Conscious also of the strategic importance of the Convention as a framework for national, regional and global action in the marine sector, as recognized also by the United Nations Conference on Environment and Development in chapter 17 of Agenda 21,"" Noting the recommendation of the Commission on Sustainable Development,’ endorsed by the Economic and Social Council,*? concerning international cooperation and coordination in the implementation of chapter 17 of Agenda 21, 10 SPLOS/4, para. 25 (e). “ Report of the United Nations Conference on Environment and Development, Rio de Janeiro, 3-14 June 1992 (A/CONF.151/26/Rev.1 (Vol. I and Vol. I/Corr.1, Vol. II, Vol. III and Vol. III/Corr.1)) (United Nations publication, Sales No. E.93. 1. 8 and corrigenda), vol. I: Resolutions Adopted by the Conference, resolution 1, annex II. % See Official Records of the Economic and Social Council, 1996, Supplement No. 8 (E/1996/28), chap. I.A, para. 1. % See Official Records of the General Assembly , Fifty-first Session, Supplement No. 3, chap. V.B.1, para. 119, resolution 1996/ 1. Noting also the Washington Declaration and the Global Programme of Action for the Protection of the Marine Environment from Land-based Activities,™* Conscious of the need to promote and facilitate international cooperation, especially at the subregional and regional levels, in order to ensure the orderly and sustainable development of the uses and resources of the seas and oceans, Reaffirming the importance of the annual consideration and review by the General Assembly of the overall developments pertaining to the implementation of the Convention, as well as of other developments relating to the law of the sea and ocean affairs, 1. Calls upon all States that have not done so to become parties to the United Nations Convention on the Law of the Sea and to ratify, confirm formally or accede to the Agreement relating to the implementation of Part XI of the United Nations Convention on the Law of the Sea of 10 December 1982 in order to achieve the goal of universal participation; 2. Calls upon States to harmonize their national legislation with the provisions of the Convention, to ensure the consistent application of those provisions and to ensure also that any declarations or statements that they have made or make when signing, ratifying or acceding are in conformity with the Convention; 3. Reaffirms the unified character of the Convention; 4. Recalls its decision to fund the budget for the administrative expenses of the International Seabed Authority initially from the regular budget of the United Nations, in accordance with the provisions of the Agreement;*° 5. Approves the provision by the Secretary-General of such services as may be required for the two meetings of the Authority to be held in 1997, from 17 to 28 March and from 18 to 29 August; 6. Requests the Secretary-General to convene the meetings of States parties to the Convention from 10 to 14 March and from 19 to 23 May 1997; 7. Notes with appreciation the progress made in the establishment of the institutions created by the Convention, requests the Secretary-General to continue to provide assistance to those institutions, and invites the Secretary- General to take steps to conclude relationship agreements between the United Nations and the Authority, and between the United Nations and the Tribunal, to be applied provisionally pending the approval of the General Assembly , and as appropriate by the Assembly of the Authority or the States parties to the Convention; “ 2/51/116, annex I, appendix II, and annex II. 8. Encourages States parties to the Convention to consider making a written declaration choosing from the means set out in article 287 of the Convention for the settlement of disputes concerning the interpretation or application of the Convention; 9. Expresses its appreciation to the Secretary-General for the annual comprehensive report on the law of the sea*® and the activities of the Division for Ocean Affairs and the Law of the Sea, in accordance with the provisions of the Convention and the mandate set forth in resolution 49/28; 10. Reaffirms the importance of ensuring the uniform and consistent application of the Convention and a coordinated approach to its overall implementation, and of strengthening technical cooperation and financial assistance for this purpose, stresses once again the continuing importance of t t e Secretary-General’s efforts to these ends, and reiterates its invitation to e competent international organizations and other international bodies to support these objectives; 12. Invites Member States and others in a position to do so to contribute to the further development of the fellowship programme on the law of the sea and training and educational activities on the law of the sea and ocean affairs established by the General Assembly in its resolution 35/116 of 10 December 1980, as well as advisory services and assistance in support of effective implementation of the Convention; 13. Requests the Secretary-General to continue his efforts to further strengthen the existing system for the collection, compilation and dissemination of information on the law of the sea and related matters and to further develop, in cooperation with relevant international organizations, a centralized system for providing coordinated information and advice; 14. Reaffirms its decision to undertake an annual review and evaluation of the implementation of the Convention and other developments relating to ocean affairs and the law of the sea; 15. Reiterates its request to the Secretary-General to prepare a comprehensive report on the impact of the entry into force of the Convention on related existing and proposed instruments and programmes throughout the United Nations system, for submission to the Assembly at its fifty-second session, and calls upon competent international organizations and other international bodies to cooperate in the preparation of the report; © R/51/645. 16. Requests the Secretary-General to report to the Assembly at its fifty- second session on the implementation of the present resolution, including other developments and issues relating to ocean affairs and the law of the sea, in connection with his annual comprehensive report on oceans and the law of the sea; 17. Decides to include in the provisional agenda of its fifty-second session an item entitled ""Oceans and the law of the sea"".",11/19/1996,1996_228651,Samoa,"1 1. Requests the Secretary-General to ensure that the institutional capacity of the Organization adequately responds to the needs of States, the newly established institutions and other competent international organizations by providing advice and assistance, taking into account the special needs of developing countries;",yes
