year,Council,Session,Agenda item,Agenda detail,cosponsored countries,body title number,body title detail,body text,date,file,filecountry,footnote,scanned
1994,General Assembly,Forty-ninth session,151,OBSERVER STATUS FOR THE SOUTH PACIFIC FORUM IN THE GENERAL ASSEMBLY,"Andorra, Antigua and Barbuda, Argentina, Armenia, Australia, Austria, Azerbaijan, Bahamas, Bangladesh, Barbados, Belgium, Belize, Benin, Bhutan, Bolivia, Bosnia and Herzegovina, Brazil, Bulgaria, Cambodia, Canada, Cape Verde, Chile, Colombia, Costa Rica, Céte d’Ivoire, Cuba, Cyprus, Czech Republic, Denmark, Ecuador, Egypt, Fiji, Finland, France, Georgia, Germany, Ghana, Greece, Grenada, Guyana, Honduras, Hungary, Iceland, India, Indonesia, Ireland, Israel, Italy, Jamaica, Japan, Kazakhstan, Kenya, Kyrgyzstan, Lao People’s Democratic Republic, Liechtenstein, Luxembourg, Malaysia, Maldives, Malta, Marshall Islands, Mauritius, Mexico, Micronesia (Federated States of), Monaco, Mongolia, Myanmar, Namibia, Nepal, Netherlands, New Zealand, Nicaragua, Nigeria, Norway, Papua New Guinea, Peru, Philippines, Poland, Portugal, Republic of Korea, Romania, Russian Federation, Saint Kitts and Nevis, Saint Lucia, Saint Vincent and the Grenadines, Samoa, San Marino, Seychelles, Sierra Leone, Singapore, Slovakia, Slovenia, Solomon Islands, South Africa, Spain, Sri Lanka, Sudan, Suriname, Sweden, Tajikistan, Thailand, Trinidad _and Tobago, Tunisia, Turkey, Uganda, United Kingdom of Great Britain and Northern Ireland, United States of America, Vanuatu, Venezuela and Viet Nam",N/A,N/A,"The General Assembly , Noting the desire of the South Pacific Forum for cooperation between the United Nations and the South Pacific Forum, 1. Decides to invite the South Pacific Forum to participate in the sessions and the work of the General Assembly in the capacity of observer; 2. Requests the Secretary-General to take the necessary action to implement the present resolution.",10/11/1994,1994_163214,Sri Lanka,N/A,yes
1994,General Assembly,Forty-ninth session,20,COOPERATION BETWEEN THE UNITED NATIONS AND THE ASTAN-AFRICAN LEGAL CONSULTATIVE COMMITTEE,"China, Egypt, India, Japan, Kenya, Nigeria, Pakistan, Qatar and Sri Lanka",N/A,N/A,"The General Assembly , Recalling its resolutions 36/38 of 18 November 1981, 37/8 of 29 October 1982, 38/37 of 5 December 1983, 39/47 of 10 December 1984, 40/60 of 9 December 1985, 41/5 of 17 October 1986, 43/1 of 17 October 1988, 45/4 of 16 October 1990 and 47/6 of 21 October 1992, Having considered the report of the Secretary-General on cooperation between the United Nations and the Asian-African Legal Consultative Committee, 1/ Having heard the statement made by the Secretary-General of the Asian- African Legal Consultative Committee on the steps taken by the Consultative Committee to ensure continuing, close and effective cooperation between the two organizations, 1. Takes note with appreciation of the report of the Secretary-General; 2. Notes with satisfaction the continuing efforts of the Asian-African Legal Consultative Committee towards strengthening the role of the United Nations and its various organs, including the International Court of Justice, through programmes and initiatives undertaken by the Consultative Committee; 3. Notes with satisfaction the commendable progress achieved towards enhancing cooperation between the United Nations and the Consultative Committee in wider areas; 1/— -B/49/262. 4. Notes with appreciation the decision of the Consultative Committee to participate actively in the programmes of the United Nations Decade of International Law and of environment and sustainable development; 5. Requests the Secretary-General to submit to the General Assembly at its fifty-first session a report on cooperation between the United Nations and the Consultative Committee; 6. Decides to include in the provisional agenda of its fifty-first session the item entitled ""Cooperation between the United Nations and the Asian- African Legal Consultative Committee"".",10/18/1994,1994_163234,Sri Lanka,1/— -B/49/262.,yes
1994,Special Political And Decolonization Committee,Forty-ninth session,74,PROTECTION AND SECURITY OF SMALL STATES,"Afghanistan, Antigua and Barbuda, Australia, Bahamas, Bahrain, Bangladesh, Barbados, Belize, Bhutan, Brunei Darussalam, Cape Verde, Comoros, Cyprus, Djibouti, Dominica, Fiji, Grenada, Guinea-Bissau, Guyana, India, Indonesia, Jamaica, Kuwait, Kyrgyzstan, Lao People’s Democratic Republic, Libyan Arab Jamahiriya, Madagascar, Malaysia, Maldives, Mali, Marshall Islands, Mauritania, Mauritius, Micronesia (Federated States of) Mongolia, Morocco, Myanmar, Namibia, Nepal, New Zealand, Nicaragua, Pakistan, Panama, Papua New Guinea, Paraguay, Qatar, Republic of Korea, Saint Kitts and Nevis, Saint Lucia, Saint Vincent and the Grenadines, Samoa, Saudi Arabia, Seychelles, Sierra Leone, Singapore, Solomon Islands, Sri Lanka, Suriname, Swaziland, Trinidad and Tobago, United Arab Emirates and Vanuatu",N/A,N/A,"The General Assembly , Recalling its resolution 44/51 of 8 December 1989 and 46/43 of 9 December 1991, in which it recognized that small States may be particularly vulnerable to external threats and acts of interference in their internal affairs, Reaffirming its commitment to international peace and security, Recalling the Declaration on Principles of International Law concerning Friendly Relations and Cooperation among States in accordance with the Charter of the United Nations, 1/ Conscious that small States may be threats and acts of interference in thei needs consonant with the right to sovere Concerned about the danger that mercenaries and terrorists, traffickers, can represent for small Sta Condemning all acts of aggression, and territorial integrity of small State Having examined the report of the S implementation of resolution 46/43, 1. Expresses its deep appreciatio particularly vulnerable to external rv internal affairs and may have special ignty and territorial integrity, as well as drug tes, including those against the sovereignty Sy ecretary-General 2/ on the n to the Secretary-General for his report on the implementation of resoluti 2. Recognizes that small States m external threats and acts of interferenc 3. Stresses the vital importance respect by all States of all the princip Nations, including t non-interference in the internal affairs settlement of disputes, and their consis 4. Stresses also the importance o arrangements by increasing interaction, 5. Appeals to the relevant region provide assistance when requested by sma security in accordance with the principl 6. Requests the Secretary-General monitoring the security situation of sma the provisions of Article 99 of the Char 7. Calls upon the Security Counci United Nations to pay special attention States in the restructuring and revitali Nations, especially within the context o of the United Nations and on the Strengt and in the follow-up activities of the A he principles of sovereign on 46/43; ay be particularly vulnerable to e in their internal affairs; States of the unconditional the Charter of the United equality, territorial integrity, of other countries and the peaceful tent application; for al les of f strengthening the regional security cooperation and consultation; al and international organizations to 1 States for the strengthening of their es of the Charter; to continue to pay special attention to 1 States and to consider making use of ter; and other relevant organs of the to the protection and security of small zation of the work of the United f the Special Committee on the Charter ening of the Role of the Organization, genda for Peace.",10/18/1994,1994_163532,Sri Lanka,"1/ Resolution 2625 (XXV), annex. 2/ B/49/353.",yes
1994,Special Political And Decolonization Committee,Forty-ninth session,84,OFFERS BY MEMBER STATES OF STUDY AND TRAINING FACILITIES FOR INHABITANTS OF NON-SELF-GOVERNING TERRITORIES,"Algeria, Antigua and Barbuda, Argentina, Australia, Barbados, Brazil, Bulgaria, China, Costa Rica, Cuba, Guinea, Guyana, India, Indonesia, Iran (Islamic Republic of) Madagascar, Mali, New Zealand, Nicaragua, Nigeria, Pakistan, Panama, Papua New Guinea, Philippines, Samoa, Singapore, Sri Lanka, Sudan, Sweden, Thailand, Trinidad and Tobago, Tunisia and United Republic of Tanzania",N/A,N/A,"The General Assembly , Recalling is resolution 48/48 of 10 December 1993, Having examined the report of the Secretary-General on offers by Member States of study and training facilities for inhabitants of Non-Self-Governing Territories, 1/ prepared pursuant to General Assembly resolution 845 (IX) of 22 November 1954, Conscious of the importance of promoting the educational advancement of the inhabitants of Non-Self-Governing Territories, Strongly convinced that the continuation and expansion of offers of scholarships is essential in order to meet the increasing need of students from Non-Self-Governing Territories for educational and training assistance, and considering that students in those Territories should be encouraged to avail themselves of such offers, 1. Takes note of the report of the Secretary-General; i/ A/49/413. 2. Expresses its appreciation to those Member States that have made scholarships available to the inhabitants of Non-Self-Governing Territories; 3. Invites all States to make or continue to make generous offers of study and training facilities to the inhabitants of those Territories that have not yet attained self-government or independence and, wherever possible, to provide travel funds to prospective students; 4. Urges the administering Powers to take effective measures to ensure the widespread and continuous dissemination in the Territories under their administration of information relating to offers of study and training facilities made by States and to provide all the necessary facilities to enable students to avail themselves of such offers; 5. Requests the Secretary-General to report to the General Assembly at its fiftieth session on the implementation of the present resolution; 6. Draws the attention of the Special Committee on the Situation with regard to the Implementation of the Declaration on the Granting of Independence to Colonial Countries and Peoples to the present resolution.",10/25/1994,1994_163788,Sri Lanka,N/A,yes
1994,First Committee,Forty-ninth session,63 (e),"REVIEW AND IMPLEMENTATION OF THE CONCLUDING DOCUMENT OFTHE TWELFTH SPECIAL SESSION OF THE GENERAL ASSEMBLY:UNITED NATIONS REGIONAL CENTRE FOR PEACE AND DISARMAMENTIN AFRICA, UNITED NATIONS REGIONAL CENTRE FOR PEACE ANDDISARMAMENT IN ASIA AND THE PACIFIC AND UNITED NATIONSREGIONAL CENTRE FOR PEACE, DISARMAMENT AND DEVELOPMENT IN LATIN AMERICA AND THE CARIBBEAN","Argentina, Bangladesh, Bolivia, Brazil, Chile, Costa Rica, Democratic People’s Republic of Korea, Dominican Republic, Ecuador, El Salvador, Gambia*, Honduras, Jamaica, Lao People’s Democratic Republic, Mongolia, Myanmar, Nepal, Nicaragua, Pakistan, Panama, Paraguay, Peru, Singapore, Sri Lanka, Venezuela and Viet Nam",N/A,"United Nations Regional Centre for Peace and Disarmament in Africa, United Nations Regional Centre for Peace and Disarmament in Asia and the Pacific and United Nations Regional Centre for Peace, Disarmament and Development in Latin America and the Caribbean","The General Assembly , Recalling its resolutions 40/151 G of 16 December 1985, 41/60 D of 3 December 1986, 42/39 J of 30 November 1987 and 43/76 D of 7 December 1988 on the United Nations Regional Centre for Peace and Disarmament in Africa, 41/60 J of 3 December 1986, 42/39 K of 30 November 1987 and 43/76 H of 7 December 1988 on the United Nations Regional Centre for Peace, Disarmament and Development in Latin America and the Caribbean, 42/39 D of 30 November 1987 and 43/76 G of 7 December 1988 on the United Nations Regional Centre for Peace and Disarmament in Asia, and 44/117 F of 15 December 1989, 45/59 EB of 4 December 1990 and 46/37 F of 9 December 1991 on the United Nations Regional Centre for Peace and Disarmament in Africa, the United Nations Regional Centre for Peace and Disarmament in Asia and the Pacific and the United Nations Regional Centre for Peace, Disarmament and Development in Latin America and the Caribbean, Reaffirming its resolutions 46/36 F of 6 December 1991 and 47/52 G of 9 December 1992 on regional disarmament, including confidence-building measures, Also recalling its resolution 48/76 E of 16 December 1993 on the regional disarmament centres, Mindful of the provisions of Article 11, paragraph 1 of the Charter of the United Nations stipulating that a function of the General Assembly is to consider the general principles of cooperation in the maintenance of international peace and security, including the principles governing disarmament and arms limitation, Bearing in mind that the changed international environment has created new opportunities for the pursuit of disarmament, as well as posed new challenges, Taking note of the report of the Secretary-General on the activities of the regional centres, 1/ Convinced that the initiatives and activities mutually agreed upon by Member States of the respective regions aimed at fostering mutual confidence and security, as well as the implementation and coordination of regional activities under the United Nations Disarmament Information Programme would encourage and facilitate the development of effective measures of confidence-building, arms limitation and disarmament in these regions, Welcoming the programme of activities carried out by the regional centres, which have contributed substantially to understanding and cooperation among the States in each particular region and have thereby strengthened the role assigned to each regional centre in the areas of peace, disarmament and development, Recognizing the need to provide the centres with financial viability and stability so as to facilitate the effective planning and implementation of their respective programmes of activities, Expressing its gratitude to the Member States and international governmental and non-governmental organizations and foundations that have contributed to the trust funds of the three regional centres, 1. Commends the activities being carried out by the regional centres in identifying and broadening the understanding of pressing disarmament and security issues and exploring optimum solutions under given specific conditions prevailing in each region, in accordance with their mandates; A/C.1/49/L.26 in promoting cooperation with subregional and regional organizations and among the States in their respective regions to facilitate the development of effective measures of confidence-building, arms limitation and disarmament, with a view to strengthening peace and security; 3. Encourages also further use of the potential of the regional centres to maintain the increased interest in and momentum for revitalization of the Organization to meet the challenges of a new phase of international relations in order to fulfil the purposes and principles of the Charter of the United Nations related to peace, disarmament and development, taking into account the guidelines and recommendations for regional approaches to disarmament within the context of global security as adopted by the Disarmament Commission at its 1993 substantive session; 2/ 4. Appeals once again to Member States, as well as to international governmental and non-governmental organizations and foundations, to make voluntary contributions in order to strengthen the programmes of activities of the regional centres and their effective implementation; 5. Requests the Secretary-General to continue to provide all necessary support to the regional centres in carrying out their programmes of activities; 6. Also requests the Secretary-General that the directors of the regional centres should be locally based in order to revitalize the activities of the centres; 7. Also requests the Secretary-General to report to the General Assembly at its fiftieth session on the implementation of resolution 46/37 F and the present resolution, and decides to include in the provisional agenda of its fiftieth session the item entitled ""United Nations Regional Centre for Peace and Disarmament in Africa, United Nations Regional Centre for Peace and Disarmament in Asia and the Pacific and United Nations Regional Centre for Peace, Disarmament and Development in Latin America and the Caribbean"".",11/02/1994,1994_163796,Sri Lanka,"* On behalf of the States Members of the United Nations that are members of the African Group of States. 1/ A/49/389. 2/ Official Records of the General Assembly , Forty-eighth Session, Supplement No. 42 (A/48/42), annex II.",yes
1994,Second Committee,Forty-ninth session,12,REPORT OF THE ECONOMIC AND SOCIAL COUNCIL,"Albania, Algeria, Andorra, Angola, Antigua and Barbuda, Argentina, Australia, Austria, Bahamas, Bangladesh, Barbados, Belarus, Belgium, Belize, Benin, Bhutan, Bolivia, Brazil, Burkina Faso, Cambodia, Canada, Cape Verde, Chile, Colombia, Comoros, Congo, Costa Rica, Céte d’Ivoire, Cyprus, Czech Republic, Denmark, Dominican Republic, Ecuador, Egypt, El Salvador, Fiji, France, Germany, Greece, Grenada, Guatemala, Guinea-Bissau, Guyana, Honduras, Hungary, Iceland, India, Ireland, Israel, Italy, Jamaica, Lithuania, Luxembourg, Malawi, Maldives, Malaysia, Malta, Marshall Islands, Mauritania, Mauritius, Micronesia (Federated States of), Monaco, Mongolia, Morocco, Mozambique, Netherlands, New Zealand, Nicaragua, Pakistan, Panama, Papua New Guinea, Paraguay, Peru, Philippines, Poland, Portugal, Qatar, Republic of Moldova, Romania, Russian Federation, Saint Kitts and Nevis, Saint Lucia, Samoa, San Marino, Sao Tome and Principe, Senegal, Seychelles, Slovakia, Slovenia, Solomon Islands, South Africa, Spain, Sri Lanka, Suriname, Thailand, Trinidad and Tobago, Turkey, Ukraine, United Kingdom of Great Britain and Northern Ireland, Uruguay, Vanuatu and Venezuela",N/A,Question of declaring 1998 International Year of the Ocean,"The General Assembly , Recalling Economic and Social Council resolution 1994/48 of 29 July 1994, Proclaims 1998 International Year of the Ocean.",11/07/1994,1994_163971,Sri Lanka,N/A,yes
1994,Second Committee,Forty-ninth session,89,"ENVIRONMENT AND SUSTAINABLE DEVELOPMENT Algeria, Antigua _and Barbuda, Argentina, Australia, Bahamas,","Benin, Canada, Ecuador, Eritrea, Fiji, Grenada, Indonesia, Maldives, Marshall Islands, Mauritania, Micronesia (Federated States of), Namibia, New Zealand, Papua New Guinea, Senegal, Sierra Leone, Sri Lanka, Suriname, Togo, Trinidad and Tobago, Tunisia and United States of America",N/A,Unauthorized fishing in zones of national jurisdiction and its impact on the living marine resources of the world’s oceans and seas,"The General Assembly , Inviting all members of the international community, particularly those with fishing interests, to strengthen their cooperation in the conservation and management of living marine resources in accordance with international law as reflected in the United Nations Convention on the Law of the Sea, 1/ Recalling Agenda 21, 2/ adopted by the United Nations Conference on Environment and Development, in particular chapter 17, concerning the sustainable development and conservation of the marine living resources of areas under national jurisdiction, i1/ United Nations publication, Sales No. E.83.V.5. Recalling also the Programme of Action for the Sustainable Development of Small Island Developing States, 3/ adopted by the Global Conference on the Sustainable Development of Small Island Developing States, in particular chapter 4, concerning the sustainable development and conservation of the coastal and marine resources of areas under national jurisdiction, Noting that, in the Rio Declaration on Environment and Development 4/ the international community recognized that the special situation and needs of developing countries, particularly the least developed and those most environmentally vulnerable, should be given special priority, Expressing deep concern at the detrimental impact of unauthorized fishing in zones under national jurisdiction, where the largest share of the global fish catch is harvested, on the sustainable development of the world’s fishery resources and on the food security and economies of many States, particularly the developing countries, Taking note of recent discussions, at the international, regional and subregional levels, on fishery conservation and management measures, and on compliance with and the enforcement thereof, 1. Calls upon States to take the responsibility, consistent with their obligations under international law as reflected in the United Nations Convention on the Law of the Sea, to ensure that no fishing vessels entitled to fly their national flag fish in zones under the national jurisdiction of other States unless duly authorized by the competent authorities of the coastal State or States concerned. Such authorized fishing operations should be carried out in accordance with the conditions set out in the authorization; 2. Also calls upon development assistance organizations to make it a high priority to support efforts by the developing coastal States, in particular the least developed countries and the small island developing States, to improve the monitoring and control of fishing activities and the enforcement of fishing regulations; 3. Requests the Secretary-General to bring the present resolution to the attention of all members of the international community, relevant intergovernmental organizations, the organizations and bodies of the United Nations system, regional and subregional fisheries bodies, and relevant non-governmental organizations; 4, Also requests the Secretariat to submit to the General Assembly , at its fiftieth session, a report on the steps taken and on problems encountered in the implementation of the present resolution, and thereafter as may be determined by the General Assembly .",11/14/1994,1994_164363,Sri Lanka,N/A,yes
