year,Council,Session,Agenda item,Agenda detail,cosponsored countries,body title number,body title detail,body text,date,file,filecountry,footnote,scanned
1996,First Committee,Fifty-first session,69,CONCLUSION OF EFFECTIVE INTERNATIONAL ARRANGEMENTS TO ASSURE NON-NUCLEAR-WEAPON STATES AGAINST THE USE OR THREAT OF USE OF NUCLEAR WEAPONS,"Bangladesh, Brunei Darussalam, Colombia, Democratic People’s Republic of Korea, Ghana, Indonesia, Iran (Islamic Republic of), Libyan Arab Jamahiriya, Malaysia, Myanmar, Pakistan, Philippines, Sri Lanka, Sudan, Viet Nam",N/A,N/A,"The General Assembly , Bearing in mind the need to allay the legitimate concern of the States of the world with regard to ensuring lasting security for their peoples, Convinced that nuclear weapons pose the greatest threat to mankind and to the survival of civilization, Welcoming the progress achieved in recent years in both nuclear and conventional disarmament, Noting that, despite recent progress in the field of nuclear disarmament, further efforts are necessary towards the achievement of general and complete disarmament under effective international control, Also convinced that nuclear disarmament and the complete elimination of nuclear weapons are essential to remove the danger of nuclear war, Determined strictly to abide by the relevant provisions of the Charter of the United Nations on the non-use of force or threat of force, Recognizing that the independence, territorial integrity and sovereignty of non-nuclear-weapon States need to be safeguarded against the use or threat of use of force, including the use or threat of use of nuclear weapons, Considering that, until nuclear disarmament is achieved on a universal basis, it is imperative for the international community to develop effective measures and arrangements to ensure the security of non-nuclear-weapon States against the use or threat of use of nuclear weapons from any quarter, Recognizing also that effective measures and arrangements to assure the non-nuclear-weapon States against the use or threat of use of nuclear weapons can contribute positively to the prevention of the spread of nuclear weapons, Bearing in mind paragraph 59 of the Final Document of the Tenth Special Session of the Assembly, 1/ the first special session devoted to disarmament, in which it urged the nuclear-weapon States to pursue efforts to conclude, as appropriate, effective arrangements to assure non-nuclear-weapon States against the use or threat of use of nuclear weapons, and desirous of promoting the implementation of the relevant provisions of the Final Document, Recalling the relevant parts of the special report of the Committee on Disarmament 2/ submitted to the General Assembly at its twelfth special session, 3/ the second special session devoted to disarmament, and of the special report of the Conference on Disarmament submitted to the Assembly at its fifteenth special session, 4/ the third special session devoted to disarmament, as well as the report of the Conference on its 1992 session, 5/ Recalling also paragraph 12 of the Declaration of the 1980s as the Second Disarmament Decade, contained in the annex to its resolution 35/46 of 3 December 1980, which states, inter alia, that all efforts should be exerted by the Committee on Disarmament urgently to negotiate with a view to reaching agreement on effective international arrangements to assure non-nuclear-weapon States against the use or threat of use of nuclear weapons, Noting the in-depth negotiations undertaken in the Conference on Disarmament and its Ad Hoc Committee on Effective International Arrangements to Assure Non-Nuclear-Weapon States against the Use or Threat of Use of Nuclear Weapons, 6/ with a view to reaching agreement on this item, Jase Taking note of the proposals submitted under that item in the Conference on Disarmament, including the s of an international convention, Taking note also of the relevant decision of the Eleventh Conference of Heads of State or Government of Non-Aligned Countries held at Cartagena de Indias, Colombia, from 18 to 20 October 1995, 7/ and also of the decision adopted by the Tenth Conference of Heads of State or Government of Non-Aligned Countries, held at Jakarta from 1 to 6 September 1992, 8/ as well as the relevant recommendations of the Organization of the Islamic Conference reiterated in the Final Communiqué of the Twentieth Islamic Conference of Foreign Ministers, held at Istanbul from 4 to 8 August 1991, 9/ calling upon the Conference on Disarmament to reach an urgent agreement on an international convention to assure non-nuclear-weapon States against the use or threat of use of nuclear weapons, Taking note further of the unilateral declarations made by all nuclear- weapon States on their policies of non-use or non-threat of use of nuclear weapons against non-nuclear-weapon States, Noting the support expressed in the Conference on Disarmament and in the General Assembly for the elaboration of an international convention to assure non-nuclear-weapon States against the use or threat of use of nuclear weapons, as well as the difficulties pointed out in evolving a common approach acceptable to all, Noting also the greater willingness to overcome the difficulties encountered in previous years, Noting further Security Council resolution 984 (1995) and the views expressed on it, Recalling its relevant resolutions adopted in previous years, in particular resolutions 45/54 of 4 December 1990, 46/32 of 6 December 1991, 47/50 of 9 December 1992, 48/73 of 16 December 1993, 49/73 of 15 December 1994 and 50/68 of 12 December 1995, 1. Reaffirms the urgent need to reach an early agreement on effective international arrangements to assure non-nuclear-weapon States against the use or threat of use of nuclear weapons; 2. Notes with satisfaction that in the Conference on Disarmament there is no objection, in principle, to the idea of an international convention to assure non-nuclear-weapon States against the use or threat of use of nuclear weapons, although the difficulties as regards evolving a common approach acceptable to all have also been pointed out; T/ See A/50/752-S/1995/1035, annex III. 8/ See A/47/675-S/24816, annex, chap. II, para. 47. 3. Appeals to all States, especially the nuclear-weapon States, to work actively towards an early agreement on a common approach and, in particular, on a common formula that could be included in an international instrument of a legally binding character; 4. Recommends that further intensive efforts should be devoted to the search for such a common approach or common formula and that the various alternative approaches, including, in particular, those considered in the Conference on Disarmament, should be further explored in order to overcome the difficulties; 5. Recommends also that the Conference on Disarmament should actively continue intensive negotiations with a view to reaching early agreement and concluding effective international arrangements to assure non-nuclear-weapon States against the use or threat of use of nuclear weapons, taking into account the widespread support for the conclusion of an international convention and giving consideration to any other proposals designed to secure the same objective; 6. Decides to include in the provisional agenda of its fifty-second session the item entitled ""Conclusion of effective international arrangements to assure non-nuclear-weapon States against the use or threat of use of nuclear weapons"".",10/29/1996,1996_223118,Sri Lanka,"1/ Resolution S-10/2. 2/ The Committee on Disarmament was redesignated the Conference on Disarmament as from 7 February 1984. 3/ Offical Records of the General Assembly , Twelfth Special Session, Supplement No. 2 (A/S-12/2), sect. III.C. 4/ Ibid., Fifteenth Special Session, Supplement No. 2 (A/S-15/2), sect. III.F. 5/ Ibid., Forty-seventh Session, Supplement No. 27 (A/47/27), sect. III.F. 6/ Ibid., Forty-eighth Session, Supplement No. 27 (A/48/27), para. 39.",yes
1996,First Committee,Fifty-first session,70,"PREVENTION OF AN ARMS RACE IN OUTER SPACE Algeria, Bolivia, China, Democratic People’s Republic of Korea,","Egypt, Indonesia, Iran (Islamic Republic of), Malaysia, Marshall Islands, Papua New Guinea and Sri Lanka",N/A,Prevention of an arms race in outer space,"The General Assembly , Recognizing the common interest of all mankind in the exploration and use of outer space for peaceful purposes, Reaffirming the will of all States that the exploration and use of outer space, including the Moon and other celestial bodies, shall be for peaceful purposes and shall be carried out for the benefit and in the interest of all countries, irrespective of their degree of economic or scientific development, Reaffirming also provisions of articles III and IV of the Treaty on Principles Governing the Activities of States in the Exploration and Use of Outer Space, including the Moon and Other Celestial Bodies, 1/ Recalling the obligation of all States to observe the provisions of the Charter of the United Nations regarding the use or threat of use of force in their international relations, including in their space activities, Reaffirming further paragraph 80 of the Final Document of the Tenth Special Session of the General Assembly 2/ in which it is stated that in order to prevent an arms race in outer space further measures should be taken and appropriate international negotiations held in accordance with the spirit of the Treaty, Recalling also its previous resolutions on this issue and taking note of the proposals submitted to the General Assembly at its tenth special session and at its regular sessions, and of the recommendation made to the competent organs of the United Nations and to the Conference on Disarmament, Recognizing that prevention of an arms race in outer space would avert a grave danger for international peace and security, Emphasizing the paramount importance of strict compliance with existing arms limitation and disarmament agreements relevant to outer space, including bilateral agreements, and with the existing legal regime concerning the use of outer space, Considering that wide participation in the legal regime applicable to outer space could contribute to enhancing its effectiveness, Noting that the Ad Hoc Committee on the Prevention of an Arms Race in Outer Space, taking into account its previous efforts since its establishment in 1985 and seeking to enhance its functioning in qualitative terms, continued the examination and identification of various issues, existing agreements and existing proposals, as well as future initiatives relevant to the prevention of an arms race in outer space 3/ and that this contributed to a better understanding of a number of problems and to a clearer perception of the various positions, Regretting the inability of the Conference on Disarmament to re-establish the Ad Hoc Committee on the Prevention of an Arms Race in Outer Space in 1996, Emphasizing the mutually complementary nature of bilateral and multilateral efforts in the field of preventing an arms race in outer space, and hoping that concrete results will emerge from those efforts as soon as possible, Convinced that further measures should be examined in the search for effective and verifiable bilateral and multilateral agreements in order to prevent an arms race in outer space, Stressing that the growing use of outer space increases the need for greater transparency and better information on the part of the international community, Recalling in this context its previous resolutions, in particular resolutions 45/55 B of 4 December 1990, 47/51 of 9 December 1992 and 48/74 A of 16 December 1993, in which, inter alia, it reaffirmed the importance of confidence-building measures as means conducive to ensuring the attainment of the objective of the prevention of an arms race in outer space, Conscious of the benefits of confidence- and security-building measures in the military field, Recognizing that the conclusion of an international agreement or agreements to prevent an arms race in outer space remains the fundamental task of the Ad Hoc Committee and that the concrete proposals on confidence-building measures could form an integral part of such agreements, 1. Reaffirms the importance and urgency of preventing an arms race in outer space, and the readiness of all States to contribute to that common objective, in conformity with the provisions of the Treaty on Principles Governing the Activities of States in the Exploration and Use of Outer Space, including the Moon and Other Celestial Bodies; 1/ 2. Reaffirms its recognition, as stated in the report of the Ad Hoc Committee on the Prevention of an Arms Race in Outer Space, that the legal regime applicable to outer space by itself does not guarantee the prevention of an arms race in outer space, that this legal regime plays a significant role in the prevention of an arms race in that environment, that there is a need to consolidate and reinforce that regime and enhance its effectiveness, and that it is important strictly to comply with existing agreements, both bilateral and multilateral; 3. Emphasizes the necessity of further measures with appropriate and effective provisions for verification to prevent an arms race in outer space; 4. Calls upon all States, in particular those with major space capabilities, to contribute actively to the objective of the peaceful use of outer space and of the prevention of an arms race in outer space and to refrain from actions contrary to that objective and to the relevant existing treaties in the interest of maintaining international peace and security and promoting international cooperation; 5. Reiterates that the Conference on Disarmament, as the single multilateral disarmament negotiating forum, has the primary role in the negotiation of a multilateral agreement or agreements, as appropriate, on the prevention of an arms race in outer space in all its aspects; 6. Requests the Conference on Disarmament to re-establish the Ad Hoc Committee with a negotiating mandate at the beginning of its 1997 session, taking into account the work undertaken since 1985, with a view to conducting negotiations for the conclusion of an agreement or agreements, as appropriate, to prevent an arms race in outer space in all its aspects; 7. Recognizes, in this respect, the growing convergence of views on the elaboration of measures designed to strengthen transparency, confidence and security in the peaceful uses of outer space; A/C.1/51/L. 43 interested in conducting such activities, to keep the Conference on Disarmament informed of the progress of bilateral or multilateral negotiations relating to the prevention of an arms race in outer space, if any, so as to facilitate its work; 9. Decides to include in the provisional agenda of its fifty-second session the item entitled ""Prevention of an arms race in outer space"".",10/31/1996,1996_223126,Sri Lanka,"1/ Resolution 2222 (XXI), annex. 2/ Resolution S-10/2. 3/ Official Records of the General Assembly , Forty-ninth Session, Supplement No. 27 (A/49/27), sect. III.D (para. 5 of the quoted text).",yes
1996,First Committee,Fifty-first session,71 (f),GENERAL AND COMPLETE DISARMAMENT,"Afghanistan, Cambodia, Nicaragua, South Africa and Sri Lanka",N/A,Measures to curb the illicit transfer and_use of conventional arms,"The General Assembly , Recalling its resolution 46/36 H of 6 December 1991 and its decision 47/419 of 9 December 1992 on international arms transfers, Recalling also its resolutions 48/75 F and H of 16 December 1993, 49/75 M of 15 December 1994 and 50/70 J of 12 December 1995 on measures to curb the illicit transfer and use of conventional arms, Recognizing that the availability of massive quantities of conventional weapons and especially their illicit transfer, often associated with destabilizing activities, are most disturbing and dangerous phenomena, in particular for the internal situation of affected States and the violation of human rights, Bearing in mind that in certain situations mercenaries, terrorists and child soldiers are supplied with weapons acquired from illicit transfers of conventional arms, Convinced that peace and security are inextricably interlinked with and in some cases imperative for economic development and reconstruction, including in war-stricken countries, Realizing the urgent need to resolve conflicts and to diminish tension, and to accelerate efforts towards general and complete disarmament with a view to maintaining regional and international peace and security, Recognizing the curbing of the illicit transfer of arms as an important contribution to the relaxation of tension and peaceful reconciliation processes, Stressing the need for effective national control measures on the transfer of conventional weapons, Convinced that effective measures to curb the illicit transfer and use of conventional arms will help enhance regional and international peace, security and economic development, 1. Welcomes the adoption by the Disarmament Commission of the report on international arms transfers, with particular reference to General Assembly resolution 46/36 H, as well as a text entitled ""Guidelines for international arms transfers in the context of General Assembly resolution 46/36 H of 6 December 1991""; 1/ 2. Invites Member States: (a) To enact adequate national legislation and/or regulations and adopt administrative procedures to exercise effective control over armaments and the export and import of arms, inter alia, to prevent trafficking in illicit arms and to bring offenders to justice; (b) To provide the Secretary-General, by 15 April 1997, with relevant information on national control measures on arms transfers with a view to preventing illicit arms transfers; 3. Also invites Member States to provide the Secretary-General, by 15 April 1997, with their views on: (a) Effective ways and means of collecting weapons transferred illicitly, in particular in the light of experience gained by the United Nations; (b) Concrete proposals concerning measures at national, regional and international levels to curb the illicit transfer and use of conventional arms; 4, Requests the Secretary-General to: (a) Submit to the General Assembly at its fifty-second session a report containing the views expressed by Member States; (b) Report to the General Assembly at its fifty-second session on the effective implementation of the present resolution; 5. Decides to include in the provisional agenda of its fifty-second session the item entitled ""Measures to curb the illicit transfer and use of conventional arms"". i/ See Official Records of the General Assembly , Fifty-first Session, Supplement No. 42 (A/51/42), para. 29 and annex I.",10/31/1996,1996_223167,Sri Lanka,N/A,yes
1996,First Committee,Fifty-first session,63,THE ROLE OF SCIENCE AND TECHNOLOGY IN THE CONTEXT OF INTERNATIONAL SECURITY AND DISARMAMENT,"Bhutan, Costa Rica, Cuba, Guyana, India, Indonesia, Iran (Islamic Republic of), Lesotho, Libyan Arab Jamahiriya, Malaysia, Nepal, Nigeria, Singapore and Sri Lanka",N/A,N/A,"The General Assembly , Recognizing that scientific and technological developments can have both civilian and military applications and that progress in science and technology for civilian applications needs to be maintained and encouraged, Concerned that military applications of scientific and technological developments can contribute significantly to the improvement and upgrading of weapons of mass destruction, Aware of the need to follow closely the scientific and technological developments that may have a negative impact on international security and disarmament, and to channel scientific and technological developments for beneficial purposes, Cognizant that the international transfers of dual-use as well as high- technology products, services and know-how for peaceful purposes are important for the economic and social development of States, Expressing concern over the growing proliferation of ad hoc and exclusive export control regimes and arrangements for dual-use goods and technologies, Recalling that the Final Declaration of the Eleventh Conference of Heads of State or Government of Non-Aligned Countries, held at Cartagena de Indias, Colombia, from 18 to 20 October 1995, noted that restrictions being placed on access to technology through the imposition of non-transparent ad hoc export control regimes with exclusive membership tended to impede the economic and social development of developing countries, Emphasizing that the internationally negotiated guidelines for the transfer of high technology with military applications should take into account the legitimate defence requirements of all States and requirements for the maintenance of international peace and security, while ensuring that access to high-technology products and services and know-how for peaceful purposes is not denied, 1. Affirms that scientific and technological progress should be used for the benefit of all mankind to promote the sustainable economic and social development of all States and to safeguard international security, and that international cooperation in the use of science and technology through the transfer and exchange of technological know-how for peaceful purposes should be promoted; 2. Invites Member States to undertake additional efforts to apply science and technology for disarmament-related purposes and to make disarmament-related technologies available to interested States; 3. Urges Member States to undertake multilateral negotiations with the participation of all interested States in order to establish universally acceptable, non-discriminatory guidelines for international transfers of dual- use goods and technologies and high technology with military applications; 4. Recalls the report of the Secretary-General entitled ""Scientific and technological developments and their impact on international security"", 1/ and requests the Secretary-General to update and further develop that report in order to evaluate the impact of recent scientific and technological developments, especially those which have potential military applications, and to submit a report to the General Assembly not later than at its fifty-third session; 5. Encourages United Nations bodies to contribute, within existing mandates, to promoting the application of science and technology for peaceful purposes; 6. Decides to include in the provisional agenda of its fifty-second session the item entitled ""The role of science and technology in the context of international security and disarmament"". i1/ A/45/568.",11/04/1996,1996_223310,Sri Lanka,N/A,yes
