year,Council,Session,Agenda item,Agenda detail,cosponsored countries,body title number,body title detail,body text,date,file,filecountry,footnote,scanned
1994,Third Committee,Forty-ninth session,100 (e),HUMAN RIGHTS QUESTIONS: CAPITAL PUNISHMENT,"Andorra, Australia, Austria, Belgium, Cambodia, Cape Verde, Chile, Colombia, Costa Rica, Czech Republic, Denmark, Ecuador, Finland, France, Greece, Haiti, Honduras, Hungary, Iceland, Ireland, Italy, Liechtenstein, Luxembourg, Malta, Marshall Islands, Monaco, Nicaragua, Norway, Panama, Paraguay, Portugal, Romania, San Marino, Spain, Sweden, Uruguay and Vanuatu",N/A,Capital punishment,"The General Assembl , Recalling article 3 of the Universal Declaration of Human Rights, 1/ which affirms the right of everyone to life, article 6 of the International Covenant on Civil and Political Rights 2/ and articles 6 and 37 (a) of the Convention on the Rights of the Child, 3/ Recalling its resolutions 2857 (XXVI) of 20 December 1971, 32/61 of 8 December 1977 and 44/128 of 15 December 1989, by the latter of which it adopted and opened for signature the Second Optional Protocol to the International Covenant on Civil and Political Rights, aiming at the abolition of the death penalty, Recalling also Economic and Social Council resolutions 1574 (L) of 20 May 1971, 1745 (LIV) of 16 May 1973, 1930 (LVIII) of 6 May 1975, 1984/50 of 25 May 1984, 1985/33 of 29 May 1985, 1990/29 of 24 May 1990 and 1990/51 of 24 July 1990, Deeply concerned that in some countries that have not yet abolished the death penalty sentence of death is imposed for other than the most serious crimes, Also concerned that several countries impose the death penalty on juveniles, pregnant women and insane persons, in disregard of the limitations provided for in the International Covenant on Civil and Political Rights, the Convention on the Rights of the Child, and the safeguards guaranteeing protection of the rights of those facing the death penalty, set out in the annex to Economic and Social Council resolution 1984/50 of 25 May 1984, Welcoming the fact that in the statute of the International Tribunal for the Prosecution of Persons Responsible for Serious Violations of International Humanitarian Law Committed in the Territory of the Former Yugoslavia since 1991, the statute of the ad hoc international criminal tribunal on Rwanda and the statute for an international criminal court elaborated by the International Law Commission, 4/ capital punishment is excluded from the penalties that these Courts are authorized to impose, Noting that abolition of the death penalty contributes to the enhancement of human dignity and the progressive development of human rights, Reaffirming the sovereign right of States to determine, in accordance with international law, including the Charter of the United Nations, the legal measures and penalties which are appropriate to deal with the most serious crimes, 1. Invites all States that have not yet done so to consider acceding to or ratifying the Second Optional Protocol to the International Covenant on Civil and Political Rights, aiming at the abolition of the death penalty; 2. Urges all States parties that still maintain the death penalty to comply fully with their obligations under the International Covenant on Civil and Political Rights and the Convention on the Rights of the Child, and in particular to exclude pregnant women and juveniles from capital executions; 3. Invites all States that have not yet abolished the death penalty to consider the progressive restriction of the number of offences for which the death penalty may be imposed and to exclude insane persons from capital executions; 4. Encourages all States that have not yet abolished the death penalty to consider the opportunity of instituting a moratorium on pending executions with a view to ensuring that the principle that no State should dispose of the life of any human being be affirmed in every part of the world by the year 2000.",12/08/1994,1994_165233,Vanuatu,"1/ Resolution 217 A (III). 2/ Resolution 220 A (XXI), annex. 3/ Resolution 44/25.",yes
1994,Third Committee,Forty-ninth session,100 (e),HUMAN RIGHTS QUESTIONS: CAPITAL PUNISHMENT,"Andorra, Australia, Austria, Belgium, Cambodia, Cape Verde, Chile, Colombia, Costa Rica, Czech Republic, Denmark, Ecuador, Finland, France, Greece, Haiti, Honduras, Hungary, Iceland, Ireland, Italy, Liechtenstein, Luxembourg, Malta, Marshall Islands, Monaco, Netherlands, Nicaragua, Norway, Panama, Paraguay, Portugal, Romania, San Marino, Spain, Sweden, Uruguay and Vanuatu",N/A,Capital punishment,"The General Assembly , Recalling article 3 of the Universal Declaration of Human Rights, 1/ which affirms the right of everyone to life, article 6 of the International Covenant on Civil and Political Rights 2/ and articles 6 and 37 (a) of the Convention on the Rights of the Child, 3/ Recalling its resolutions 2857 (XXVI) of 20 December 1971, 32/61 of 8 December 1977 and 44/128 of 15 December 1989, by the latter of which it adopted and opened for signature the Second Optional Protocol to the International Covenant on Civil and Political Rights, aiming at the abolition of the death penalty, Recalling also Economic and Social Council resolutions 1574 (L) of 20 May 1971, 1745 (LIV) of 16 May 1973, 1930 (LVIII) of 6 May 1975, 1984/50 of 25 May 1984, 1985/33 of 29 May 1985, 1990/29 of 24 May 1990 and 1990/51 of 24 July 1990, Deeply concerned that in some countries that have not yet abolished the death penalty sentence of death is imposed for other than the most serious crimes, Also concerned that several countries impose the death penalty on juveniles, pregnant women and insane persons, in disregard of the limitations provided for in the International Covenant on Civil and Political Rights, the Convention on the Rights of the Child, and the safeguards guaranteeing protection of the rights of those facing the death penalty, set out in the annex to Economic and Social Council resolution 1984/50 of 25 May 1984, Welcoming that in the statute of the International Tribunal for the Prosecution of Persons Responsible for Serious Violations of International Humanitarian Law Committed in the Territory of the Former Yugoslavia since 1991, the statute of the ad hoc international criminal tribunal on Rwanda and the statute for an international criminal court elaborated by the International Law Commission, 4/ capital punishment is excluded from the penalties that these Courts are authorized to impose, Convinced that abolition of the death penalty contributes to the enhancement of human dignity and the progressive development of human rights, 1. Calls upon all States that have not yet done so to consider acceding to or ratifying the Second Optional Protocol to the International Covenant on Civil and Political Rights, aiming at the abolition of the death penalty; 2. Urges all States that still maintain the death penalty to comply fully with their obligations under the International Covenant on Civil and Political Rights and the Convention on the Rights of the Child, and in particular to exclude pregnant women and juveniles from capital executions; 3. Invites all States that have not yet abolished the death penalty to consider the progressive restriction of the number of offences for which the death penalty may be imposed and to exclude insane persons from capital executions; 4. Encourages all States that have not yet abolished the death penalty to consider the opportunity of instituting a moratorium on pending executions with a view to ensuring that the principle that no State should dispose of the life of any human being be affirmed in every part of the world by the year 2000.",11/29/1994,1994_165963,Vanuatu,"1/ Resolution 217 A (III). 2/ Resolution 220 A (XXI), annex.",yes
1994,General Assembly,Forty-ninth session,14,REPORT OF THE INTERNATIONAL ATOMIC ENERGY AGENCY,"Antigua_and Barbuda, Argentina, Australia, Belgium, Bulgaria, Canada, Chile, Costa Rica, Croatia, Czech Republic, Denmark, El Salvador, Fiji, Finland, France, Germany, Greece, Guatemala, Hungary, Ireland, Italy, Japan, Latvia, Luxembourg, Marshall Islands, Micronesia (Federated States of), Netherlands, New Zealand, Nicaragua, Nigeria, Norway, Poland, Portugal, Republic of Korea, Romania, Russian Federation, Singapore, Slovakia, Slovenia, Solomon Islands, Spain, Sweden, Thailand, Turkey, Ukraine, United Kingdom of Great Britain and Northern Ireland, United States of America_and Vanuatu",N/A,N/A,"The General Assembly , Having received the report of the International Atomic Energy Agency to the General Assembly for the year 1993, 1/ Noting the statement of the Director General of the International Atomic Energy Agency of 17 October 1994, 2/ in which he provided additional information on the main developments in the activities of the Agency during 1994, Recognizing the importance of the work of the Agency in promoting the further application of nuclear energy for peaceful purposes, as envisaged in its statute and in accordance with the inalienable right of State parties to the Treaty on the Non-Proliferation of Nuclear Weapons 3/ and other relevant internationally legally binding agreements that have concluded relevant safeguards agreements with the Agency to develop research, production and use of nuclear energy for peaceful purposes without discrimination and in conformity with articles I and II of the Treaty, other relevant articles and with the object and purposes of the Treaty, Also recognizing the special needs of the developing countries for technical assistance from the Agency in order to benefit effectively from the application of nuclear technology for peaceful purposes as well as from the contribution of nuclear energy to their economic development, Conscious of the importance of the work of the Agency in the implementation of the safeguards provisions of the Treaty on the Non-Proliferation of Nuclear Weapons and other international treaties, conventions and agreements designed to achieve similar objectives, as well as in ensuring, as far as it is able, that the assistance provided by the Agency or at its request or under its supervision or control is not used in such a way as to further any military purpose, as stated in article II of its statute, Further recognizing the importance of the work of the Agency on nuclear power, applications of nuclear methods and techniques, nuclear safety, radiological protection and radioactive waste management, including its work directed towards assisting developing countries in all these fields, Again stressing the need for the highest standards of safety in the design and operation of nuclear plants so as to minimize risks to life, health and the environment, Noting from the Director General’s statement that the Agency is now ina position to implement its ongoing monitoring and verification plan in Iraq, Taking note of resolutions GOV/2711 of 21 March 1994 and GOV/2742 of 10 June 1994 of the Board of Governors and GC(XXXVIII)/RES/16 of the General Conference of the Agency in connection with the implementation of the agreement between the Agency and the Democratic People’s Republic of Korea for the application of safeguards in connection with the Treaty on the Non-Proliferation of Nuclear Weapons, as well as the statements of the President of the Security Council of 31 March 1994, 30 May 1994 and 4 November 1994; 4/ expressing its grave concern that the Democratic People’s Republic of Korea has failed to discharge its safeguards obligations, and supporting all efforts, including ongoing bilateral discussions, which can contribute to the full implementation by the Democratic People’s Republic of Korea of its safeguards agreement, 5/ Bearing in mind resolutions GC(XXXVIII)/RES/6 on measures to resolve international radioactive waste management issues, GC(XXXVIII)/RES/7 on a plan for producing potable water economically, GC(XXXVIII)/RES/8 on the strengthening of the Agency’s technical cooperation activities, GC(XXXVIII)/RES/10 on strengthening the effectiveness and improving the efficiency of the safeguards system, GC(XXXVIII)/RES/15 on measures against the illicit trafficking in nuclear material, GC(XXXVIII)/RES/16 on the implementation of the agreement between the Agency and the Democratic People’s Republic of Korea for the application of safeguards in connection with the Treaty on the Non-Proliferation of Nuclear Weapons, GC(XXXVIII)/RES/17 on a nuclear-weapon-free zone in Africa, GC (XXXVIII) /RES/19 on the implementation of Security Council resolutions 687 (1991), 707 (1991) and 715 (1991) relating to Iraq and GC(XXXVIII)/RES/21 on the application of Agency safeguards in the Middle East, adopted on 23 September 1994 by the General Conference of the Agency at its thirty-eighth regular session, Taking note of resolution GC(XXXVIII)/RES/14 on the amendment of article VI of the statute relating to the membership of the Board of Governors of the Agency, adopted on 23 September 1994 by the General Conference of the Agency, Welcoming resolution GC(XXXVIII)/RES/18 of the General Conference of the Agency inviting South Africa to resume participation in all activities of the Agency, Noting the adoption and opening for signature of the Convention on Nuclear Safety at the Agency headquarters at Vienna, 6/ 1. Takes note of the report of the International Atomic Energy Agency; 1/ 2. Affirms its confidence in the role of the Agency in the application of nuclear energy for peaceful purposes; 3. Urges all States to strive for effective and harmonious international cooperation in carrying out the work of the Agency, pursuant to its statute; in promoting the use of nuclear energy and the application of the necessary measures to strengthen further the safety of nuclear installations and to minimize risks to life, health and the environment; in strengthening technical assistance and cooperation for developing countries; and in ensuring the effectiveness and efficiency of the safeguards systems of the Agency; 4. Welcomes the measures and decisions taken by the Agency to strengthen the safeguards system; 5. Welcomes also the measures and decisions taken by the Agency to strengthen its technical assistance and cooperation activities; 6. Commends the Director General and the secretariat of the Agency for their impartial efforts to implement the safeguards agreement still in force between the Agency and the Democratic People’s Republic of Korea, and urges the Democratic People’s Republic of Korea to cooperate without further delay with the Agency in the full implementation of the safeguards agreement and to allow the Agency to have access to all safeguards-relevant information and locations; 7. Also commends the Director General of the Agency and his staff for their strenuous efforts in the implementation of Security Council resolutions 687 (1991) of 3 April 1991, 707 (1991) of 15 August 1991 and 715 (1991) of 11 October 1991, and stresses the need for Iraq to cooperate fully with the Agency in achieving the complete and long-term implementation of the relevant Security Council resolutions; 8. Calls upon all States to take all necessary measures to prevent illicit trafficking in nuclear material, and welcomes the initiatives taken by the Agency to intensify international cooperation efforts in this respect; 9. Appeals to all States to become parties to the Convention on Nuclear Safety; 10. Requests the Secretary-General to transmit to the Director General of the Agency the records of the forty-ninth session of the General Assembly relating to the activities of the Agency.",12/13/1994,1994_169459,Vanuatu,"1/ International Atomic Energy Agency, The Annual Report for 1993 (Austria, July 1994) (GC(XXXVIII)/2 and Corr.1); transmitted to the members of the General Assembly by a note of the Secretary-General (A/49/297 and Corr.1). 2/ See Official Records of the General Assembly , Forty-ninth Session, Plenary Meetings, 33rd meeting. 3/ United Nations, Treaty Series, vol. 729, No. 10485. 4/ — S/PRST/1994/13, 28 and 64.",yes
1994,General Assembly,Forty-ninth session,161,COOPERATION BETWEEN THE UNITED NATIONS AND THE CARIBBEAN COMMUNITY,"Antigua_and Barbuda, Bahamas, Barbados, Belize, Dominica, Grenada, Guyana, Jamaica, Saint Kitts and Nevis, Saint Lucia, Saint Vincent and the Grenadines, Suriname, and Trinidad and Tobago",N/A,Addendum,"Add the following countries to the list of sponsors of the resolution: Algeria, Argentina, Austria, Belgium, Benin, Bolivia, Brazil, Burkina Faso, Cambodia, Canada, Chile, Colombia, Costa Rica, Cuba, Democratic People’s Republic of Korea, Denmark, Ecuador, El Salvador, Fiji, Finland, France, Gambia, Germany, Greece, Guatemala, Haiti, Honduras, Iceland, India, Ireland, Italy, Kenya, Luxembourg, Malaysia, Malta, Marshall Islands, Micronesia (Federated States of), Netherlands, Nicaragua, Panama, Papua New Guinea, Portugal, Samoa, Seychelles, Singapore, Solomon Islands, Spain, Sweden, Uganda, United Kingdom of Great Britain and Northern Ireland, United States of America, Vanuatu and Venezuela",12/29/1994,1994_169957,Vanuatu,* Reissued for technical reasons.,yes
1994,General Assembly,Forty-ninth session,19,ADMISSION OF NEW MEMBERS TO THE UNITED NATIONS,"Albania, Algeria, Andorra, Armenia, Australia, Austria, Bahamas, Bangladesh, Barbados, Benin, Brunei Darussalam, Burkina Faso, Cambodia, China, Comoros, Congo, Céte d’Ivoire, Cyprus, Denmark, Djibouti, Fiji, France, Gabon, Georgia, Germany, Guinea, Iceland, India, Japan, Kenya, Lesotho, Liechtenstein, Malawi, Malaysia, Maldives, Mali, Marshall Islands, Mexico, Micronesia, (Federated States of), Mongolia, Myanmar, Nepal, New Zealand, Nicaragua, Papua New Guinea, Peru, Philippines, Republic of Korea, Russian Federation, Saint Kitts and Nevis, Saint Lucia, Saint Vincent and the Grenadines, Samoa, Senegal, Sierra Leone, Singapore, Slovakia, Slovenia, Solomon Islands, Sweden, Tajikistan, Togo, United Kingdom of Great Britain and Northern Ireland, United States of America, Vanuatu_and Zambia",N/A,Admission of the Republic of Palau_to membership in the United Nations,"The General Assembly , Having received the recommendation of the Security Council of 29 November 1994 that the Republic of Palau should be admitted to membership in the United Nations, 1/ Having considered the application for membership of the Republic of Palau, 2/ Decides to admit the Republic of Palau to membership in the United Nations. 1/-— A/49/722. 2/ — B/49/679-S/1994/1315.",12/12/1994,1994_169959,Vanuatu,1/-— A/49/722. 2/ — B/49/679-S/1994/1315.,yes
1994,General Assembly,Forty-ninth session,156,BUILDING A PEACEFUL AND BETTER WORLD THROUGH SPORT,"Algeria, Angola, Antigua and Barbuda, Armenia, Australia, Bahamas, Barbados, Belarus, Benin, Bolivia, Botswana, Bulgaria, Burkina Faso, Burundi, Cameroon, Cape Verde, Comoros, Congo, Céte d’Ivoire, Cyprus, Czech Republic, Djibouti, Dominican Republic, Egypt, Eritrea, Ethiopia, Gabon, Gambia, Georgia, Ghana, Greece, Guinea, Guinea- Bissau, Guyana, Haiti, Honduras, Hungary, Iceland, India, Indonesia, Israel, Jamaica, Japan, Kazakhstan, Kenya, Lesotho, Liberia, Libyan Arab Jamahiriya, Liechtenstein, Luxembourg, Madagascar, Malawi, Mali, Malta, Mauritania, Mauritius, Monaco, Mongolia, Mozambique, Namibia, New Zealand, Niger, Nigeria, Norway, Pakistan, Panama, Papua New Guinea, Republic of Korea, Rwanda, Saint Kitts and Nevis, Saint Vincent and the Grenadines, Samoa, San Marino, Senegal, Seychelles, Sierra Leone, Slovakia, South Africa, Spain, Sudan, Suriname, Swaziland, the former Yugoslav Republic of Macedonia, Togo, Tunisia, Turkey, United States of America, Uruguay, Uzbekistan, Vanuatu, Yemen, Zaire, Zambia_and Zimbabwe",N/A,The Olympic Ideal,"The General Assembly , Recalling its resolution 48/10 of 25 October 1993, in which it commemorated the centenary of the founding of the International Olympic Committee by proclaiming 1994 as International Year of Sport and the Olympic Ideal, Recalling also its resolution 48/11 of 25 October 1993, on the observance of the Olympic Truce, which, inter alia, revived the ancient Greek tradition of ekecheria or ""Olympia Truce"", calling for all hostilities to cease during the Olympic Games, thereby mobilizing the youth of the world in the cause of peace, Taking into account resolution CM/Res.1530(LX), adopted by the Council of Ministers of the Organization of African Unity at its sixtieth ordinary session, held at Tunis from 6 to 11 June 1994, 1/ Reaffirming that the Olympic Ideal is to promote international understanding among the youth of the world through sport and culture in order to advance the harmonious development of humankind, Recognizing that the Olympic Ideal is relevant to the United Nations Year for Tolerance, which will be commemorated in 1995, in accordance with General Assembly resolution 48/126 of 20 December 1993, Noting with satisfaction the mutually beneficial cooperation agreements made between the International Olympic Committee and the relevant organs, organizations, programmes and specialized agencies of the United Nations system, in particular the United Nations International Drug Control Programme, the United Nations Children’s Fund, the United Nations Environment Programme, the Office of the United Nations High Commissioner for Refugees, the United Nations Educational, Scientific and Cultural Organization and the World Health Organization, Aware of the increasing humanitarian activities of the International Olympic Committee, such as food relief assistance to children in war-torn areas in cooperation with the Office of the United Nations High Commissioner for Refugees, and also aware of the pledges by the Committee to help reconstruct sport installations destroyed by war, such as those used in the winter Olympic Games at Sarajevo in 1984, 1. Congratulates the International Olympic Committee upon its centenary and for it activities organized to celebrate the observance of the International Year of Sport and the Olympic Ideal in 1994 in cooperation with the international sports federations and the national Olympic committees; 2. Welcomes the report of the President of the International Olympic Committee transmitted to members of the General Assembly concerning the 1994 International Year of Sport and the Olympic Ideal; 2/ 3. Requests the Secretary-General to invite and encourage ministers of youth and sport or concerned officials of States Members of the United Nations to participate in the consideration by the General Assembly at its fiftieth session of an item entitled ""Building a peaceful and better world through sport and the Olympic Ideal"" on the eve of the centenary of the revival of the Olympic Games in 1896 at Athens, and also requests the Secretary-General to invite the President of the International Olympic Committee to attend; 4. Calls upon Member States to reaffirm during the General Assembly at its fiftieth session the observance of the Olympic Truce, which will be observed during the next summer Olympic Games, to be held at Atlanta in 1996; 5. Invites the President of the International Olympic Committee to mobilize the Olympic Movement in support of the forthcoming celebration of the fiftieth anniversary of the United Nations and of the United Nations Year for Tolerance in 1995; 6. Decides to include in the provisional agenda of its fiftieth session an item entitled ""Building a peaceful and better world through sport and the Olympic Ideal"".",12/02/1994,1994_169998,Vanuatu,"1/ See A/49/313, annex I. 2/ A/49/720, annex.",yes
