year,Council,Session,Agenda item,Agenda detail,cosponsored countries,body title number,body title detail,body text,date,file,filecountry,footnote,scanned
1994,General Assembly,Forty-ninth session,151,OBSERVER STATUS FOR THE SOUTH PACIFIC FORUM IN THE GENERAL ASSEMBLY,"Andorra, Antigua and Barbuda, Argentina, Armenia, Australia, Austria, Azerbaijan, Bahamas, Bangladesh, Barbados, Belgium, Belize, Benin, Bhutan, Bolivia, Bosnia and Herzegovina, Brazil, Bulgaria, Cambodia, Canada, Cape Verde, Chile, Colombia, Costa Rica, Céte d’Ivoire, Cuba, Cyprus, Czech Republic, Denmark, Ecuador, Egypt, Fiji, Finland, France, Georgia, Germany, Ghana, Greece, Grenada, Guyana, Honduras, Hungary, Iceland, India, Indonesia, Ireland, Israel, Italy, Jamaica, Japan, Kazakhstan, Kenya, Kyrgyzstan, Lao People’s Democratic Republic, Liechtenstein, Luxembourg, Malaysia, Maldives, Malta, Marshall Islands, Mauritius, Mexico, Micronesia (Federated States of), Monaco, Mongolia, Myanmar, Namibia, Nepal, Netherlands, New Zealand, Nicaragua, Nigeria, Norway, Papua New Guinea, Peru, Philippines, Poland, Portugal, Republic of Korea, Romania, Russian Federation, Saint Kitts and Nevis, Saint Lucia, Saint Vincent and the Grenadines, Samoa, San Marino, Seychelles, Sierra Leone, Singapore, Slovakia, Slovenia, Solomon Islands, South Africa, Spain, Sri Lanka, Sudan, Suriname, Sweden, Tajikistan, Thailand, Trinidad _and Tobago, Tunisia, Turkey, Uganda, United Kingdom of Great Britain and Northern Ireland, United States of America, Vanuatu, Venezuela and Viet Nam",N/A,N/A,"The General Assembly , Noting the desire of the South Pacific Forum for cooperation between the United Nations and the South Pacific Forum, 1. Decides to invite the South Pacific Forum to participate in the sessions and the work of the General Assembly in the capacity of observer; 2. Requests the Secretary-General to take the necessary action to implement the present resolution.",10/11/1994,1994_163214,Vanuatu,N/A,yes
1994,General Assembly,Forty-ninth session,152,OBSERVER STATUS FOR THE INTERNATIONAL FEDERATION OF RED CROSS AND RED CRESCENT SOCIETIES IN THE GENERAL ASSEMBLY,"Afghanistan, Algeria, Antigua _and Barbuda, Armenia, Australia, Austria, Bahamas, Bangladesh, Barbados, Belarus, Belize, Benin, Bhutan, Bolivia, Bulgaria, Burkina Faso, Cambodia, Cameroon, Canada, Cape Verde, Chile, Colombia, Congo, Costa Rica, Céte d’Ivoire, Croatia, Cyprus, Democratic People’s Republic of Korea, Denmark, Djibouti, Dominican Republic, Ecuador, El Salvador, Eritrea, Estonia, Ethiopia, Fiji, Finland, Gambia, Georgia, Ghana, Guatemala, Guinea, Honduras, Hungary, Iceland, Indonesia, Iraq, Jordan, Kazakhstan, Kyrgyzstan, Lao People’s Democratic Republic, Liberia, Libyan Arab Jamahiriya, Liechtenstein, Madagascar, Malawi, Malaysia, Maldives, Mali, Malta, Marshall Islands, Mauritania, Mexico, Micronesia (Federated States of) Mongolia, Morocco, Mozambique, Myanmar, Namibia, Nepal, New Zealand, Norway, Oman, Pakistan, Panama, Papua New Guinea, Peru, Poland, Qatar, Republic of Korea, Saint Lucia, Samoa, San Marino, Saudi Arabia, Senegal, Sierra Leone, Slovakia, Solomon Islands, Sudan, Sweden, Thailand, Togo, Tunisia, Turkey, Ukraine, Vanuatu, Venezuela, Yemen and Zimbabwe",N/A,N/A,"The General Assembly , Recalling the special functions of the member societies of the International Federation of Red Cross and Red Crescent Societies which are recognized by their respective Governments as auxiliaries to the public authorities in the humanitarian field on the basis of the Geneva Conventions of 12 August 1949, Considering the specific role of the International Federation of Red Cross and Red Crescent Societies in international humanitarian relations as further defined by the International Conference of the Red Cross and Red Crescent, Desirous of promoting cooperation between the United Nations and the International Federation of Red Cross and Red Crescent Societies, 1. Decides to invite the International Federation of Red Cross and Red Crescent Societies to participate in the sessions and the work of the General Assembly in the capacity of observer; 2. Requests the Secretary-General to take the necessary action to implement the present resolution.",10/17/1994,1994_163336,Vanuatu,N/A,yes
1994,Special Political And Decolonization Committee,Forty-ninth session,74,PROTECTION AND SECURITY OF SMALL STATES,"Afghanistan, Antigua and Barbuda, Australia, Bahamas, Bahrain, Bangladesh, Barbados, Belize, Bhutan, Brunei Darussalam, Cape Verde, Comoros, Cyprus, Djibouti, Dominica, Fiji, Grenada, Guinea-Bissau, Guyana, India, Indonesia, Jamaica, Kuwait, Kyrgyzstan, Lao People’s Democratic Republic, Libyan Arab Jamahiriya, Madagascar, Malaysia, Maldives, Mali, Marshall Islands, Mauritania, Mauritius, Micronesia (Federated States of) Mongolia, Morocco, Myanmar, Namibia, Nepal, New Zealand, Nicaragua, Pakistan, Panama, Papua New Guinea, Paraguay, Qatar, Republic of Korea, Saint Kitts and Nevis, Saint Lucia, Saint Vincent and the Grenadines, Samoa, Saudi Arabia, Seychelles, Sierra Leone, Singapore, Solomon Islands, Sri Lanka, Suriname, Swaziland, Trinidad and Tobago, United Arab Emirates and Vanuatu",N/A,N/A,"The General Assembly , Recalling its resolution 44/51 of 8 December 1989 and 46/43 of 9 December 1991, in which it recognized that small States may be particularly vulnerable to external threats and acts of interference in their internal affairs, Reaffirming its commitment to international peace and security, Recalling the Declaration on Principles of International Law concerning Friendly Relations and Cooperation among States in accordance with the Charter of the United Nations, 1/ Conscious that small States may be threats and acts of interference in thei needs consonant with the right to sovere Concerned about the danger that mercenaries and terrorists, traffickers, can represent for small Sta Condemning all acts of aggression, and territorial integrity of small State Having examined the report of the S implementation of resolution 46/43, 1. Expresses its deep appreciatio particularly vulnerable to external rv internal affairs and may have special ignty and territorial integrity, as well as drug tes, including those against the sovereignty Sy ecretary-General 2/ on the n to the Secretary-General for his report on the implementation of resoluti 2. Recognizes that small States m external threats and acts of interferenc 3. Stresses the vital importance respect by all States of all the princip Nations, including t non-interference in the internal affairs settlement of disputes, and their consis 4. Stresses also the importance o arrangements by increasing interaction, 5. Appeals to the relevant region provide assistance when requested by sma security in accordance with the principl 6. Requests the Secretary-General monitoring the security situation of sma the provisions of Article 99 of the Char 7. Calls upon the Security Counci United Nations to pay special attention States in the restructuring and revitali Nations, especially within the context o of the United Nations and on the Strengt and in the follow-up activities of the A he principles of sovereign on 46/43; ay be particularly vulnerable to e in their internal affairs; States of the unconditional the Charter of the United equality, territorial integrity, of other countries and the peaceful tent application; for al les of f strengthening the regional security cooperation and consultation; al and international organizations to 1 States for the strengthening of their es of the Charter; to continue to pay special attention to 1 States and to consider making use of ter; and other relevant organs of the to the protection and security of small zation of the work of the United f the Special Committee on the Charter ening of the Role of the Organization, genda for Peace.",10/18/1994,1994_163532,Vanuatu,"1/ Resolution 2625 (XXV), annex. 2/ B/49/353.",yes
1994,First Committee,Forty-ninth session,62,GENERAL AND COMPLETE DISARMAMENT,"Afghanistan, Argentina, Austria, Bahamas, Bhutan, Bolivia, Bulgaria, Burundi, Cambodia, Colombia, Costa Rica, Croatia, Cyprus, Czech Republic, Denmark, El Salvador, Eritrea, Germany, Ghana, Greece, Guatemala, Guyana, Honduras, Hungary, Iceland, Ireland, Italy, Kazakhstan, Liberia, Luxembourg, Madagascar, Maldives, Malta, Marshall Islands, Mauritania, Nepal, Netherlands, New Zealand, Nicaragua, Norway, Panama, Philippines, Poland, Portugal, Republic of Moldova, Romania, Sierra Leone, Slovenia, South Africa, Spain, Sweden, the former Yugoslav Republic of Macedonia, Togo, United Kingdom of Great Britain and Northern Ireland, United States of America, Vanuatu and Yemen",N/A,Moratorium _on the export of anti-personnel land-mines,"The General Assembly , Recalling with satisfaction its resolution 48/75 of 16 December 1993, by which it, inter alia, called upon States to agree to a moratorium on the export of anti-personnel land-mines that pose grave dangers to civilian populations, and urged States to implement such a moratorium, Noting that there are approximately 85 million or more anti-personnel land- mines in the ground throughout the world and that many thousands of such mines continue to be laid in an indiscriminate manner, Expressing deep concern that anti-personnel land-mines kill or maim hundreds of people every week, mostly unarmed civilians, obstruct economic development and reconstruction and have other severe consequences, which include inhibiting the repatriation of refugees and the return of internally displaced persons, Welcoming the programmes of assistance which exist for demining and humanitarian support for the victims of anti-personnel land-mines, Gravely concerned with the suffering and casualties caused to non- combatants as a result of the proliferation, as well as the indiscriminate and irresponsible use, of anti-personnel land-mines, Recognizing that States can move most effectively towards the ultimate goal of the eventual elimination of anti-personnel land-mines as viable and humane alternatives are developed, Recalling with satisfaction the report of the Secretary-General 1/ concerning progress on the initiative in the aforementioned resolution, Convinced that moratoriums by States exporting anti-personnel land-mines that pose grave dangers to civilian populations are important measures in helping reduce substantially the human and economic costs resulting from the use of such devices, Noting with satisfaction that many States already have declared moratoriums on the export, transfer or sale of anti-personnel land-mines and related devices, with many of these moratoriums being declared as a result of the aforementioned resolution, Believing that ongoing efforts to strengthen the Convention on Prohibitions or Restrictions on the Use of Certain Conventional Weapons Which May Be Deemed to Be Excessively Injurious or To Have Indiscriminate Effects 2/ (the Convention on Conventional Weapons), particularly Protocol II, 3/ are an important part of the overall effort to address problems caused by anti- personnel land-mines, Recalling with satisfaction its resolution 48/7 of 19 October 1993 calling for assistance in mine clearance, 1. Welcomes the moratoriums already declared by certain States on the export of anti-personnel land-mines; 2. Urges States that have not yet done so to declare such moratoriums at the earliest possible date; 1/-— A/49/275. A/C.1/49/L.19 Member States to implement such moratoriums, and to submit it to the General Assembly at its fiftieth session under the item entitled ""General and complete disarmament""; 4. Emphasizes the importance of the Convention on Conventional Weapons and its Protocols as the authoritative international instrument governing the responsible use of anti-personnel land-mines and related devices; 5. Urges States which have not done so to adhere to this Convention and its Protocols; 6. Encourages further international efforts to seek solutions to the problems caused by anti-personnel land-mines, with a view towards the eventual elimination of anti-personnel land-mines.",11/01/1994,1994_163619,Vanuatu,"1/-— A/49/275. 2/ See The United Nations Disarmament Yearbook, vol. 5:1980 (United Nations publication, Sales No. E.8 1. 1X.4), appendix VII. 3/ Ibid., Protocol on Prohibitions or Restrictions on the Use of Mines, Booby Traps and Other Devices.",yes
1994,Special Political And Decolonization Committee,Forty-ninth session,18,IMPLEMENTATION OF THE DECLARATION ON THE GRANTING OF INDEPENDENCE TO COLONIAL COUNTRIES AND PEOPLESQUESTION OF WESTERN SAHARA,"Algeria, Angola, Antigua and Barbuda, Bahamas, Barbados, Belize, Bolivia, Botswana, Burundi, Chile, Colombia, Congo, Costa Rica, Cuba, Cyprus, Democratic People’s Republic of Korea, Dominica, Ecuador, El Salvador, Ethiopia, Fiji, Ghana, Grenada, Guyana, Haiti, Honduras, Jamaica, Kenya, Lao People’s Democratic Republic, Lesotho, Malawi, Marshall Islands, Mauritania, Mauritius, Mexico, Micronesia (Federated States of), Mozambique, Namibia, Nicaragua, Nigeria, Panama, Papua New Guinea, Paraguay, Rwanda, Saint Kitts and Nevis, Saint Lucia, Saint Vincent and the Grenadines, Seychelles, Sierra Leone, Trinidad and Tobago, Uganda, United Republic of Tanzania, Uruguay, Vanuatu, Venezuela, Viet Nam, Zambia and Zimbabwe",N/A,N/A,"The General Assembly , Having considered in depth the question of Western Sahara, Reaffirming the inalienable right of all peoples to self-determination and independence, in accordance with the principles set forth in the Charter of the United Nations and in General Assembly resolution 1514 (XV) of 14 December 1960, containing the Declaration on the Granting of Independence to Colonial Countries and Peoples, Recalling its resolution 48/49 of 10 December 1993, Recalling also the agreement in principle given on 30 August 1988 by the Kingdom of Morocco and the Frente Popular para la Liberacién de Saguia el-Hamra y de Rio de Oro to the proposals of the Secretary-General of the United Nations and the current Chairman of the Assembly of Heads of State and Government of the Organization of African Unity in the context of their joint mission of good offices, Recalling further Security Council resolutions 621 (1988) of 20 September 1988, 658 (1990) of 27 June 1990, 690 (1991) of 29 April 1991, 725 (1991) of 31 December 1991 and 809 (1993) of 2 March 1993 relating to the question of Western Sahara, Recalling with satisfaction the entry into force of the cease-fire in Western Sahara on 6 September 1991, in accordance with the proposal of the Secretary-General accepted by the two parties, Taking note of the adoption by the Security Council on 29 March 1994 of resolution 907 (1994), Taking note also of the statement by the President of the Security Council on 29 July 1994, 1/ Welcoming the appointment of Mr. Erik Jensen as Deputy Special Representative of the Secretary-General for Western Sahara and the progress made, under his leadership, by the Identification Commission of the United Nations Mission for the Referendum in Western Sahara, Stressing the importance and usefulness of the resumption of direct talks between the two parties, the Kingdom of Morocco and the Frente Popular para la Liberacioén de Saguia el-Hamra y de Rio de Oro, in order to create a propitious atmosphere conducive to a speedy and effective implementation of the settlement plan, Having examined the relevant chapter of the report of the Special Committee on the Situation with regard to the Implementation of the Declaration on the Granting of Independence to Colonial Countries and Peoples, 2/ Having also examined the report of the Secretary-General, 3/ 1. Takes note with appreciation of the report of the Secretary-General; 2. Pays tribute to the Secretary-General for his action with a view to settling the question of Western Sahara by the implementation of the settlement plan; 1/. S/PRST/1994/39. 2/ A/49/23 (Part V), chap. VIII. 3. Reiterates its support for further efforts of the Secretary-General for the organization and supervision by the United Nations, in cooperation with the Organization of African Unity, of a referendum for self-determination of the people of Western Sahara, in conformity with Security Council resolutions 658 (1990) and 690 (1991) by which the Council adopted the settlement plan for Western Sahara; 4. Reaffirms that the goal on which all were agreed consists in the holding of a free, fair and impartial referendum for the people of Western Sahara, organized and conducted by the United Nations in cooperation with the Organization of African Unity and without any military or administrative constraints; 5. Endorses the contents of the statement of 29 July 1994 by the President of the Security Council in which the Council, inter alia, welcomes the progress made to date on the issues outlined in the Secretary-General’s report towards the implementation of the settlement plan; commends, in particular, the work of the Identification Commission and the efforts of the Deputy Special Representative pursuant to resolution 907 (1994) of 29 March 1994; and urges the two parties to continue to cooperate with the Secretary-General and the United Nations Mission for the Referendum in Western Sahara to ensure the earliest possible implementation of the settlement plan; 1/ 6. Encourages the Secretary-General to continue to deploy all efforts to bring the two parties to resume, as soon as possible, direct talks in order to create a propitious atmosphere conducive to a speedy and effective implementation of the settlement plan; 7. Requests Special Committee on the Situation with regard to the Implementation of the Declaration on the Granting of Independence to Colonial Countries and Peoples to continue to consider the situation in Western Sahara, bearing in mind the ongoing referendum process, and to report thereon to the General Assembly at its fiftieth session; 8. Invites the Secretary-General to submit to the General Assembly at its fiftieth session a report on the implementation of the present resolution.",10/25/1994,1994_163789,Vanuatu,"1/. S/PRST/1994/39. 2/ A/49/23 (Part V), chap. VIII.",yes
1994,Special Political And Decolonization Committee,Forty-ninth session,18,IMPLEMENTATION OF THE DECLARATION ON THE GRANTING OF INDEPENDENCE TO COLONIAL COUNTRIES AND PEOPLESQUESTION OF WESTERN SAHARA,"Algeria, Angola, Antigua and Barbuda, Bahamas, Barbados, Belize, Bolivia, Botswana, Burundi, Chile, Colombia, Congo, Costa Rica, Cuba, Cyprus, Democratic People’s Republic of Korea, Dominica, Ecuador, El Salvador, Ethiopia, Fiji, Ghana, Grenada, Guyana, Haiti, Honduras, Jamaica, Kenya, Lao People’s Democratic Republic, Lesotho, Malawi, Marshall Islands, Mauritania, Mauritius, Mexico, Micronesia (Federated States of), Mozambique, Namibia, Nicaragua, Nigeria, Panama, Papua New Guinea, Paraguay, Rwanda, Saint Kitts and Nevis, Saint Lucia, Saint Vincent and the Grenadines, Seychelles, Sierra Leone, Trinidad and Tobago, Uganda, United Republic of Tanzania, Uruguay, Vanuatu, Venezuela, Viet Nam, Zambia and Zimbabwe",N/A,N/A,"The General Assembly , Having considered in depth the question of Western Sahara, Reaffirming the inalienable right of all peoples to self-determination and independence, in accordance with the principles set forth in the Charter of the United Nations and in General Assembly resolution 1514 (XV) of 14 December 1960, containing the Declaration on the Granting of Independence to Colonial Countries and Peoples, Recalling its resolution 48/49 of 10 December 1993, Recalling also the agreement in principle given on 30 August 1988 by the Kingdom of Morocco and the Frente Popular para la Liberacién de Saguia el-Hamra y de Rio de Oro to the proposals of the Secretary-General of the United Nations and the current Chairman of the Assembly of Heads of State and Government of the Organization of African Unity in the context of their joint mission of good offices, Recalling further Security Council resolutions 621 (1988) of 20 September 1988, 658 (1990) of 27 June 1990, 690 (1991) of 29 April 1991, 725 (1991) of 31 December 1991 and 809 (1993) of 2 March 1993 relating to the question of Western Sahara, Recalling with satisfaction the entry into force of the cease-fire in Western Sahara on 6 September 1991, in accordance with the proposal of the Secretary-General accepted by the two parties, Taking note of the adoption by the Security Council on 29 March 1994 of resolution 907 (1994), Taking note also of the statement by the President of the Security Council on 29 July 1994, 1/ Welcoming the appointment of Mr. Erik Jensen as Deputy Special Representative of the Secretary-General for Western Sahara and the progress made, under his leadership, by the Identification Commission of the United Nations Mission for the Referendum in Western Sahara, Stressing the importance and usefulness of the resumption of direct talks between the two parties mentioned above in order to create a propitious atmosphere conducive to a speedy and effective implementation of the settlement plan, Having examined the relevant chapter of the report of the Special Committee on the Situation with regard to the Implementation of the Declaration on the Granting of Independence to Colonial Countries and Peoples, 2/ Having also examined the report of the Secretary-General, 3/ 1. Takes note with appreciation of the report of the Secretary-General; 2. Pays tribute to the Secretary-General and the United Nations Mission for the Referendum in Western Sahara personnel for their action with a view to settling the question of Western Sahara by the implementation of the settlement plan; 1/. S/PRST/1994/39. 2/ A/49/23 (Part V), chap. VIII. 3. Reiterates its support for further efforts of the Secretary-General for the organization and supervision by the United Nations, in cooperation with the Organization of African Unity, of a referendum for self-determination of the people of Western Sahara, in conformity with Security Council resolutions 658 (1990) and 690 (1991) by which the Council adopted the settlement plan for Western Sahara; 4. Reaffirms that the goal on which all were agreed consists in the holding of a free, fair and impartial referendum for the people of Western Sahara, organized and conducted by the United Nations in cooperation with the Organization of African Unity and without any military or administrative constraints, in conformity with the settlement plan; 5. Endorses the contents of the statement of 29 July 1994 by the President of the Security Council in which the Council, inter alia, welcomes the progress made to date on the issues outlined in the Secretary-General’s report towards the implementation of the settlement plan; commends, in particular, the work of the Identification Commission and the efforts of the Deputy Special Representative pursuant to resolution 907 (1994) of 29 March 1994; and urges the two parties to continue to cooperate with the Secretary-General and the United Nations Mission for the Referendum in Western Sahara to ensure the earliest possible implementation of the settlement plan; 1/ 6. Expresses the hope that direct talks between the two parties will soon resume in order to create a propitious atmosphere conducive to a speedy and effective implementation of the settlement plan; 7. Requests the Special Committee on the Situation with regard to the Implementation of the Declaration on the Granting of Independence to Colonial Countries and Peoples to continue to consider the situation in Western Sahara, bearing in mind the ongoing referendum process, and to report thereon to the General Assembly at its fiftieth session; 8. Invites the Secretary-General to submit to the General Assembly at its fiftieth session a report on the implementation of the present resolution.",10/27/1994,1994_163913,Vanuatu,"1/. S/PRST/1994/39. 2/ A/49/23 (Part V), chap. VIII.",yes
1994,Economic And Social Council,Forty-ninth session,12,REPORT OF THE ECONOMIC AND SOCIAL COUNCIL,"Algeria, Antigua _and Barbuda, Argentina, Armenia, Austria, Azerbaijan, Belgium, Benin, Bolivia, Bhutan, Brazil, Cambodia, Canada, Cape Verde, Chile, China, Colombia, Congo, Costa Rica, Cuba, Czech Republic, Denmark, Egypt, El Salvador, Eritrea, Ethiopia, Finland, France, Gabon, Gambia, Germany, Greece, Guinea, Guinea-Bissau, Guyana, Honduras, India, Indonesia, Ireland, Italy, Jamaica, Japan, Jordan, Kyrgyzstan, Lao People’s Democratic Republic, Lebanon, Luxembourg, Madagascar, Mali, Mexico, Micronesia (Federated States of), Mongolia, Morocco, Myanmar, Namibia, Nepal, Netherlands, Niger, Norway, Panama, Paraguay, Peru, Philippines, Portugal, Samoa, Senegal, Spain, Sudan, Suriname, Sweden, Tunisia, Turkmenistan, United Kingdom of Great Britain and Northern Ireland, United States of America, Venezuela, Viet Nam and Zambia",N/A,Twenty-fifth anniversary of the operations of the United Nations Population Fund Addendum,"Add the following countries to the list of sponsors of the resolution: Afghanistan, Australia, Bangladesh, Belize, Botswana, Comoros, Céte d'Ivoire, Democratic People’s Republic of Korea, Dominica, Fiji, Haiti, Kazakhstan, Lesotho, Malaysia, Mauritania, Mozambique, Nigeria, Pakistan, Papua New Guinea, Romania, Russian Federation, Rwanda, Sierra Leone, South Africa, Swaziland, Tajikistan, Thailand, Togo, Trinidad and Tobago, Uganda and Vanuatu",10/20/1994,1994_163951,Vanuatu,N/A,yes
