year,Council,Session,Agenda item,Agenda detail,cosponsored countries,body title number,body title detail,body text,date,file,filecountry,footnote,scanned
1996,First Committee,Fifty-first session,71,GENERAL AND COMPLETE DISARMAMENT,"Algeria, Angola, Argentina, Bahamas, Benin, Bolivia, Botswana, Brazil, Cambodia, Cape Verde, Chile, Colombia, Congo, Costa Rica, Céte d’Ivoire, Ecuador, Egypt, El Salvador, Ethiopia, Fiji, Gabon, Ghana, Grenada, Guatemala, Guinea-Bissau, Guyana, Haiti, Honduras, Indonesia, Jamaica, Kenya, Lesotho, Liberia, Malaysia, Marshall Islands, Mexico, Micronesia (Federated States of), Mongolia, Mozambique, Namibia, Nepal, New Zealand, Nicaragua, Nigeria, Panama, Papua New Guinea, Paraguay, Peru, Philippines, Samoa, Sierra Leone, Singapore, Solomon Islands, South Africa, Suriname, Thailand, the former Yugoslav Republic of Macedonia, Togo, Tunisia, United Republic of Tanzania, Trinidad and Tobago, Uruguay, Vanuatu, Venezuela, Viet Nam, Zaire and Zimbabwe",N/A,The nuclear-weapon-free Southern Hemisphere and adjacent areas,"The General Assembly , Determined to continue to contribute to the prevention of the proliferation of nuclear weapons in all its aspects and to the process of general and complete disarmament under strict and effective international control, in particular in the field of nuclear weapons and other weapons of mass destruction, with a view to strengthening international peace and security, in accordance with the purposes and principles of the Charter of the United Nations, Stressing the importance of the Treaties of Tlatelolco, Rarotonga, Bangkok and Pelindaba, establishing nuclear-weapon-free zones, as well as the Antarctic Treaty, Recalling that at its first special session devoted to disarmament, the General Assembly declared, inter alia, that the establishment of nuclear-weapon- free zones on the basis of agreements or arrangements freely arrived at among the States of the zone concerned constitutes an important disarmament measure; that the States participating in such zones should undertake to comply fully with all the objectives, purposes and principles of the agreements or arrangements establishing the zones, thus ensuring that they are genuinely free from nuclear weapons; and that the nuclear-weapon States are called upon to give undertakings, negotiated with the competent authority of each zone, in particular, to respect strictly the status of the nuclear-weapon-free zone and to refrain from the use or threat of use of nuclear weapons against the States of the zone, Recalling also that the 1995 Review and Extension Conference of the Parties to the Treaty on the Non-Proliferation of Nuclear Weapons 1/ reaffirmed the conviction that the establishment of internationally recognized nuclear-weapon- free zones, on the basis of arrangements freely arrived at among the States of the region concerned, enhances global and regional peace and security, and encouraged the development of nuclear-weapon-free zones, especially in regions of tension, such as in the Middle East, Recalling the applicable principles and rules of international law relating to rights of passage through maritime space, 1. Recognizes with satisfaction that the Antarctic Treaty and the Treaties of Tlatelolco, Rarotonga, Bangkok and Pelindaba are gradually freeing the entire Southern Hemisphere and adjacent areas covered by those Treaties from nuclear weapons; 2. Calls for the ratification of the Treaties of Tlatelolco, Rarotonga, Bangkok and Pelindaba by all regional States, and calls upon all concerned States to continue to work together in order to facilitate adherence to the protocols to nuclear-weapon-free zone treaties by all relevant States that have not yet done so; 3. Calls upon all States to consider proposals to establish further nuclear-weapon-free zones, especially in areas such as the Middle East, to strengthen the nuclear non-proliferation regime and, with particular reference to the responsibilities of the nuclear-weapon States, to advance the process of nuclear disarmament with the ultimate goal of eliminating all nuclear weapons; 4. Calls upon the States parties and signatories to the Treaties of Tlatelolco, Rarotonga, Bangkok and Pelindaba, in order to promote the common goals envisaged in those Treaties, to explore and implement further ways and means of cooperation, including the consolidation of the status of the nuclear- weapon-free Southern Hemisphere and adjacent areas; A/C.1/51/L.4/Rev. treaties to provide assistance to the States parties and signatories to such treaties so as to facilitate the accomplishment of these goals; 6. Decides to include in the provisional agenda of its fifty-second session an item entitled ""The nuclear-weapon-free Southern Hemisphere and adjacent areas"".",11/07/1996,1996_223446,Vanuatu,"1/ See 1995 Review and Extension Conference of the Parties to the Treaty on the Non-Proliferation of Nuclear Weapons, Final Document, Part I (NPT/CONF.1995/32 (Part I)).",yes
1996,General Assembly,Fifty-first session,44,IMPLEMENTATION OF THE UNITED NATIONS NEW AGENDA FOR THE DEVELOPMENT OF AFRICA IN THE 1990s,"Algeria, Angola, Argentina, Armenia, Australia, Austria, Bangladesh, Belgium, Benin, Botswana, Brazil, Burkina Faso, Burundi, Cambodia, Cameroon, Canada, Cape Verde, China, Comoros, Congo, Costa Rica, Céte d'Ivoire, Czech Republic, Denmark, Egypt Ethiopia, Fiji, Finland, France, Gabon, Gambia, Germany, Ghana, Greece, Guinea-Bissau, Guyana, India, Indonesia, Ireland, Italy, Japan, Jordan, Kenya, Lesotho, Luxembourg, Madagascar, Malawi, Malaysia, Mali, Malta, Mauritius, Mongolia, Morocco, Mozambique Namibia, Netherlands, Niger, Nigeria, Norway, Pakistan, Panama, Papua New Guinea, Paraguay, Peru, Philippines, Portugal, Republic of Korea, Romania, Russian Federation, Sao Tome and Principe, Seychelles, Sierra Leone, Singapore, Slovenia, South Africa, Spain, Swaziland, Sweden, Thailand, Togo, Tunisia, Turkey, Uganda, United Kingdom of Great Britain and Northern Ireland, United Republic of Tanzania, United States of America, Viet Nam, Zambia and Zimbabwe",N/A,Mid-term review of the implementation of the United Nations New Agenda for the Development of Africa in the 1990s Addendum,"Add the following countries to the list of sponsors of the resolution: Belize, Bulgaria, Colombia, Djibouti, Dominican Republic, Ecuador, Eritrea, Guinea, Haiti, Iceland, Iran (Islamic Republic of), Israel, Jamaica Kazakstan, Marshall Islands, Mauritania, Monaco, Myanmar, Nepal, New Zealand, Republic of Moldova, Rwanda, Samoa, Senegal, Slovakia, Solomon Islands, Sudan, Uzbekistan, Vanuatu and Zaire",12/06/1996,1996_229322,Vanuatu,N/A,yes
1996,General Assembly,Fifty-first session,163,OBSERVER STATUS FOR THE INTERNATIONAL TRIBUNAL FOR THE LAW OF THE SEA IN THE GENERAL ASSEMBLY,"Antigua and Barbuda, Argentina, Australia, Austria, Bahamas, Barbados, Belize, Brazil, Bulgaria, Cameroon, Canada, Cape Verde, China, Céte d'Ivoire, Croatia, Cyprus, Dominica, Fiji, Finland, Gabon, Georgia, Germany, Ghana, Greece, Grenada, Guyana, Iceland, India, Ireland, Italy, Jamaica, Japan, Kenya, Lebanon, Malta, Marshall Islands, Mexico, Micronesia (Federated States of), Nepal, New Zealand, Norway, Panama, Portugal, Republic of Korea, Romania, Saint Lucia, Samoa, Senegal, Seychelles, Sierra Leone, Singapore, Solomon Islands, Sri Lanka, Trinidad and Tobago, Ukraine, United Kingdom of Great Britain and Northern Ireland, United Republic of Tanzania and Vanuatu",N/A,N/A,"The General Assembly , Stressing the importance of the uniform interpretation or application of the provisions of the United Nations Convention on the Law of the Sea,' the agreements related thereto and any other agreement which confers jurisdiction on the International Tribunal for the Law of the Sea, Aware of the need for States to settle any disputes concerning the interpretation or application of the United Nations Convention on the Law of the Sea by peaceful means, Welcoming the establishment of the Tribunal in the Free and Hanseatic City of Hamburg, Federal Republic of Germany, + Official Records of the Third United Nations Conference on the Law of the Sea, vol. XVII (United Nations publication, Sales No. E.84.V.3), document A/CONF. 62/122. Noting the decision of the meeting of States Parties at its fifth session to seek observer status for the International Tribunal for the Law of the Sea in order to enable it to participate in the sessions and the work of the General Assembly* and the decision of the Tribunal at its first session to seek such observer status, 1. Decides to invite the International Tribunal for the Law of the Sea to participate in the sessions and the work of the General Assembly in the capacity of observer; 2. Requests the Secretary-General to take the necessary action to implement the present resolution.",12/11/1996,1996_229421,Vanuatu,"* See SPLOS/14, para. 36.",yes
1996,General Assembly,Fifty-first session,164,PROCLAMATION OF 21 NOVEMBER AS WORLD TELEVISION DAY,"Afghanistan, Albania, Algeria, Andorra, Angola, Antigua and Barbuda, Argentina, Azerbaijan, Bahamas, Bahrain, Bangladesh, Barbados, Belgium, Bhutan, Bolivia, Bosnia and Herzegovina, Botswana, Brazil, Bulgaria, Burundi, Cambodia Cameroon, Canada, Cape Verde, Chad, Chile, Comoros, Congo, Costa Rica, Céte d'Ivoire, Cyprus, Djibouti, Dominican Republic, Ecuador, Egypt, El Salvador, Eritrea, Ethiopia, Fiji, France, Gabon, Gambia, Georgia, Greece, Grenada, Guatemala, Guinea-Bissau, Guyana, Haiti, Honduras, Hungary, Iceland, India, Israel, Italy, Jamaica, Jordan, Kazakstan, Kenya, Kuwait, Kyrgyzstan, Lao People's Democratic Republic, Latvia, Lebanon, Lesotho, Liberia, Lithuania, Madagascar, Malawi, Mali, Malta, Marshall Islands, Mauritania, Mauritius, Micronesia (Federated States of), Monaco, Mongolia, Morocco, Mozambique, Myanmar, Namibia, Nepal, Nicaragua, Niger, Nigeria, Oman, Pakistan, Palau, Panama, Papua New Guinea, Paraguay, Peru, Poland, Portugal, Qatar, Republic of Korea, Republic of Moldova, Romania, Saint Kitts and Nevis, Saint Lucia, Saint Vincent and the Grenadines, Samoa, San Marino, Sao Tome and Principe, Saudi Arabia, Senegal, Seychelles, Sierra Leone, Slovenia, Solomon Islands, South Africa, Spain, Sri Lanka, Sudan, Suriname, Swaziland, The former Yugoslav Republic of Macedonia, Togo, Tunisia, Turke Turkmenistan, Uganda, United Arab Emirates, Uzbekistan, Vanuatu, Venezuela, Yemen and Zaire",N/A,N/A,"The General Assembly , Recalling its resolution 13 (I) of 1 February 1946, in which it stated, inter alia, that the United Nations cannot achieve its purposes unless the peoples of the world are fully informed of its aims and activities, Recalling also its resolutions concerning information in service of humanity and United Nations public information policies and activities, Reaffirming its commitment to the principles of the Charter of the United Nations and to the principles of freedom of information, as well as to those of the independence, pluralism and diversity of the media, Underlining that communications have become one of today's central international issues, not only for its relevance for the world economy, but also for its implications for social and cultural development, Recognizing the increasing impact television has on decision-making by alerting world attention to conflicts and threats to peace and security and its potential role in sharpening the focus on other major issues, including economic and social issues, Underlining that the United Nations faces ever-increasing demands to address the major issues facing humankind, and that television, as one of today's most powerful communications media, could play a role in presenting these issues to the world, Noting with satisfaction the holding at the United Nations, on 21 and 22 November 1996, of the first World Television Forum, where leading media figures met under the auspices of the United Nations to discuss the growing significance of television in today's changing world and to consider how they might enhance their mutual cooperation, 1. Decides to proclaim 21 November World Television Day, commemorating the date on which the first World Television Forum was held; 2. Invites all Member States to observe World Television Day by encouraging global exchanges of television programmes focusing, among other things, on such issues as peace, security, economic and social development and the enhancement of cultural exchange; 3. Requests the Secretary-General to bring the present resolution to the attention of all Governments and appropriate non-governmental organizations.",12/11/1996,1996_229595,Vanuatu,N/A,yes
1997,Economic And Social Council,Substantive session,6 (c),"COORDINATION, PROGRAMME AND OTHER QUESTIONS: INTERNATIONAL COOPERATION IN THE FIELD OF INFORMATICS","Albania*, Algeria*, Andorra*, Angola*, Antiqua and Barbuda*, Argentina, Armenia*, Australia, Azerbaijan*, Bahamas*, Bahrain*, Bangladesh, Barbados*, Belize*, Benin*, Bhutan*, Bolivia*, Bosnia and Herzegovina* Botswana*, Brazil, Brunei Darussalam*, Bulgaria*, Burkina Faso*, Burundi*, Cambodia*, Cameroon*, Canada, Cape Verde, Central African Republic, Chad*, Chile, China, Colombia, Comoros*, Congo, Costa Rica*, Céte d'Ivoire, Croatia*, Cuba, Cyprus*, Czech Republic, Democratic People's Republic of Korea*, Democratic Republic of the Congo*, Djibouti, Dominica*, Dominican Republic*, Ecuador*, Egypt*, El Salvador, Eritrea*, Ethiopia*, Fiji*, France, Gabon, Gambia, Ghana*, Grenada*, Guatemala*, Guinea*, Guinea-Bissau*, Guyana, Haiti*, Honduras*, Hungary* Indonesia*, Iran (Islamic Republic of)*, Irag*, Italy*, Jamaica, Japan, Jordan, Kazakhstan*, Kenya*, Kuwait*, Kyrgyzstan*, Lao People's Democratic Republic*, Latvia, Lebanon, Lesotho*, Liberia*, Libyan Arab Jamahiriya*, Liechtenstein*, Lithuania*, Madagascar*, Malawi*, Malaysia, Mali*, Malta*, Marshall Islands*, Mauritania*, Mauritius*, Mexico, Micronesia (Federated States of)*, Mongolia*, Morocco*, Mozambique Myanmar*, Namibia*, Nepal*, New Zealand*, Nicaragua, Niger*, Nigeria*, Norway*, Oman*, Pakistan*, Palau*, Panama*, Papua New Guinea*, Paraguay* Peru*, Philippines, Poland, Qatar*, Republic of Korea, Republic of Moldova*, Romania, Russian Federation, Rwanda*, Saint Kitts and Nevis*, Saint Lucia*, Saint Vincent and the Grenadines*, Samoa*, San Marino* Saudi Arabia*, Senegal*, Seychelles*, Sierra Leone*, Singapore* Slovakia*, Slovenia*, Solomon Islands*, South Africa, Spain, Sri Lanka, Sudan, Suriname*, Swaziland*, Syrian Arab Republic*, Tajikistan*, Thailand, The former Yugoslav Republic of Macedonia*, Togo, Trinidad and Tobago*, Tunisia, Turkey, Turkmenistan*, Uganda, Ukraine*, United Arab Emirates*, United Republic of Tanzania*, United States of America, Uruguay*, Uzbekistan*, Vanuatu*, Venezuela*, Viet Nam*, Yemen*, Zambia, Zimbabwe*",N/A,N/A,"The Economic and Social Council , Conscious. of the deep interest of Member States in harnessing the benefits of new information technologies for furthering the objectives of the United Nations, including the objectives of economic and social development, Recalling its resolutions 1991/70 of 26 July 1991, 1992/60 of 31 July 1992, 1993/56 of 29 July 1993, 1994/46 of 29 July 1994, 1995/61 of 28 July 1995 and 1996/35 of 25 July 1996 on the need to harmonize and improve United Nations information systems for optimal utilization and accessibility by all States, with due regard to all official languages, Recalling also. that in its resolution 1996/35, it commended the Ad Hoc Open-ended Working Group on Informatics for the concrete actions it had taken in pursuance of its mandate, and requested the President of the Economic and Social Council to convene the Working Group for one more year, from within existing resources, for the due fulfilment of the provisions of the Council resolutions on this item, Welcoming the report presented by the Chairman of the Ad Hoc Open-ended Working Group on Informatics on the progress achieved so far by the Working Group in fulfilling its mandate, Highly appreciating the accomplishments of the Working Group, which include: (a) The attainment of near universal connectivity between the United Nations databases and the Permanent Missions of the Member States, (b) The training of a large number of personnel of the Permanent Missions and the Secretariat on a variety of electronic facilities and techniques, (c) The identification and progressive elimination of several impediments to access to the United Nations databases, (d) The establishment of video-conferencing facilities for use by the Permanent Missions and the Secretariat, (e) The establishment of the United Nations Web Page on the Internet and a connection between this facility and the United Nations Optical Disk System, E/1997/L.28 page 3 (£) The uploading of all resolutions and decisions of the Security Council, the General Assembly , the Economic and Social Council and the Trusteeship Council from 1946 onwards on the United Nations Optical Disk System, and the increasing database of documents on the United Nations Web Page, (g) The efforts to enable the United Nations and its Member States to reduce waste and duplication as well as expenditure on unnecessary documentation, (h) The assistance given to Permanent Missions in creating their own Web pages on the Internet, Deeply appreciating that the work of the Working Group has not involved any additional expenditures and that its needs have been met from within existing resources, Highly appreciating that the work done by the Working Group has already resulted in savings for the United Nations and its Member States and has created opportunities for further savings, Taking note with deep interest of the proposed initiatives of the Working Group, including the promotion of computer-based decision-making techniques to facilitate the ing of resolutions and documents in ways that would accelerate the reaching of agreements in the process of ing, and the employment of modern information technology for the developmental activities of the United Nations, Recognizing that the work done by the Working Group will support and facilitate the successful implementation of the initiatives being taken by the Secretary-General with a view to expanding the use of information technology and the availability and transparency of information in order to further facilitate access to United Nations information in all countries, Agreeing with the assessment contained in the report of the Working Group that further work needs to be done by the Working Group to fulfil its mandate, Taking note of the report of the Secretary-General on follow-up action taken, + +E/1997/88. E/1997/L.28 page 4 1. Reiterates, once again, the high priority it attaches to easy, economical, uncomplicated and unhindered access for States Members of the United Nations and for observers, through, inter alia, their Permanent Missions, to the growing number of computerized databases and information systems and services of the United Nations; 2. Calls for the urgent and continued implementation of measures required to achieve these objectives; 3. Reaffirms. the continuing need for representatives of States to be closely consulted and actively associated with the respective executive and governing bodies of United Nations institutions dealing with informatics within the United Nations system, so that the specific needs of States as internal end-users can be given due priority; 4, Decides that the action programme to harmonize and improve United Nations informatics systems for optimal utilization and accessibility by all States should continue to be implemented from within existing resources and in full consultation with the representatives of States; 5. Highly commends the Ad Hoc Open-ended Working Group on Informatics for the concrete actions it has taken and for the impressive results it has produced in pursuance of its mandate; 6. Requests. the President of the Economic and Social Council to convene the Working Group for one more year, from within existing resources, for the due fulfilment of the provisions of the Council resolutions on this item, and for facilitating the successful implementation of the initiatives being taken by the Secretary-General with regard to the use of information technology; 7. Requests. the Working Group to design an overall information management strategy for the United Nations system; 8. Requests. the Secretary-General to extend full cooperation to the Working Group and to give priority to implementing its recommendations; 9. Also requests. the Secretary-General to report on the follow-up action taken on the present resolution, including the findings of the Working Group, to the Economic and Social Council at its substantive session of 1998.",07/14/1997,1997_242423,Vanuatu,N/A,yes
1997,Special Political And Decolonization Committee,Fifty-second session,18,IMPLEMENTATION OF THE DECLARATION ON THE GRANTING OF INDEPENDENCE TO COLONIAL COUNTRIES AND PEOPLES,"Antigua and Barbuda, Argentina, Chile, Céte d'Ivoire, Cuba, Fiji, Grenada, Iran (Islamic Republic of), Mali, Marshall Islands, Papua New Guinea, Paraguay, Portugal, Saint Lucia, Samoa, Solomon Islands, Spain, Syrian Arab Republic, Uruguay, Vanuatu",N/A,N/A,"The General Assembly , Recalling its resolutions 1514 (XV) of 14 December 1960, 1541 (XV) of 15 December 1960, 43/47 of 22 November 1988, as well as all other relevant United Nations resolutions and decisions, Recognizing that decolonization is a major political success of the United Nations, Convinced that the process of decolonization has not been completed, Mindful of the statement made by the Secretary-General on 17 March 1997 regarding the administrative reforms of the Secretariat; section 2, Political Affairs, of the proposed programme budget for the biennium 1998-1999;* and the report of the Secretary-General entitled ""United Nations reforms: measures and proposals"",?” Noting the resolution entitled ""Decolonization programme in the United Nations System"" adopted by consensus by the Special Committee on the Situation with regard to the Implementation of the Declaration on the Granting of Independence to Colonial Countries and Peoples on 6 June 1997,? Noting also the letter dated 18 September 1997 from the Chairman of the Special Committee on the Situation with regard to the Implementation of the Declaration on the Granting of Independence to Colonial Countries and Peoples addressed to the Secretary-General, * Reaffirming the political nature and substance of the mandate of the Special Committee, Concerned that the proposed administrative changes could jeopardize, downgrade and undermine the United Nations decolonization programme, 1. Urges the Secretary-General to avail the Decolonization Branch of all necessary and adequate resources until the completion of the International Decade for the Eradication of Colonialism; 2. Also urges the Secretary-General to maintain the Decolonization Branch and all its functions pertaining to the Special Committee on the Situation with regard to the Implementation of the Declaration on the Granting of Independence to Colonial Countries and Peoples and to the Special Political and Decolonization Committee (Fourth Committee) in the Department of Political Affairs.",10/08/1997,1997_244594,Vanuatu,"1 Official Records of the General Assembl Fifty-second Session, Supplement No. 6 (A/52/6/Rev.1), vol. I. * B/52/303. * B/52/379.",yes
