year,Council,Session,Agenda item,Agenda detail,cosponsored countries,body title number,body title detail,body text,date,file,filecountry,footnote,scanned
1995,Special Political And Decolonization Committee,Fiftieth session,18,IMPLEMENTATION OF THE DECLARATION ON THE GRANTING OF INDEPENDENCE TO COLONIAL COUNTRIES AND PEOPLES,"Algeria, Antigua _and Barbuda, Bahamas, Barbados, Belize, Bolivia, Botswana, Burundi, Cape Verde, Costa Rica, Cuba, Cyprus, Dominica, Ecuador, Ethiopia, Fiji, Gambia, Ghana, Grenada, Guyana, Honduras, Jamaica, Kenya, Lesotho, Malawi, Marshall Islands, Mauritania, Mauritius, Micronesia (Federated States of) Mozambique, Namibia, Nicaragua, Niger, Nigeria, Palau, Panama, Papua New Guinea, Paraguay, Rwanda, Saint Kitts and Nevis, Saint Lucia, Saint Vincent and the Grenadines, Samoa, Seychelles, Sierra Leone, Slovenia, Solomon Islands, South Africa, Suriname, Trinidad and Tobago, Uganda, United Republic of Tanzania, Uruguay, Vanuatu, Venezuela, Viet Nam, Zambia and Zimbabwe:",N/A,Question of Western Sahara,"The General Assembly , Having considered in depth the question of Western Sahara, Reaffirming the inalienable right of all peoples to self-determination and independence, in accordance with the principles set forth in the Charter of the United Nations and in General Assembly resolution 1514 (XV) of 14 December 1960, containing the Declaration on the Granting of Independence to Colonial Countries and Peoples, Recalling its resolution 49/44 of 9 December 1994, Recalling also the agreement in principle given on 30 August 1988 by the Kingdom of Morocco and the Frente Popular para la Liberacién de Saguia el-Hamra y de Rio de Oro to the proposals of the Secretary-General of the United Nations and the current Chairman of the Assembly of Heads of State and Government of the Organization of African Unity in the context of their joint mission of good offices, Recalling further Security Council resolutions 621 (1988) of 20 September 1988, 658 (1990) of 27 June 1990, 690 (1991) of 29 April 1991, 725 (1991) of 31 December 1991, 809 (1993) of 2 March 1993 and 907 (1994) of 29 March 1994 relating to the question of Western Sahara, Recalling with satisfaction the entry into force of the cease-fire in Western Sahara on 6 September 1991, in accordance with the proposal of the Secretary-General accepted by the two parties, Noting the adoption by the Security Council of resolutions 973 (1995) of 13 January 1995, 995 (1995) of 26 May 1995, 1002 (1995) of 30 June 1995 and 1017 (1995) of 22 September 1995, Welcoming the mission of the Security Council, which visited Western Sahara and the countries of the region from 3 to 9 June 1995, Welcoming also the appointment of Mr. Erik Jensen as acting Special Representative of the Secretary-General for Western Sahara, Concerned that the parties’ continuing suspicion and lack of trust have contributed to delays in the implementation of the settlement plan, 1/ Noting that, for progress to be achieved, the two parties must have a vision of the post-referendum period, Stressing the importance and usefulness of the resumption of direct talks between the two parties mentioned above in order to create a propitious atmosphere conducive to a speedy and effective implementation of the settlement plan, Having examined the relevant chapter of the report of the Special Committee on the Situation with regard to the Implementation of the Declaration on the Granting of Independence to Colonial Countries and Peoples, Having also examined the report of the Secretary-General, 2/ 1. Takes note with appreciation of the report of the Secretary-General; 2. Pays tribute to the Secretary-General and the personnel of the United Nations Mission for the Referendum in Western Sahara for their action with a view to settling the question of Western Sahara by the implementation of the settlement plan; i/ S/21360 and S/22464 and Corr. 1. 3. Reiterates its support for further efforts of the Secretary-General for the organization and supervision by the United Nations, in cooperation with the Organization of African Unity, of a referendum for self-determination of the people of Western Sahara, in conformity with Security Council resolutions 658 (1990) and 690 (1991), by which the Council adopted the settlement plan for Western Sahara; 4. Reaffirms that the goal on which all were agreed consists of the holding of a free, fair and impartial referendum for the people of Western Sahara, organized and conducted by the United Nations in cooperation with the Organization of African Unity and without any military or administrative constraints, in conformity with the settlement plan; 5. Notes with concern the insufficient progress made towards the fulfilment of the settlement plan, including the identification process, the code of conduct, the release of political prisoners, the confinement of troops of the Frente Popular para la Liberacién de Saguia el-Hamra y de Rio de Oro and the arrangements for the reduction of the Moroccan troops in the territory; 6. Calls upon the Kingdom of Morocco and the Frente Polisario to work with the Secretary-General and the United Nations Mission for the Referendum in Western Sahara, in a spirit of genuine cooperation to implement the settlement plan in accordance with the relevant Security Council resolutions; 7. Takes note of the decision of the Security Council to review the arrangements for the completion of the identification process on the basis of the report of the Secretary-General requested by the Council in paragraph 4 of its resolution 1017 (1995) and to consider at that time any further necessary measures which might need to be taken to ensure the prompt completion of that process and of all the other aspects relevant to the fulfilment of the settlement plan; 8. Expresses the hope that direct talks between the two parties will soon resume in order to create a propitious atmosphere conducive to a speedy and effective implementation of the settlement plan; 9. Requests the Special Committee on the Situation with regard to the Implementation of the Declaration on the Granting of Independence to Colonial Countries and Peoples to continue to consider the situation in Western Sahara, bearing in mind the ongoing referendum process, and to report thereon to the General Assembly at its fifty-first session; 10. Invites the Secretary-General to submit to the General Assembly at its fifty-first session a report on the implementation of the present resolution.",10/31/1995,1995_200155,Vanuatu,N/A,yes
1995,General Assembly,Fiftieth session,156,MULTILINGUALISM,"Albania, Argentina, Armenia, Austria, Belarus, Belgium, Benin, Bolivia, Brazil, Bulgaria, Burkina Faso, Burundi, Cambodia, Cameroon, Canada, Central African Republic, Chile, Colombia, Congo, Costa Rica, Céte d'Ivoire, Cuba, Djibouti, Dominica, Dominican Republic, Ecuador, Egypt, El Salvador, France, Gabon, Germany, Greece, Guatemala, Guinea, Guinea-Bissau, Haiti, Honduras, Lebanon, Liechtenstein, Luxembourg, Madagascar, Mali, Malta, Mauritania, Mauritius, Mexico, Monaco, Morocco, Nicaragua, Niger, Oman, Panama, Paragua Peru, Poland, Portugal, Republic of Moldova, Romania, Russian Federation, Rwanda, Senegal, Spain, Togo, Tunisia, Uruguay, Vanuatu, Venezuela, Viet Nam and Zaire:",N/A,N/A,"The General Assembly , Recalling its resolutions 2 (I) of 1 February 1946, 2241 B (XXI) of 20 December 1966, 2292 (XXII) of 8 December 1967, 2359 B (XXII) of 19 December 1967, 2479 (XXIII) and 2480 B (XXIII) of 21 December 1968, 3189 (XXVIII), 3190 (XXVIII) and 3191 (XXVIII) of 18 December 1973 and 43/224 D of 21 December 1988, Recalling also, on the occasion of the commemoration of the fiftieth anniversary of the signing of the Charter of the United Nations, that the universality of the United Nations and its corollary, multilingualism, entail for each State Member of the Organization, irrespective of the official language in which it expresses itself, the right and the duty to make itself understood and to understand others, Stressing the need for strict observance of the resolutions and rules establishing language arrangements for the different bodies and organs of the United Nations, Recalling that Arabic, Chinese, English, French, Russian and Spanish are both official and working languages of the General Assembly and its committees and subcommittees 1/ and of the Security Council 2/ and that English and French are the working languages of the Secretariat, 3/ Regretting that unequal use is made of the different official languages and of the working languages of the Secretariat in the United Nations, and desiring that persons recruited by the Organization should have a command of and use at least one of the six official languages in addition to one working language of the Secretariat, Considering that the translation and interpretation budgets of United Nations bodies should be commensurate with the needs and should not be subject to budgetary constraints, as noted in resolution 42/207 C of 11 December 1987, Noting that the principle of equality of the official languages is being called into question with increasing frequency by the holding of so-called ""low-cost"" informal meetings, Emphasizing the need for the Organization to continue to promote the learning of all the official languages and the working languages of the Secretariat by members of missions accredited to the Organization and by Secretariat staff, Emphasizing also the importance of providing access for all Governments and all sectors of civil society to the Organization's documentation, archives and data banks in all the official languages, 1. Requests the Secretary-General to ensure the strict implementation of the resolutions establishing language arrangements for both the official languages and the working languages of the Secretariat, and invites Member States to do likewise; 2. Recalls that the Secretariat is required, in its relations with Member States, to use the official or working language requested by those States; 3. Requests the Secretary-General to ensure that, upon recruitment, personnel recruited by the different bodies of the Organization have a command of and use at least one of the working languages of the Secretariat or one of the working languages of another body of the Organization, in the case of staff members who are to work for that body and whose tenure of appointment does not exceed two years; also requests the Secretary-General to ensure that the use of another of the six official languages is duly encouraged and taken into account, particularly when promotions and incremental steps are under consideration, in order to ensure linguistic balance within the Organization; 4. Also requests the Secretary-General to ensure, in particular in the recruitment and promotion of Secretariat staff, equality of the working languages of the Secretariat and of their use within the Organization; 5. Stresses the need to ensure, in particular through the training and recruitment of specialists, that the necessary resources are available to guarantee the proper and timely translation of documents into the different official and working languages of the United Nations; 6. Recalls the need to ensure the simultaneous distribution of such documents in the official languages of the Organization; 7. Stresses the need to ensure adequate human and financial resources for maintaining the teaching, at all levels, of the official languages and the working languages of the Secretariat; 8. Stresses also the importance of ensuring the availability of adequate data banks and publications in the different official languages in the libraries and documentation centres of the various bodies; 9. Urges the delegations of Member States and the Secretariat to endeavour to avoid holding informal meetings without interpretation; 10. Requests the Secretary-General to submit a report at its fifty-second session on the implementation of this resolution and on the use of the official languages of the United Nations and the working languages of the Secretariat.",11/01/1995,1995_200156,Vanuatu,* Reissued for technical reasons. 1/ Rule 51 of the rules of procedure of the General Assembly . 2/ Rule 41 of the provisional rules of procedure of the Security Council.,yes
1995,First Committee,Fiftieth session,70,GENERAL AND COMPLETE DISARMAMENT,"Afghanistan, Angola, Albania, Argentina, Armenia, Australia, Austria, Azerbaijan, Bahamas, Belarus, Belgium, Bhutan, Bolivia, Bosnia and Herzegovina, Botswana, Bulgaria, Burundi, Cambodia, Cameroon, Canada, Cape Verde, Chad, Colombia, Congo, Costa Rica, Céte d’Ivoire, Croatia, Cyprus, Czech Republic, Denmark, Ecuador, El Salvador, Ethiopia, Fiji, France, Georgia, Germany, Ghana, Guatemala, Guyana, Haiti, Honduras, Hungary, Iceland, Ireland, Italy, Japan, Jordan, Kazakstan, Kenya, Kuwait, Lesotho, Liberia, Lithuania, Luxembourg, Madagascar, Malaysia, Malta, Marshall Islands, Mauritania, Micronesia (Federated States of), Mongolia, Mozambique, Namibia, Nepal, Netherlands, New Zealand, Nicaragua, Niger, Norway, Panama, Paraguay, Peru, Philippines, Poland, Portugal, Republic of Moldova, Romania, Rwanda, Sierra Leone, Slovakia, Slovenia, Solomon Islands, South Africa, Spain, Sweden, Tajikistan, the former Yugoslav Republic of Macedonia, Togo, Turkmenistan, Ukraine, United Kingdom of Great Britain and Northern Ireland, United States of America, Uruguay, Vanuatu, Venezuela, Yemen and Zambia",N/A,Moratorium on the export of anti-personnel land-mines,"The General Assembly , Recalling with satisfaction its resolutions 49/75 D of 15 December 1994 and 48/75 of 16 December 1993, in which it, inter alia, called upon States to agree to a moratorium on the export of anti-personnel land-mines that pose grave dangers to civilian populations, and urged States to implement moratoria on the export of anti-personnel land-mines, Also recalling with satisfaction its resolution 49/75 D of 15 December 1994, in which it, inter alia, established as a goal of the international community the eventual elimination of anti-personnel land-mines, Noting that according to the 1994 report of the Secretary-General entitled ""Assistance in mine clearance"", 1/ it is estimated that there are more than 110 million land-mines in the ground in more than 60 countries throughout the world, Noting also that according to the same report, the global land-mine crisis continues to worsen as an estimated 2 million to 5 million new land-mines are laid each year, while only an estimated 100,000 were cleared in 1994, Expressing deep concern that anti-personnel land-mines kill or maim hundreds of people every week, mostly innocent and defenceless civilians, obstruct economic development and reconstruction and have other severe consequences for years after emplacement, which include inhibiting the repatriation of refugees and the return of internally displaced persons, Gravely concerned with the suffering and casualties caused to non-combatants as a result of the proliferation, as well as the indiscriminate and irresponsible use, of anti-personnel land-mines, Recalling with satisfaction its resolutions 48/7 of 19 October 1993 and 49/215 A of 23 December 1994, calling for assistance in mine clearance, Welcoming the programmes of assistance which exist for demining and humanitarian support for the victims of anti-personnel land-mines, Welcoming also the International Meeting on Mine Clearance held at Geneva from 5 to 7 July 1995, and noting the statement of the Secretary-General at the meeting that the international community must take specific and tangible steps to address the ""intolerable situation caused by the proliferation of anti-personnel land-mines throughout the world"", Recalling with satisfaction the report of the Secretary-General concerning progress on the initiative in resolution 49/75 D, 2/ Convinced that moratoria by States on the export of anti-personnel land- mines that pose grave dangers to civilian populations are important measures in helping to reduce substantially the human and economic costs resulting from the proliferation, as well as the indiscriminate and irresponsible use, of such devices, Noting with satisfaction that more than twenty-five States already have declared moratoria on the export, transfer or sale of anti-personnel land-mines, with many of these moratoria being declared as a result of the aforementioned resolutions, Believing that ongoing efforts to strengthen the Convention on Prohibitions or Restrictions on the Use of Certain Conventional Weapons Which May Be Deemed to Be Excessively Injurious or to Have Indiscriminate Effects, 3/ particularly Protocol II, 4/ are an essential part of the overall effort to address problems caused by the proliferation, as well as the indiscriminate and irresponsible use, of anti-personnel land-mines, Noting the efforts that were made at the Review Conference of the aforementioned Convention held at Vienna in September and October 1995 to strengthen prohibitions and restrictions in Protocol II governing land-mine use and transfer, and urging parties to build consensus towards agreement on such prohibition and restrictions when the conference reconvenes in January and April 1996, Believing that, in addition to Protocol II, other Measures to control the production, stockpiling and transfer of anti-personnel land-mines are also necessary to address problems caused by anti-personnel land-mines, especially the indiscriminate or illegal use of anti-personnel land-mines that continue to inflict harm on civilian populations long after emplacement, Recognizing that States can move most effectively towards the goal of the eventual elimination of anti-personnel land-mines as viable alternatives are developed that significantly reduce the risk to the civilian population, and emphasizing the need for States to work on developing such alternatives on an urgent basis, 1. Welcomes the moratoria already declared by certain States on the export of anti-personnel land-mines; 2. Urges States that have not yet done so to declare such moratoria at the earliest possible date; 3. Requests the Secretary-General to prepare a report on steps taken by Member States to implement such moratoria, and to submit it to the General Assembly at its fifty-first session under the item entitled ""General and complete disarmament""; 4. Emphasizes the importance of the Convention on Prohibitions or Restrictions on the Use of Certain Conventional Weapons Which May Be Deemed to Be Excessively Injurious or to Have Indiscriminate Effects and Protocol II as the authoritative international instrument governing the responsible use of anti-personnel land-mines and related devices and urges parties to build consensus towards an agreement when the Review Conference reconvenes; 5. Encourages the widest possible accession to the Convention and to Protocol II, and further, urges all States immediately to comply fully with the applicable rules of Protocol II; A/C.1/50/L.45 to the problems caused by anti-personnel land-mines, with a view to the eventual elimination of anti-personnel land-mines.",11/06/1995,1995_200507,Vanuatu,"1/ A/49/357 and Add.1 and 2. 2/ A/50/70 1. 3/ See The United Nations Disarmament Yearbook, vol. 5: 1980 (United Nations publication, Sales No. E.8 1. 1X.4), appendix VII. 4/ Ibid., Protocol on Prohibitions or Restrictions on the Use of Mines, Booby Traps and Other Devices.",yes
1995,N/A,N/A,N/A,N/A,N/A,N/A,N/A,N/A,11/15/1995,1995_200548,Vanuatu,N/A,yes
1995,General Assembly,Fiftieth session,164,NORMALIZATION OF THE SITUATION CONCERNING SOUTH AFRICA,"Albania, Algeria, Antigua _ and Barbuda, Australia, Bahamas, Benin, Bolivia, Botswana, Brazil, Burkina Faso, Burundi, Cambodia, Cameroon, Cape Verde, Central African Republic, Chad, Chile, Colombia, Comoros, Congo, Costa Rica, Céte D’ Ivoire, Cuba, Czech Republic, Djibouti, Egypt, El Salvador, Equatorial Guinea, Eritrea, Ethiopia, Fiji, Finland, Gabon, Gambia, Ghana, Grenada, Guatemala, Guinea, Guinea-Bissau, Honduras, Jamaica, Kenya, Lesotho, Liberia, the Libyan Arab Jamahiriya, Madagascar, Malawi, Malaysia, Mali, Marshall Islands, Mauritania, Mauritius, Micronesia (Federated States of), Mongolia, Morocco, Mozambique, Namibia, New Zealand, Nicaragua, Niger, Nigeria, Panama, Papua New Guinea, Peru, Rwanda, Saint Lucia, Saint Vincent and the Grenadines, Samoa, Sao Tome and Principe, Senegal, Seychelles, Sierra Leone, Singapore, Solomon Islands, South Africa, Sudan, Suriname, Swaziland, the former Yugoslav Republic of Macedonia, Togo, Tunisia, Uganda, Ukraine, United Republic of Tanzania, United States of America, Vanuatu, Venezuela, Yemen, Zaire, Zambia and Zimbabwe",N/A,N/A,"The General Assembly , Recalling its resolution 48/258 A, adopted by consensus on 23 June 1994, the date on which South Africa was invited to resume its participation in the work of the General Assembly , Noting that South Africa has since that date commenced payment of its assessed contributions, Also recalling the exceptional circumstances pertaining to the resumption of South Africa’s participation in the work of the General Assembly following the elimination of apartheid and the establishment of a democratic, non-racial South Africa, Recognizing that, owing to these exceptional circumstances, South Africa should not be held liable for contributions relating to the period from 30 September 1974 to 23 June 1994, Recognizing also that the General Assembly took a moral and political decision to exclude South Africa from participation in its work, Recognizing further that the exclusion of South Africa from the work of the General Assembly was unprecedented, 1. Decides that, owing to these unique and exceptional circumstances, South Africa’s unpaid assessments accruing during the period from 30 September 1974 to 23 June 1994 for the regular budget of the United Nations shall be considered no longer due and payable and that the amount of authorized retained surplus in the General Fund pursuant to General Assembly resolution 42/216 A of 21 December 1987 shall be reduced accordingly; 2. Decides also that, owing to these unique and exceptional circumstances, South Africa’s unpaid assessments accruing during the period from 30 September 1974 to 23 June 1994 for United Nations peace-keeping operations shall be considered no longer due and payable; 3. Decides further that under no circumstances shall the decisions referred to in paragraphs 1 and 2 of the present resolution be used as a precedent.",12/04/1995,1995_201036,Vanuatu,N/A,yes
