year,Council,Session,Agenda item,Agenda detail,cosponsored countries,body title number,body title detail,body text,date,file,filecountry,footnote,scanned
1996,General Assembly,Fifty-first session,30,COOPERATION BETWEEN THE UNITED NATIONS AND THE LEAGUE OF ARAB STATES,"Algeria, Bahrain, Djibouti, Egypt, Irag, Jordan, Kuwait, Lebanon, Libyan Arab Jamahiriya, Mauritania, Morocco, Oman, Qatar, Saudi Arabia, Sudan, Syrian Arab Republic, Tunisia, United Arab Emirates and Yemen",N/A,N/A,"The General Assembly , Recalling its previous resolutions on the promotion of cooperation between the United Nations and the League of Arab States, Having considered the report of the Secretary-General of 19 September 1996 on cooperation between the United Nations and the League of Arab States, 1/ Recalling also the decision of the Council of the League of Arab States that it considers the League a regional organization within the meaning of Chapter VIII of the Charter of the United Nations, Noting the desire of both organizations to consolidate, develop and enhance further the ties existing between them in the political, economic, social, humanitarian, cultural and administrative fields, Taking into account the report of the Secretary-General entitled ""An Agenda for Peace"", 2/ in particular section VII, concerning cooperation with regional 1/— A/51/380. arrangements and organizations, and the ""Supplement to an Agenda for Peace"", 3/ Convinced that the maintenance and further strengthening of cooperation between the United Nations system and the League of Arab States contribute to the promotion of the purposes and principles of the United Nations, Convinced _ also of the need for more efficient and coordinated utilization of available economic and financial resources to promote common objectives of the two organizations, Recognizing the need for closer cooperation between the United Nations system and the League of Arab States and its specialized organizations in realizing the goals and objectives of both organizations, Welcoming the second meeting on cooperation between the United Nations and regional organizations, held on 15 and 16 February 1996 1. Takes note with satisfaction of the report of the Secretary- General; 1/ 2. Commends the continued efforts of the League of Arab States to promote multilateral cooperation among Arab States, and requests the United Nations system to continue to lend its support; 3. Expresses its appreciation to the Secretary-General for the follow-up action taken by him to implement the proposals adopted at the meetings between the representatives of the secretariats of the United Nations and other organizations of the United Nations system and the General Secretariat of the League of Arab States and its specialized organizations, including the last meeting held at Vienna in 1995; 4. Requests the Secretariat of the United Nations and the General Secretariat of the League of Arab States, within their respective fields of competence, to intensify further their cooperation towards the realization of the purposes and principles of the Charter of the United Nations, the strengthening of international peace and security, economic development, disarmament, decolonization, self-determination and the eradication of all forms of racism and racial discrimination; 5. Also requests the Secretary-General to continue his efforts to strengthen cooperation and coordination between the United Nations and other organizations and agencies of the United Nations system and the League of Arab States and its specialized organizations in order to enhance their capacity to serve the mutual interests of the two organizations in the political, economic, social, humanitarian, cultural and administrative fields; 6. Calls upon the specialized agencies and other organizations and programmes of the United Nations system: (a) To continue to cooperate with the Secretary-General and among themselves, as well as with the League of Arab States and its specialized organizations, in the follow-up of multilateral proposals aimed at strengthening and expanding cooperation in all fields between the United Nations system and the League of Arab States and its specialized organizations; (b) To maintain and increase contacts and improve the mechanism of consultation with the counterpart programmes, organizations and agencies concerned regarding projects and programmes, in order to facilitate their implementation; (c) To associate whenever possible with organizations and institutions of the League of Arab States in the execution and implementation of development projects in the Arab region; (d) To inform the Secretary-General, not later than 15 June 1997, of the progress of their cooperation with the League of Arab States and its specialized organizations, in particular the follow-up action taken on the multilateral and bilateral proposals adopted at the previous meetings between the two organizations; 7. Also calls upon the specialized agencies and other organizations and programmes of the United Nations system to intensify cooperation with the League of Arab States and its specialized organizations in the following priority sectors, namely, energy, rural development, desertification and green belts, training and vocational training, technology, environment, and information and documentation; 8. Requests the Secretary-General of the United Nations, in cooperation with the Secretary-General of the League of Arab States, to encourage periodic consultation between representatives of the Secretariat of the United Nations and the General Secretariat of the League of Arab States to review and strengthen coordination mechanisms with a view to accelerating implementation and follow-up action of multilateral projects, proposals and recommendations adopted at the meetings between the two organizations; 9. Decides that, in order to enhance cooperation and for the purpose of review and appraisal of progress, a general meeting between the United Nations system and the League of Arab States should take place once every two years, and inter-agency sectoral meetings should be organized regularly on areas of priority and wide importance in the development of the Arab States, on the basis of agreement between the counterpart programmes of the United Nations system and the League of Arab States and its specialized organizations; 10. Recommends that the next general meeting on cooperation between the representatives of the secretariats of the United Nations system and the General Secretariat of the League of Arab States and its specialized organizations be held during 1997; 12. Decides to include in the provisional agenda of its fifty-second session the item entitled ""Cooperation between the United Nations and the League of Arab States"".",10/23/1996,1996_222881,Yemen,"1/— A/51/380. 2/ A/47/277-S/24111; see Official Records of the Security Council, Forty-seventh Year, Supplement for April, May and June 1992, document S/2411 1. 3/ A/50/60-S/1995/1; see Official Records of the Security Council, Fiftieth Year, Supplement for January, February and March 1995, document S/1995/ 1.",yes
1996,First Committee,Fifty-first session,71,GENERAL AND COMPLETE DISARMAMENT,"Afghanistan, Albania, Angola, Argentina, Armenia, Austria, Azerbaijan, Bangladesh, Belgium, Bhutan, Bolivia, Bosnia and Herzegovina, Botswana, Brazil, Brunei Darussalam, Cambodia, Canada, Chad, Chile, Colombia, Costa Rica, Croatia, Cyprus, Czech Republic, Denmark, El Salvador, Ethiopia, Fiji, Gabon, Georgia, Germany, Ghana, Guatemala, Haiti, Honduras, Hungary, Iceland, Ireland, Italy, Jamaica, Japan, Kazakstan, Kyrgyzstan, Liechtenstein, Lithuania, Luxembourg, Maldives, Malta, Marshall Islands, Mauritius, Mexico, Micronesia (Federated States of), Morocco, Mozambique, Namibia, Netherlands, New Zealand, Nicaragua, Niger, Norway, Palau, Peru, Philippines, Poland, Portugal, Republic of Moldova, Romania, Rwanda, Sierra Leone, Slovakia, Slovenia, Solomon Islands, South Africa, Sweden, Tunisia, United Kingdom of Great Britain and Northern Ireland, United States of America, Uruguay, Uzbekistan, Vanuatu, Venezuela, Yemen, Zambia and Zimbabwe",N/A,An_international agreement to ban anti-personnel landmines,"The General Assembly , Recalling with satisfaction its resolutions 48/75 K of 16 December 1993, 49/75 D of 15 December 1994 and 50/70 O of 12 December 1995, in which it, inter alia, urged States to implement moratoria on the export of anti-personnel landmines, Also recalling with satisfaction its resolutions 49/75 D and 50/70 O, in which it, inter alia, established as a goal of the international community the eventual elimination of anti-personnel landmines, Noting that, according to the 1995 report of the Secretary-General entitled ""Assistance in mine clearance"", 1/ it is estimated that there are one hundred and ten million landmines in the ground in more than sixty countries throughout the world, Noting also that, according to the same report, the global landmine crisis continues to worsen as an estimated two million new landmines are laid each year, while only an estimated one hundred and fifty thousand were cleared in 1995, Expressing deep concern that anti-personnel landmines kill or maim hundreds of people every week, mostly innocent and defenceless civilians and especially children, obstruct economic development and reconstruction, inhibit the repatriation of refugees and the return of internally displaced persons, and have other severe consequences for years after emplacement, Gravely concerned about the suffering and casualties caused to non-combatants as a result of the proliferation, as well as the indiscriminate and irresponsible use, of anti-personnel landmines, Recalling with satisfaction its resolutions 48/7 of 19 October 1993, 49/215 A of 23 December 1994 and 50/82 of 14 December 1995 calling for assistance in mine clearance, Welcoming the recent decisions taken at the Review Conference of the States Parties to the Convention on Prohibitions or Restrictions on the Use of Certain Conventional Weapons Which May be Deemed to be Excessively Injurious or to Have Indiscriminate Effects, particularly with respect to the Convention’s amended Protocol II, 2/ and believing that the amended Protocol is an essential part of the global effort to address problems caused by the proliferation, as well as the indiscriminate and irresponsible use, of anti-personnel landmines, Welcoming the adoption of the declaration entitled ""Towards a Global Ban on Anti-Personnel Mines"" by participants at the International Strategy Conference at Ottawa on 5 October 1996, including its call for the earliest possible conclusion of a legally binding international agreement to ban anti-personnel landmines, and further welcoming the follow-on conference at Brussels in June 1997, Welcoming also the recent decisions taken by States to adopt various bans, moratoria or other restrictions on the use, stockpiling, production and transfer of anti-personnel landmines, and other measures taken unilaterally as well as multilaterally, Recognizing the need to conclude an international agreement to ban all anti-personnel landmines as soon as possible, i/ A/50/408. 1. Urges States to pursue vigorously an effective, legally-binding international agreement to ban the use, stockpiling, production and transfer of anti-personnel landmines with a view to completing the negotiation as soon as possible; 2. Urges States that have not yet done so to accede to the Convention on Prohibitions or Restrictions on the Use of Certain Conventional Weapons Which May be Deemed to be Excessively Injurious or to Have Indiscriminate Effects 3/ and Protocol II as amended on 3 May 1996, and urges all States immediately to comply to the fullest extent possible with the applicable rules of Protocol II as amended; 3. Welcomes the various bans, moratoria or other restrictions already declared by States on anti-personnel landmines; 4. Calls upon States that have not yet done so to declare and implement such bans, moratoria or other restrictions - particularly on operational use and transfer - at the earliest date possible; 5. Requests the Secretary-General to prepare a report on steps taken to complete an international agreement banning the use, stockpiling, production and transfer of anti-personnel landmines, and on other steps taken by Member States to implement such bans, moratoria or other restrictions and to submit it to the General Assembly at its fifty-second session under the item entitled ""General and complete disarmament""; 6. Requests Member States to provide the requested information for the report of the Secretary-General on steps taken to complete an international agreement banning the use, stockpiling, production and transfer of anti-personnel landmines, and on other steps taken to implement bans, moratoria or other restrictions on anti-personnel landmines and to submit such information to the Secretary-General by 15 April 1997.",10/31/1996,1996_223135,Yemen,N/A,yes
1996,Third Committee,Fifty-first session,105,"REPORT OF THE UNITED NATIONS HIGH COMMISSIONER FOR REFUGEES, QUESTIONS RELATING TO REFUGEES, RETURNEES AND DISPLACED PERSONS AND HUMANITARIAN QUESTIONS","Bangladesh, Bosnia and Herzegovina, Egypt, El Salvador, Guatemala, Honduras, Jordan, Kyrgyzstan, Libyan Arab Jamahiriya, Mauritania, Monaco, Morocco, Oman, Pakistan, Qatar, Slovenia, Sudan and Yemen",N/A,New international humanitarian order,"The General Assembly , Recalling its resolution 49/170 of 23 December 1994 and other pertinent resolutions 1/ relating to the promotion of a new international humanitarian order and of international cooperation in the humanitarian field, Taking note of the report of the Secretary-General 2/ and the previous reports 3/ containing the comments and views of Governments, specialized agencies and non-governmental organizations, Add.1, A/45/524, A/47/352 and A/49/577 and Corr. 1. Noting that a number of Governments have not yet submitted their comments in regard to the above-mentioned resolutions, Noting with deep concern the growing scale of humanitarian emergencies involving widespread suffering, loss of life and uprootedness, Noting the corresponding increase in the burden on the international community to provide emergency relief for protracted periods while durable solutions remain evasive, to the detriment of stability and security and thereby adversely affecting economic and social development, Bearing in mind the urgent need to elaborate further principles and norms relating to humanitarian emergencies, as well as effective measures to ensure respect for them, including, inter alia, a declaration relating to humanitarian action, 1. Expresses its appreciation to the Secretary-General for his continuing support for the efforts to promote a new international humanitarian order; 2. Urges Governments and governmental and non-governmental organizations that have not yet done so to submit their comments and views to the Secretary- General regarding the promotion of a new international humanitarian order; 3. Requests Governments to make available to the Secretary-General, on a voluntary basis, information and expertise on humanitarian issues of special concern to them in order to identify opportunities for future action; 4. Invites the Independent Bureau for Humanitarian Issues to continue and further strengthen its activities in cooperation with the governmental and non-governmental bodies concerned; 5. Requests the Secretary-General to remain in contact with Governments and non-governmental organizations, including the Independent Bureau for Humanitarian Issues, in order to report on the progress made by them to the General Assembly at its fifty-third session.",11/05/1996,1996_223297,Yemen,"1/ Resolutions 36/136 of 14 December 1981, 37/201 of 18 December 1982, 38/125 of 16 December 1983, 40/126 of 13 December 1985, 42/120 and 42/121 of 7 December 1987, 43/129 and 43/130 of 8 December 1988, 45/101 and 45/102 of 14 December 1990 and 47/106 of 16 December 1992. 2/ — B/51/454. 3/ —-A/37/145, A/38/450, A/40/358 and Add.1 and 2, A/41/472, A/43/734 and",yes
1996,Third Committee,Fifty-first session,109,RIGHT OF PEOPLES TO SELF-DETERMINATION,"Afghanistan, Algeria, Angola, Austria, Bahrain, Bangladesh, Belgium, Brazil, Brunei Darussalam, Chile, Colombia, Cuba, Cyprus, Denmark, Djibouti, Egypt, Finland, France, Greece, Guinea, Indonesia, Ireland, Italy, Jordan, Kuwait, Lesotho, Luxembourg, Malaysia, Mali, Malta, Mauritania, Morocco, Mozambique, Namibia, Netherlands, Nigeria, Oman, Pakistan, Portugal, Qatar, Saudi Arabia, Sierra Leone, Spain, Sudan, Sweden, Tunisia, United Arab Emirates, United Kingdom of Great Britain and Northern Ireland, United Republic of Tanzania, Viet Nam, Yemen and Zambia",N/A,The right of the Palestinian people to self-determination,"The General Assembly , Aware that the development of friendly relations among nations, based on respect for the principle of equal rights and self-determination of peoples, is among the purposes and principles of the United Nations, as defined in its Charter, Recalling the International Covenants on Human Rights, 1/ the Universal Declaration of Human Rights, 2/ the Declaration on the Granting of Independence to Colonial Countries and Peoples 3/ and the Vienna Declaration and Programme of Action, adopted at the World Conference on Human Rights on 25 June 1993, 4/ Recalling also the Declaration on the Occasion of the Fiftieth Anniversary of the United Nations, 5/ Noting the developments in the Middle East peace process, including the mutual recognition and the signing of the Declaration of Principles on Interim Self-Government Arrangements in Washington on 13 September 1993 by the Palestine Liberation Organization, the representative of the Palestinian people, and the Government of Israel, 6/ as well as the ensuing implementation agreements, in particular the interim agreement of 28 September 1995, Affirming the right of all States in the region to live in peace within secure and internationally recognized borders, 1. Reaffirms the right of the Palestinian people to self-determination; 2. Expresses the hope that the Palestinian people will soon be exercising their right to self-determination in the current peace process; 3. Urges all States, specialized agencies and organizations of the United Nations system to continue to support and assist the Palestinian people in their quest for self-determination.",11/11/1996,1996_223497,Yemen,"1/ Resolution 2200 A (XXI), annex. 2/ Resolution 217 A (III). 3/ Resolution 1514 (XV). 4/ A/CONF.157/24 (Part I), chap. III. 5/ Resolution 50/6.",yes
1996,Second Committee,Fifty-first session,12,REPORT OF THE ECONOMIC AND SOCIAL COUNCIL,"Bangladesh, Egypt, Malaysia, Mauritania, Sudan, Tunisia, United Arab Emirates and Yemen",N/A,"Natural resources of the occupied Palestinian territory, including Jerusalem, and other occupied Arab territories","The General Assembly , Reaffirming the principle of the permanent sovereignty of peoples under foreign occupation over their natural resources; Guided by the principles of the Charter of the United Nations and affirming the inadmissibility of the acquisition of territory by war, Reaffirming the applicability of the Fourth Geneva Convention relative to the Protection of Civilian Persons in Time of War, of 12 August 1949, 1/ to the occupied Palestinian territory, including Jerusalem, and other Arab territories occupied by Israel since 1967, Expressing concern at the exploitation by Israel, the occupying Power, of the natural resources of the occupied Palestinian territory, including Jerusalem, and other Arab territories occupied by Israel since 1967, Aware of the additional, dangerous impact of the Israeli colonial settlements on Palestinian and other Arab natural resources, especially the confiscation of land and the theft of water resources, Welcoming the Middle East peace process and the agreements reached, and calling for the scrupulous implementation of those agreements, 1. Reaffirms the inalienable rights of the Palestinian people and the population of the occupied Syrian Golan to sovereignty over their natural resources, including their land, water, archaeological ruins and artifacts, and geological resources; 2. Reaffirms also the obligations of Israel, the occupying Power, under international law, not to exploit, cause loss and depletion of or endanger the natural resources in the occupied Palestinian territory, including Jerusalem, and other Arab territories occupied by Israel since 1967, and requests that Israel abide by these obligations; 3. Recognizes the right of the Palestinian people to restitution and full compensation as a result of any exploitation, loss or depletion of, or damage to, their natural resources; 4. Requests the Secretary-General to report on the implementation of the present resolution, and decides to include on the agenda of its fifty-second session the item ""Permanent sovereignty of peoples under foreign occupation over their natural resources"".",11/15/1996,1996_223747,Yemen,"1/ United Nations, Treaty Series, vol. 75, No. 973.",yes
1996,Special Political And Decolonization Committee,Fifty-first session,85,REPORT OF THE SPECIAL COMMITTEE TO INVESTIGATE ISRAELI PRACTICES AFFECTING THE HUMAN RIGHTS OF THE PALESTINIAN PEOPLE AND OTHER ARABS OF THE OCCUPIED TERRITORIES,"Bangladesh, Brunei Darussalam, Cuba, Djibouti, Egypt, Indonesia, Lebanon, Malaysia, Mauritania, Saudi Arabia, Sudan, Syrian Arab Republic, Tunisia, United Arab Emirates and Yemen",N/A,The occupied Syrian Golan,"The General Assembly , Deeply concerned that the Syrian Golan occupied since 1967 has been under continued Israeli military occupation, Recalling Security Council resolution 497 (1981) of 17 December 1981, Recalling also its previous relevant resolutions, the last of which was 50/29 D of 6 December 1995, Having considered the report of the Secretary-General of 17 October 1996,' Recalling further its previous relevant resolutions in which, inter alia, it called upon Israel to put an end to its occupation of the Arab territories, Reaffirming once more the illegality of the decision of 14 December 1981 taken by Israel to impose its laws, jurisdiction and administration on the occupied Syrian Golan, which has resulted in the effective annexation of that territory, Reaffirming that the acquisition of territory by force is inadmissible under the Charter of the United Nations, Reaffirming also the applicability of the Geneva Convention relative to the Protection of Civilian Persons in Time of War, of 12 August 1949,? to the occupied Syrian Golan, Bearing in mind Security Council resolution 237 (1967) of 14 June 1967, Welcoming the convening at Madrid of the Peace Conference on the Middle East on the basis of Security Council resolutions 242 (1967) of 22 November 1967 and 338 (1973) of 22 October 1973 aimed at the realization of a just, comprehensive and lasting peace, and stressing the need for rapid progress in all bilateral negotiations, 1. Calls upon Israel, the occupying Power, to comply with the relevant resolutions on the occupied Syrian Golan, in particular Security Council resolution 497 (1981), in which the Council, inter alia, decided that the Israeli decision to impose its laws, jurisdiction and administration on the occupied Syrian Golan was null and void and without international legal effect, and demanded that Israel, the occupying Power, should rescind forthwith its decisions; 2. Also calls upon Israel to desist from changing the physical character, demographic composition, institutional structure and legal status of the occupied Syrian Golan and in particular to desist from the establishment of settlements; 3. Determines that all legislative and administrative measures and actions taken or to be taken by Israel, the occupying Power, that purport to alter the character and legal status of the occupied Syrian Golan are null and void, constitute a flagrant violation of international law and of the Geneva Convention relative to the Protection of Civilian Persons in Time of War, of 12 August 1949, and have no legal effect; 4. Further calls upon Israel to desist from imposing Israeli citizenship and Israeli identity cards on the Syrian citizens in the occupied Syrian Golan, and to desist from its repressive measures against the population of the occupied Syrian Golan; 5. Deplores the violations by Israel of the Geneva Convention relative to the Protection of Civilian Persons in Time of War, of 12 August 1949; 6. Calls once again upon Member States not to recognize any of the legislative or administrative measures and actions referred to above; 7. Requests the Secretary-General to report to the General Assembly at its fifty-second session on the implementation of the present resolution. 2? United Nations, Treaty Series, vol. 75, No. 973.",11/22/1996,1996_228624,Yemen,* B/51/518.,yes
